cluster_id,subject,mention_index_in_cluster,mention_id,mention_text,mention_start,mention_end,sentence_index,mention_render_rule,mention_render_was_changed,original_context_text,rendered_context_text,context_text,normalized_context_text,chunk_index,elapsed_seconds_at_completion,openness_positive_probability,openness_negative_probability,openness_neutral_probability,conscientiousness_positive_probability,conscientiousness_negative_probability,conscientiousness_neutral_probability,extraversion_positive_probability,extraversion_negative_probability,extraversion_neutral_probability,agreeableness_positive_probability,agreeableness_negative_probability,agreeableness_neutral_probability,neuroticism_positive_probability,neuroticism_negative_probability,neuroticism_neutral_probability,OCEAN_weight_high_probability,OCEAN_weight_medium_probability,OCEAN_weight_low_probability
7,Virginia,178,1208,Virginia,11399,11400,337,proper_name_to_canonical,False,"""Papa,"" said [[Virginia]], quietly, ""I have been with the Ghost.","""Papa,"" said Virginia, quietly, ""I have been with the Ghost.","""Papa,"" said Virginia, quietly, ""I have been with the Ghost.","""Papa,"" said Virginia, quietly, ""I have been with the Ghost.",3,43.45103050000034,0.43338945332009887,0.4067467309783832,0.15986381570151792,0.14266230506295982,0.36777498643585305,0.48956270850118716,0.025814584203799427,0.5439140151268497,0.4302714006693509,0.14255123198350508,0.16649660108149425,0.6909521669350006,0.2264437809169149,0.6964749746976896,0.0770812443853954,0.22382630665371595,0.5694712079908435,0.2067024853554406
7,Virginia,179,1209,I,11404,11405,337,first_second_person_keep_original,False,"""Papa,"" said Virginia, quietly, "" [[I]] have been with the Ghost.","""Papa,"" said Virginia, quietly, "" I have been with the Ghost.","""Papa,"" said Virginia, quietly, "" I have been with the Ghost.","""Papa,"" said Virginia, quietly, "" I have been with the Ghost.",3,43.45103050000034,0.4274968337949392,0.4119305112704027,0.16057265493465822,0.14243975994602864,0.380259063640504,0.47730117641346737,0.02490095747843473,0.5514562495787771,0.4236427929427882,0.15571175802158407,0.16318452131481131,0.6811037206636046,0.2202921214643545,0.7029985864265021,0.07670929210914323,0.21438677005993,0.5626318296729489,0.22298140026712104
7,Virginia,180,1218,me,11444,11445,339,first_second_person_keep_original,False,"He had been very wicked, but he was really sorry for all that he had done, and he gave [[me]] this box of beautiful jewels before he died.","He had been very wicked, but he was really sorry for all that he had done, and he gave me this box of beautiful jewels before he died.","He had been very wicked, but he was really sorry for all that he had done, and he gave me this box of beautiful jewels before he died.","He had been very wicked, but he was really sorry for all that he had done, and he gave me this box of beautiful jewels before he died.",3,43.45103050000034,0.13062628902404252,0.33438127941975204,0.5349924315562055,0.09474629602297543,0.18944028286197476,0.7158134211150499,0.1631387072768899,0.35807183272045673,0.4787894600026532,0.4526877156613321,0.31672211607191275,0.23059016826675513,0.26547470713543,0.5676637969757461,0.16686149588882382,0.420879365367318,0.4125625181559802,0.16655811647670182
7,Virginia,181,1220,her,11461,11462,340,third_person_object_pronoun_to_canonical,True,""" The whole family gazed at [[her]] in mute amazement, but she was quite grave and serious; and, turning round, she led them through the opening in the wainscoting down a narrow secret corridor, Washington following with a lighted candle, which he had caught up from the table.",""" The whole family gazed at Virginia in mute amazement, but she was quite grave and serious; and, turning round, she led them through the opening in the wainscoting down a narrow secret corridor, Washington following with a lighted candle, which he had caught up from the table.",""" The whole family gazed at Virginia in mute amazement, but she was quite grave and serious; and, turning round, she led them through the opening in the wainscoting down a narrow secret corridor, Washington following with a lighted candle, which he had caught up from the table.",""" The whole family gazed at Virginia in mute amazement, but she was quite grave and serious; and, turning round, she led them through the opening in the wainscoting down a narrow secret corridor, Washington following with a lighted candle, which he had caught up from the table.",3,43.45103050000034,0.349574597900192,0.18493385686191344,0.4654915452378945,0.910007657758154,0.0767686815444972,0.013223660697348953,0.067264957568984,0.3982021232094283,0.5345329192215877,0.301473724634116,0.04253421624435099,0.655992059121533,0.16074772780230792,0.7588758406172036,0.08037643158048847,0.5251396015903544,0.17241331764820744,0.30244708076143806
7,Virginia,182,1221,she,11467,11468,340,third_person_subject_pronoun_to_canonical,True,""" The whole family gazed at her in mute amazement, but [[she]] was quite grave and serious; and, turning round, she led them through the opening in the wainscoting down a narrow secret corridor, Washington following with a lighted candle, which he had caught up from the table.",""" The whole family gazed at her in mute amazement, but Virginia was quite grave and serious; and, turning round, she led them through the opening in the wainscoting down a narrow secret corridor, Washington following with a lighted candle, which he had caught up from the table.",""" The whole family gazed at her in mute amazement, but Virginia was quite grave and serious; and, turning round, she led them through the opening in the wainscoting down a narrow secret corridor, Washington following with a lighted candle, which he had caught up from the table.",""" The whole family gazed at her in mute amazement, but Virginia was quite grave and serious; and, turning round, she led them through the opening in the wainscoting down a narrow secret corridor, Washington following with a lighted candle, which he had caught up from the table.",3,43.45103050000034,0.31236111624995727,0.18480257927334887,0.5028363044766939,0.9226641279550691,0.06462322525987328,0.012712646785057494,0.05975435128045946,0.36886563414730533,0.5713800145722352,0.3327581981319747,0.041608918528063414,0.6256328833399618,0.1561709290913269,0.7702030887637055,0.07362598214496756,0.5859282434172571,0.14384226972403696,0.2702294868587059
7,Virginia,183,1222,she,11479,11480,340,third_person_subject_pronoun_to_canonical,True,""" The whole family gazed at her in mute amazement, but she was quite grave and serious; and, turning round, [[she]] led them through the opening in the wainscoting down a narrow secret corridor, Washington following with a lighted candle, which he had caught up from the table.",""" The whole family gazed at her in mute amazement, but she was quite grave and serious; and, turning round, Virginia led them through the opening in the wainscoting down a narrow secret corridor, Washington following with a lighted candle, which he had caught up from the table.",""" The whole family gazed at her in mute amazement, but she was quite grave and serious; and, turning round, Virginia led them through the opening in the wainscoting down a narrow secret corridor, Washington following with a lighted candle, which he had caught up from the table.",""" The whole family gazed at her in mute amazement, but she was quite grave and serious; and, turning round, Virginia led them through the opening in the wainscoting down a narrow secret corridor, Washington following with a lighted candle, which he had caught up from the table.",3,43.45103050000034,0.5633751424232929,0.17102454119055388,0.2656003163861531,0.8924047983610345,0.0920595328953887,0.015535668743576937,0.09730508755212106,0.44090860242378893,0.46178631002409,0.4585999768963799,0.052149054684132494,0.48925096841948756,0.15149057234340874,0.7820203913744576,0.06648903628213367,0.4968763018532277,0.1646142367246661,0.3385094614221062
7,Virginia,184,1225,Virginia,11526,11527,342,proper_name_to_canonical,False,"When [[Virginia]] touched it, it swung back on its heavy hinges, and they found themselves in a little low room, with a vaulted ceiling, and one tiny grated window.","When Virginia touched it, it swung back on its heavy hinges, and they found themselves in a little low room, with a vaulted ceiling, and one tiny grated window.","When Virginia touched it, it swung back on its heavy hinges, and they found themselves in a little low room, with a vaulted ceiling, and one tiny grated window.","When Virginia touched it, it swung back on its heavy hinges, and they found themselves in a little low room, with a vaulted ceiling, and one tiny grated window.",3,43.45103050000034,0.22011224957688746,0.4446661059112028,0.3352216445119096,0.23341272885344608,0.4033010296799419,0.3632862414666119,0.20426211416456574,0.3331729934565245,0.4625648923789096,0.3385129196669203,0.13974182793770917,0.5217452523953705,0.22079766938219755,0.6582151906110029,0.12098714000679965,0.19416953314896024,0.3292870628694832,0.4765434039815565
7,Virginia,185,1228,Virginia,11650,11651,346,proper_name_to_canonical,False,"[[Virginia]] knelt down beside the skeleton, and, folding her little hands together, began to pray silently, while the rest of the party looked on in wonder at the terrible tragedy whose secret was now disclosed to them.","Virginia knelt down beside the skeleton, and, folding her little hands together, began to pray silently, while the rest of the party looked on in wonder at the terrible tragedy whose secret was now disclosed to them.","Virginia knelt down beside the skeleton, and, folding her little hands together, began to pray silently, while the rest of the party looked on in wonder at the terrible tragedy whose secret was now disclosed to them.","Virginia knelt down beside the skeleton, and, folding her little hands together, began to pray silently, while the rest of the party looked on in wonder at the terrible tragedy whose secret was now disclosed to them.",3,43.45103050000034,0.140418657918634,0.5470234409558686,0.31255790112549725,0.1492002826290766,0.16660756628280132,0.6841921510881221,0.024481055258068825,0.3677385486017075,0.6077803961402237,0.8611773365358987,0.034400999020418585,0.1044216644436827,0.1773731049702407,0.7434941669123406,0.07913272811741871,0.43736644880857084,0.43523607578393414,0.12739747540749508
7,Virginia,186,1229,her,11660,11661,346,third_person_possessive_pronoun_to_canonical_possessive,True,"Virginia knelt down beside the skeleton, and, folding [[her]] little hands together, began to pray silently, while the rest of the party looked on in wonder at the terrible tragedy whose secret was now disclosed to them.","Virginia knelt down beside the skeleton, and, folding Virginia's little hands together, began to pray silently, while the rest of the party looked on in wonder at the terrible tragedy whose secret was now disclosed to them.","Virginia knelt down beside the skeleton, and, folding Virginia's little hands together, began to pray silently, while the rest of the party looked on in wonder at the terrible tragedy whose secret was now disclosed to them.","Virginia knelt down beside the skeleton, and, folding Virginia's little hands together, began to pray silently, while the rest of the party looked on in wonder at the terrible tragedy whose secret was now disclosed to them.",3,43.45103050000034,0.15336115567512817,0.4824087231961036,0.3642301211287681,0.2422352134350318,0.17068360068384875,0.5870811858811193,0.033381497178672996,0.37318126613670694,0.5934372366846201,0.8860618985732047,0.041099092043708624,0.07283900938308675,0.17710473092404108,0.7726960700845396,0.05019919899141935,0.3889953471202511,0.36793390641907203,0.24307074646067686
7,Virginia,187,1235,Virginia,11760,11761,351,proper_name_to_canonical,False,""" ""God has forgiven him,"" said [[Virginia]], gravely, as she rose to her feet, and a beautiful light seemed to illumine her face.",""" ""God has forgiven him,"" said Virginia, gravely, as she rose to her feet, and a beautiful light seemed to illumine her face.",""" ""God has forgiven him,"" said Virginia, gravely, as she rose to her feet, and a beautiful light seemed to illumine her face.",""" ""God has forgiven him,"" said Virginia, gravely, as she rose to her feet, and a beautiful light seemed to illumine her face.",3,43.45103050000034,0.14965657334182428,0.25807881766779905,0.5922646089903767,0.3717099099683881,0.14843467881177713,0.4798554112198347,0.09906073230559756,0.27972837895431857,0.6212108887400838,0.6988874612341389,0.04431986910297495,0.256792669662886,0.053362491760386654,0.7504423143607916,0.19619519387882184,0.3174290684461643,0.23536113661988534,0.44720979493395036
7,Virginia,188,1236,she,11765,11766,351,third_person_subject_pronoun_to_canonical,True,""" ""God has forgiven him,"" said Virginia, gravely, as [[she]] rose to her feet, and a beautiful light seemed to illumine her face.",""" ""God has forgiven him,"" said Virginia, gravely, as Virginia rose to her feet, and a beautiful light seemed to illumine her face.",""" ""God has forgiven him,"" said Virginia, gravely, as Virginia rose to her feet, and a beautiful light seemed to illumine her face.",""" ""God has forgiven him,"" said Virginia, gravely, as Virginia rose to her feet, and a beautiful light seemed to illumine her face.",3,43.45103050000034,0.16918232450822332,0.21596526868570817,0.6148524068060685,0.379794702222404,0.13086956784860665,0.4893357299289892,0.0976752337786251,0.25347401570353484,0.64885075051784,0.7103649174257808,0.034733769562534086,0.254901313011685,0.0509558412959492,0.7517213053802859,0.19732285332376476,0.33486401899693297,0.2354768764754405,0.4296591045276265
7,Virginia,189,1237,her,11768,11769,351,third_person_possessive_pronoun_to_canonical_possessive,True,""" ""God has forgiven him,"" said Virginia, gravely, as she rose to [[her]] feet, and a beautiful light seemed to illumine her face.",""" ""God has forgiven him,"" said Virginia, gravely, as she rose to Virginia's feet, and a beautiful light seemed to illumine her face.",""" ""God has forgiven him,"" said Virginia, gravely, as she rose to Virginia's feet, and a beautiful light seemed to illumine her face.",""" ""God has forgiven him,"" said Virginia, gravely, as she rose to Virginia's feet, and a beautiful light seemed to illumine her face.",3,43.45103050000034,0.17070670983510988,0.21769848286490687,0.6115948072999833,0.43734789985790407,0.1225192365090232,0.44013286363307275,0.10766940230392218,0.26818126099225037,0.6241493367038274,0.8041557108000704,0.030221177506923096,0.16562311169300659,0.04707834409393775,0.7342748562652601,0.2186467996408022,0.2969478582404313,0.20515064238781713,0.4979014993717516
7,Virginia,190,1238,her,11778,11779,351,third_person_possessive_pronoun_to_canonical_possessive,True,""" ""God has forgiven him,"" said Virginia, gravely, as she rose to her feet, and a beautiful light seemed to illumine [[her]] face.",""" ""God has forgiven him,"" said Virginia, gravely, as she rose to her feet, and a beautiful light seemed to illumine Virginia's face.",""" ""God has forgiven him,"" said Virginia, gravely, as she rose to her feet, and a beautiful light seemed to illumine Virginia's face.",""" ""God has forgiven him,"" said Virginia, gravely, as she rose to her feet, and a beautiful light seemed to illumine Virginia's face.",3,43.45103050000034,0.1483099975427764,0.18367572683635916,0.6680142756208645,0.40531484962221637,0.10074316202534113,0.49394198835244246,0.08992511739235118,0.2614806037014423,0.6485942789062066,0.7498643429901478,0.026710411867310505,0.22342524514254167,0.032577490112474024,0.7664923267733837,0.20093018311414224,0.365337412686031,0.2273976509297637,0.40726493638420536
7,Virginia,191,1239,an angel,11784,11786,352,ambiguous_or_unsupported_keep_original,False,"""What [[an angel]] you are!"" cried the young Duke, and he put his arm round her neck, and kissed her.","""What an angel you are!"" cried the young Duke, and he put his arm round her neck, and kissed her.","""What an angel you are!"" cried the young Duke, and he put his arm round her neck, and kissed her.","""What an angel you are!"" cried the young Duke, and he put his arm round her neck, and kissed her.",3,43.45103050000034,0.1809245047774297,0.2906735852223181,0.5284019100002522,0.15134727306239462,0.25934292913411205,0.5893097978034934,0.41457423309011676,0.17997904512383212,0.40544672178605107,0.8834105939385866,0.03271689639635253,0.08387250966506087,0.10536388159407946,0.6278692896981106,0.2667668287078099,0.18926221570038998,0.32823558014234916,0.4825022041572608
7,Virginia,192,1240,you,11786,11787,352,first_second_person_keep_original,False,"""What an angel [[you]] are!"" cried the young Duke, and he put his arm round her neck, and kissed her.","""What an angel you are!"" cried the young Duke, and he put his arm round her neck, and kissed her.","""What an angel you are!"" cried the young Duke, and he put his arm round her neck, and kissed her.","""What an angel you are!"" cried the young Duke, and he put his arm round her neck, and kissed her.",4,56.20173270000669,0.18926221570038998,0.4825022041572608,0.32823558014234916,0.03271689639635253,0.08387250966506087,0.8834105939385866,0.25934292913411205,0.5893097978034934,0.15134727306239462,0.17997904512383212,0.40544672178605107,0.41457423309011676,0.6278692896981106,0.2667668287078099,0.10536388159407946,0.2906735852223181,0.5284019100002522,0.1809245047774297
7,Virginia,193,1247,her,11801,11802,352,third_person_possessive_pronoun_to_canonical_possessive,True,"""What an angel you are!"" cried the young Duke, and he put his arm round [[her]] neck, and kissed her.","""What an angel you are!"" cried the young Duke, and he put his arm round Virginia's neck, and kissed her.","""What an angel you are!"" cried the young Duke, and he put his arm round Virginia's neck, and kissed her.","""What an angel you are!"" cried the young Duke, and he put his arm round Virginia's neck, and kissed her.",4,56.20173270000669,0.17577649129867665,0.552108454313157,0.2721150543881663,0.018834306680692005,0.06163481597702278,0.9195308773422851,0.2554763387420733,0.5623881656514499,0.18213549560647674,0.1418679331747295,0.43901573209832195,0.41911633472694854,0.7361955275878842,0.19775771522488955,0.0660467571872262,0.2980455271897384,0.5225437189575379,0.17941075385272365
7,Virginia,194,1248,her,11806,11807,352,third_person_object_pronoun_to_canonical,True,"""What an angel you are!"" cried the young Duke, and he put his arm round her neck, and kissed [[her]].","""What an angel you are!"" cried the young Duke, and he put his arm round her neck, and kissed Virginia.","""What an angel you are!"" cried the young Duke, and he put his arm round her neck, and kissed Virginia.","""What an angel you are!"" cried the young Duke, and he put his arm round her neck, and kissed Virginia.",4,56.20173270000669,0.16604641644737198,0.5584460363799867,0.2755075471726413,0.019776411295879533,0.08725761880238547,0.892965969901735,0.24549193579281675,0.5775140947552037,0.1769939694519795,0.18035853857991682,0.4441088977668089,0.3755325636532743,0.7284647665185263,0.19231836515650882,0.07921686832496475,0.2714709954433305,0.5438532892678739,0.1846757152887956
7,Virginia,195,1251,little Virginia,11930,11932,356,proper_name_to_canonical,True,"Lord Canterville was the chief mourner, having come up specially from Wales to attend the funeral, and sat in the first carriage along with [[little Virginia]].","Lord Canterville was the chief mourner, having come up specially from Wales to attend the funeral, and sat in the first carriage along with Virginia.","Lord Canterville was the chief mourner, having come up specially from Wales to attend the funeral, and sat in the first carriage along with Virginia.","Lord Canterville was the chief mourner, having come up specially from Wales to attend the funeral, and sat in the first carriage along with Virginia.",4,56.20173270000669,0.16991811673319512,0.4313464102541115,0.39873547301269335,0.19476049509951854,0.3115304654683895,0.49370903943209193,0.24693602811162124,0.409221371695433,0.3438426001929458,0.48374624014080564,0.33816307360904957,0.17809068625014474,0.7557124433710947,0.061160452622368335,0.183127104006537,0.29242877823648483,0.5602413248805174,0.14732989688299783
7,Virginia,196,1263,Virginia,12066,12067,360,proper_name_to_canonical,False,"When the ceremony was over, the servants, according to an old custom observed in the Canterville family, extinguished their torches, and, as the coffin was being lowered into the grave, [[Virginia]] stepped forward, and laid on it a large cross made of white and pink almond-blossoms.","When the ceremony was over, the servants, according to an old custom observed in the Canterville family, extinguished their torches, and, as the coffin was being lowered into the grave, Virginia stepped forward, and laid on it a large cross made of white and pink almond-blossoms.","When the ceremony was over, the servants, according to an old custom observed in the Canterville family, extinguished their torches, and, as the coffin was being lowered into the grave, Virginia stepped forward, and laid on it a large cross made of white and pink almond-blossoms.","When the ceremony was over, the servants, according to an old custom observed in the Canterville family, extinguished their torches, and, as the coffin was being lowered into the grave, Virginia stepped forward, and laid on it a large cross made of white and pink almond-blossoms.",4,56.20173270000669,0.38893922620486154,0.23094575733173903,0.38011501646339946,0.1120848542936461,0.07215571734505066,0.8157594283613032,0.279154752582561,0.11289891482719147,0.6079463325902474,0.3377228633797249,0.1974735269459018,0.46480360967437323,0.7595218457430032,0.08534090895556896,0.15513724530142786,0.4775232137804361,0.28805826355521325,0.23441852266435056
7,Virginia,197,1264,she,12087,12088,361,third_person_subject_pronoun_to_canonical,True,"As [[she]] did so, the moon came out from behind a cloud, and flooded with its silent silver the little churchyard, and from a distant copse a nightingale began to sing.","As Virginia did so, the moon came out from behind a cloud, and flooded with its silent silver the little churchyard, and from a distant copse a nightingale began to sing.","As Virginia did so, the moon came out from behind a cloud, and flooded with its silent silver the little churchyard, and from a distant copse a nightingale began to sing.","As Virginia did so, the moon came out from behind a cloud, and flooded with its silent silver the little churchyard, and from a distant copse a nightingale began to sing.",4,56.20173270000669,0.25241825373612464,0.3617490465934154,0.38583269967045997,0.05320528286995873,0.528507042665673,0.4182876744643682,0.29461809817408907,0.3188693627292839,0.38651253909662703,0.29020501072661825,0.5247882423516028,0.18500674692177893,0.6940990474272323,0.21465469893602274,0.091246253636745,0.2750668366904664,0.27053799435542825,0.4543951689541054
7,Virginia,198,1265,She,12121,12122,362,proper_name_to_canonical,True,"[[She]] thought of the ghost's description of the Garden of Death, her eyes became dim with tears, and she hardly spoke a word during the drive home.","Virginia thought of the ghost's description of the Garden of Death, her eyes became dim with tears, and she hardly spoke a word during the drive home.","Virginia thought of the ghost's description of the Garden of Death, her eyes became dim with tears, and she hardly spoke a word during the drive home.","Virginia thought of the ghost's description of the Garden of Death, her eyes became dim with tears, and she hardly spoke a word during the drive home.",4,56.20173270000669,0.4006248016867041,0.06966916016790736,0.5297060381453886,0.10574287654975878,0.8388600880646492,0.05539703538559209,0.14944310612932005,0.8106478381169199,0.039909055753760116,0.45316726801631624,0.5439615095766175,0.002871222407066376,0.05023321035140088,0.01320689271582807,0.9365598969327711,0.5182328881708579,0.44413468333892964,0.037632428490212394
7,Virginia,199,1267,her,12134,12135,362,third_person_possessive_pronoun_to_canonical_possessive,True,"She thought of the ghost's description of the Garden of Death, [[her]] eyes became dim with tears, and she hardly spoke a word during the drive home.","She thought of the ghost's description of the Garden of Death, Virginia's eyes became dim with tears, and she hardly spoke a word during the drive home.","She thought of the ghost's description of the Garden of Death, Virginia's eyes became dim with tears, and she hardly spoke a word during the drive home.","She thought of the ghost's description of the Garden of Death, Virginia's eyes became dim with tears, and she hardly spoke a word during the drive home.",4,56.20173270000669,0.37664167906630186,0.07051018536890313,0.552848135564795,0.1316454671010679,0.7726033407226343,0.09575119217629784,0.13890412601038368,0.8099459750455561,0.051149898944060225,0.41029946866398587,0.5865800693776061,0.0031204619584079807,0.01744412529249099,0.010642573314196324,0.9719133013933128,0.4854895539930041,0.47193320418907464,0.042577241817921274
