cluster_id,subject,mention_index_in_cluster,mention_id,mention_text,mention_start,mention_end,sentence_index,mention_render_rule,mention_render_was_changed,original_context_text,rendered_context_text,context_text,normalized_context_text,chunk_index,elapsed_seconds_at_completion,openness_positive_probability,openness_negative_probability,openness_neutral_probability,conscientiousness_positive_probability,conscientiousness_negative_probability,conscientiousness_neutral_probability,extraversion_positive_probability,extraversion_negative_probability,extraversion_neutral_probability,agreeableness_positive_probability,agreeableness_negative_probability,agreeableness_neutral_probability,neuroticism_positive_probability,neuroticism_negative_probability,neuroticism_neutral_probability,OCEAN_weight_high_probability,OCEAN_weight_medium_probability,OCEAN_weight_low_probability
6,Mrs. Otis,19,337,her,3909,3910,115,third_person_object_pronoun_to_canonical,True,"The ghost glared at [[her]] in fury, and began at once to make preparations for turning himself into a large black dog, an accomplishment for which he was justly renowned, and to which the family doctor always attributed the permanent idiocy of Lord Canterville's uncle, the Hon.","The ghost glared at Mrs. Otis in fury, and began at once to make preparations for turning himself into a large black dog, an accomplishment for which he was justly renowned, and to which the family doctor always attributed the permanent idiocy of Lord Canterville's uncle, the Hon.","The ghost glared at Mrs. Otis in fury, and began at once to make preparations for turning himself into a large black dog, an accomplishment for which he was justly renowned, and to which the family doctor always attributed the permanent idiocy of Lord Canterville's uncle, the Hon.","The ghost glared at Mrs. Otis in fury, and began at once to make preparations for turning himself into a large black dog, an accomplishment for which he was justly renowned, and to which the family doctor always attributed the permanent idiocy of Lord Canterville's uncle, the Hon.",1,15.727320399993914,0.06875831512467111,0.43276605178270044,0.49847563309262843,0.16634526978914194,0.38967883154177274,0.4439758986690855,0.15451641706335856,0.45173005312921755,0.3937535298074238,0.010663797155212014,0.9052949581809457,0.08404124466384214,0.34184970678115234,0.4686240623114171,0.18952623090743073,0.5342324068452944,0.22538134939741022,0.24038624375729548
6,Mrs. Otis,20,352,Mrs. Otis,4035,4037,119,proper_name_to_canonical,False,"The vulgarity of the twins, and the gross materialism of [[Mrs. Otis]], were naturally extremely annoying, but what really distressed him most was that he had been unable to wear the suit of mail.","The vulgarity of the twins, and the gross materialism of Mrs. Otis, were naturally extremely annoying, but what really distressed him most was that he had been unable to wear the suit of mail.","The vulgarity of the twins, and the gross materialism of Mrs. Otis, were naturally extremely annoying, but what really distressed him most was that he had been unable to wear the suit of mail.","The vulgarity of the twins, and the gross materialism of Mrs. Otis, were naturally extremely annoying, but what really distressed him most was that he had been unable to wear the suit of mail.",1,15.727320399993914,0.008947295866089198,0.25950682151058563,0.7315458826233251,0.007705342605482488,0.12570100623657848,0.8665936511579391,0.08632347534791787,0.16868337826817614,0.7449931463839059,0.0025970998042852207,0.4218827339559247,0.5755201662397902,0.22437382632155548,0.2256923758759075,0.549933797802537,0.1997563061425829,0.3309772465172341,0.46926644734018297
6,Mrs. Otis,21,396,his wife,4472,4474,132,ambiguous_or_unsupported_keep_original,False,"Having reduced the reckless and foolhardy youth to a condition of abject terror, he was then to proceed to the room occupied by the United States Minister and [[his wife]], and there to place a clammy hand on Mrs. Otis's forehead, while he hissed into her trembling husband's ear the awful secrets of the charnel-house.","Having reduced the reckless and foolhardy youth to a condition of abject terror, he was then to proceed to the room occupied by the United States Minister and his wife, and there to place a clammy hand on Mrs. Otis's forehead, while he hissed into her trembling husband's ear the awful secrets of the charnel-house.","Having reduced the reckless and foolhardy youth to a condition of abject terror, he was then to proceed to the room occupied by the United States Minister and his wife, and there to place a clammy hand on Mrs. Otis's forehead, while he hissed into her trembling husband's ear the awful secrets of the charnel-house.","Having reduced the reckless and foolhardy youth to a condition of abject terror, he was then to proceed to the room occupied by the United States Minister and his wife, and there to place a clammy hand on Mrs. Otis's forehead, while he hissed into her trembling husband's ear the awful secrets of the charnel-house.",1,15.727320399993914,0.05215807103854194,0.33796126186958697,0.609880667091871,0.10726818561908358,0.37495159965952096,0.5177802147213953,0.042086159443779046,0.4381732763042293,0.5197405642519917,0.09906174158248508,0.508758669217518,0.3921795891999969,0.961696185650285,0.02237527149524937,0.015928542854465585,0.295046623211281,0.322388208396498,0.38256516839222093
6,Mrs. Otis,22,398,Mrs. Otis,4483,4485,132,proper_name_to_canonical,False,"Having reduced the reckless and foolhardy youth to a condition of abject terror, he was then to proceed to the room occupied by the United States Minister and his wife, and there to place a clammy hand on [[Mrs. Otis]]'s forehead, while he hissed into her trembling husband's ear the awful secrets of the charnel-house.","Having reduced the reckless and foolhardy youth to a condition of abject terror, he was then to proceed to the room occupied by the United States Minister and his wife, and there to place a clammy hand on Mrs. Otis's forehead, while he hissed into her trembling husband's ear the awful secrets of the charnel-house.","Having reduced the reckless and foolhardy youth to a condition of abject terror, he was then to proceed to the room occupied by the United States Minister and his wife, and there to place a clammy hand on Mrs. Otis's forehead, while he hissed into her trembling husband's ear the awful secrets of the charnel-house.","Having reduced the reckless and foolhardy youth to a condition of abject terror, he was then to proceed to the room occupied by the United States Minister and his wife, and there to place a clammy hand on Mrs. Otis's forehead, while he hissed into her trembling husband's ear the awful secrets of the charnel-house.",1,15.727320399993914,0.05201947626951374,0.33838245716250237,0.609598066567984,0.10783326201989474,0.3754573030039964,0.5167094349761089,0.042086159443779046,0.4381732763042293,0.5197405642519917,0.09906174158248508,0.508758669217518,0.3921795891999969,0.961696185650285,0.02237527149524937,0.015928542854465585,0.295046623211281,0.322388208396498,0.38256516839222093
6,Mrs. Otis,23,400,her,4492,4493,132,third_person_possessive_pronoun_to_canonical_possessive,True,"Having reduced the reckless and foolhardy youth to a condition of abject terror, he was then to proceed to the room occupied by the United States Minister and his wife, and there to place a clammy hand on Mrs. Otis's forehead, while he hissed into [[her]] trembling husband's ear the awful secrets of the charnel-house.","Having reduced the reckless and foolhardy youth to a condition of abject terror, he was then to proceed to the room occupied by the United States Minister and his wife, and there to place a clammy hand on Mrs. Otis's forehead, while he hissed into Mrs. Otis' trembling husband's ear the awful secrets of the charnel-house.","Having reduced the reckless and foolhardy youth to a condition of abject terror, he was then to proceed to the room occupied by the United States Minister and his wife, and there to place a clammy hand on Mrs. Otis's forehead, while he hissed into Mrs. Otis' trembling husband's ear the awful secrets of the charnel-house.","Having reduced the reckless and foolhardy youth to a condition of abject terror, he was then to proceed to the room occupied by the United States Minister and his wife, and there to place a clammy hand on Mrs. Otis's forehead, while he hissed into Mrs. Otis' trembling husband's ear the awful secrets of the charnel-house.",1,15.727320399993914,0.06267847991185058,0.30521790927004155,0.6321036108181078,0.12242936495092416,0.3730796976842947,0.5044909373647811,0.050424043432953876,0.4386922717174451,0.5108836848496009,0.12015504096780011,0.46534860978808745,0.41449634924411244,0.9641870723152768,0.01914603952796913,0.016666888156754173,0.2889018491566267,0.28628641760515566,0.42481173323821764
6,Mrs. Otis,24,442,his murdered wife,4911,4914,142,ambiguous_or_unsupported_keep_original,False,"He stepped stealthily out of the wainscoting, with an evil smile on his cruel, wrinkled mouth, and the moon hid her face in a cloud as he stole past the great oriel window, where his own arms and those of [[his murdered wife]] were blazoned in azure and gold.","He stepped stealthily out of the wainscoting, with an evil smile on his cruel, wrinkled mouth, and the moon hid her face in a cloud as he stole past the great oriel window, where his own arms and those of his murdered wife were blazoned in azure and gold.","He stepped stealthily out of the wainscoting, with an evil smile on his cruel, wrinkled mouth, and the moon hid her face in a cloud as he stole past the great oriel window, where his own arms and those of his murdered wife were blazoned in azure and gold.","He stepped stealthily out of the wainscoting, with an evil smile on his cruel, wrinkled mouth, and the moon hid her face in a cloud as he stole past the great oriel window, where his own arms and those of his murdered wife were blazoned in azure and gold.",1,15.727320399993914,0.024720750628931313,0.1793050077872211,0.7959742415838476,0.029618414251249354,0.2561140449811725,0.7142675407675781,0.045635922661847274,0.3214505178469714,0.6329135594911814,0.057640541920024525,0.7046097769105113,0.23774968116946424,0.246253103096852,0.4835547614041074,0.2701921354990407,0.20726564510615164,0.23555182848112,0.5571825264127284
6,Mrs. Otis,25,495,his new friend,5437,5440,156,ambiguous_or_unsupported_keep_original,False,"Accordingly, just as the dawn was touching the hills with silver, he returned towards the spot where he had first laid eyes on the grisly phantom, feeling that, after all, two ghosts were better than one, and that, by the aid of [[his new friend]], he might safely grapple with the twins.","Accordingly, just as the dawn was touching the hills with silver, he returned towards the spot where he had first laid eyes on the grisly phantom, feeling that, after all, two ghosts were better than one, and that, by the aid of his new friend, he might safely grapple with the twins.","Accordingly, just as the dawn was touching the hills with silver, he returned towards the spot where he had first laid eyes on the grisly phantom, feeling that, after all, two ghosts were better than one, and that, by the aid of his new friend, he might safely grapple with the twins.","Accordingly, just as the dawn was touching the hills with silver, he returned towards the spot where he had first laid eyes on the grisly phantom, feeling that, after all, two ghosts were better than one, and that, by the aid of his new friend, he might safely grapple with the twins.",1,15.727320399993914,0.43903530548949893,0.3968290619851722,0.1641356325253289,0.3839211384261827,0.3633117864924831,0.25276707508133434,0.26772222130207873,0.3616696424725261,0.3706081362253952,0.4134605497746304,0.24676804912101494,0.3397714011043546,0.2562961395573954,0.543905205623698,0.19979865481890666,0.2710415218218751,0.32336628760805136,0.4055921905700736
6,Mrs. Otis,26,628,his wife,6978,6980,201,ambiguous_or_unsupported_keep_original,False,"He had gone down-stairs to the great entrance-hall, feeling sure that there, at any rate, he would be quite unmolested, and was amusing himself by making satirical remarks on the large Saroni photographs of the United States Minister and [[his wife]] which had now taken the place of the Canterville family pictures.","He had gone down-stairs to the great entrance-hall, feeling sure that there, at any rate, he would be quite unmolested, and was amusing himself by making satirical remarks on the large Saroni photographs of the United States Minister and his wife which had now taken the place of the Canterville family pictures.","He had gone down-stairs to the great entrance-hall, feeling sure that there, at any rate, he would be quite unmolested, and was amusing himself by making satirical remarks on the large Saroni photographs of the United States Minister and his wife which had now taken the place of the Canterville family pictures.","He had gone down-stairs to the great entrance-hall, feeling sure that there, at any rate, he would be quite unmolested, and was amusing himself by making satirical remarks on the large Saroni photographs of the United States Minister and his wife which had now taken the place of the Canterville family pictures.",1,15.727320399993914,0.1038828380124726,0.22513522158915125,0.6709819403983761,0.03212702677759884,0.21124073617053027,0.756632237051871,0.17320379762166419,0.25672965614177806,0.5700665462365577,0.03316651527315836,0.15381036974336665,0.8130231149834749,0.057241632954803695,0.4325692460336426,0.5101891210115538,0.13935836881481986,0.43420788520264364,0.4264337459825364
6,Mrs. Otis,27,666,Mrs. Otis,7368,7370,211,proper_name_to_canonical,False,"Mr. Otis consequently resumed his great work on the history of the Democratic Party, on which he had been engaged for some years; [[Mrs. Otis]] organized a wonderful clam-bake, which amazed the whole county; the boys took to lacrosse euchre, poker, and other American national games, and Virginia rode about the lanes on her pony, accompanied by the young Duke of Cheshire, who had come to spend the last week of his holidays at Canterville Chase.","Mr. Otis consequently resumed his great work on the history of the Democratic Party, on which he had been engaged for some years; Mrs. Otis organized a wonderful clam-bake, which amazed the whole county; the boys took to lacrosse euchre, poker, and other American national games, and Virginia rode about the lanes on her pony, accompanied by the young Duke of Cheshire, who had come to spend the last week of his holidays at Canterville Chase.","Mr. Otis consequently resumed his great work on the history of the Democratic Party, on which he had been engaged for some years; Mrs. Otis organized a wonderful clam-bake, which amazed the whole county; the boys took to lacrosse euchre, poker, and other American national games, and Virginia rode about the lanes on her pony, accompanied by the young Duke of Cheshire, who had come to spend the last week of his holidays at Canterville Chase.","Mr. Otis consequently resumed his great work on the history of the Democratic Party, on which he had been engaged for some years; Mrs. Otis organized a wonderful clam-bake, which amazed the whole county; the boys took to lacrosse euchre, poker, and other American national games, and Virginia rode about the lanes on her pony, accompanied by the young Duke of Cheshire, who had come to spend the last week of his holidays at Canterville Chase.",1,15.727320399993914,0.8495273154694563,0.046625229294457095,0.10384745523608661,0.8849090818615577,0.05748926234971328,0.057601655788728945,0.9013629229016569,0.03208725009298944,0.0665498270053537,0.9708851416212464,0.006136431159513116,0.02297842721924042,0.00926643409738222,0.39866337308215916,0.5920701928204586,0.19845924124615585,0.2628982270958924,0.5386425316579517
6,Mrs. Otis,28,683,the Minister's worthy wife,7478,7483,212,proper_name_to_canonical,True,"It was generally assumed that the ghost had gone away, and, in fact, Mr. Otis wrote a letter to that effect to Lord Canterville, who, in reply, expressed his great pleasure at the news, and sent his best congratulations to [[the Minister's worthy wife]].","It was generally assumed that the ghost had gone away, and, in fact, Mr. Otis wrote a letter to that effect to Lord Canterville, who, in reply, expressed his great pleasure at the news, and sent his best congratulations to Mrs. Otis.","It was generally assumed that the ghost had gone away, and, in fact, Mr. Otis wrote a letter to that effect to Lord Canterville, who, in reply, expressed his great pleasure at the news, and sent his best congratulations to Mrs. Otis.","It was generally assumed that the ghost had gone away, and, in fact, Mr. Otis wrote a letter to that effect to Lord Canterville, who, in reply, expressed his great pleasure at the news, and sent his best congratulations to Mrs. Otis.",1,15.727320399993914,0.3328964026703515,0.27303204001363346,0.39407155731601506,0.3600463927771959,0.2432629721767517,0.3966906350460524,0.2529682088416812,0.36247082919155943,0.3845609619667595,0.8646835552138906,0.03078034208290812,0.10453610270320117,0.11568357562535846,0.626908172025332,0.2574082523493095,0.25422762790850106,0.44917536893194115,0.29659700315955784
6,Mrs. Otis,29,716,she,7783,7784,216,third_person_subject_pronoun_to_canonical,True,"Accordingly, he made arrangements for appearing to Virginia's little lover in his celebrated impersonation of ""The Vampire Monk, or the Bloodless Benedictine,"" a performance so horrible that when old Lady Startup saw it, which [[she]] did on one fatal New Year's Eve, in the year 1764, she went off into the most piercing shrieks, which culminated in violent apoplexy, and died in three days, after disinheriting the Cantervilles, who were her nearest relations, and leaving all her money to her London apothecary.","Accordingly, he made arrangements for appearing to Virginia's little lover in his celebrated impersonation of ""The Vampire Monk, or the Bloodless Benedictine,"" a performance so horrible that when old Lady Startup saw it, which Mrs. Otis did on one fatal New Year's Eve, in the year 1764, she went off into the most piercing shrieks, which culminated in violent apoplexy, and died in three days, after disinheriting the Cantervilles, who were her nearest relations, and leaving all her money to her London apothecary.","Accordingly, he made arrangements for appearing to Virginia's little lover in his celebrated impersonation of ""The Vampire Monk, or the Bloodless Benedictine,"" a performance so horrible that when old Lady Startup saw it, which Mrs. Otis did on one fatal New Year's Eve, in the year 1764, she went off into the most piercing shrieks, which culminated in violent apoplexy, and died in three days, after disinheriting the Cantervilles, who were her nearest relations, and leaving all her money to her London apothecary.","Accordingly, he made arrangements for appearing to Virginia's little lover in his celebrated impersonation of ""The Vampire Monk, or the Bloodless Benedictine,"" a performance so horrible that when old Lady Startup saw it, which Mrs. Otis did on one fatal New Year's Eve, in the year 1764, she went off into the most piercing shrieks, which culminated in violent apoplexy, and died in three days, after disinheriting the Cantervilles, who were her nearest relations, and leaving all her money to her London apothecary.",1,15.727320399993914,0.08041831223381937,0.4329366981766908,0.4866449895894899,0.15539191907489489,0.4084547348006853,0.43615334612441975,0.14374426816713345,0.37364159497042854,0.482614136862438,0.09362126999974489,0.509272474760332,0.39710625523992316,0.31677660135954233,0.5079407295298354,0.17528266911062237,0.29989529308612617,0.26439833962865916,0.4357063672852147
6,Mrs. Otis,30,718,she,7798,7799,216,third_person_subject_pronoun_to_canonical,True,"Accordingly, he made arrangements for appearing to Virginia's little lover in his celebrated impersonation of ""The Vampire Monk, or the Bloodless Benedictine,"" a performance so horrible that when old Lady Startup saw it, which she did on one fatal New Year's Eve, in the year 1764, [[she]] went off into the most piercing shrieks, which culminated in violent apoplexy, and died in three days, after disinheriting the Cantervilles, who were her nearest relations, and leaving all her money to her London apothecary.","Accordingly, he made arrangements for appearing to Virginia's little lover in his celebrated impersonation of ""The Vampire Monk, or the Bloodless Benedictine,"" a performance so horrible that when old Lady Startup saw it, which she did on one fatal New Year's Eve, in the year 1764, Mrs. Otis went off into the most piercing shrieks, which culminated in violent apoplexy, and died in three days, after disinheriting the Cantervilles, who were her nearest relations, and leaving all her money to her London apothecary.","Accordingly, he made arrangements for appearing to Virginia's little lover in his celebrated impersonation of ""The Vampire Monk, or the Bloodless Benedictine,"" a performance so horrible that when old Lady Startup saw it, which she did on one fatal New Year's Eve, in the year 1764, Mrs. Otis went off into the most piercing shrieks, which culminated in violent apoplexy, and died in three days, after disinheriting the Cantervilles, who were her nearest relations, and leaving all her money to her London apothecary.","Accordingly, he made arrangements for appearing to Virginia's little lover in his celebrated impersonation of ""The Vampire Monk, or the Bloodless Benedictine,"" a performance so horrible that when old Lady Startup saw it, which she did on one fatal New Year's Eve, in the year 1764, Mrs. Otis went off into the most piercing shrieks, which culminated in violent apoplexy, and died in three days, after disinheriting the Cantervilles, who were her nearest relations, and leaving all her money to her London apothecary.",1,15.727320399993914,0.04811213230292467,0.3868383990807268,0.5650494686163485,0.10124020041323464,0.3311848170841026,0.5675749825026627,0.10693364369338473,0.30473718012762996,0.5883291761789853,0.04755835794085244,0.4913229191717092,0.4611187228874385,0.503665063933295,0.257372582583335,0.23896235348336986,0.3529576199278802,0.2670776390565395,0.37996474101558037
6,Mrs. Otis,31,721,her,7826,7827,216,third_person_possessive_pronoun_to_canonical_possessive,True,"Accordingly, he made arrangements for appearing to Virginia's little lover in his celebrated impersonation of ""The Vampire Monk, or the Bloodless Benedictine,"" a performance so horrible that when old Lady Startup saw it, which she did on one fatal New Year's Eve, in the year 1764, she went off into the most piercing shrieks, which culminated in violent apoplexy, and died in three days, after disinheriting the Cantervilles, who were [[her]] nearest relations, and leaving all her money to her London apothecary.","Accordingly, he made arrangements for appearing to Virginia's little lover in his celebrated impersonation of ""The Vampire Monk, or the Bloodless Benedictine,"" a performance so horrible that when old Lady Startup saw it, which she did on one fatal New Year's Eve, in the year 1764, she went off into the most piercing shrieks, which culminated in violent apoplexy, and died in three days, after disinheriting the Cantervilles, who were Mrs. Otis' nearest relations, and leaving all her money to her London apothecary.","Accordingly, he made arrangements for appearing to Virginia's little lover in his celebrated impersonation of ""The Vampire Monk, or the Bloodless Benedictine,"" a performance so horrible that when old Lady Startup saw it, which she did on one fatal New Year's Eve, in the year 1764, she went off into the most piercing shrieks, which culminated in violent apoplexy, and died in three days, after disinheriting the Cantervilles, who were Mrs. Otis' nearest relations, and leaving all her money to her London apothecary.","Accordingly, he made arrangements for appearing to Virginia's little lover in his celebrated impersonation of ""The Vampire Monk, or the Bloodless Benedictine,"" a performance so horrible that when old Lady Startup saw it, which she did on one fatal New Year's Eve, in the year 1764, she went off into the most piercing shrieks, which culminated in violent apoplexy, and died in three days, after disinheriting the Cantervilles, who were Mrs. Otis' nearest relations, and leaving all her money to her London apothecary.",1,15.727320399993914,0.16549782244708774,0.4620020671563619,0.3725001103965504,0.18927737146450047,0.39487334803975943,0.4158492804957401,0.22014008274221103,0.36893537947547766,0.4109245377823113,0.17430543500743623,0.5561201997237586,0.26957436526880524,0.27408235783417645,0.5990164072589943,0.12690123490682909,0.2648661458000911,0.28325944942113646,0.4518744047787725
