cluster_id,subject,mention_index_in_cluster,mention_id,mention_text,mention_start,mention_end,sentence_index,mention_render_rule,mention_render_was_changed,original_context_text,rendered_context_text,context_text,normalized_context_text,chunk_index,elapsed_seconds_at_completion,openness_positive_probability,openness_negative_probability,openness_neutral_probability,conscientiousness_positive_probability,conscientiousness_negative_probability,conscientiousness_neutral_probability,extraversion_positive_probability,extraversion_negative_probability,extraversion_neutral_probability,agreeableness_positive_probability,agreeableness_negative_probability,agreeableness_neutral_probability,neuroticism_positive_probability,neuroticism_negative_probability,neuroticism_neutral_probability,OCEAN_weight_high_probability,OCEAN_weight_medium_probability,OCEAN_weight_low_probability
7,Virginia,110,915,I,9460,9461,273,first_second_person_keep_original,False,"""Have you ever read the old prophecy on the library window?"" ""Oh, often,"" cried the little girl, looking up; "" [[I]] know it quite well.","""Have you ever read the old prophecy on the library window?"" ""Oh, often,"" cried the little girl, looking up; "" I know it quite well.","""Have you ever read the old prophecy on the library window?"" ""Oh, often,"" cried the little girl, looking up; "" I know it quite well.","""Have you ever read the old prophecy on the library window?"" ""Oh, often,"" cried the little girl, looking up; "" I know it quite well.",2,29.854924900006154,0.47114922628621836,0.2488850837073046,0.279965690006477,0.15152599515809784,0.26658645544787296,0.5818875493940292,0.29875967917543966,0.29774027107321344,0.40350004975134696,0.3911391117178965,0.12704629688158342,0.48181459140052,0.1096072311291235,0.6657128543326675,0.22467991453820899,0.21115968311139738,0.45357647791549954,0.3352638389731031
7,Virginia,111,919,I,9535,9536,276,first_second_person_keep_original,False,"""But [[I]] don't know what they mean.","""But I don't know what they mean.","""But I don't know what they mean.","""But I don't know what they mean.",2,29.854924900006154,0.2882191933295682,0.3764597449330921,0.3353210617373396,0.12040104436140242,0.417377993078357,0.46222096256024064,0.1672099511548539,0.46145610428296113,0.37133394456218494,0.14918200721853817,0.2864347711739613,0.5643832216075005,0.26345999727923874,0.4789316017984085,0.2576084009223527,0.01819868167674713,0.7633199546869643,0.21848136363628856
7,Virginia,112,921,you,9557,9558,277,first_second_person_keep_original,False,""" ""They mean,"" he said, sadly, ""that [[you]] must weep with me for my sins, because I have no tears, and pray with me for my soul, because I have no faith, and then, if you have always been sweet, and good, and gentle, the angel of death will have mercy on me.",""" ""They mean,"" he said, sadly, ""that you must weep with me for my sins, because I have no tears, and pray with me for my soul, because I have no faith, and then, if you have always been sweet, and good, and gentle, the angel of death will have mercy on me.",""" ""They mean,"" he said, sadly, ""that you must weep with me for my sins, because I have no tears, and pray with me for my soul, because I have no faith, and then, if you have always been sweet, and good, and gentle, the angel of death will have mercy on me.",""" ""They mean,"" he said, sadly, ""that you must weep with me for my sins, because I have no tears, and pray with me for my soul, because I have no faith, and then, if you have always been sweet, and good, and gentle, the angel of death will have mercy on me.",2,29.854924900006154,0.06323258225655273,0.35928803684621513,0.5774793808972322,0.08053679734172929,0.17049640131037253,0.7489668013478982,0.03264566267820998,0.25245783142890466,0.7148965058928853,0.5275523772224279,0.14247493969925895,0.3299726830783131,0.4951907782235091,0.3930693532286165,0.11173986854787439,0.20897304890753657,0.5291878509813156,0.26183910011114786
7,Virginia,113,928,you,9590,9591,277,first_second_person_keep_original,False,""" ""They mean,"" he said, sadly, ""that you must weep with me for my sins, because I have no tears, and pray with me for my soul, because I have no faith, and then, if [[you]] have always been sweet, and good, and gentle, the angel of death will have mercy on me.",""" ""They mean,"" he said, sadly, ""that you must weep with me for my sins, because I have no tears, and pray with me for my soul, because I have no faith, and then, if you have always been sweet, and good, and gentle, the angel of death will have mercy on me.",""" ""They mean,"" he said, sadly, ""that you must weep with me for my sins, because I have no tears, and pray with me for my soul, because I have no faith, and then, if you have always been sweet, and good, and gentle, the angel of death will have mercy on me.",""" ""They mean,"" he said, sadly, ""that you must weep with me for my sins, because I have no tears, and pray with me for my soul, because I have no faith, and then, if you have always been sweet, and good, and gentle, the angel of death will have mercy on me.",2,29.854924900006154,0.06323258225655273,0.35928803684621513,0.5774793808972322,0.08053679734172929,0.17049640131037253,0.7489668013478982,0.03264566267820998,0.25245783142890466,0.7148965058928853,0.5275523772224279,0.14247493969925895,0.3299726830783131,0.4951907782235091,0.3930693532286165,0.11173986854787439,0.20897304890753657,0.5291878509813156,0.26183910011114786
7,Virginia,114,930,You,9612,9613,278,first_second_person_keep_original,False,"[[You]] will see fearful shapes in darkness, and wicked voices will whisper in your ear, but they will not harm you, for against the purity of a little child the powers of Hell cannot prevail.","You will see fearful shapes in darkness, and wicked voices will whisper in your ear, but they will not harm you, for against the purity of a little child the powers of Hell cannot prevail.","You will see fearful shapes in darkness, and wicked voices will whisper in your ear, but they will not harm you, for against the purity of a little child the powers of Hell cannot prevail.","You will see fearful shapes in darkness, and wicked voices will whisper in your ear, but they will not harm you, for against the purity of a little child the powers of Hell cannot prevail.",2,29.854924900006154,0.25794159068436384,0.30691207060484293,0.4351463387107932,0.2387681472627455,0.2000835788390315,0.561148273898223,0.15640512058012213,0.4747560676594711,0.3688388117604067,0.3566308118459073,0.2509211148328173,0.3924480733212754,0.17847732771149374,0.5806505294594847,0.24087214282902153,0.26306160089732855,0.17264641353302032,0.5642919855696511
7,Virginia,115,931,your,9626,9627,278,first_second_person_keep_original,False,"You will see fearful shapes in darkness, and wicked voices will whisper in [[your]] ear, but they will not harm you, for against the purity of a little child the powers of Hell cannot prevail.","You will see fearful shapes in darkness, and wicked voices will whisper in your ear, but they will not harm you, for against the purity of a little child the powers of Hell cannot prevail.","You will see fearful shapes in darkness, and wicked voices will whisper in your ear, but they will not harm you, for against the purity of a little child the powers of Hell cannot prevail.","You will see fearful shapes in darkness, and wicked voices will whisper in your ear, but they will not harm you, for against the purity of a little child the powers of Hell cannot prevail.",2,29.854924900006154,0.25794159068436384,0.30691207060484293,0.4351463387107932,0.2387681472627455,0.2000835788390315,0.561148273898223,0.15640512058012213,0.4747560676594711,0.3688388117604067,0.3566308118459073,0.2509211148328173,0.3924480733212754,0.17847732771149374,0.5806505294594847,0.24087214282902153,0.26306160089732855,0.17264641353302032,0.5642919855696511
7,Virginia,116,932,you,9634,9635,278,first_second_person_keep_original,False,"You will see fearful shapes in darkness, and wicked voices will whisper in your ear, but they will not harm [[you]], for against the purity of a little child the powers of Hell cannot prevail.","You will see fearful shapes in darkness, and wicked voices will whisper in your ear, but they will not harm you, for against the purity of a little child the powers of Hell cannot prevail.","You will see fearful shapes in darkness, and wicked voices will whisper in your ear, but they will not harm you, for against the purity of a little child the powers of Hell cannot prevail.","You will see fearful shapes in darkness, and wicked voices will whisper in your ear, but they will not harm you, for against the purity of a little child the powers of Hell cannot prevail.",2,29.854924900006154,0.25794159068436384,0.30691207060484293,0.4351463387107932,0.2387681472627455,0.2000835788390315,0.561148273898223,0.15640512058012213,0.4747560676594711,0.3688388117604067,0.3566308118459073,0.2509211148328173,0.3924480733212754,0.17847732771149374,0.5806505294594847,0.24087214282902153,0.26306160089732855,0.17264641353302032,0.5642919855696511
7,Virginia,117,933,Virginia,9654,9655,279,proper_name_to_canonical,False,""" [[Virginia]] made no answer, and the ghost wrung his hands in wild despair as he looked down at her bowed golden head.",""" Virginia made no answer, and the ghost wrung his hands in wild despair as he looked down at her bowed golden head.",""" Virginia made no answer, and the ghost wrung his hands in wild despair as he looked down at her bowed golden head.",""" Virginia made no answer, and the ghost wrung his hands in wild despair as he looked down at her bowed golden head.",2,29.854924900006154,0.028986682667918946,0.39698636533509285,0.5740269519969882,0.11495530668427544,0.31439398570060334,0.5706507076151212,0.01268786970578892,0.48148586012318273,0.5058262701710284,0.03884023007982612,0.20133383071270758,0.7598259392074663,0.8577663182547304,0.11476161876520749,0.027472062980062106,0.2142402728712423,0.4200769880511842,0.3656827390775736
7,Virginia,118,937,her,9673,9674,279,third_person_possessive_pronoun_to_canonical_possessive,True,""" Virginia made no answer, and the ghost wrung his hands in wild despair as he looked down at [[her]] bowed golden head.",""" Virginia made no answer, and the ghost wrung his hands in wild despair as he looked down at Virginia's bowed golden head.",""" Virginia made no answer, and the ghost wrung his hands in wild despair as he looked down at Virginia's bowed golden head.",""" Virginia made no answer, and the ghost wrung his hands in wild despair as he looked down at Virginia's bowed golden head.",2,29.854924900006154,0.0338549801908293,0.46044505641756284,0.5056999633916078,0.15670221304484055,0.290480013062725,0.5528177738924345,0.015932647526801708,0.4913129242966964,0.492754428176502,0.043823392002988,0.22287979328661753,0.7332968147103944,0.8965924411228281,0.06554629419042363,0.037861264686748185,0.200591531911124,0.4002897378747416,0.39911873021413435
7,Virginia,119,938,she,9679,9680,280,third_person_subject_pronoun_to_canonical,True,"Suddenly [[she]] stood up, very pale, and with a strange light in her eyes.","Suddenly Virginia stood up, very pale, and with a strange light in her eyes.","Suddenly Virginia stood up, very pale, and with a strange light in her eyes.","Suddenly Virginia stood up, very pale, and with a strange light in her eyes.",2,29.854924900006154,0.09024290742484882,0.5335125237154696,0.3762445688596816,0.051210175298227786,0.294982139693029,0.6538076850087433,0.012112637340401194,0.5450567626468391,0.44283060001275965,0.03590455484133662,0.09367661062148558,0.8704188345371778,0.9697445499713245,0.012267033963922296,0.017988416064753158,0.4196928508309104,0.5107152523049893,0.06959189686410039
7,Virginia,120,939,her,9692,9693,280,third_person_possessive_pronoun_to_canonical_possessive,True,"Suddenly she stood up, very pale, and with a strange light in [[her]] eyes.","Suddenly she stood up, very pale, and with a strange light in Virginia's eyes.","Suddenly she stood up, very pale, and with a strange light in Virginia's eyes.","Suddenly she stood up, very pale, and with a strange light in Virginia's eyes.",2,29.854924900006154,0.16512674924634171,0.4910554755573193,0.34381777519633905,0.07696049565172819,0.3091780259382577,0.6138614784100141,0.025936186839964702,0.5734716515751626,0.4005921615848727,0.08083632131566418,0.15780683128529868,0.7613568473990371,0.9612816784399963,0.015118569035161915,0.023599752524841876,0.4364027745206033,0.5177352696574843,0.04586195582191246
7,Virginia,121,940,I,9696,9697,281,first_second_person_keep_original,False,""" [[I]] am not afraid,"" she said firmly, ""and I will ask the angel to have mercy on you.""",""" I am not afraid,"" she said firmly, ""and I will ask the angel to have mercy on you.""",""" I am not afraid,"" she said firmly, ""and I will ask the angel to have mercy on you.""",""" I am not afraid,"" she said firmly, ""and I will ask the angel to have mercy on you.""",2,29.854924900006154,0.10272654499268033,0.4847853894017675,0.4124880656055522,0.34705538379625495,0.2702870046696703,0.38265761153407485,0.3770123011772187,0.42079302986739797,0.20219466895538335,0.43641150772651216,0.3332224325685619,0.23036605970492596,0.05569013604627823,0.6837658541470489,0.26054400980667275,0.5535400353910607,0.038902582763258683,0.40755738184568063
7,Virginia,122,941,she,9702,9703,281,third_person_subject_pronoun_to_canonical,True,"""I am not afraid,"" [[she]] said firmly, ""and I will ask the angel to have mercy on you.""","""I am not afraid,"" Virginia said firmly, ""and I will ask the angel to have mercy on you.""","""I am not afraid,"" Virginia said firmly, ""and I will ask the angel to have mercy on you.""","""I am not afraid,"" Virginia said firmly, ""and I will ask the angel to have mercy on you.""",2,29.854924900006154,0.05366293562441613,0.43794257117805196,0.5083944931975319,0.3625762263122941,0.23086167370863642,0.40656209997906956,0.3611501217898934,0.41700263880561655,0.2218472394044901,0.3757639166726937,0.3818910587468356,0.2423450245804708,0.03936538326815931,0.6710370374606992,0.2895975792711416,0.577071567919727,0.026313330353948096,0.39661510172632475
7,Virginia,123,942,I,9708,9709,281,first_second_person_keep_original,False,"""I am not afraid,"" she said firmly, ""and [[I]] will ask the angel to have mercy on you.""","""I am not afraid,"" she said firmly, ""and I will ask the angel to have mercy on you.""","""I am not afraid,"" she said firmly, ""and I will ask the angel to have mercy on you.""","""I am not afraid,"" she said firmly, ""and I will ask the angel to have mercy on you.""",2,29.854924900006154,0.09765097586119509,0.46524161709453293,0.43710740704427203,0.3399888799973881,0.26388012879475403,0.3961309912078579,0.37133503550906094,0.4181152279610734,0.21054973652986567,0.4340684878585649,0.3234792420018274,0.2424522701396077,0.05821913807670736,0.6754546425196499,0.2663262194036426,0.5498960689011013,0.03925507978923202,0.41084885130966664
7,Virginia,124,946,her,9735,9736,282,third_person_possessive_pronoun_to_canonical_possessive,True,"He rose from his seat with a faint cry of joy, and taking [[her]] hand bent over it with old-fashioned grace and kissed it.","He rose from his seat with a faint cry of joy, and taking Virginia's hand bent over it with old-fashioned grace and kissed it.","He rose from his seat with a faint cry of joy, and taking Virginia's hand bent over it with old-fashioned grace and kissed it.","He rose from his seat with a faint cry of joy, and taking Virginia's hand bent over it with old-fashioned grace and kissed it.",2,29.854924900006154,0.24616448468357194,0.23397603589760602,0.5198594794188222,0.18000584879670745,0.14520486301625687,0.6747892881870358,0.3074290971408086,0.1446530667330406,0.5479178361261507,0.931080722064952,0.01980517260334245,0.04911410533170571,0.046426334571480085,0.7067275097297719,0.24684615569874802,0.21966460393699117,0.33508143238584287,0.445253963677166
7,Virginia,125,949,Virginia,9765,9766,283,proper_name_to_canonical,False,"His fingers were as cold as ice, and his lips burned like fire, but [[Virginia]] did not falter, as he led her across the dusky room.","His fingers were as cold as ice, and his lips burned like fire, but Virginia did not falter, as he led her across the dusky room.","His fingers were as cold as ice, and his lips burned like fire, but Virginia did not falter, as he led her across the dusky room.","His fingers were as cold as ice, and his lips burned like fire, but Virginia did not falter, as he led her across the dusky room.",2,29.854924900006154,0.19258553403509987,0.3679250521822589,0.43948941378264117,0.5998901928518391,0.23486302830245773,0.16524677884570318,0.24280944568881258,0.4599845846172951,0.2972059696938924,0.4941150318373781,0.27085186802766453,0.23503310013495726,0.08722754391258661,0.5696288425673387,0.3431436135200747,0.45329503384255365,0.10906921224547987,0.4376357539119664
7,Virginia,126,951,her,9773,9774,283,third_person_possessive_pronoun_to_canonical_possessive,True,"His fingers were as cold as ice, and his lips burned like fire, but Virginia did not falter, as he led [[her]] across the dusky room.","His fingers were as cold as ice, and his lips burned like fire, but Virginia did not falter, as he led Virginia's across the dusky room.","His fingers were as cold as ice, and his lips burned like fire, but Virginia did not falter, as he led Virginia's across the dusky room.","His fingers were as cold as ice, and his lips burned like fire, but Virginia did not falter, as he led Virginia's across the dusky room.",2,29.854924900006154,0.2960673398541845,0.36115867211393843,0.34277398803187714,0.6826012709973127,0.19390454009398228,0.12349418890870509,0.3180863078140613,0.42242594799847655,0.25948774418746234,0.5687498887365885,0.22283443591835295,0.20841567534505864,0.07032298149563135,0.5951662861068562,0.33451073239751244,0.42250577376673043,0.1024582158834335,0.4750360103498361
7,Virginia,127,956,her,9801,9802,285,third_person_object_pronoun_to_canonical,True,They blew their tasselled horns and with their tiny hands waved to [[her]] to go back.,They blew their tasselled horns and with their tiny hands waved to Virginia to go back.,They blew their tasselled horns and with their tiny hands waved to Virginia to go back.,They blew their tasselled horns and with their tiny hands waved to Virginia to go back.,2,29.854924900006154,0.07748367168609828,0.340400882398368,0.5821154459155338,0.12061272876670838,0.2622872540851288,0.6171000171481629,0.17262419468584406,0.2510441111592205,0.5763316941549355,0.1566450423931713,0.15152933616119998,0.6918256214456286,0.24526159968235334,0.5397703406929082,0.2149680596247385,0.12392400363570434,0.44648543752786035,0.42959055883643527
7,Virginia,128,957,little Virginia,9810,9812,287,proper_name_to_canonical,True,"[[little Virginia]],"" they cried, ""go back!""","Virginia,"" they cried, ""go back!""","Virginia,"" they cried, ""go back!""","Virginia,"" they cried, ""go back!""",3,43.45103050000034,0.12639241313746583,0.516263874657873,0.35734371220466116,0.15845154332116668,0.48438520430072923,0.3571632523781042,0.3383781980851984,0.35254554662688026,0.3090762552879212,0.11916465466058251,0.5441935736520498,0.33664177168736764,0.49881264715842377,0.32197903284261337,0.1792083199989628,0.12687059291730596,0.3749474105595146,0.49818199652317935
7,Virginia,129,960,her,9826,9827,288,third_person_possessive_pronoun_to_canonical_possessive,True,"but the ghost clutched [[her]] hand more tightly, and she shut her eyes against them.","but the ghost clutched Virginia's hand more tightly, and she shut her eyes against them.","but the ghost clutched Virginia's hand more tightly, and she shut her eyes against them.","but the ghost clutched Virginia's hand more tightly, and she shut her eyes against them.",3,43.45103050000034,0.027462117448114182,0.4073141892498287,0.5652236933020571,0.10094890752009952,0.22517111324066968,0.6738799792392308,0.03619176064707542,0.3471711252120805,0.6166371141408441,0.09491857936791068,0.2299323395625712,0.6751490810695181,0.5959298105515559,0.3603923161250878,0.043677873323356084,0.21220086429971197,0.4921787152749596,0.29562042042532843
7,Virginia,130,961,she,9832,9833,288,third_person_subject_pronoun_to_canonical,True,"but the ghost clutched her hand more tightly, and [[she]] shut her eyes against them.","but the ghost clutched her hand more tightly, and Virginia shut her eyes against them.","but the ghost clutched her hand more tightly, and Virginia shut her eyes against them.","but the ghost clutched her hand more tightly, and Virginia shut her eyes against them.",3,43.45103050000034,0.026197356370487836,0.42074447063047116,0.5530581729990409,0.06982606424062732,0.272517188504287,0.6576567472550857,0.03035414757714263,0.37699060841402365,0.5926552440088337,0.07859474975315109,0.37049576328606837,0.5509094869607806,0.4295162296966515,0.5424294146091309,0.028054355694217596,0.26242854177404157,0.4878929468893596,0.24967851133659896
7,Virginia,131,962,her,9834,9835,288,third_person_possessive_pronoun_to_canonical_possessive,True,"but the ghost clutched her hand more tightly, and she shut [[her]] eyes against them.","but the ghost clutched her hand more tightly, and she shut Virginia's eyes against them.","but the ghost clutched her hand more tightly, and she shut Virginia's eyes against them.","but the ghost clutched her hand more tightly, and she shut Virginia's eyes against them.",3,43.45103050000034,0.022277160474408225,0.37678960684862867,0.6009332326769631,0.11879986190059261,0.22832283192678474,0.6528773061726226,0.04062372278267866,0.3589069413031318,0.6004693359141896,0.08515612898184759,0.32294892883718895,0.5918949421809635,0.5555287094082195,0.36325882704476903,0.08121246354701146,0.18338908801174297,0.4224549086454057,0.3941560033428513
7,Virginia,132,963,her,9849,9850,289,third_person_object_pronoun_to_canonical,True,"Horrible animals with lizard tails and goggle eyes blinked at [[her]] from the carven chimneypiece, and murmured, ""Beware!","Horrible animals with lizard tails and goggle eyes blinked at Virginia from the carven chimneypiece, and murmured, ""Beware!","Horrible animals with lizard tails and goggle eyes blinked at Virginia from the carven chimneypiece, and murmured, ""Beware!","Horrible animals with lizard tails and goggle eyes blinked at Virginia from the carven chimneypiece, and murmured, ""Beware!",3,43.45103050000034,0.08152070322243454,0.32226324222939684,0.5962160545481686,0.0912168704676255,0.39276081001710456,0.5160223195152699,0.06087883933911613,0.36348967167268464,0.5756314889881993,0.029748013440567045,0.23126022801189833,0.7389917585475347,0.5042954565137432,0.42590529402187693,0.06979924946437985,0.19559496246567834,0.42162979586866506,0.3827752416656566
7,Virginia,133,964,little Virginia,9861,9863,290,proper_name_to_canonical,True,"[[little Virginia]], beware!","Virginia, beware!","Virginia, beware!","Virginia, beware!",3,43.45103050000034,0.1483611140179676,0.520874243030705,0.3307646429513275,0.06741722581918554,0.6779042338577906,0.2546785403230238,0.15466791791134243,0.6371019994838326,0.20823008260482503,0.05569948458718211,0.6426032692112125,0.3016972462016053,0.6721998151442083,0.2372930498750158,0.09050713498077591,0.29794431111802483,0.422947640674797,0.27910804820717827
7,Virginia,134,965,you,9870,9871,291,first_second_person_keep_original,False,"we may never see [[you]] again,"" but the Ghost glided on more swiftly, and Virginia did not listen.","we may never see you again,"" but the Ghost glided on more swiftly, and Virginia did not listen.","we may never see you again,"" but the Ghost glided on more swiftly, and Virginia did not listen.","we may never see you again,"" but the Ghost glided on more swiftly, and Virginia did not listen.",3,43.45103050000034,0.06834182790557132,0.4387356174743735,0.4929225546200552,0.09026886045417659,0.3524303811124606,0.5573007584333628,0.05894288524811279,0.575017778617306,0.3660393361345812,0.03531247291273947,0.31604563965895677,0.6486418874283038,0.1511767023934247,0.7226337270293074,0.1261895705772679,0.12758269153426613,0.38322344679204956,0.4891938616736844
7,Virginia,135,967,Virginia,9883,9884,291,proper_name_to_canonical,False,"we may never see you again,"" but the Ghost glided on more swiftly, and [[Virginia]] did not listen.","we may never see you again,"" but the Ghost glided on more swiftly, and Virginia did not listen.","we may never see you again,"" but the Ghost glided on more swiftly, and Virginia did not listen.","we may never see you again,"" but the Ghost glided on more swiftly, and Virginia did not listen.",3,43.45103050000034,0.06837472535956692,0.43894681002269154,0.49267846461774156,0.09018093580879667,0.3525171593449735,0.5573019048462299,0.058935107685909045,0.574380711909104,0.366684180404987,0.03534227016665707,0.3153099947448808,0.6493477350884621,0.15078254366845215,0.7228642919354706,0.1263531643960772,0.12725695727717173,0.3833665308454384,0.48937651187738973
