cluster_id,subject,mention_index_in_cluster,mention_id,mention_text,mention_start,mention_end,sentence_index,mention_render_rule,mention_render_was_changed,original_context_text,rendered_context_text,context_text,normalized_context_text,chunk_index,elapsed_seconds_at_completion,openness_positive_probability,openness_negative_probability,openness_neutral_probability,conscientiousness_positive_probability,conscientiousness_negative_probability,conscientiousness_neutral_probability,extraversion_positive_probability,extraversion_negative_probability,extraversion_neutral_probability,agreeableness_positive_probability,agreeableness_negative_probability,agreeableness_neutral_probability,neuroticism_positive_probability,neuroticism_negative_probability,neuroticism_neutral_probability,OCEAN_weight_high_probability,OCEAN_weight_medium_probability,OCEAN_weight_low_probability
6,Mrs. Otis,48,1202,my,11368,11369,336,first_second_person_keep_original,False,"""My own darling, thank God you are found; you must never leave [[my]] side again,"" murmured Mrs. Otis, as she kissed the trembling child, and smoothed the tangled gold of her hair.","""My own darling, thank God you are found; you must never leave my side again,"" murmured Mrs. Otis, as she kissed the trembling child, and smoothed the tangled gold of her hair.","""My own darling, thank God you are found; you must never leave my side again,"" murmured Mrs. Otis, as she kissed the trembling child, and smoothed the tangled gold of her hair.","""My own darling, thank God you are found; you must never leave my side again,"" murmured Mrs. Otis, as she kissed the trembling child, and smoothed the tangled gold of her hair.",1,15.727320399993914,0.06099990715224622,0.26894715761252797,0.6700529352352258,0.13806458740588828,0.22508793129114393,0.6368474813029679,0.141005857680942,0.2617028334256976,0.5972913088933604,0.9570670247642251,0.030885279392499562,0.012047695843275167,0.6986621915266292,0.2693418299874165,0.03199597848595432,0.36006543608146224,0.31161066245791136,0.3283239014606264
6,Mrs. Otis,49,1203,Mrs. Otis,11374,11376,336,proper_name_to_canonical,False,"""My own darling, thank God you are found; you must never leave my side again,"" murmured [[Mrs. Otis]], as she kissed the trembling child, and smoothed the tangled gold of her hair.","""My own darling, thank God you are found; you must never leave my side again,"" murmured Mrs. Otis, as she kissed the trembling child, and smoothed the tangled gold of her hair.","""My own darling, thank God you are found; you must never leave my side again,"" murmured Mrs. Otis, as she kissed the trembling child, and smoothed the tangled gold of her hair.","""My own darling, thank God you are found; you must never leave my side again,"" murmured Mrs. Otis, as she kissed the trembling child, and smoothed the tangled gold of her hair.",1,15.727320399993914,0.06099990715224622,0.26894715761252797,0.6700529352352258,0.13806458740588828,0.22508793129114393,0.6368474813029679,0.141005857680942,0.2617028334256976,0.5972913088933604,0.9570670247642251,0.030885279392499562,0.012047695843275167,0.6986621915266292,0.2693418299874165,0.03199597848595432,0.3595001199381159,0.31172967494470377,0.3287702051171802
6,Mrs. Otis,50,1204,she,11378,11379,336,third_person_subject_pronoun_to_canonical,True,"""My own darling, thank God you are found; you must never leave my side again,"" murmured Mrs. Otis, as [[she]] kissed the trembling child, and smoothed the tangled gold of her hair.","""My own darling, thank God you are found; you must never leave my side again,"" murmured Mrs. Otis, as Mrs. Otis kissed the trembling child, and smoothed the tangled gold of her hair.","""My own darling, thank God you are found; you must never leave my side again,"" murmured Mrs. Otis, as Mrs. Otis kissed the trembling child, and smoothed the tangled gold of her hair.","""My own darling, thank God you are found; you must never leave my side again,"" murmured Mrs. Otis, as Mrs. Otis kissed the trembling child, and smoothed the tangled gold of her hair.",1,15.727320399993914,0.061040454891471405,0.25054692148429136,0.6884126236242372,0.14080637028818768,0.19818135805169068,0.6610122716601216,0.14521030791324763,0.26584659160782675,0.5889431004789255,0.9604602259295508,0.029633247181762096,0.009906526888686987,0.6390713329871783,0.32828126483126246,0.032647402181559225,0.38258923335452966,0.3065197616110021,0.31089100503446826
6,Mrs. Otis,51,1254,his wife,11940,11942,357,ambiguous_or_unsupported_keep_original,False,"Then came the United States Minister and [[his wife]], then Washington and the three boys, and in the last carriage was Mrs. Umney.","Then came the United States Minister and his wife, then Washington and the three boys, and in the last carriage was Mrs. Umney.","Then came the United States Minister and his wife, then Washington and the three boys, and in the last carriage was Mrs. Umney.","Then came the United States Minister and his wife, then Washington and the three boys, and in the last carriage was Mrs. Umney.",1,15.727320399993914,0.26737203347365057,0.34398367413534586,0.3886442923910037,0.3922723632286953,0.2826811782432208,0.32504645852808395,0.2716175890771244,0.3520145458912784,0.3763678650315971,0.3823874376084441,0.1922764786489187,0.4253360837426372,0.2438176673247484,0.5451757288177838,0.21100660385746778,0.2372340726995512,0.5574068193177341,0.20535910798271478
6,Mrs. Otis,52,1257,she,11966,11967,358,third_person_subject_pronoun_to_canonical,True,"It was generally felt that, as [[she]] had been frightened by the ghost for more than fifty years of her life, she had a right to see the last of him.","It was generally felt that, as Mrs. Otis had been frightened by the ghost for more than fifty years of her life, she had a right to see the last of him.","It was generally felt that, as Mrs. Otis had been frightened by the ghost for more than fifty years of her life, she had a right to see the last of him.","It was generally felt that, as Mrs. Otis had been frightened by the ghost for more than fifty years of her life, she had a right to see the last of him.",1,15.727320399993914,0.05026775832422987,0.4157294892135969,0.5340027524621732,0.17267158919639355,0.16605664449444457,0.6612717663091618,0.021150951752353226,0.35007325203804973,0.6287757962095971,0.06822591634934451,0.29091170744410505,0.6408623762065504,0.9100177151239558,0.07438941616445291,0.015592868711591275,0.4158473274690506,0.3357782608371115,0.24837441169383784
6,Mrs. Otis,53,1259,her,11979,11980,358,third_person_possessive_pronoun_to_canonical_possessive,True,"It was generally felt that, as she had been frightened by the ghost for more than fifty years of [[her]] life, she had a right to see the last of him.","It was generally felt that, as she had been frightened by the ghost for more than fifty years of Mrs. Otis' life, she had a right to see the last of him.","It was generally felt that, as she had been frightened by the ghost for more than fifty years of Mrs. Otis' life, she had a right to see the last of him.","It was generally felt that, as she had been frightened by the ghost for more than fifty years of Mrs. Otis' life, she had a right to see the last of him.",1,15.727320399993914,0.0406531190107585,0.4530879712593727,0.5062589097298688,0.1432410809042608,0.1585534231669154,0.6982054959288237,0.019000751116593863,0.40161900941675643,0.5793802394666496,0.058157177177594284,0.2885048210594396,0.6533380017629661,0.949144724785916,0.04145887260945857,0.009396402604625194,0.4135955141962648,0.36109688068661183,0.22530760511712342
6,Mrs. Otis,54,1260,she,11982,11983,358,third_person_subject_pronoun_to_canonical,True,"It was generally felt that, as she had been frightened by the ghost for more than fifty years of her life, [[she]] had a right to see the last of him.","It was generally felt that, as she had been frightened by the ghost for more than fifty years of her life, Mrs. Otis had a right to see the last of him.","It was generally felt that, as she had been frightened by the ghost for more than fifty years of her life, Mrs. Otis had a right to see the last of him.","It was generally felt that, as she had been frightened by the ghost for more than fifty years of her life, Mrs. Otis had a right to see the last of him.",1,15.727320399993914,0.05695833108281446,0.4500949852119811,0.4929466837052045,0.20948744788649035,0.16555645598834698,0.6249560961251627,0.02487282082296061,0.43177371824867483,0.5433534609283646,0.07470962725026024,0.2957710055995257,0.6295193671502141,0.9239093351643963,0.06399558777857954,0.012095077057024195,0.43850862061267193,0.35407624929935894,0.20741513008796914
6,Mrs. Otis,55,1301,Mrs. Otis,12356,12358,368,proper_name_to_canonical,False,"I am also informed by [[Mrs. Otis]], who, I may say, is no mean authority upon Art,--having had the privilege of spending several winters in Boston when she was a girl,--that these gems are of great monetary worth, and if offered for sale would fetch a tall price.","I am also informed by Mrs. Otis, who, I may say, is no mean authority upon Art,--having had the privilege of spending several winters in Boston when she was a girl,--that these gems are of great monetary worth, and if offered for sale would fetch a tall price.","I am also informed by Mrs. Otis, who, I may say, is no mean authority upon Art,--having had the privilege of spending several winters in Boston when she was a girl,--that these gems are of great monetary worth, and if offered for sale would fetch a tall price.","I am also informed by Mrs. Otis, who, I may say, is no mean authority upon Art,--having had the privilege of spending several winters in Boston when she was a girl,--that these gems are of great monetary worth, and if offered for sale would fetch a tall price.",1,15.727320399993914,0.27151569003317244,0.22443592184977568,0.5040483881170519,0.5120760586103139,0.22612554490866907,0.2617983964810171,0.16347045518408296,0.3289319931904739,0.5075975516254432,0.38568143225566887,0.12557979976159916,0.48873876798273186,0.028738353237111203,0.6135536667069665,0.35770798005592225,0.15071854456726808,0.35917953370647615,0.4901019217262558
6,Mrs. Otis,56,1303,she,12381,12382,368,third_person_subject_pronoun_to_canonical,True,"I am also informed by Mrs. Otis, who, I may say, is no mean authority upon Art,--having had the privilege of spending several winters in Boston when [[she]] was a girl,--that these gems are of great monetary worth, and if offered for sale would fetch a tall price.","I am also informed by Mrs. Otis, who, I may say, is no mean authority upon Art,--having had the privilege of spending several winters in Boston when Mrs. Otis was a girl,--that these gems are of great monetary worth, and if offered for sale would fetch a tall price.","I am also informed by Mrs. Otis, who, I may say, is no mean authority upon Art,--having had the privilege of spending several winters in Boston when Mrs. Otis was a girl,--that these gems are of great monetary worth, and if offered for sale would fetch a tall price.","I am also informed by Mrs. Otis, who, I may say, is no mean authority upon Art,--having had the privilege of spending several winters in Boston when Mrs. Otis was a girl,--that these gems are of great monetary worth, and if offered for sale would fetch a tall price.",1,15.727320399993914,0.311381439029301,0.19127534086956835,0.4973432201011307,0.5468367504964065,0.199604480838566,0.2535587686650276,0.16139318537708033,0.33018854688383437,0.5084182677390853,0.3926270874919384,0.113704441361754,0.4936684711463074,0.027743832893459785,0.6078496954177347,0.3644064716888055,0.15730371768106394,0.36672563906367944,0.47597064325525656
6,Mrs. Otis,57,1330,Mrs. Otis,12593,12595,372,proper_name_to_canonical,False,"For my own part, I confess I am a good deal surprised to find a child of mine expressing sympathy with mediaevalism in any form, and can only account for it by the fact that Virginia was born in one of your London suburbs shortly after [[Mrs. Otis]] had returned from a trip to Athens.","For my own part, I confess I am a good deal surprised to find a child of mine expressing sympathy with mediaevalism in any form, and can only account for it by the fact that Virginia was born in one of your London suburbs shortly after Mrs. Otis had returned from a trip to Athens.","For my own part, I confess I am a good deal surprised to find a child of mine expressing sympathy with mediaevalism in any form, and can only account for it by the fact that Virginia was born in one of your London suburbs shortly after Mrs. Otis had returned from a trip to Athens.","For my own part, I confess I am a good deal surprised to find a child of mine expressing sympathy with mediaevalism in any form, and can only account for it by the fact that Virginia was born in one of your London suburbs shortly after Mrs. Otis had returned from a trip to Athens.",1,15.727320399993914,0.14298763930962174,0.5674633449537497,0.28954901573662845,0.12662660763997474,0.2892856283892201,0.5840877639708051,0.16741293704115,0.38848723505804744,0.44409982790080255,0.1529115513717776,0.22887590820681653,0.6182125404214058,0.15564579829111735,0.6158917288167338,0.22846247289214874,0.19401595683061995,0.6092492836776294,0.19673475949175057
6,Mrs. Otis,58,1409,her,13032,13033,380,third_person_possessive_pronoun_to_canonical_possessive,True,"They were both so charming, and they loved each other so much, that every one was delighted at the match, except the old Marchioness of Dumbleton, who had tried to catch the Duke for one of [[her]] seven unmarried daughters, and had given no less than three expensive dinner-parties for that purpose, and, strange to say, Mr. Otis himself.","They were both so charming, and they loved each other so much, that every one was delighted at the match, except the old Marchioness of Dumbleton, who had tried to catch the Duke for one of Mrs. Otis' seven unmarried daughters, and had given no less than three expensive dinner-parties for that purpose, and, strange to say, Mr. Otis himself.","They were both so charming, and they loved each other so much, that every one was delighted at the match, except the old Marchioness of Dumbleton, who had tried to catch the Duke for one of Mrs. Otis' seven unmarried daughters, and had given no less than three expensive dinner-parties for that purpose, and, strange to say, Mr. Otis himself.","They were both so charming, and they loved each other so much, that every one was delighted at the match, except the old Marchioness of Dumbleton, who had tried to catch the Duke for one of Mrs. Otis' seven unmarried daughters, and had given no less than three expensive dinner-parties for that purpose, and, strange to say, Mr. Otis himself.",1,15.727320399993914,0.16454352888039875,0.4044747092087965,0.43098176191080473,0.27356889324116007,0.2447470822498674,0.48168402450897246,0.5207595729155616,0.23330356621302983,0.24593686087140862,0.9205913387622326,0.04218262517656328,0.03722603606120407,0.11051492727148765,0.6439375646729987,0.24554750805551362,0.34891883927167455,0.41589693928263016,0.2351842214456953
