cluster_id,subject,mention_index_in_cluster,mention_id,mention_text,mention_start,mention_end,sentence_index,mention_render_rule,mention_render_was_changed,original_context_text,rendered_context_text,context_text,normalized_context_text,chunk_index,elapsed_seconds_at_completion,openness_positive_probability,openness_negative_probability,openness_neutral_probability,conscientiousness_positive_probability,conscientiousness_negative_probability,conscientiousness_neutral_probability,extraversion_positive_probability,extraversion_negative_probability,extraversion_neutral_probability,agreeableness_positive_probability,agreeableness_negative_probability,agreeableness_neutral_probability,neuroticism_positive_probability,neuroticism_negative_probability,neuroticism_neutral_probability,OCEAN_weight_high_probability,OCEAN_weight_medium_probability,OCEAN_weight_low_probability
20,Toto,104,3277,Toto,17437,17438,713,proper_name_to_canonical,False,"And then they scampered in all directions, for [[Toto]] had awakened from his sleep, and seeing all these mice around him he gave one bark of delight and jumped right into the middle of the group.","And then they scampered in all directions, for Toto had awakened from his sleep, and seeing all these mice around him he gave one bark of delight and jumped right into the middle of the group.","And then they scampered in all directions, for Toto had awakened from his sleep, and seeing all these mice around him he gave one bark of delight and jumped right into the middle of the group.","And then they scampered in all directions, for Toto had awakened from his sleep, and seeing all these mice around him he gave one bark of delight and jumped right into the middle of the group.",2,18.05213480000384,0.9318488836288452,0.021003521978855133,0.047147639095783234,0.026681585237383842,0.27707985043525696,0.6962385773658752,0.9918620586395264,0.0025866543874144554,0.0055513279512524605,0.9107145667076111,0.022666094824671745,0.06661935895681381,0.008877811022102833,0.4332219660282135,0.5579001307487488,0.1647174060344696,0.5329489707946777,0.30233365297317505
20,Toto,105,3278,his,17441,17442,713,third_person_possessive_pronoun_to_canonical_possessive,True,"And then they scampered in all directions, for Toto had awakened from [[his]] sleep, and seeing all these mice around him he gave one bark of delight and jumped right into the middle of the group.","And then they scampered in all directions, for Toto had awakened from Toto's sleep, and seeing all these mice around him he gave one bark of delight and jumped right into the middle of the group.","And then they scampered in all directions, for Toto had awakened from Toto's sleep, and seeing all these mice around him he gave one bark of delight and jumped right into the middle of the group.","And then they scampered in all directions, for Toto had awakened from Toto's sleep, and seeing all these mice around him he gave one bark of delight and jumped right into the middle of the group.",2,18.05213480000384,0.9487291574478149,0.019403915852308273,0.031866926699876785,0.02966003306210041,0.31027427315711975,0.660065770149231,0.992889404296875,0.0025616672355681658,0.004548862110823393,0.9285364151000977,0.0172576941549778,0.05420587211847305,0.011148407123982906,0.38784781098365784,0.6010038256645203,0.21245083212852478,0.5120126008987427,0.27553656697273254
20,Toto,106,3279,him,17450,17451,713,third_person_object_pronoun_to_canonical,True,"And then they scampered in all directions, for Toto had awakened from his sleep, and seeing all these mice around [[him]] he gave one bark of delight and jumped right into the middle of the group.","And then they scampered in all directions, for Toto had awakened from his sleep, and seeing all these mice around Toto he gave one bark of delight and jumped right into the middle of the group.","And then they scampered in all directions, for Toto had awakened from his sleep, and seeing all these mice around Toto he gave one bark of delight and jumped right into the middle of the group.","And then they scampered in all directions, for Toto had awakened from his sleep, and seeing all these mice around Toto he gave one bark of delight and jumped right into the middle of the group.",2,18.05213480000384,0.9361465573310852,0.020621666684746742,0.043231815099716187,0.03379884362220764,0.2657836079597473,0.7004175186157227,0.9906677603721619,0.0031346571631729603,0.006197589915245771,0.9210208058357239,0.01832016184926033,0.06065898761153221,0.01216514129191637,0.4420168697834015,0.5458179712295532,0.19450126588344574,0.535987377166748,0.2695113718509674
20,Toto,107,3280,he,17451,17452,713,third_person_subject_pronoun_to_canonical,True,"And then they scampered in all directions, for Toto had awakened from his sleep, and seeing all these mice around him [[he]] gave one bark of delight and jumped right into the middle of the group.","And then they scampered in all directions, for Toto had awakened from his sleep, and seeing all these mice around him Toto gave one bark of delight and jumped right into the middle of the group.","And then they scampered in all directions, for Toto had awakened from his sleep, and seeing all these mice around him Toto gave one bark of delight and jumped right into the middle of the group.","And then they scampered in all directions, for Toto had awakened from his sleep, and seeing all these mice around him Toto gave one bark of delight and jumped right into the middle of the group.",2,18.05213480000384,0.9389663338661194,0.017882848158478737,0.043150823563337326,0.026060091331601143,0.2619795501232147,0.7119604349136353,0.9906733632087708,0.002988208318129182,0.00633840449154377,0.9211198687553406,0.016472039744257927,0.06240813434123993,0.008240642957389355,0.3986104428768158,0.593148946762085,0.1902928352355957,0.5172695517539978,0.29243770241737366
20,Toto,108,3282,Toto,17467,17468,714,proper_name_to_canonical,False,"[[Toto]] had always loved to chase mice when he lived in Kansas, and he saw no harm in it.","Toto had always loved to chase mice when he lived in Kansas, and he saw no harm in it.","Toto had always loved to chase mice when he lived in Kansas, and he saw no harm in it.","Toto had always loved to chase mice when he lived in Kansas, and he saw no harm in it.",2,18.05213480000384,0.08330350369215012,0.29663729667663574,0.6200591325759888,0.0026770094409585,0.13628578186035156,0.8610372543334961,0.32723554968833923,0.056236833333969116,0.6165276169776917,0.07807450741529465,0.1079731285572052,0.8139523863792419,0.001639575813896954,0.30313074588775635,0.695229709148407,0.03743547201156616,0.4381580352783203,0.5244064927101135
20,Toto,109,3283,he,17475,17476,714,third_person_subject_pronoun_to_canonical,True,"Toto had always loved to chase mice when [[he]] lived in Kansas, and he saw no harm in it.","Toto had always loved to chase mice when Toto lived in Kansas, and he saw no harm in it.","Toto had always loved to chase mice when Toto lived in Kansas, and he saw no harm in it.","Toto had always loved to chase mice when Toto lived in Kansas, and he saw no harm in it.",2,18.05213480000384,0.07729379832744598,0.28432101011276245,0.6383851766586304,0.002789378399029374,0.12933091819286346,0.8678797483444214,0.27189400792121887,0.05353747308254242,0.6745685338973999,0.0768154188990593,0.07237312942743301,0.8508114814758301,0.001492556999437511,0.305448055267334,0.6930593848228455,0.04225299879908562,0.47536617517471313,0.48238080739974976
20,Toto,110,3285,he,17481,17482,714,third_person_subject_pronoun_to_canonical,True,"Toto had always loved to chase mice when he lived in Kansas, and [[he]] saw no harm in it.","Toto had always loved to chase mice when he lived in Kansas, and Toto saw no harm in it.","Toto had always loved to chase mice when he lived in Kansas, and Toto saw no harm in it.","Toto had always loved to chase mice when he lived in Kansas, and Toto saw no harm in it.",2,18.05213480000384,0.08384271711111069,0.28718993067741394,0.6289673447608948,0.0025730396155267954,0.1334948092699051,0.8639321327209473,0.3234402537345886,0.05235091596841812,0.6242088675498962,0.12781469523906708,0.08076932281255722,0.7914159893989563,0.0014128307811915874,0.32699054479599,0.6715965867042542,0.051556579768657684,0.47491639852523804,0.47352707386016846
20,Toto,111,3287,the dog,17494,17496,715,simple_nominal_to_canonical,True,"But the Tin Woodman caught [[the dog]] in his arms and held him tight, while he called to the mice, ""Come back!","But the Tin Woodman caught Toto in his arms and held him tight, while he called to the mice, ""Come back!","But the Tin Woodman caught Toto in his arms and held him tight, while he called to the mice, ""Come back!","But the Tin Woodman caught Toto in his arms and held him tight, while he called to the mice, ""Come back!",2,18.05213480000384,0.22349154949188232,0.43094903230667114,0.34555941820144653,0.1714244931936264,0.264020711183548,0.564554750919342,0.4549194872379303,0.2591104209423065,0.2859700322151184,0.9274412989616394,0.04388831928372383,0.028670450672507286,0.1451973170042038,0.6668116450309753,0.18799105286598206,0.1234154999256134,0.38769155740737915,0.4888930022716522
20,Toto,112,3290,him,17501,17502,715,third_person_object_pronoun_to_canonical,True,"But the Tin Woodman caught the dog in his arms and held [[him]] tight, while he called to the mice, ""Come back!","But the Tin Woodman caught the dog in his arms and held Toto tight, while he called to the mice, ""Come back!","But the Tin Woodman caught the dog in his arms and held Toto tight, while he called to the mice, ""Come back!","But the Tin Woodman caught the dog in his arms and held Toto tight, while he called to the mice, ""Come back!",2,18.05213480000384,0.1992562711238861,0.3708084225654602,0.4299353063106537,0.18208199739456177,0.23678499460220337,0.5811330080032349,0.39921966195106506,0.23926684260368347,0.3615134060382843,0.9017292857170105,0.06251265853643417,0.03575804457068443,0.1258465051651001,0.6923841834068298,0.18176937103271484,0.05987424775958061,0.4103667140007019,0.5297590494155884
20,Toto,113,3294,Toto,17518,17519,717,proper_name_to_canonical,False,[[Toto]] shall not hurt you.,Toto shall not hurt you.,Toto shall not hurt you.,Toto shall not hurt you.,2,18.05213480000384,0.1872185468673706,0.532555341720581,0.2802261412143707,0.3396007716655731,0.2750170826911926,0.38538220524787903,0.18595053255558014,0.5268862247467041,0.28716328740119934,0.4192385673522949,0.32858243584632874,0.2521790564060211,0.11907947808504105,0.685547947883606,0.1953725814819336,0.050397664308547974,0.19845260679721832,0.7511497139930725
20,Toto,114,3299,he,17555,17556,718,third_person_subject_pronoun_to_canonical,True,""" At this the Queen of the Mice stuck her head out from underneath a clump of grass and asked, in a timid voice, ""Are you sure [[he]] will not bite us?"" ""I will not let him,"" said the Woodman; ""so do not be afraid.",""" At this the Queen of the Mice stuck her head out from underneath a clump of grass and asked, in a timid voice, ""Are you sure Toto will not bite us?"" ""I will not let him,"" said the Woodman; ""so do not be afraid.",""" At this the Queen of the Mice stuck her head out from underneath a clump of grass and asked, in a timid voice, ""Are you sure Toto will not bite us?"" ""I will not let him,"" said the Woodman; ""so do not be afraid.",""" At this the Queen of the Mice stuck her head out from underneath a clump of grass and asked, in a timid voice, ""Are you sure Toto will not bite us?"" ""I will not let him,"" said the Woodman; ""so do not be afraid.",2,18.05213480000384,0.06589855253696442,0.3761081397533417,0.5579932928085327,0.15111257135868073,0.19280464947223663,0.6560826897621155,0.07469002157449722,0.28884807229042053,0.6364619731903076,0.4397220015525818,0.36459797620773315,0.19568003714084625,0.23792974650859833,0.5359212160110474,0.2261490374803543,0.1978684812784195,0.35061371326446533,0.451517790555954
20,Toto,115,3304,him,17568,17569,718,third_person_object_pronoun_to_canonical,True,""" At this the Queen of the Mice stuck her head out from underneath a clump of grass and asked, in a timid voice, ""Are you sure he will not bite us?"" ""I will not let [[him]],"" said the Woodman; ""so do not be afraid.",""" At this the Queen of the Mice stuck her head out from underneath a clump of grass and asked, in a timid voice, ""Are you sure he will not bite us?"" ""I will not let Toto,"" said the Woodman; ""so do not be afraid.",""" At this the Queen of the Mice stuck her head out from underneath a clump of grass and asked, in a timid voice, ""Are you sure he will not bite us?"" ""I will not let Toto,"" said the Woodman; ""so do not be afraid.",""" At this the Queen of the Mice stuck her head out from underneath a clump of grass and asked, in a timid voice, ""Are you sure he will not bite us?"" ""I will not let Toto,"" said the Woodman; ""so do not be afraid.",2,18.05213480000384,0.06501106172800064,0.413297176361084,0.5216917991638184,0.12477746605873108,0.19439482688903809,0.6808276772499084,0.049049779772758484,0.27317726612091064,0.6777729392051697,0.4768357574939728,0.3083949089050293,0.21476934850215912,0.3386828303337097,0.4620212912559509,0.19929590821266174,0.18796902894973755,0.3076469898223877,0.50438392162323
20,Toto,116,3307,Toto,17594,17595,719,proper_name_to_canonical,False,""" One by one the mice came creeping back, and [[Toto]] did not bark again, although he tried to get out of the Woodman's arms, and would have bitten him had he not known very well he was made of tin.",""" One by one the mice came creeping back, and Toto did not bark again, although he tried to get out of the Woodman's arms, and would have bitten him had he not known very well he was made of tin.",""" One by one the mice came creeping back, and Toto did not bark again, although he tried to get out of the Woodman's arms, and would have bitten him had he not known very well he was made of tin.",""" One by one the mice came creeping back, and Toto did not bark again, although he tried to get out of the Woodman's arms, and would have bitten him had he not known very well he was made of tin.",2,18.05213480000384,0.04108547791838646,0.3545779287815094,0.6043365597724915,0.29978102445602417,0.2048763483762741,0.49534258246421814,0.04624134674668312,0.3909735679626465,0.5627850890159607,0.24611125886440277,0.4431544840335846,0.31073421239852905,0.14116983115673065,0.7044275999069214,0.15440256893634796,0.14765655994415283,0.3941859006881714,0.45815759897232056
20,Toto,117,3308,he,17601,17602,719,third_person_subject_pronoun_to_canonical,True,""" One by one the mice came creeping back, and Toto did not bark again, although [[he]] tried to get out of the Woodman's arms, and would have bitten him had he not known very well he was made of tin.",""" One by one the mice came creeping back, and Toto did not bark again, although Toto tried to get out of the Woodman's arms, and would have bitten him had he not known very well he was made of tin.",""" One by one the mice came creeping back, and Toto did not bark again, although Toto tried to get out of the Woodman's arms, and would have bitten him had he not known very well he was made of tin.",""" One by one the mice came creeping back, and Toto did not bark again, although Toto tried to get out of the Woodman's arms, and would have bitten him had he not known very well he was made of tin.",2,18.05213480000384,0.04653037711977959,0.37430325150489807,0.5791663527488708,0.3240424394607544,0.22220851480960846,0.4537490904331207,0.06442535668611526,0.4008680582046509,0.5347066521644592,0.23496365547180176,0.48140841722488403,0.2836279571056366,0.14841997623443604,0.7077264785766602,0.1438535898923874,0.15454083681106567,0.39367151260375977,0.4517876207828522
20,Toto,118,3312,he,17618,17619,719,third_person_subject_pronoun_to_canonical,True,""" One by one the mice came creeping back, and Toto did not bark again, although he tried to get out of the Woodman's arms, and would have bitten him had [[he]] not known very well he was made of tin.",""" One by one the mice came creeping back, and Toto did not bark again, although he tried to get out of the Woodman's arms, and would have bitten him had Toto not known very well he was made of tin.",""" One by one the mice came creeping back, and Toto did not bark again, although he tried to get out of the Woodman's arms, and would have bitten him had Toto not known very well he was made of tin.",""" One by one the mice came creeping back, and Toto did not bark again, although he tried to get out of the Woodman's arms, and would have bitten him had Toto not known very well he was made of tin.",2,18.05213480000384,0.046093255281448364,0.3677218556404114,0.5861849784851074,0.3358322083950043,0.2154444307088852,0.44872337579727173,0.048643629997968674,0.393026202917099,0.5583301782608032,0.2583942115306854,0.45593827962875366,0.28566738963127136,0.11697620898485184,0.7260755896568298,0.15694820880889893,0.16014458239078522,0.39616814255714417,0.4436872601509094
20,Toto,119,3502,Toto,18561,18562,756,proper_name_to_canonical,False,"they all answered, and away the Queen ran, while Dorothy held [[Toto]] tightly lest he should run after her and frighten her.","they all answered, and away the Queen ran, while Dorothy held Toto tightly lest he should run after her and frighten her.","they all answered, and away the Queen ran, while Dorothy held Toto tightly lest he should run after her and frighten her.","they all answered, and away the Queen ran, while Dorothy held Toto tightly lest he should run after her and frighten her.",2,18.05213480000384,0.020968835800886154,0.24560649693012238,0.7334246039390564,0.10342631489038467,0.19322578608989716,0.7033478617668152,0.09313233941793442,0.2273886650800705,0.6794789433479309,0.3583989143371582,0.18017029762268066,0.4614308476448059,0.5533365607261658,0.2756657302379608,0.17099769413471222,0.11607160419225693,0.47770920395851135,0.40621915459632874
20,Toto,120,3503,he,18564,18565,756,third_person_subject_pronoun_to_canonical,True,"they all answered, and away the Queen ran, while Dorothy held Toto tightly lest [[he]] should run after her and frighten her.","they all answered, and away the Queen ran, while Dorothy held Toto tightly lest Toto should run after her and frighten her.","they all answered, and away the Queen ran, while Dorothy held Toto tightly lest Toto should run after her and frighten her.","they all answered, and away the Queen ran, while Dorothy held Toto tightly lest Toto should run after her and frighten her.",2,18.05213480000384,0.019275875762104988,0.26792049407958984,0.7128036022186279,0.0779971033334732,0.19630025327205658,0.725702702999115,0.08935566246509552,0.21937941014766693,0.6912648677825928,0.23678621649742126,0.26801931858062744,0.49519452452659607,0.4920453727245331,0.2906743884086609,0.2172802835702896,0.10447214543819427,0.4508247673511505,0.4447031021118164
20,Toto,121,3628,Toto,19136,19137,772,proper_name_to_canonical,False,"But the people do not seem to be as friendly as the Munchkins, and I'm afraid we shall be unable to find a place to pass the night."" ""I should like something to eat besides fruit,"" said the girl, ""and I'm sure [[Toto]] is nearly starved.","But the people do not seem to be as friendly as the Munchkins, and I'm afraid we shall be unable to find a place to pass the night."" ""I should like something to eat besides fruit,"" said the girl, ""and I'm sure Toto is nearly starved.","But the people do not seem to be as friendly as the Munchkins, and I'm afraid we shall be unable to find a place to pass the night."" ""I should like something to eat besides fruit,"" said the girl, ""and I'm sure Toto is nearly starved.","But the people do not seem to be as friendly as the Munchkins, and I'm afraid we shall be unable to find a place to pass the night."" ""I should like something to eat besides fruit,"" said the girl, ""and I'm sure Toto is nearly starved.",2,18.05213480000384,0.10987266898155212,0.2728019058704376,0.6173254251480103,0.09200070798397064,0.14925898611545563,0.7587403059005737,0.09672482311725616,0.2422809898853302,0.6609941720962524,0.141641303896904,0.14429394900798798,0.7140647172927856,0.23795999586582184,0.32956916093826294,0.43247076869010925,0.09389185160398483,0.4221317172050476,0.4839763939380646
20,Toto,122,3812,YOU,20026,20027,812,first_second_person_keep_original,False,"But what do [[YOU]] want?"" he continued, speaking to Toto.","But what do YOU want?"" he continued, speaking to Toto.","But what do YOU want?"" he continued, speaking to Toto.","But what do YOU want?"" he continued, speaking to Toto.",2,18.05213480000384,0.30392974615097046,0.4476463496685028,0.24842384457588196,0.18300870060920715,0.4417566955089569,0.3752345144748688,0.2119687795639038,0.4173516631126404,0.3706795275211334,0.33849260210990906,0.3458435833454132,0.3156638741493225,0.2087799459695816,0.6144629120826721,0.17675717175006866,0.1288544088602066,0.2726682722568512,0.5984773635864258
20,Toto,123,3814,Toto,20035,20036,812,proper_name_to_canonical,False,"But what do YOU want?"" he continued, speaking to [[Toto]].","But what do YOU want?"" he continued, speaking to Toto.","But what do YOU want?"" he continued, speaking to Toto.","But what do YOU want?"" he continued, speaking to Toto.",2,18.05213480000384,0.30392974615097046,0.4476463496685028,0.24842384457588196,0.18300870060920715,0.4417566955089569,0.3752345144748688,0.2119687795639038,0.4173516631126404,0.3706795275211334,0.33849260210990906,0.3458435833454132,0.3156638741493225,0.2087799459695816,0.6144629120826721,0.17675717175006866,0.1288544088602066,0.2726682722568512,0.5984773635864258
20,Toto,124,3815,Toto,20037,20038,813,proper_name_to_canonical,False,"[[Toto]] only wagged his tail; for, strange to say, he could not speak.","Toto only wagged his tail; for, strange to say, he could not speak.","Toto only wagged his tail; for, strange to say, he could not speak.","Toto only wagged his tail; for, strange to say, he could not speak.",2,18.05213480000384,0.029986249282956123,0.3776402473449707,0.5923734903335571,0.03880476579070091,0.1278587132692337,0.8333365321159363,0.04797579348087311,0.4569631814956665,0.4950610101222992,0.13341647386550903,0.11889505386352539,0.7476884126663208,0.14125776290893555,0.69631427526474,0.16242797672748566,0.016636095941066742,0.48808085918426514,0.4952830970287323
20,Toto,125,3816,his,20040,20041,813,third_person_possessive_pronoun_to_canonical_possessive,True,"Toto only wagged [[his]] tail; for, strange to say, he could not speak.","Toto only wagged Toto's tail; for, strange to say, he could not speak.","Toto only wagged Toto's tail; for, strange to say, he could not speak.","Toto only wagged Toto's tail; for, strange to say, he could not speak.",2,18.05213480000384,0.014178362675011158,0.3446863889694214,0.6411352753639221,0.02937965840101242,0.11745375394821167,0.8531666398048401,0.018398651853203773,0.425761342048645,0.555840015411377,0.0638980120420456,0.0929710641503334,0.8431309461593628,0.18771758675575256,0.5997781157493591,0.2125042825937271,0.012220989912748337,0.5242370367050171,0.46354204416275024
20,Toto,126,3817,he,20049,20050,813,third_person_subject_pronoun_to_canonical,True,"Toto only wagged his tail; for, strange to say, [[he]] could not speak.","Toto only wagged his tail; for, strange to say, Toto could not speak.","Toto only wagged his tail; for, strange to say, Toto could not speak.","Toto only wagged his tail; for, strange to say, Toto could not speak.",2,18.05213480000384,0.0240477304905653,0.36655983328819275,0.6093924641609192,0.03167574852705002,0.11219067126512527,0.8561335802078247,0.03929801657795906,0.45504340529441833,0.5056585073471069,0.10065506398677826,0.11022455990314484,0.7891203165054321,0.13871659338474274,0.68412184715271,0.17716149985790253,0.014588863588869572,0.485007643699646,0.5004034638404846
20,Toto,127,3826,Toto,20140,20141,817,proper_name_to_canonical,False,"[[Toto]] ate a little of everything, and was glad to get a good supper again.","Toto ate a little of everything, and was glad to get a good supper again.","Toto ate a little of everything, and was glad to get a good supper again.","Toto ate a little of everything, and was glad to get a good supper again.",2,18.05213480000384,0.35235780477523804,0.05103533715009689,0.5966069102287292,0.048268020153045654,0.13693328201770782,0.8147987127304077,0.06455635279417038,0.12639519572257996,0.8090484738349915,0.507228434085846,0.02090517245233059,0.4718663990497589,0.024950111284852028,0.41708269715309143,0.5579671859741211,0.042555131018161774,0.5981651544570923,0.3592797517776489
20,Toto,128,3828,Toto,20170,20171,818,proper_name_to_canonical,False,"The woman now gave Dorothy a bed to sleep in, and [[Toto]] lay down beside her, while the Lion guarded the door of her room so she might not be disturbed.","The woman now gave Dorothy a bed to sleep in, and Toto lay down beside her, while the Lion guarded the door of her room so she might not be disturbed.","The woman now gave Dorothy a bed to sleep in, and Toto lay down beside her, while the Lion guarded the door of her room so she might not be disturbed.","The woman now gave Dorothy a bed to sleep in, and Toto lay down beside her, while the Lion guarded the door of her room so she might not be disturbed.",3,25.768819600023562,0.11879701912403107,0.29532039165496826,0.5858826041221619,0.3222994804382324,0.1445641666650772,0.5331363081932068,0.11907215416431427,0.2671566307544708,0.6137712001800537,0.8479946255683899,0.03520660474896431,0.1167987510561943,0.05384897068142891,0.6352106332778931,0.31094038486480713,0.10891352593898773,0.4098329246044159,0.4812534749507904
