cluster_id,subject,mention_index_in_cluster,mention_id,mention_text,mention_start,mention_end,sentence_index,mention_render_rule,mention_render_was_changed,original_context_text,rendered_context_text,context_text,normalized_context_text,chunk_index,elapsed_seconds_at_completion,openness_positive_probability,openness_negative_probability,openness_neutral_probability,conscientiousness_positive_probability,conscientiousness_negative_probability,conscientiousness_neutral_probability,extraversion_positive_probability,extraversion_negative_probability,extraversion_neutral_probability,agreeableness_positive_probability,agreeableness_negative_probability,agreeableness_neutral_probability,neuroticism_positive_probability,neuroticism_negative_probability,neuroticism_neutral_probability,OCEAN_weight_high_probability,OCEAN_weight_medium_probability,OCEAN_weight_low_probability
20,Toto,129,4181,all her friends except Toto,21699,21704,875,proper_name_to_canonical,True,"So Dorothy said good-bye to [[all her friends except Toto]], and taking the dog in her arms followed the green girl through seven passages and up three flights of stairs until they came to a room at the front of the Palace.","So Dorothy said good-bye to Toto, and taking the dog in her arms followed the green girl through seven passages and up three flights of stairs until they came to a room at the front of the Palace.","So Dorothy said good-bye to Toto, and taking the dog in her arms followed the green girl through seven passages and up three flights of stairs until they came to a room at the front of the Palace.","So Dorothy said good-bye to Toto, and taking the dog in her arms followed the green girl through seven passages and up three flights of stairs until they came to a room at the front of the Palace.",3,25.768819600023562,0.18903282284736633,0.2796453535556793,0.5313218235969543,0.22025024890899658,0.19173085689544678,0.5880188941955566,0.16922485828399658,0.18758943676948547,0.6431856751441956,0.45726528763771057,0.0766783356666565,0.4660564064979553,0.1175440326333046,0.41948583722114563,0.46297013759613037,0.08022664487361908,0.31498703360557556,0.6047863364219666
20,Toto,130,4184,Toto,21703,21704,875,proper_name_to_canonical,False,"So Dorothy said good-bye to all her friends except [[Toto]], and taking the dog in her arms followed the green girl through seven passages and up three flights of stairs until they came to a room at the front of the Palace.","So Dorothy said good-bye to all her friends except Toto, and taking the dog in her arms followed the green girl through seven passages and up three flights of stairs until they came to a room at the front of the Palace.","So Dorothy said good-bye to all her friends except Toto, and taking the dog in her arms followed the green girl through seven passages and up three flights of stairs until they came to a room at the front of the Palace.","So Dorothy said good-bye to all her friends except Toto, and taking the dog in her arms followed the green girl through seven passages and up three flights of stairs until they came to a room at the front of the Palace.",3,25.768819600023562,0.18084394931793213,0.39403632283210754,0.4251197278499603,0.2110019475221634,0.19744521379470825,0.5915529131889343,0.22331121563911438,0.3069302439689636,0.4697584807872772,0.6510187983512878,0.09792985022068024,0.2510513663291931,0.0894240066409111,0.6312707662582397,0.27930521965026855,0.1022091880440712,0.35989439487457275,0.537896454334259
20,Toto,131,4269,Toto,22186,22187,890,proper_name_to_canonical,False,"Dorothy put on a green silk apron and tied a green ribbon around [[Toto]]'s neck, and they started for the Throne Room of the Great Oz.","Dorothy put on a green silk apron and tied a green ribbon around Toto's neck, and they started for the Throne Room of the Great Oz.","Dorothy put on a green silk apron and tied a green ribbon around Toto's neck, and they started for the Throne Room of the Great Oz.","Dorothy put on a green silk apron and tied a green ribbon around Toto's neck, and they started for the Throne Room of the Great Oz.",3,25.768819600023562,0.23697693645954132,0.21471895277500153,0.5483040809631348,0.17796891927719116,0.11028780043125153,0.7117432951927185,0.20704010128974915,0.19525741040706635,0.5977025032043457,0.6383610367774963,0.054301321506500244,0.3073376417160034,0.056466881185770035,0.5001450777053833,0.44338804483413696,0.06584657728672028,0.28421467542648315,0.6499388217926025
20,Toto,132,4974,Toto,25329,25330,1017,proper_name_to_canonical,False,"The green girl, who was very kind to them, filled Dorothy's basket with good things to eat, and fastened a little bell around [[Toto]]'s neck with a green ribbon.","The green girl, who was very kind to them, filled Dorothy's basket with good things to eat, and fastened a little bell around Toto's neck with a green ribbon.","The green girl, who was very kind to them, filled Dorothy's basket with good things to eat, and fastened a little bell around Toto's neck with a green ribbon.","The green girl, who was very kind to them, filled Dorothy's basket with good things to eat, and fastened a little bell around Toto's neck with a green ribbon.",3,25.768819600023562,0.27494892477989197,0.2141304463148117,0.5109206438064575,0.16393877565860748,0.08757888525724411,0.7484824061393738,0.22543175518512726,0.19301040470600128,0.5815578103065491,0.9181072115898132,0.015693120658397675,0.06619967520236969,0.057742923498153687,0.5821781754493713,0.3600788712501526,0.08218327164649963,0.4503944218158722,0.4674222767353058
20,Toto,133,5065,Toto,25707,25708,1031,proper_name_to_canonical,False,The ribbon around [[Toto]]'s neck had also lost its green color and was as white as Dorothy's dress.,The ribbon around Toto's neck had also lost its green color and was as white as Dorothy's dress.,The ribbon around Toto's neck had also lost its green color and was as white as Dorothy's dress.,The ribbon around Toto's neck had also lost its green color and was as white as Dorothy's dress.,3,25.768819600023562,0.11731357872486115,0.29593610763549805,0.586750328540802,0.1320609748363495,0.18787987530231476,0.6800591349601746,0.11588660627603531,0.23013067245483398,0.6539826989173889,0.4369913637638092,0.07168605923652649,0.4913225769996643,0.23993118107318878,0.6236269474029541,0.1364419311285019,0.08305720239877701,0.4461618959903717,0.4707809090614319
20,Toto,134,5081,Toto,25793,25794,1034,proper_name_to_canonical,False,"In the afternoon the sun shone hot in their faces, for there were no trees to offer them shade; so that before night Dorothy and [[Toto]] and the Lion were tired, and lay down upon the grass and fell asleep, with the Woodman and the Scarecrow keeping watch.","In the afternoon the sun shone hot in their faces, for there were no trees to offer them shade; so that before night Dorothy and Toto and the Lion were tired, and lay down upon the grass and fell asleep, with the Woodman and the Scarecrow keeping watch.","In the afternoon the sun shone hot in their faces, for there were no trees to offer them shade; so that before night Dorothy and Toto and the Lion were tired, and lay down upon the grass and fell asleep, with the Woodman and the Scarecrow keeping watch.","In the afternoon the sun shone hot in their faces, for there were no trees to offer them shade; so that before night Dorothy and Toto and the Lion were tired, and lay down upon the grass and fell asleep, with the Woodman and the Scarecrow keeping watch.",3,25.768819600023562,0.05945159122347832,0.18152135610580444,0.7590270042419434,0.07144273072481155,0.13570694625377655,0.7928503751754761,0.0460720993578434,0.18825553357601166,0.7656723856925964,0.26852717995643616,0.064911849796772,0.6665610671043396,0.07384486496448517,0.44102710485458374,0.4851279854774475,0.07769685238599777,0.27870631217956543,0.643596887588501
20,Toto,135,5267,Toto,26746,26747,1077,proper_name_to_canonical,False,"This the Woodman did, and as Dorothy lay close beside the Lion and held [[Toto]] in her arms, the straw covered them entirely.","This the Woodman did, and as Dorothy lay close beside the Lion and held Toto in her arms, the straw covered them entirely.","This the Woodman did, and as Dorothy lay close beside the Lion and held Toto in her arms, the straw covered them entirely.","This the Woodman did, and as Dorothy lay close beside the Lion and held Toto in her arms, the straw covered them entirely.",3,25.768819600023562,0.08761736750602722,0.3124559819698334,0.5999266505241394,0.09415212273597717,0.22785304486751556,0.6779948472976685,0.10219968110322952,0.2621254026889801,0.6356749534606934,0.36814650893211365,0.07213924080133438,0.5597141981124878,0.13122941553592682,0.582698404788971,0.28607213497161865,0.08673736453056335,0.4002869427204132,0.5129756927490234
20,Toto,136,5480,Toto,27790,27791,1119,proper_name_to_canonical,False,"She stood, with [[Toto]] in her arms, watching the sad fate of her comrades and thinking it would soon be her turn.","She stood, with Toto in her arms, watching the sad fate of her comrades and thinking it would soon be her turn.","She stood, with Toto in her arms, watching the sad fate of her comrades and thinking it would soon be her turn.","She stood, with Toto in her arms, watching the sad fate of her comrades and thinking it would soon be her turn.",3,25.768819600023562,0.033145081251859665,0.23318266868591309,0.7336722016334534,0.14437346160411835,0.20589861273765564,0.649728000164032,0.028701478615403175,0.34461307525634766,0.6266854405403137,0.14044266939163208,0.20394417643547058,0.655613124370575,0.7030614614486694,0.2668520212173462,0.030086517333984375,0.1870046854019165,0.394393652677536,0.4186016619205475
20,Toto,137,5669,Toto,28716,28717,1149,proper_name_to_canonical,False,"The child did not know this, and was full of fear for herself and [[Toto]].","The child did not know this, and was full of fear for herself and Toto.","The child did not know this, and was full of fear for herself and Toto.","The child did not know this, and was full of fear for herself and Toto.",3,25.768819600023562,0.018260672688484192,0.2845313549041748,0.6972079277038574,0.09812865406274796,0.21100974082946777,0.6908615827560425,0.02197493240237236,0.4794626832008362,0.4985623061656952,0.22206521034240723,0.28236639499664307,0.4955684542655945,0.9298275113105774,0.0486336424946785,0.02153893932700157,0.2585872411727905,0.5310320258140564,0.21038076281547546
20,Toto,138,5671,Toto,28722,28723,1150,proper_name_to_canonical,False,Once the Witch struck [[Toto]] a blow with her umbrella and the brave little dog flew at her and bit her leg in return.,Once the Witch struck Toto a blow with her umbrella and the brave little dog flew at her and bit her leg in return.,Once the Witch struck Toto a blow with her umbrella and the brave little dog flew at her and bit her leg in return.,Once the Witch struck Toto a blow with her umbrella and the brave little dog flew at her and bit her leg in return.,3,25.768819600023562,0.426275372505188,0.20373177528381348,0.3699929714202881,0.359737366437912,0.26838043332099915,0.37188228964805603,0.895226240158081,0.05819503962993622,0.04657872021198273,0.2601279616355896,0.633531928062439,0.10634010285139084,0.14502137899398804,0.42302775382995605,0.4319508373737335,0.7608948945999146,0.12264572829008102,0.11645933240652084
20,Toto,139,5684,Toto,28808,28809,1153,proper_name_to_canonical,False,"Sometimes she would cry bitterly for hours, with [[Toto]] sitting at her feet and looking into her face, whining dismally to show how sorry he was for his little mistress.","Sometimes she would cry bitterly for hours, with Toto sitting at her feet and looking into her face, whining dismally to show how sorry he was for his little mistress.","Sometimes she would cry bitterly for hours, with Toto sitting at her feet and looking into her face, whining dismally to show how sorry he was for his little mistress.","Sometimes she would cry bitterly for hours, with Toto sitting at her feet and looking into her face, whining dismally to show how sorry he was for his little mistress.",3,25.768819600023562,0.005641525145620108,0.08816216140985489,0.9061963558197021,0.024550484493374825,0.04788012057542801,0.9275693297386169,0.00279289111495018,0.20290175080299377,0.7943053245544434,0.5877913236618042,0.08119712024927139,0.331011563539505,0.9634772539138794,0.011059211567044258,0.02546355128288269,0.2532796859741211,0.646377682685852,0.10034266859292984
20,Toto,140,5687,he,28825,28826,1153,third_person_subject_pronoun_to_canonical,True,"Sometimes she would cry bitterly for hours, with Toto sitting at her feet and looking into her face, whining dismally to show how sorry [[he]] was for his little mistress.","Sometimes she would cry bitterly for hours, with Toto sitting at her feet and looking into her face, whining dismally to show how sorry Toto was for his little mistress.","Sometimes she would cry bitterly for hours, with Toto sitting at her feet and looking into her face, whining dismally to show how sorry Toto was for his little mistress.","Sometimes she would cry bitterly for hours, with Toto sitting at her feet and looking into her face, whining dismally to show how sorry Toto was for his little mistress.",3,25.768819600023562,0.005444047506898642,0.0879053846001625,0.9066506028175354,0.02330440655350685,0.04307316616177559,0.9336224794387817,0.002604349283501506,0.18629369139671326,0.8111019730567932,0.4626007676124573,0.09748861193656921,0.43991056084632874,0.9458269476890564,0.015437894500792027,0.03873513638973236,0.21592308580875397,0.6896030306816101,0.09447385370731354
20,Toto,141,5688,his,28828,28829,1153,third_person_possessive_pronoun_to_canonical_possessive,True,"Sometimes she would cry bitterly for hours, with Toto sitting at her feet and looking into her face, whining dismally to show how sorry he was for [[his]] little mistress.","Sometimes she would cry bitterly for hours, with Toto sitting at her feet and looking into her face, whining dismally to show how sorry he was for Toto's little mistress.","Sometimes she would cry bitterly for hours, with Toto sitting at her feet and looking into her face, whining dismally to show how sorry he was for Toto's little mistress.","Sometimes she would cry bitterly for hours, with Toto sitting at her feet and looking into her face, whining dismally to show how sorry he was for Toto's little mistress.",3,25.768819600023562,0.007885086350142956,0.10096539556980133,0.8911495208740234,0.03254912793636322,0.05355972796678543,0.9138911962509155,0.003927222918719053,0.23366068303585052,0.7624120712280273,0.5125877261161804,0.1164020374417305,0.3710102438926697,0.9427908658981323,0.017846429720520973,0.03936271741986275,0.1882644146680832,0.708423912525177,0.10331160575151443
20,Toto,142,5690,Toto,28832,28833,1154,proper_name_to_canonical,False,"[[Toto]] did not really care whether he was in Kansas or the Land of Oz so long as Dorothy was with him; but he knew the little girl was unhappy, and that made him unhappy too.","Toto did not really care whether he was in Kansas or the Land of Oz so long as Dorothy was with him; but he knew the little girl was unhappy, and that made him unhappy too.","Toto did not really care whether he was in Kansas or the Land of Oz so long as Dorothy was with him; but he knew the little girl was unhappy, and that made him unhappy too.","Toto did not really care whether he was in Kansas or the Land of Oz so long as Dorothy was with him; but he knew the little girl was unhappy, and that made him unhappy too.",3,25.768819600023562,0.03603991121053696,0.28294000029563904,0.6810200810432434,0.020867446437478065,0.07344163954257965,0.9056909084320068,0.05279097333550453,0.40059521794319153,0.5466138124465942,0.8281108736991882,0.10548831522464752,0.06640082597732544,0.657597005367279,0.06088298186659813,0.2815200388431549,0.3103647232055664,0.6411952972412109,0.04844001308083534
20,Toto,143,5691,he,28838,28839,1154,third_person_subject_pronoun_to_canonical,True,"Toto did not really care whether [[he]] was in Kansas or the Land of Oz so long as Dorothy was with him; but he knew the little girl was unhappy, and that made him unhappy too.","Toto did not really care whether Toto was in Kansas or the Land of Oz so long as Dorothy was with him; but he knew the little girl was unhappy, and that made him unhappy too.","Toto did not really care whether Toto was in Kansas or the Land of Oz so long as Dorothy was with him; but he knew the little girl was unhappy, and that made him unhappy too.","Toto did not really care whether Toto was in Kansas or the Land of Oz so long as Dorothy was with him; but he knew the little girl was unhappy, and that made him unhappy too.",3,25.768819600023562,0.03598373755812645,0.26929110288619995,0.6947252154350281,0.02595706656575203,0.08109360188245773,0.8929493427276611,0.05999794974923134,0.3880016505718231,0.5520003437995911,0.8425455093383789,0.0963013544678688,0.061153117567300797,0.6673051714897156,0.08040179312229156,0.25229305028915405,0.30786722898483276,0.6438473463058472,0.04828542098402977
20,Toto,144,5695,him,28853,28854,1154,third_person_object_pronoun_to_canonical,True,"Toto did not really care whether he was in Kansas or the Land of Oz so long as Dorothy was with [[him]]; but he knew the little girl was unhappy, and that made him unhappy too.","Toto did not really care whether he was in Kansas or the Land of Oz so long as Dorothy was with Toto; but he knew the little girl was unhappy, and that made him unhappy too.","Toto did not really care whether he was in Kansas or the Land of Oz so long as Dorothy was with Toto; but he knew the little girl was unhappy, and that made him unhappy too.","Toto did not really care whether he was in Kansas or the Land of Oz so long as Dorothy was with Toto; but he knew the little girl was unhappy, and that made him unhappy too.",3,25.768819600023562,0.03896668925881386,0.2807084321975708,0.6803248524665833,0.019973384216427803,0.0733097493648529,0.9067168831825256,0.05439548194408417,0.38512057065963745,0.5604839324951172,0.8086362481117249,0.11368542164564133,0.07767828553915024,0.6913744807243347,0.05527465045452118,0.2533508837223053,0.3394377827644348,0.6134430766105652,0.04711923003196716
20,Toto,145,5696,he,28856,28857,1154,third_person_subject_pronoun_to_canonical,True,"Toto did not really care whether he was in Kansas or the Land of Oz so long as Dorothy was with him; but [[he]] knew the little girl was unhappy, and that made him unhappy too.","Toto did not really care whether he was in Kansas or the Land of Oz so long as Dorothy was with him; but Toto knew the little girl was unhappy, and that made him unhappy too.","Toto did not really care whether he was in Kansas or the Land of Oz so long as Dorothy was with him; but Toto knew the little girl was unhappy, and that made him unhappy too.","Toto did not really care whether he was in Kansas or the Land of Oz so long as Dorothy was with him; but Toto knew the little girl was unhappy, and that made him unhappy too.",3,25.768819600023562,0.03724755346775055,0.25891247391700745,0.7038400173187256,0.017992988228797913,0.08052093535661697,0.9014860391616821,0.057076819241046906,0.34203922748565674,0.6008840203285217,0.7671171426773071,0.11385487765073776,0.11902793496847153,0.5954869389533997,0.07853155583143234,0.3259814381599426,0.3073488771915436,0.6393201351165771,0.05333104357123375
20,Toto,146,5698,him,28867,28868,1154,third_person_object_pronoun_to_canonical,True,"Toto did not really care whether he was in Kansas or the Land of Oz so long as Dorothy was with him; but he knew the little girl was unhappy, and that made [[him]] unhappy too.","Toto did not really care whether he was in Kansas or the Land of Oz so long as Dorothy was with him; but he knew the little girl was unhappy, and that made Toto unhappy too.","Toto did not really care whether he was in Kansas or the Land of Oz so long as Dorothy was with him; but he knew the little girl was unhappy, and that made Toto unhappy too.","Toto did not really care whether he was in Kansas or the Land of Oz so long as Dorothy was with him; but he knew the little girl was unhappy, and that made Toto unhappy too.",3,25.768819600023562,0.020317168906331062,0.21130713820457458,0.7683756947517395,0.021784260869026184,0.06984139233827591,0.9083743095397949,0.03842731565237045,0.3697875738143921,0.5917850732803345,0.7741279602050781,0.11825353652238846,0.10761850327253342,0.7288716435432434,0.0668913722038269,0.2042369395494461,0.3277309536933899,0.6348100304603577,0.03745902702212334
20,Toto,147,6081,Toto,30923,30924,1226,proper_name_to_canonical,False,"Finding they were determined to go, the Winkies gave [[Toto]] and the Lion each a golden collar; and to Dorothy they presented a beautiful bracelet studded with diamonds; and to the Scarecrow they gave a gold-headed walking stick, to keep him from stumbling; and to the Tin Woodman they offered a silver oil-can, inlaid with gold and set with precious jewels.","Finding they were determined to go, the Winkies gave Toto and the Lion each a golden collar; and to Dorothy they presented a beautiful bracelet studded with diamonds; and to the Scarecrow they gave a gold-headed walking stick, to keep him from stumbling; and to the Tin Woodman they offered a silver oil-can, inlaid with gold and set with precious jewels.","Finding they were determined to go, the Winkies gave Toto and the Lion each a golden collar; and to Dorothy they presented a beautiful bracelet studded with diamonds; and to the Scarecrow they gave a gold-headed walking stick, to keep him from stumbling; and to the Tin Woodman they offered a silver oil-can, inlaid with gold and set with precious jewels.","Finding they were determined to go, the Winkies gave Toto and the Lion each a golden collar; and to Dorothy they presented a beautiful bracelet studded with diamonds; and to the Scarecrow they gave a gold-headed walking stick, to keep him from stumbling; and to the Tin Woodman they offered a silver oil-can, inlaid with gold and set with precious jewels.",3,25.768819600023562,0.16151553392410278,0.4525394141674042,0.3859451115131378,0.2438310831785202,0.2685817778110504,0.4875870645046234,0.25683602690696716,0.24103958904743195,0.5021244287490845,0.4327605664730072,0.08774909377098083,0.4794903099536896,0.18386253714561462,0.6075903177261353,0.20854710042476654,0.07718463242053986,0.27371007204055786,0.6491052508354187
20,Toto,148,6182,Toto,31525,31526,1247,proper_name_to_canonical,False,"She sat down on the grass and looked at her companions, and they sat down and looked at her, and [[Toto]] found that for the first time in his life he was too tired to chase a butterfly that flew past his head.","She sat down on the grass and looked at her companions, and they sat down and looked at her, and Toto found that for the first time in his life he was too tired to chase a butterfly that flew past his head.","She sat down on the grass and looked at her companions, and they sat down and looked at her, and Toto found that for the first time in his life he was too tired to chase a butterfly that flew past his head.","She sat down on the grass and looked at her companions, and they sat down and looked at her, and Toto found that for the first time in his life he was too tired to chase a butterfly that flew past his head.",3,25.768819600023562,0.06727892905473709,0.36359545588493347,0.5691255331039429,0.05564692243933678,0.1682535707950592,0.7760995030403137,0.05929074436426163,0.30265095829963684,0.6380583643913269,0.42523956298828125,0.07742296904325485,0.4973375201225281,0.11124111711978912,0.6494360566139221,0.23932284116744995,0.10201971232891083,0.4520593583583832,0.4459209144115448
20,Toto,149,6183,his,31533,31534,1247,third_person_possessive_pronoun_to_canonical_possessive,True,"She sat down on the grass and looked at her companions, and they sat down and looked at her, and Toto found that for the first time in [[his]] life he was too tired to chase a butterfly that flew past his head.","She sat down on the grass and looked at her companions, and they sat down and looked at her, and Toto found that for the first time in Toto's life he was too tired to chase a butterfly that flew past his head.","She sat down on the grass and looked at her companions, and they sat down and looked at her, and Toto found that for the first time in Toto's life he was too tired to chase a butterfly that flew past his head.","She sat down on the grass and looked at her companions, and they sat down and looked at her, and Toto found that for the first time in Toto's life he was too tired to chase a butterfly that flew past his head.",3,25.768819600023562,0.07237511873245239,0.45005834102630615,0.4775664806365967,0.07205215841531754,0.18698035180568695,0.7409674525260925,0.05779498815536499,0.3472743034362793,0.5949307680130005,0.4622626006603241,0.08052555471658707,0.45721182227134705,0.2188764214515686,0.5045729279518127,0.27655068039894104,0.1055092141032219,0.5854023098945618,0.30908843874931335
