cluster_id,subject,mention_index_in_cluster,mention_id,mention_text,mention_start,mention_end,sentence_index,mention_render_rule,mention_render_was_changed,original_context_text,rendered_context_text,context_text,normalized_context_text,chunk_index,elapsed_seconds_at_completion,openness_positive_probability,openness_negative_probability,openness_neutral_probability,conscientiousness_positive_probability,conscientiousness_negative_probability,conscientiousness_neutral_probability,extraversion_positive_probability,extraversion_negative_probability,extraversion_neutral_probability,agreeableness_positive_probability,agreeableness_negative_probability,agreeableness_neutral_probability,neuroticism_positive_probability,neuroticism_negative_probability,neuroticism_neutral_probability,OCEAN_weight_high_probability,OCEAN_weight_medium_probability,OCEAN_weight_low_probability
20,Toto,0,59,Toto,504,505,19,proper_name_to_canonical,False,"It was [[Toto]] that made Dorothy laugh, and saved her from growing as gray as her other surroundings.","It was Toto that made Dorothy laugh, and saved her from growing as gray as her other surroundings.","It was Toto that made Dorothy laugh, and saved her from growing as gray as her other surroundings.","It was Toto that made Dorothy laugh, and saved her from growing as gray as her other surroundings.",1,8.725492700003088,0.6501410007476807,0.14865130186080933,0.20120769739151,0.12374480068683624,0.17450813949108124,0.7017470002174377,0.8919171094894409,0.03602253645658493,0.07206036150455475,0.9656489491462708,0.011718623340129852,0.022632397711277008,0.024695198982954025,0.7160831689834595,0.25922155380249023,0.24809406697750092,0.6855952739715576,0.06631061434745789
20,Toto,1,63,Toto,522,523,20,proper_name_to_canonical,False,"[[Toto]] was not gray; he was a little black dog, with long silky hair and small black eyes that twinkled merrily on either side of his funny, wee nose.","Toto was not gray; he was a little black dog, with long silky hair and small black eyes that twinkled merrily on either side of his funny, wee nose.","Toto was not gray; he was a little black dog, with long silky hair and small black eyes that twinkled merrily on either side of his funny, wee nose.","Toto was not gray; he was a little black dog, with long silky hair and small black eyes that twinkled merrily on either side of his funny, wee nose.",1,8.725492700003088,0.2555379271507263,0.326837956905365,0.4176240861415863,0.10677927732467651,0.2006622552871704,0.6925585269927979,0.33425384759902954,0.24051901698112488,0.4252271056175232,0.4912939965724945,0.10378850251436234,0.40491750836372375,0.06705684214830399,0.6486867070198059,0.2842563986778259,0.025990134105086327,0.2824380397796631,0.691571831703186
20,Toto,2,64,he,527,528,20,third_person_subject_pronoun_to_canonical,True,"Toto was not gray; [[he]] was a little black dog, with long silky hair and small black eyes that twinkled merrily on either side of his funny, wee nose.","Toto was not gray; Toto was a little black dog, with long silky hair and small black eyes that twinkled merrily on either side of his funny, wee nose.","Toto was not gray; Toto was a little black dog, with long silky hair and small black eyes that twinkled merrily on either side of his funny, wee nose.","Toto was not gray; Toto was a little black dog, with long silky hair and small black eyes that twinkled merrily on either side of his funny, wee nose.",1,8.725492700003088,0.253544420003891,0.32843145728111267,0.41802409291267395,0.10124810039997101,0.19251076877117157,0.7062411308288574,0.3180413544178009,0.2351970374584198,0.4467616379261017,0.4625668525695801,0.10711472481489182,0.4303184449672699,0.06763794273138046,0.6379817724227905,0.29438021779060364,0.026973078027367592,0.32334697246551514,0.649679958820343
20,Toto,3,65,his,549,550,20,third_person_possessive_pronoun_to_canonical_possessive,True,"Toto was not gray; he was a little black dog, with long silky hair and small black eyes that twinkled merrily on either side of [[his]] funny, wee nose.","Toto was not gray; he was a little black dog, with long silky hair and small black eyes that twinkled merrily on either side of Toto's funny, wee nose.","Toto was not gray; he was a little black dog, with long silky hair and small black eyes that twinkled merrily on either side of Toto's funny, wee nose.","Toto was not gray; he was a little black dog, with long silky hair and small black eyes that twinkled merrily on either side of Toto's funny, wee nose.",1,8.725492700003088,0.23255422711372375,0.32223957777023315,0.4452061951160431,0.10694754868745804,0.19327911734580994,0.6997733116149902,0.34118345379829407,0.24646620452404022,0.4123503565788269,0.4450105130672455,0.10736379027366638,0.44762566685676575,0.05342128500342369,0.5934328436851501,0.3531458377838135,0.027265053242444992,0.3230392038822174,0.6496957540512085
20,Toto,4,66,Toto,555,556,21,proper_name_to_canonical,False,"[[Toto]] played all day long, and Dorothy played with him, and loved him dearly.","Toto played all day long, and Dorothy played with him, and loved him dearly.","Toto played all day long, and Dorothy played with him, and loved him dearly.","Toto played all day long, and Dorothy played with him, and loved him dearly.",1,8.725492700003088,0.13189445436000824,0.08863626420497894,0.7794693112373352,0.013862482272088528,0.032168347388505936,0.9539691805839539,0.5927177667617798,0.023378297686576843,0.3839038610458374,0.9255512356758118,0.007418474182486534,0.06703034043312073,0.006307570729404688,0.4101632833480835,0.5835291147232056,0.022896364331245422,0.411434531211853,0.5656691193580627
20,Toto,5,68,him,565,566,21,third_person_object_pronoun_to_canonical,True,"Toto played all day long, and Dorothy played with [[him]], and loved him dearly.","Toto played all day long, and Dorothy played with Toto, and loved him dearly.","Toto played all day long, and Dorothy played with Toto, and loved him dearly.","Toto played all day long, and Dorothy played with Toto, and loved him dearly.",1,8.725492700003088,0.11438656598329544,0.08753209561109543,0.7980813980102539,0.014651917852461338,0.03350583836436272,0.9518423080444336,0.5027468800544739,0.03206116333603859,0.46519193053245544,0.9122403860092163,0.009265556000173092,0.07849404215812683,0.008259309455752373,0.4024502635002136,0.58929044008255,0.02393908053636551,0.4343930780887604,0.5416678190231323
20,Toto,6,69,him,569,570,21,third_person_object_pronoun_to_canonical,True,"Toto played all day long, and Dorothy played with him, and loved [[him]] dearly.","Toto played all day long, and Dorothy played with him, and loved Toto dearly.","Toto played all day long, and Dorothy played with him, and loved Toto dearly.","Toto played all day long, and Dorothy played with him, and loved Toto dearly.",1,8.725492700003088,0.10384205728769302,0.06286049634218216,0.8332974314689636,0.01188191119581461,0.023722486570477486,0.9643955826759338,0.5310225486755371,0.020499693229794502,0.4484778046607971,0.9234811067581177,0.0072960276156663895,0.06922278553247452,0.005003042984753847,0.3895634710788727,0.6054335236549377,0.029836183413863182,0.43715691566467285,0.5330069065093994
20,Toto,7,73,Toto,608,609,24,proper_name_to_canonical,False,"Dorothy stood in the door with [[Toto]] in her arms, and looked at the sky too.","Dorothy stood in the door with Toto in her arms, and looked at the sky too.","Dorothy stood in the door with Toto in her arms, and looked at the sky too.","Dorothy stood in the door with Toto in her arms, and looked at the sky too.",1,8.725492700003088,0.27185752987861633,0.37633267045021057,0.3518097996711731,0.11556888371706009,0.16765980422496796,0.7167713046073914,0.12976695597171783,0.22852787375450134,0.6417050957679749,0.430588960647583,0.08339200168848038,0.48601898550987244,0.08300101011991501,0.5885633230209351,0.3284356892108917,0.06410328298807144,0.38320937752723694,0.5526873469352722
20,Toto,8,95,Toto,782,783,37,proper_name_to_canonical,False,"[[Toto]] jumped out of Dorothy's arms and hid under the bed, and the girl started to get him.","Toto jumped out of Dorothy's arms and hid under the bed, and the girl started to get him.","Toto jumped out of Dorothy's arms and hid under the bed, and the girl started to get him.","Toto jumped out of Dorothy's arms and hid under the bed, and the girl started to get him.",1,8.725492700003088,0.06635869294404984,0.5063870549201965,0.427254319190979,0.1133057028055191,0.4094265103340149,0.4772678017616272,0.4331681430339813,0.4378463923931122,0.12898552417755127,0.08823274075984955,0.41360029578208923,0.49816691875457764,0.8768831491470337,0.043307121843099594,0.07980971038341522,0.16687661409378052,0.5700763463973999,0.2630470097064972
20,Toto,9,98,him,801,802,37,third_person_object_pronoun_to_canonical,True,"Toto jumped out of Dorothy's arms and hid under the bed, and the girl started to get [[him]].","Toto jumped out of Dorothy's arms and hid under the bed, and the girl started to get Toto.","Toto jumped out of Dorothy's arms and hid under the bed, and the girl started to get Toto.","Toto jumped out of Dorothy's arms and hid under the bed, and the girl started to get Toto.",1,8.725492700003088,0.07581853866577148,0.4576910436153412,0.46649035811424255,0.06363972276449203,0.355127215385437,0.5812330842018127,0.4461318254470825,0.40167126059532166,0.15219689905643463,0.07865972071886063,0.3885023593902588,0.5328378677368164,0.8700480461120605,0.05159130319952965,0.0783606469631195,0.15331122279167175,0.5931796431541443,0.2535090744495392
20,Toto,10,102,Toto,831,832,39,proper_name_to_canonical,False,Dorothy caught [[Toto]] at last and started to follow her aunt.,Dorothy caught Toto at last and started to follow her aunt.,Dorothy caught Toto at last and started to follow her aunt.,Dorothy caught Toto at last and started to follow her aunt.,1,8.725492700003088,0.0834730863571167,0.24799074232578278,0.6685362458229065,0.14716684818267822,0.2187766283750534,0.634056568145752,0.18109890818595886,0.4284299910068512,0.39047107100486755,0.348893404006958,0.22112137079238892,0.4299851953983307,0.10886605829000473,0.6367738842964172,0.2543601393699646,0.07836928963661194,0.4251108765602112,0.49651986360549927
20,Toto,11,124,Toto,1054,1055,48,proper_name_to_canonical,False,[[Toto]] did not like it.,Toto did not like it.,Toto did not like it.,Toto did not like it.,1,8.725492700003088,0.015369893051683903,0.47465410828590393,0.5099760293960571,0.16152314841747284,0.45923882722854614,0.3792380690574646,0.06516924500465393,0.6370019912719727,0.2978288233280182,0.016239551827311516,0.7369449138641357,0.2468155026435852,0.6190429925918579,0.24635855853557587,0.13459843397140503,0.2585451304912567,0.6473692655563354,0.0940856859087944
20,Toto,12,125,He,1060,1061,49,proper_name_to_canonical,True,"[[He]] ran about the room, now here, now there, barking loudly; but Dorothy sat quite still on the floor and waited to see what would happen.","Toto ran about the room, now here, now there, barking loudly; but Dorothy sat quite still on the floor and waited to see what would happen.","Toto ran about the room, now here, now there, barking loudly; but Dorothy sat quite still on the floor and waited to see what would happen.","Toto ran about the room, now here, now there, barking loudly; but Dorothy sat quite still on the floor and waited to see what would happen.",1,8.725492700003088,0.2804894745349884,0.4453847408294678,0.27412575483322144,0.029134701937437057,0.2375938892364502,0.7332714200019836,0.877571165561676,0.056679464876651764,0.06574933230876923,0.11775435507297516,0.26374879479408264,0.618496835231781,0.3457532525062561,0.2712523639202118,0.3829943835735321,0.03849838301539421,0.4341837167739868,0.5273179411888123
20,Toto,13,128,Toto,1093,1094,50,proper_name_to_canonical,False,"Once [[Toto]] got too near the open trap door, and fell in; and at first the little girl thought she had lost him.","Once Toto got too near the open trap door, and fell in; and at first the little girl thought she had lost him.","Once Toto got too near the open trap door, and fell in; and at first the little girl thought she had lost him.","Once Toto got too near the open trap door, and fell in; and at first the little girl thought she had lost him.",1,8.725492700003088,0.2424190491437912,0.46545320749282837,0.2921277582645416,0.028033820912241936,0.3026454746723175,0.6693206429481506,0.13651740550994873,0.26931869983673096,0.5941638946533203,0.16409718990325928,0.10060490667819977,0.7352979183197021,0.39900100231170654,0.3394554853439331,0.26154351234436035,0.046357303857803345,0.7674086689949036,0.1862339824438095
20,Toto,14,131,him,1116,1117,50,third_person_object_pronoun_to_canonical,True,"Once Toto got too near the open trap door, and fell in; and at first the little girl thought she had lost [[him]].","Once Toto got too near the open trap door, and fell in; and at first the little girl thought she had lost Toto.","Once Toto got too near the open trap door, and fell in; and at first the little girl thought she had lost Toto.","Once Toto got too near the open trap door, and fell in; and at first the little girl thought she had lost Toto.",1,8.725492700003088,0.22093690931797028,0.4911882281303406,0.28787481784820557,0.03086835891008377,0.3013571798801422,0.6677744388580322,0.12078927457332611,0.26489296555519104,0.614317774772644,0.15512128174304962,0.08134501427412033,0.7635337114334106,0.3026370108127594,0.31980448961257935,0.37755846977233887,0.039798635989427567,0.7605394124984741,0.19966194033622742
20,Toto,15,133,his,1124,1125,51,third_person_possessive_pronoun_to_canonical_possessive,True,"But soon she saw one of [[his]] ears sticking up through the hole, for the strong pressure of the air was keeping him up so that he could not fall.","But soon she saw one of Toto's ears sticking up through the hole, for the strong pressure of the air was keeping him up so that he could not fall.","But soon she saw one of Toto's ears sticking up through the hole, for the strong pressure of the air was keeping him up so that he could not fall.","But soon she saw one of Toto's ears sticking up through the hole, for the strong pressure of the air was keeping him up so that he could not fall.",1,8.725492700003088,0.2617468535900116,0.24709197878837585,0.49116119742393494,0.3307006061077118,0.14782625436782837,0.5214731693267822,0.17712357640266418,0.21490737795829773,0.6079691052436829,0.5368265509605408,0.08840814977884293,0.3747653067111969,0.11816589534282684,0.6559461951255798,0.22588787972927094,0.07645027339458466,0.5721125602722168,0.3514372408390045
20,Toto,16,134,him,1141,1142,51,third_person_object_pronoun_to_canonical,True,"But soon she saw one of his ears sticking up through the hole, for the strong pressure of the air was keeping [[him]] up so that he could not fall.","But soon she saw one of his ears sticking up through the hole, for the strong pressure of the air was keeping Toto up so that he could not fall.","But soon she saw one of his ears sticking up through the hole, for the strong pressure of the air was keeping Toto up so that he could not fall.","But soon she saw one of his ears sticking up through the hole, for the strong pressure of the air was keeping Toto up so that he could not fall.",1,8.725492700003088,0.2500346899032593,0.30575117468833923,0.4442141354084015,0.2116003930568695,0.13319431245326996,0.6552053093910217,0.14173105359077454,0.23596817255020142,0.6223007440567017,0.5166666507720947,0.08055977523326874,0.40277352929115295,0.10000032931566238,0.6792199015617371,0.22077976167201996,0.07408661395311356,0.5821675062179565,0.3437458872795105
20,Toto,17,135,he,1145,1146,51,third_person_subject_pronoun_to_canonical,True,"But soon she saw one of his ears sticking up through the hole, for the strong pressure of the air was keeping him up so that [[he]] could not fall.","But soon she saw one of his ears sticking up through the hole, for the strong pressure of the air was keeping him up so that Toto could not fall.","But soon she saw one of his ears sticking up through the hole, for the strong pressure of the air was keeping him up so that Toto could not fall.","But soon she saw one of his ears sticking up through the hole, for the strong pressure of the air was keeping him up so that Toto could not fall.",1,8.725492700003088,0.23615770041942596,0.2769063711166382,0.48693594336509705,0.23254865407943726,0.13940463960170746,0.6280466914176941,0.14346739649772644,0.2105865627527237,0.6459460258483887,0.4970189332962036,0.07910194993019104,0.4238791763782501,0.11618304997682571,0.6869534850120544,0.19686351716518402,0.0840967446565628,0.5727360248565674,0.343167245388031
20,Toto,18,137,Toto,1157,1158,52,proper_name_to_canonical,False,"She crept to the hole, caught [[Toto]] by the ear, and dragged him into the room again, afterward closing the trap door so that no more accidents could happen.","She crept to the hole, caught Toto by the ear, and dragged him into the room again, afterward closing the trap door so that no more accidents could happen.","She crept to the hole, caught Toto by the ear, and dragged him into the room again, afterward closing the trap door so that no more accidents could happen.","She crept to the hole, caught Toto by the ear, and dragged him into the room again, afterward closing the trap door so that no more accidents could happen.",1,8.725492700003088,0.02827797830104828,0.22220641374588013,0.7495155930519104,0.10561202466487885,0.2349979728460312,0.6593900322914124,0.06025074049830437,0.3037456274032593,0.6360036134719849,0.21070386469364166,0.2524259090423584,0.5368702411651611,0.32870879769325256,0.4726964831352234,0.19859468936920166,0.09598953276872635,0.347024530172348,0.5569859147071838
20,Toto,19,138,him,1164,1165,52,third_person_object_pronoun_to_canonical,True,"She crept to the hole, caught Toto by the ear, and dragged [[him]] into the room again, afterward closing the trap door so that no more accidents could happen.","She crept to the hole, caught Toto by the ear, and dragged Toto into the room again, afterward closing the trap door so that no more accidents could happen.","She crept to the hole, caught Toto by the ear, and dragged Toto into the room again, afterward closing the trap door so that no more accidents could happen.","She crept to the hole, caught Toto by the ear, and dragged Toto into the room again, afterward closing the trap door so that no more accidents could happen.",1,8.725492700003088,0.028661862015724182,0.19968420267105103,0.7716538906097412,0.10717826336622238,0.2369161695241928,0.6559056043624878,0.053445931524038315,0.2708333730697632,0.675720751285553,0.21449792385101318,0.20901815593242645,0.576483964920044,0.3359728753566742,0.5063289999961853,0.1576981395483017,0.11294491589069366,0.3173811137676239,0.569674015045166
20,Toto,20,151,Toto,1282,1283,55,proper_name_to_canonical,False,"At last she crawled over the swaying floor to her bed, and lay down upon it; and [[Toto]] followed and lay down beside her.","At last she crawled over the swaying floor to her bed, and lay down upon it; and Toto followed and lay down beside her.","At last she crawled over the swaying floor to her bed, and lay down upon it; and Toto followed and lay down beside her.","At last she crawled over the swaying floor to her bed, and lay down upon it; and Toto followed and lay down beside her.",1,8.725492700003088,0.32211190462112427,0.24612903594970703,0.4317590594291687,0.23063094913959503,0.21163885295391083,0.5577302575111389,0.23693260550498962,0.20049382746219635,0.5625734925270081,0.8882913589477539,0.027865398675203323,0.08384319394826889,0.07850557565689087,0.5641598105430603,0.35733455419540405,0.11989626288414001,0.37111416459083557,0.5089896321296692
20,Toto,21,161,Toto,1363,1364,58,proper_name_to_canonical,False,"As it was, the jar made her catch her breath and wonder what had happened; and [[Toto]] put his cold little nose into her face and whined dismally.","As it was, the jar made her catch her breath and wonder what had happened; and Toto put his cold little nose into her face and whined dismally.","As it was, the jar made her catch her breath and wonder what had happened; and Toto put his cold little nose into her face and whined dismally.","As it was, the jar made her catch her breath and wonder what had happened; and Toto put his cold little nose into her face and whined dismally.",1,8.725492700003088,0.04951312765479088,0.3422657251358032,0.608221173286438,0.09137018024921417,0.21747995913028717,0.691149890422821,0.017094716429710388,0.3040485680103302,0.6788567304611206,0.1540646255016327,0.0898212268948555,0.7561141848564148,0.9577258825302124,0.022867081686854362,0.019407039508223534,0.07327283173799515,0.6804167628288269,0.24631033837795258
20,Toto,22,168,Toto,1415,1416,60,proper_name_to_canonical,False,She sprang from her bed and with [[Toto]] at her heels ran and opened the door.,She sprang from her bed and with Toto at her heels ran and opened the door.,She sprang from her bed and with Toto at her heels ran and opened the door.,She sprang from her bed and with Toto at her heels ran and opened the door.,1,8.725492700003088,0.8823094964027405,0.04721957445144653,0.07047084718942642,0.1902545690536499,0.3228447437286377,0.4869007170200348,0.9340789318084717,0.026109270751476288,0.0398118831217289,0.7958605289459229,0.09371551871299744,0.11042387038469315,0.44917401671409607,0.34777337312698364,0.2030526101589203,0.08054286241531372,0.20228707790374756,0.717170000076294
20,Toto,23,248,her,2059,2060,87,third_person_possessive_pronoun_to_canonical_possessive,True,"""There are [[her]] two feet, still sticking out from under a block of wood.","""There are Toto's two feet, still sticking out from under a block of wood.","""There are Toto's two feet, still sticking out from under a block of wood.","""There are Toto's two feet, still sticking out from under a block of wood.",1,8.725492700003088,0.09167516976594925,0.29679933190345764,0.6115254759788513,0.14084438979625702,0.3606259226799011,0.49852970242500305,0.15470145642757416,0.37617218494415283,0.4691263735294342,0.22881826758384705,0.24741151928901672,0.5237702131271362,0.20266735553741455,0.5777685642242432,0.2195640653371811,0.018701674416661263,0.35529521107673645,0.626003086566925
20,Toto,24,254,her,2145,2146,92,third_person_object_pronoun_to_canonical,True,"""The house must have fallen on [[her]].","""The house must have fallen on Toto.","""The house must have fallen on Toto.","""The house must have fallen on Toto.",1,8.725492700003088,0.024431608617305756,0.2110569030046463,0.7645115256309509,0.07457612454891205,0.31405389308929443,0.6113699674606323,0.03585057705640793,0.4334564208984375,0.5306930541992188,0.043656546622514725,0.2563062012195587,0.7000372409820557,0.6459051966667175,0.2600153386592865,0.09407939016819,0.03386551886796951,0.40222302079200745,0.563911497592926
20,Toto,25,257,she,2174,2175,94,third_person_subject_pronoun_to_canonical,True,"""But who was [[she]]?"" asked Dorothy.","""But who was Toto?"" asked Dorothy.","""But who was Toto?"" asked Dorothy.","""But who was Toto?"" asked Dorothy.",1,8.725492700003088,0.46200835704803467,0.32018014788627625,0.2178114652633667,0.1643538773059845,0.23565608263015747,0.5999901294708252,0.1867067664861679,0.3035363256931305,0.509756863117218,0.4732680022716522,0.1004207506775856,0.426311194896698,0.13593031466007233,0.5373523235321045,0.326717346906662,0.039387885481119156,0.45921242237091064,0.5013996958732605
20,Toto,26,259,She,2182,2183,95,proper_name_to_canonical,True,""" [[She]] was the Wicked Witch of the East, as I said,"" answered the little woman.",""" Toto was the Wicked Witch of the East, as I said,"" answered the little woman.",""" Toto was the Wicked Witch of the East, as I said,"" answered the little woman.",""" Toto was the Wicked Witch of the East, as I said,"" answered the little woman.",1,8.725492700003088,0.18549174070358276,0.3713255822658539,0.44318267703056335,0.06367231160402298,0.21330738067626953,0.7230203151702881,0.14391450583934784,0.3224216103553772,0.5336639285087585,0.06760542839765549,0.4403586983680725,0.492035835981369,0.17901553213596344,0.6148382425308228,0.2061462253332138,0.08760220557451248,0.44662192463874817,0.46577590703964233
20,Toto,27,262,She,2202,2203,96,proper_name_to_canonical,True,""" [[She]] has held all the Munchkins in bondage for many years, making them slave for her night and day.",""" Toto has held all the Munchkins in bondage for many years, making them slave for her night and day.",""" Toto has held all the Munchkins in bondage for many years, making them slave for her night and day.",""" Toto has held all the Munchkins in bondage for many years, making them slave for her night and day.",1,8.725492700003088,0.004163807258009911,0.33994150161743164,0.6558946371078491,0.21223212778568268,0.19080182909965515,0.5969660878181458,0.009734596125781536,0.2319079339504242,0.7583575248718262,0.0018392687197774649,0.7945114970207214,0.20364928245544434,0.06660051643848419,0.6254419088363647,0.3079576790332794,0.47065454721450806,0.1391591876745224,0.3901863098144531
