cluster_id,subject,mention_index_in_cluster,mention_id,mention_text,mention_start,mention_end,sentence_index,mention_render_rule,mention_render_was_changed,original_context_text,rendered_context_text,context_text,normalized_context_text,chunk_index,elapsed_seconds_at_completion,openness_positive_probability,openness_negative_probability,openness_neutral_probability,conscientiousness_positive_probability,conscientiousness_negative_probability,conscientiousness_neutral_probability,extraversion_positive_probability,extraversion_negative_probability,extraversion_neutral_probability,agreeableness_positive_probability,agreeableness_negative_probability,agreeableness_neutral_probability,neuroticism_positive_probability,neuroticism_negative_probability,neuroticism_neutral_probability,OCEAN_weight_high_probability,OCEAN_weight_medium_probability,OCEAN_weight_low_probability
20,Toto,56,1012,He,6145,6146,265,proper_name_to_canonical,True,""" [[He]] can't hurt the straw.",""" Toto can't hurt the straw.",""" Toto can't hurt the straw.",""" Toto can't hurt the straw.",1,8.725492700003088,0.08804741501808167,0.39363893866539,0.5183136463165283,0.15781418979167938,0.20958088338375092,0.6326048970222473,0.10156133770942688,0.3824472427368164,0.5159914493560791,0.24634256958961487,0.24323494732379913,0.5104224681854248,0.04112726077437401,0.7095078825950623,0.24936489760875702,0.012040727771818638,0.3588218688964844,0.6291373372077942
20,Toto,57,1028,Toto,6289,6290,271,proper_name_to_canonical,False,"Sometimes, indeed, they were broken or missing altogether, leaving holes that [[Toto]] jumped across and Dorothy walked around.","Sometimes, indeed, they were broken or missing altogether, leaving holes that Toto jumped across and Dorothy walked around.","Sometimes, indeed, they were broken or missing altogether, leaving holes that Toto jumped across and Dorothy walked around.","Sometimes, indeed, they were broken or missing altogether, leaving holes that Toto jumped across and Dorothy walked around.",1,8.725492700003088,0.546381413936615,0.25359517335891724,0.20002344250679016,0.11722683161497116,0.16467180848121643,0.7181013822555542,0.5974953770637512,0.0925280824303627,0.3099765181541443,0.6626787185668945,0.029748380184173584,0.3075729012489319,0.08830809593200684,0.5120386481285095,0.39965328574180603,0.030877912417054176,0.7569217085838318,0.21220044791698456
20,Toto,58,1379,Toto,7814,7815,336,proper_name_to_canonical,False,"Dorothy could not see at all, but [[Toto]] could, for some dogs see very well in the dark; and the Scarecrow declared he could see as well as by day.","Dorothy could not see at all, but Toto could, for some dogs see very well in the dark; and the Scarecrow declared he could see as well as by day.","Dorothy could not see at all, but Toto could, for some dogs see very well in the dark; and the Scarecrow declared he could see as well as by day.","Dorothy could not see at all, but Toto could, for some dogs see very well in the dark; and the Scarecrow declared he could see as well as by day.",1,8.725492700003088,0.21797879040241241,0.2979416847229004,0.4840795695781708,0.20969897508621216,0.19699394702911377,0.5933070778846741,0.17043015360832214,0.2271101027727127,0.602459728717804,0.3850543797016144,0.07930542528629303,0.5356402397155762,0.026230476796627045,0.5674432516098022,0.40632620453834534,0.08999304473400116,0.8115541934967041,0.09845269471406937
20,Toto,59,1412,Toto,7987,7988,344,proper_name_to_canonical,False,"She lay down at once, and with [[Toto]] beside her soon fell into a sound sleep.","She lay down at once, and with Toto beside her soon fell into a sound sleep.","She lay down at once, and with Toto beside her soon fell into a sound sleep.","She lay down at once, and with Toto beside her soon fell into a sound sleep.",1,8.725492700003088,0.035846225917339325,0.17455609142780304,0.7895976305007935,0.18578127026557922,0.1133442223072052,0.7008744478225708,0.015708692371845245,0.19648408889770508,0.7878071665763855,0.692787766456604,0.026085140183568,0.2811271846294403,0.02428707480430603,0.5733895897865295,0.4023234248161316,0.06939403712749481,0.3145148754119873,0.6160910129547119
20,Toto,60,1416,Toto,8029,8030,346,proper_name_to_canonical,False,When Dorothy awoke the sun was shining through the trees and [[Toto]] had long been out chasing birds around him and squirrels.,When Dorothy awoke the sun was shining through the trees and Toto had long been out chasing birds around him and squirrels.,When Dorothy awoke the sun was shining through the trees and Toto had long been out chasing birds around him and squirrels.,When Dorothy awoke the sun was shining through the trees and Toto had long been out chasing birds around him and squirrels.,1,8.725492700003088,0.6385335326194763,0.16034667193889618,0.2011197954416275,0.14268304407596588,0.21252577006816864,0.6447911858558655,0.7942730188369751,0.02535792626440525,0.18036912381649017,0.36911436915397644,0.06915163993835449,0.5617339611053467,0.03804362192749977,0.5530737042427063,0.40888267755508423,0.14929331839084625,0.4064657986164093,0.44424089789390564
20,Toto,61,1417,him,8037,8038,346,third_person_object_pronoun_to_canonical,True,When Dorothy awoke the sun was shining through the trees and Toto had long been out chasing birds around [[him]] and squirrels.,When Dorothy awoke the sun was shining through the trees and Toto had long been out chasing birds around Toto and squirrels.,When Dorothy awoke the sun was shining through the trees and Toto had long been out chasing birds around Toto and squirrels.,When Dorothy awoke the sun was shining through the trees and Toto had long been out chasing birds around Toto and squirrels.,1,8.725492700003088,0.5046905279159546,0.24692919850349426,0.24838030338287354,0.12847210466861725,0.23978321254253387,0.6317446231842041,0.6911507844924927,0.06162833049893379,0.24722079932689667,0.2724832594394684,0.11869088560342789,0.6088258624076843,0.04880223050713539,0.5605610609054565,0.3906366527080536,0.14412043988704681,0.4083118140697479,0.44756779074668884
20,Toto,62,1452,Toto,8238,8239,356,proper_name_to_canonical,False,"She saw there was not much bread left in the basket, and the girl was thankful the Scarecrow did not have to eat anything, for there was scarcely enough for herself and [[Toto]] for the day.","She saw there was not much bread left in the basket, and the girl was thankful the Scarecrow did not have to eat anything, for there was scarcely enough for herself and Toto for the day.","She saw there was not much bread left in the basket, and the girl was thankful the Scarecrow did not have to eat anything, for there was scarcely enough for herself and Toto for the day.","She saw there was not much bread left in the basket, and the girl was thankful the Scarecrow did not have to eat anything, for there was scarcely enough for herself and Toto for the day.",1,8.725492700003088,0.06404481828212738,0.29211899638175964,0.643836259841919,0.04204854369163513,0.16687461733818054,0.7910768389701843,0.04477110877633095,0.2804860472679138,0.6747428178787231,0.15469326078891754,0.19940748810768127,0.6458991765975952,0.10090021789073944,0.6658703684806824,0.23322945833206177,0.08455592393875122,0.3802507817745209,0.5351932644844055
20,Toto,63,1485,Toto,8445,8446,366,proper_name_to_canonical,False,"Dorothy looked at him in amazement, and so did the Scarecrow, while [[Toto]] barked sharply and made a snap at the tin legs, which hurt his teeth.","Dorothy looked at him in amazement, and so did the Scarecrow, while Toto barked sharply and made a snap at the tin legs, which hurt his teeth.","Dorothy looked at him in amazement, and so did the Scarecrow, while Toto barked sharply and made a snap at the tin legs, which hurt his teeth.","Dorothy looked at him in amazement, and so did the Scarecrow, while Toto barked sharply and made a snap at the tin legs, which hurt his teeth.",1,8.725492700003088,0.03861047327518463,0.4199948012828827,0.5413947105407715,0.0296621136367321,0.16234108805656433,0.8079967498779297,0.38260987401008606,0.18783992528915405,0.4295501708984375,0.017651818692684174,0.3937905728816986,0.5885575413703918,0.444194495677948,0.1096547394990921,0.4461508095264435,0.2607801556587219,0.414594441652298,0.3246254026889801
20,Toto,64,1486,his,8459,8460,366,third_person_possessive_pronoun_to_canonical_possessive,True,"Dorothy looked at him in amazement, and so did the Scarecrow, while Toto barked sharply and made a snap at the tin legs, which hurt [[his]] teeth.","Dorothy looked at him in amazement, and so did the Scarecrow, while Toto barked sharply and made a snap at the tin legs, which hurt Toto's teeth.","Dorothy looked at him in amazement, and so did the Scarecrow, while Toto barked sharply and made a snap at the tin legs, which hurt Toto's teeth.","Dorothy looked at him in amazement, and so did the Scarecrow, while Toto barked sharply and made a snap at the tin legs, which hurt Toto's teeth.",2,18.05213480000384,0.02995774708688259,0.4151725769042969,0.5548697113990784,0.030358778312802315,0.1751244068145752,0.7945168018341064,0.24119310081005096,0.16272199153900146,0.5960848331451416,0.00972884614020586,0.4017373323440552,0.5885338187217712,0.5141118764877319,0.05275114253163338,0.43313702940940857,0.24671697616577148,0.3841806650161743,0.3691022992134094
20,Toto,65,1968,Toto,10462,10463,441,proper_name_to_canonical,False,"What worried her most was that the bread was nearly gone, and another meal for herself and [[Toto]] would empty the basket.","What worried her most was that the bread was nearly gone, and another meal for herself and Toto would empty the basket.","What worried her most was that the bread was nearly gone, and another meal for herself and Toto would empty the basket.","What worried her most was that the bread was nearly gone, and another meal for herself and Toto would empty the basket.",2,18.05213480000384,0.03038640134036541,0.23125851154327393,0.7383551001548767,0.28401854634284973,0.38181567192077637,0.3341657817363739,0.010113167576491833,0.17782175540924072,0.812065064907074,0.11531837284564972,0.19925227761268616,0.6854293346405029,0.8970832228660583,0.05110663175582886,0.05181015282869339,0.10708538442850113,0.3564746677875519,0.5364399552345276
20,Toto,66,1984,Toto,10614,10615,447,proper_name_to_canonical,False,"These sounds made the little girl's heart beat fast, for she did not know what made them; but [[Toto]] knew, and he walked close to Dorothy's side, and did not even bark in return.","These sounds made the little girl's heart beat fast, for she did not know what made them; but Toto knew, and he walked close to Dorothy's side, and did not even bark in return.","These sounds made the little girl's heart beat fast, for she did not know what made them; but Toto knew, and he walked close to Dorothy's side, and did not even bark in return.","These sounds made the little girl's heart beat fast, for she did not know what made them; but Toto knew, and he walked close to Dorothy's side, and did not even bark in return.",2,18.05213480000384,0.052349481731653214,0.47648587822914124,0.47116464376449585,0.47274747490882874,0.2603439688682556,0.26690855622291565,0.025578150525689125,0.49648773670196533,0.4779340922832489,0.4426133930683136,0.31117039918899536,0.24621616303920746,0.086582712829113,0.6951363682746887,0.21828091144561768,0.3310849964618683,0.3968377113342285,0.2720772624015808
20,Toto,67,1985,he,10618,10619,447,third_person_subject_pronoun_to_canonical,True,"These sounds made the little girl's heart beat fast, for she did not know what made them; but Toto knew, and [[he]] walked close to Dorothy's side, and did not even bark in return.","These sounds made the little girl's heart beat fast, for she did not know what made them; but Toto knew, and Toto walked close to Dorothy's side, and did not even bark in return.","These sounds made the little girl's heart beat fast, for she did not know what made them; but Toto knew, and Toto walked close to Dorothy's side, and did not even bark in return.","These sounds made the little girl's heart beat fast, for she did not know what made them; but Toto knew, and Toto walked close to Dorothy's side, and did not even bark in return.",2,18.05213480000384,0.05130641162395477,0.4752732515335083,0.4734203517436981,0.4952350854873657,0.24868568778038025,0.25607916712760925,0.021081743761897087,0.5147698521614075,0.4641483724117279,0.43351078033447266,0.3097405433654785,0.25674867630004883,0.09232301265001297,0.7038346529006958,0.20384231209754944,0.3317653238773346,0.36259812116622925,0.30563655495643616
20,Toto,68,2023,Toto,10772,10773,451,proper_name_to_canonical,False,"""But [[Toto]]!"" said the girl anxiously.","""But Toto!"" said the girl anxiously.","""But Toto!"" said the girl anxiously.","""But Toto!"" said the girl anxiously.",2,18.05213480000384,0.2807404398918152,0.37114962935447693,0.3481099605560303,0.2215701788663864,0.28290867805480957,0.4955211281776428,0.36774030327796936,0.1808544546365738,0.45140522718429565,0.5722358822822571,0.08317629992961884,0.34458789229393005,0.9345813989639282,0.04255269840359688,0.022865964099764824,0.09375963360071182,0.4812931716442108,0.42494717240333557
20,Toto,69,2025,him,10784,10785,452,third_person_object_pronoun_to_canonical,True,"""What will protect [[him]]?"" ""We must protect him ourselves if he is in danger,"" replied the Tin Woodman.","""What will protect Toto?"" ""We must protect him ourselves if he is in danger,"" replied the Tin Woodman.","""What will protect Toto?"" ""We must protect him ourselves if he is in danger,"" replied the Tin Woodman.","""What will protect Toto?"" ""We must protect him ourselves if he is in danger,"" replied the Tin Woodman.",2,18.05213480000384,0.08442021161317825,0.29958805441856384,0.6159917712211609,0.2211088389158249,0.2253597527742386,0.5535314679145813,0.0736454427242279,0.3974437117576599,0.5289108753204346,0.4398161470890045,0.1439775675535202,0.4162063002586365,0.1879604607820511,0.6456783413887024,0.16636119782924652,0.10156276077032089,0.2938098609447479,0.6046274304389954
20,Toto,70,2028,him,10792,10793,452,third_person_object_pronoun_to_canonical,True,"""What will protect him?"" ""We must protect [[him]] ourselves if he is in danger,"" replied the Tin Woodman.","""What will protect him?"" ""We must protect Toto ourselves if he is in danger,"" replied the Tin Woodman.","""What will protect him?"" ""We must protect Toto ourselves if he is in danger,"" replied the Tin Woodman.","""What will protect him?"" ""We must protect Toto ourselves if he is in danger,"" replied the Tin Woodman.",2,18.05213480000384,0.07503128796815872,0.3457573354244232,0.5792113542556763,0.23348434269428253,0.24124905467033386,0.5252666473388672,0.07879920303821564,0.4121103882789612,0.5090903639793396,0.43588706851005554,0.1918247789144516,0.37228822708129883,0.18990157544612885,0.6721099615097046,0.13798844814300537,0.10970760881900787,0.2895222008228302,0.6007701754570007
20,Toto,71,2031,he,10795,10796,452,third_person_subject_pronoun_to_canonical,True,"""What will protect him?"" ""We must protect him ourselves if [[he]] is in danger,"" replied the Tin Woodman.","""What will protect him?"" ""We must protect him ourselves if Toto is in danger,"" replied the Tin Woodman.","""What will protect him?"" ""We must protect him ourselves if Toto is in danger,"" replied the Tin Woodman.","""What will protect him?"" ""We must protect him ourselves if Toto is in danger,"" replied the Tin Woodman.",2,18.05213480000384,0.07813812792301178,0.35233476758003235,0.5695270895957947,0.2497345507144928,0.24276120960712433,0.5075042247772217,0.07794297486543655,0.39907771348953247,0.5229793190956116,0.455267995595932,0.15806794166564941,0.3866640329360962,0.20110465586185455,0.652908980846405,0.14598631858825684,0.10971247404813766,0.31207478046417236,0.5782127976417542
20,Toto,72,2047,Little Toto,10896,10898,456,proper_name_to_canonical,True,"[[Little Toto]], now that he had an enemy to face, ran barking toward the Lion, and the great beast had opened his mouth to bite the dog, when Dorothy, fearing Toto would be killed, and heedless of danger, rushed forward and slapped the Lion upon his nose as hard as she could, while she cried out: ""Don't you dare to bite Toto!","Toto, now that he had an enemy to face, ran barking toward the Lion, and the great beast had opened his mouth to bite the dog, when Dorothy, fearing Toto would be killed, and heedless of danger, rushed forward and slapped the Lion upon his nose as hard as she could, while she cried out: ""Don't you dare to bite Toto!","Toto, now that he had an enemy to face, ran barking toward the Lion, and the great beast had opened his mouth to bite the dog, when Dorothy, fearing Toto would be killed, and heedless of danger, rushed forward and slapped the Lion upon his nose as hard as she could, while she cried out: ""Don't you dare to bite Toto!","Toto, now that he had an enemy to face, ran barking toward the Lion, and the great beast had opened his mouth to bite the dog, when Dorothy, fearing Toto would be killed, and heedless of danger, rushed forward and slapped the Lion upon his nose as hard as she could, while she cried out: ""Don't you dare to bite Toto!",2,18.05213480000384,0.061845820397138596,0.19549277424812317,0.7426614165306091,0.08684077113866806,0.15375575423240662,0.7594035267829895,0.48949506878852844,0.13427868485450745,0.3762262761592865,0.2898389399051666,0.4493979215621948,0.26076313853263855,0.43589988350868225,0.3649200201034546,0.19918009638786316,0.3159196376800537,0.45010989904403687,0.23397044837474823
20,Toto,73,2048,he,10901,10902,456,third_person_subject_pronoun_to_canonical,True,"Little Toto, now that [[he]] had an enemy to face, ran barking toward the Lion, and the great beast had opened his mouth to bite the dog, when Dorothy, fearing Toto would be killed, and heedless of danger, rushed forward and slapped the Lion upon his nose as hard as she could, while she cried out: ""Don't you dare to bite Toto!","Little Toto, now that Toto had an enemy to face, ran barking toward the Lion, and the great beast had opened his mouth to bite the dog, when Dorothy, fearing Toto would be killed, and heedless of danger, rushed forward and slapped the Lion upon his nose as hard as she could, while she cried out: ""Don't you dare to bite Toto!","Little Toto, now that Toto had an enemy to face, ran barking toward the Lion, and the great beast had opened his mouth to bite the dog, when Dorothy, fearing Toto would be killed, and heedless of danger, rushed forward and slapped the Lion upon his nose as hard as she could, while she cried out: ""Don't you dare to bite Toto!","Little Toto, now that Toto had an enemy to face, ran barking toward the Lion, and the great beast had opened his mouth to bite the dog, when Dorothy, fearing Toto would be killed, and heedless of danger, rushed forward and slapped the Lion upon his nose as hard as she could, while she cried out: ""Don't you dare to bite Toto!",2,18.05213480000384,0.053833261132240295,0.20138677954673767,0.7447798848152161,0.05901177600026131,0.14094115793704987,0.8000470995903015,0.3725140392780304,0.15773236751556396,0.46975359320640564,0.27719250321388245,0.44937893748283386,0.2734285593032837,0.45540305972099304,0.31086134910583496,0.23373562097549438,0.275289386510849,0.4594498574733734,0.2652607858181
20,Toto,74,2055,Toto,10931,10932,456,proper_name_to_canonical,False,"Little Toto, now that he had an enemy to face, ran barking toward the Lion, and the great beast had opened his mouth to bite the dog, when Dorothy, fearing [[Toto]] would be killed, and heedless of danger, rushed forward and slapped the Lion upon his nose as hard as she could, while she cried out: ""Don't you dare to bite Toto!","Little Toto, now that he had an enemy to face, ran barking toward the Lion, and the great beast had opened his mouth to bite the dog, when Dorothy, fearing Toto would be killed, and heedless of danger, rushed forward and slapped the Lion upon his nose as hard as she could, while she cried out: ""Don't you dare to bite Toto!","Little Toto, now that he had an enemy to face, ran barking toward the Lion, and the great beast had opened his mouth to bite the dog, when Dorothy, fearing Toto would be killed, and heedless of danger, rushed forward and slapped the Lion upon his nose as hard as she could, while she cried out: ""Don't you dare to bite Toto!","Little Toto, now that he had an enemy to face, ran barking toward the Lion, and the great beast had opened his mouth to bite the dog, when Dorothy, fearing Toto would be killed, and heedless of danger, rushed forward and slapped the Lion upon his nose as hard as she could, while she cried out: ""Don't you dare to bite Toto!",2,18.05213480000384,0.06238165125250816,0.20837219059467316,0.729246199131012,0.07646582275629044,0.15913516283035278,0.764398992061615,0.4457404911518097,0.14080743491649628,0.41345205903053284,0.3109153211116791,0.40363335609436035,0.2854512929916382,0.4145665466785431,0.35860228538513184,0.22683119773864746,0.2843790650367737,0.456437885761261,0.2591830790042877
20,Toto,75,2061,Toto,10969,10970,456,proper_name_to_canonical,False,"Little Toto, now that he had an enemy to face, ran barking toward the Lion, and the great beast had opened his mouth to bite the dog, when Dorothy, fearing Toto would be killed, and heedless of danger, rushed forward and slapped the Lion upon his nose as hard as she could, while she cried out: ""Don't you dare to bite [[Toto]]!","Little Toto, now that he had an enemy to face, ran barking toward the Lion, and the great beast had opened his mouth to bite the dog, when Dorothy, fearing Toto would be killed, and heedless of danger, rushed forward and slapped the Lion upon his nose as hard as she could, while she cried out: ""Don't you dare to bite Toto!","Little Toto, now that he had an enemy to face, ran barking toward the Lion, and the great beast had opened his mouth to bite the dog, when Dorothy, fearing Toto would be killed, and heedless of danger, rushed forward and slapped the Lion upon his nose as hard as she could, while she cried out: ""Don't you dare to bite Toto!","Little Toto, now that he had an enemy to face, ran barking toward the Lion, and the great beast had opened his mouth to bite the dog, when Dorothy, fearing Toto would be killed, and heedless of danger, rushed forward and slapped the Lion upon his nose as hard as she could, while she cried out: ""Don't you dare to bite Toto!",2,18.05213480000384,0.06238165125250816,0.20837219059467316,0.729246199131012,0.07646582275629044,0.15913516283035278,0.764398992061615,0.4457404911518097,0.14080743491649628,0.41345205903053284,0.3109153211116791,0.40363335609436035,0.2854512929916382,0.4145665466785431,0.35860228538513184,0.22683119773864746,0.2843790650367737,0.456437885761261,0.2591830790042877
20,Toto,76,2066,a poor little dog,10987,10991,457,ambiguous_or_unsupported_keep_original,False,"You ought to be ashamed of yourself, a big beast like you, to bite [[a poor little dog]]!"" ""I didn't bite him,"" said the Lion, as he rubbed his nose with his paw where Dorothy had hit it.","You ought to be ashamed of yourself, a big beast like you, to bite a poor little dog!"" ""I didn't bite him,"" said the Lion, as he rubbed his nose with his paw where Dorothy had hit it.","You ought to be ashamed of yourself, a big beast like you, to bite a poor little dog!"" ""I didn't bite him,"" said the Lion, as he rubbed his nose with his paw where Dorothy had hit it.","You ought to be ashamed of yourself, a big beast like you, to bite a poor little dog!"" ""I didn't bite him,"" said the Lion, as he rubbed his nose with his paw where Dorothy had hit it.",2,18.05213480000384,0.06765924394130707,0.2401072233915329,0.6922335624694824,0.060514383018016815,0.18350759148597717,0.755977988243103,0.11552532762289047,0.25146952271461487,0.6330051422119141,0.1263275444507599,0.40818870067596436,0.46548378467559814,0.16702158749103546,0.42401283979415894,0.4089655578136444,0.1573159247636795,0.3312538266181946,0.5114302039146423
20,Toto,77,2069,him,10999,11000,457,third_person_object_pronoun_to_canonical,True,"You ought to be ashamed of yourself, a big beast like you, to bite a poor little dog!"" ""I didn't bite [[him]],"" said the Lion, as he rubbed his nose with his paw where Dorothy had hit it.","You ought to be ashamed of yourself, a big beast like you, to bite a poor little dog!"" ""I didn't bite Toto,"" said the Lion, as he rubbed his nose with his paw where Dorothy had hit it.","You ought to be ashamed of yourself, a big beast like you, to bite a poor little dog!"" ""I didn't bite Toto,"" said the Lion, as he rubbed his nose with his paw where Dorothy had hit it.","You ought to be ashamed of yourself, a big beast like you, to bite a poor little dog!"" ""I didn't bite Toto,"" said the Lion, as he rubbed his nose with his paw where Dorothy had hit it.",2,18.05213480000384,0.0513884536921978,0.2334774285554886,0.7151341438293457,0.054096519947052,0.19216376543045044,0.7537397742271423,0.09736914932727814,0.25169461965560913,0.6509363055229187,0.10958316177129745,0.3714398145675659,0.5189769864082336,0.1881648302078247,0.3593479096889496,0.4524873197078705,0.16719204187393188,0.33742815256118774,0.49537980556488037
