cluster_id,subject,mention_index_in_cluster,mention_id,mention_text,mention_start,mention_end,sentence_index,mention_render_rule,mention_render_was_changed,original_context_text,rendered_context_text,context_text,normalized_context_text,chunk_index,elapsed_seconds_at_completion,openness_positive_probability,openness_negative_probability,openness_neutral_probability,conscientiousness_positive_probability,conscientiousness_negative_probability,conscientiousness_neutral_probability,extraversion_positive_probability,extraversion_negative_probability,extraversion_neutral_probability,agreeableness_positive_probability,agreeableness_negative_probability,agreeableness_neutral_probability,neuroticism_positive_probability,neuroticism_negative_probability,neuroticism_neutral_probability,OCEAN_weight_high_probability,OCEAN_weight_medium_probability,OCEAN_weight_low_probability
76,the Wicked Witch,96,4869,the Wicked Witch,24872,24875,996,proper_name_to_canonical,False,"The Ball of Fire burned fiercely for a time, and the voice said, ""Bring me proof that [[the Wicked Witch]] is dead, and that moment I will give you courage.","The Ball of Fire burned fiercely for a time, and the voice said, ""Bring me proof that the Wicked Witch is dead, and that moment I will give you courage.","The Ball of Fire burned fiercely for a time, and the voice said, ""Bring me proof that the Wicked Witch is dead, and that moment I will give you courage.","The Ball of Fire burned fiercely for a time, and the voice said, ""Bring me proof that the Wicked Witch is dead, and that moment I will give you courage.",2,19.83968570001889,0.06315063685178757,0.3707553446292877,0.5660940408706665,0.2964414954185486,0.29876652359962463,0.4047919809818268,0.12307941913604736,0.2936705946922302,0.5832500457763672,0.031033124774694443,0.5403585433959961,0.4286082684993744,0.26141273975372314,0.4619406759738922,0.2766466736793518,0.36537468433380127,0.1883774697780609,0.4462478458881378
76,the Wicked Witch,97,4871,I,24881,24882,996,first_second_person_keep_original,False,"The Ball of Fire burned fiercely for a time, and the voice said, ""Bring me proof that the Wicked Witch is dead, and that moment [[I]] will give you courage.","The Ball of Fire burned fiercely for a time, and the voice said, ""Bring me proof that the Wicked Witch is dead, and that moment I will give you courage.","The Ball of Fire burned fiercely for a time, and the voice said, ""Bring me proof that the Wicked Witch is dead, and that moment I will give you courage.","The Ball of Fire burned fiercely for a time, and the voice said, ""Bring me proof that the Wicked Witch is dead, and that moment I will give you courage.",2,19.83968570001889,0.06315063685178757,0.3707553446292877,0.5660940408706665,0.2964414954185486,0.29876652359962463,0.4047919809818268,0.12307941913604736,0.2936705946922302,0.5832500457763672,0.031033124774694443,0.5403585433959961,0.4286082684993744,0.26141273975372314,0.4619406759738922,0.2766466736793518,0.36537468433380127,0.1883774697780609,0.4462478458881378
76,the Wicked Witch,98,4874,the Witch,24891,24893,997,proper_name_to_canonical,True,"But as long as [[the Witch]] lives, you must remain a coward.","But as long as the Wicked Witch lives, you must remain a coward.","But as long as the Wicked Witch lives, you must remain a coward.","But as long as the Wicked Witch lives, you must remain a coward.",2,19.83968570001889,0.03575197234749794,0.6270243525505066,0.3372235596179962,0.19234390556812286,0.30826646089553833,0.49938955903053284,0.07811860740184784,0.48017290234565735,0.441708505153656,0.021042605862021446,0.7950342297554016,0.18392314016819,0.3424726128578186,0.41229477524757385,0.24523264169692993,0.4107397794723511,0.46045616269111633,0.12880399823188782
76,the Wicked Witch,99,4890,the Wizard,24963,24965,1000,proper_name_to_canonical,True,"He was glad to find his friends waiting for him, and told them of his terrible interview with [[the Wizard]].","He was glad to find his friends waiting for him, and told them of his terrible interview with the Wicked Witch.","He was glad to find his friends waiting for him, and told them of his terrible interview with the Wicked Witch.","He was glad to find his friends waiting for him, and told them of his terrible interview with the Wicked Witch.",2,19.83968570001889,0.049560632556676865,0.4260011315345764,0.5244382619857788,0.09025029838085175,0.31347015500068665,0.596279501914978,0.08362868428230286,0.29160788655281067,0.6247633695602417,0.012921401299536228,0.5609528422355652,0.42612573504447937,0.38801872730255127,0.34969091415405273,0.262290358543396,0.26383158564567566,0.3912050426006317,0.344963401556015
76,the Wicked Witch,100,4898,the Wicked Witch,25010,25013,1002,proper_name_to_canonical,False,"""There is only one thing we can do,"" returned the Lion, ""and that is to go to the land of the Winkies, seek out [[the Wicked Witch]], and destroy her.""","""There is only one thing we can do,"" returned the Lion, ""and that is to go to the land of the Winkies, seek out the Wicked Witch, and destroy her.""","""There is only one thing we can do,"" returned the Lion, ""and that is to go to the land of the Winkies, seek out the Wicked Witch, and destroy her.""","""There is only one thing we can do,"" returned the Lion, ""and that is to go to the land of the Winkies, seek out the Wicked Witch, and destroy her.""",2,19.83968570001889,0.06657115370035172,0.41114670038223267,0.5222821235656738,0.21813541650772095,0.3410037159919739,0.4408608675003052,0.12133483588695526,0.3523821234703064,0.5262830257415771,0.031955212354660034,0.6977294087409973,0.2703153192996979,0.25567305088043213,0.4256702959537506,0.31865668296813965,0.24506163597106934,0.24149802327156067,0.5134403109550476
76,the Wicked Witch,101,4899,her,25016,25017,1002,third_person_object_pronoun_to_canonical,True,"""There is only one thing we can do,"" returned the Lion, ""and that is to go to the land of the Winkies, seek out the Wicked Witch, and destroy [[her]].""","""There is only one thing we can do,"" returned the Lion, ""and that is to go to the land of the Winkies, seek out the Wicked Witch, and destroy the Wicked Witch.""","""There is only one thing we can do,"" returned the Lion, ""and that is to go to the land of the Winkies, seek out the Wicked Witch, and destroy the Wicked Witch.""","""There is only one thing we can do,"" returned the Lion, ""and that is to go to the land of the Winkies, seek out the Wicked Witch, and destroy the Wicked Witch.""",2,19.83968570001889,0.06125583127140999,0.42941170930862427,0.5093324780464172,0.19769129157066345,0.3380953073501587,0.46421340107917786,0.09704216569662094,0.3655186891555786,0.5374391078948975,0.028621820732951164,0.7097144722938538,0.26166367530822754,0.2320602387189865,0.46320006251335144,0.30473965406417847,0.24305817484855652,0.24514397978782654,0.5117978453636169
76,the Wicked Witch,102,4933,the Witch,25178,25180,1012,proper_name_to_canonical,True,"""I will go with you; but I'm too much of a coward to kill [[the Witch]],"" said the Lion.","""I will go with you; but I'm too much of a coward to kill the Wicked Witch,"" said the Lion.","""I will go with you; but I'm too much of a coward to kill the Wicked Witch,"" said the Lion.","""I will go with you; but I'm too much of a coward to kill the Wicked Witch,"" said the Lion.",2,19.83968570001889,0.07071108371019363,0.42188602685928345,0.5074029564857483,0.23148922622203827,0.23674753308296204,0.5317632555961609,0.11199485510587692,0.3455584943294525,0.5424466133117676,0.08804773539304733,0.6050852537155151,0.30686697363853455,0.20752587914466858,0.5766813158988953,0.21579279005527496,0.20531463623046875,0.3125709891319275,0.482114315032959
76,the Wicked Witch,103,4941,you,25208,25209,1013,first_second_person_keep_original,False,"""I will go too,"" declared the Scarecrow; ""but I shall not be of much help to [[you]], I am such a fool.","""I will go too,"" declared the Scarecrow; ""but I shall not be of much help to you, I am such a fool.","""I will go too,"" declared the Scarecrow; ""but I shall not be of much help to you, I am such a fool.","""I will go too,"" declared the Scarecrow; ""but I shall not be of much help to you, I am such a fool.",2,19.83968570001889,0.06625247746706009,0.36308783292770386,0.5706597566604614,0.017949482426047325,0.24442033469676971,0.7376301884651184,0.17622090876102448,0.2546531558036804,0.5691258907318115,0.02664485201239586,0.21771393716335297,0.7556412220001221,0.2582894265651703,0.28617966175079346,0.45553091168403625,0.12291741371154785,0.47188133001327515,0.4052012264728546
76,the Wicked Witch,104,4947,a Witch,25227,25229,1014,proper_name_to_canonical,True,""" ""I haven't the heart to harm even [[a Witch]],"" remarked the Tin Woodman; ""but if you go I certainly shall go with you.",""" ""I haven't the heart to harm even the Wicked Witch,"" remarked the Tin Woodman; ""but if you go I certainly shall go with you.",""" ""I haven't the heart to harm even the Wicked Witch,"" remarked the Tin Woodman; ""but if you go I certainly shall go with you.",""" ""I haven't the heart to harm even the Wicked Witch,"" remarked the Tin Woodman; ""but if you go I certainly shall go with you.",2,19.83968570001889,0.10265412926673889,0.4703994393348694,0.42694634199142456,0.1947985738515854,0.27257221937179565,0.5326291918754578,0.10664237290620804,0.37042802572250366,0.5229295492172241,0.18460160493850708,0.5534107089042664,0.26198771595954895,0.18422874808311462,0.49038073420524597,0.32539045810699463,0.2903786897659302,0.27445560693740845,0.43516573309898376
76,the Wicked Witch,105,4952,you,25246,25247,1014,first_second_person_keep_original,False,""" ""I haven't the heart to harm even a Witch,"" remarked the Tin Woodman; ""but if you go I certainly shall go with [[you]].",""" ""I haven't the heart to harm even a Witch,"" remarked the Tin Woodman; ""but if you go I certainly shall go with you.",""" ""I haven't the heart to harm even a Witch,"" remarked the Tin Woodman; ""but if you go I certainly shall go with you.",""" ""I haven't the heart to harm even a Witch,"" remarked the Tin Woodman; ""but if you go I certainly shall go with you.",2,19.83968570001889,0.14326834678649902,0.3953835070133209,0.46134817600250244,0.13253678381443024,0.26101937890052795,0.6064438819885254,0.13161896169185638,0.32879629731178284,0.5395846962928772,0.2551747262477875,0.4057818353176117,0.33904340863227844,0.21039573848247528,0.40713566541671753,0.3824685513973236,0.23588567972183228,0.311564564704895,0.45254969596862793
76,the Wicked Witch,106,5004,the Wicked Witch of the West,25444,25450,1021,proper_name_to_canonical,True,"""Which road leads to [[the Wicked Witch of the West]]?"" asked Dorothy.","""Which road leads to the Wicked Witch?"" asked Dorothy.","""Which road leads to the Wicked Witch?"" asked Dorothy.","""Which road leads to the Wicked Witch?"" asked Dorothy.",2,19.83968570001889,0.28497830033302307,0.4627913534641266,0.25223034620285034,0.25463613867759705,0.3272787034511566,0.41808515787124634,0.15636466443538666,0.34758836030960083,0.4960470497608185,0.11381115764379501,0.5143805742263794,0.37180832028388977,0.25476545095443726,0.44636380672454834,0.2988708019256592,0.2321292906999588,0.3826230764389038,0.3852476179599762
76,the Wicked Witch,107,5013,her,25491,25492,1023,third_person_object_pronoun_to_canonical,True,"""No one ever wishes to go that way."" ""How, then, are we to find [[her]]?"" inquired the girl.","""No one ever wishes to go that way."" ""How, then, are we to find the Wicked Witch?"" inquired the girl.","""No one ever wishes to go that way."" ""How, then, are we to find the Wicked Witch?"" inquired the girl.","""No one ever wishes to go that way."" ""How, then, are we to find the Wicked Witch?"" inquired the girl.",2,19.83968570001889,0.17152607440948486,0.4332742989063263,0.39519965648651123,0.15382620692253113,0.2583662271499634,0.5878075361251831,0.06970633566379547,0.34264621138572693,0.5876474380493164,0.06040401756763458,0.39407604932785034,0.5455198884010315,0.2166154682636261,0.47438228130340576,0.30900219082832336,0.16675984859466553,0.3224598467350006,0.5107802748680115
76,the Wicked Witch,108,5017,she,25513,25514,1024,third_person_subject_pronoun_to_canonical,True,"""That will be easy,"" replied the man, ""for when [[she]] knows you are in the country of the Winkies she will find you, and make you all her slaves.","""That will be easy,"" replied the man, ""for when the Wicked Witch knows you are in the country of the Winkies she will find you, and make you all her slaves.","""That will be easy,"" replied the man, ""for when the Wicked Witch knows you are in the country of the Winkies she will find you, and make you all her slaves.","""That will be easy,"" replied the man, ""for when the Wicked Witch knows you are in the country of the Winkies she will find you, and make you all her slaves.",2,19.83968570001889,0.04652264714241028,0.3974061608314514,0.5560711622238159,0.28560933470726013,0.27520477771759033,0.43918585777282715,0.0877886712551117,0.3744405210018158,0.5377708077430725,0.02527931146323681,0.8519811630249023,0.1227395310997963,0.14968927204608917,0.5559425354003906,0.294368177652359,0.24373415112495422,0.19685254991054535,0.5594133138656616
76,the Wicked Witch,109,5022,she,25523,25524,1024,third_person_subject_pronoun_to_canonical,True,"""That will be easy,"" replied the man, ""for when she knows you are in the country of the Winkies [[she]] will find you, and make you all her slaves.","""That will be easy,"" replied the man, ""for when she knows you are in the country of the Winkies the Wicked Witch will find you, and make you all her slaves.","""That will be easy,"" replied the man, ""for when she knows you are in the country of the Winkies the Wicked Witch will find you, and make you all her slaves.","""That will be easy,"" replied the man, ""for when she knows you are in the country of the Winkies the Wicked Witch will find you, and make you all her slaves.",2,19.83968570001889,0.04770702123641968,0.37927427887916565,0.5730187296867371,0.25915348529815674,0.2643939256668091,0.47645261883735657,0.07894854992628098,0.34251850843429565,0.5785329937934875,0.02426948957145214,0.8572015762329102,0.11852898448705673,0.1493290215730667,0.5515116453170776,0.29915931820869446,0.24677643179893494,0.20237421989440918,0.5508493185043335
76,the Wicked Witch,110,5027,her,25532,25533,1024,third_person_possessive_pronoun_to_canonical_possessive,True,"""That will be easy,"" replied the man, ""for when she knows you are in the country of the Winkies she will find you, and make you all [[her]] slaves.","""That will be easy,"" replied the man, ""for when she knows you are in the country of the Winkies she will find you, and make you all the Wicked Witch's slaves.","""That will be easy,"" replied the man, ""for when she knows you are in the country of the Winkies she will find you, and make you all the Wicked Witch's slaves.","""That will be easy,"" replied the man, ""for when she knows you are in the country of the Winkies she will find you, and make you all the Wicked Witch's slaves.",2,19.83968570001889,0.04560934379696846,0.37365132570266724,0.5807393789291382,0.3251229524612427,0.2396136075258255,0.435263454914093,0.09830531477928162,0.33394575119018555,0.5677489042282104,0.02754894830286503,0.7968850135803223,0.17556601762771606,0.15608222782611847,0.5043318867683411,0.3395858407020569,0.2669839859008789,0.21384789049625397,0.5191681385040283
76,the Wicked Witch,111,5032,her,25552,25553,1025,third_person_object_pronoun_to_canonical,True,""" ""Perhaps not,"" said the Scarecrow, ""for we mean to destroy [[her]].",""" ""Perhaps not,"" said the Scarecrow, ""for we mean to destroy the Wicked Witch.",""" ""Perhaps not,"" said the Scarecrow, ""for we mean to destroy the Wicked Witch.",""" ""Perhaps not,"" said the Scarecrow, ""for we mean to destroy the Wicked Witch.",2,19.83968570001889,0.06395726650953293,0.3951478600502014,0.5408948659896851,0.1691029667854309,0.3269108533859253,0.5039861798286438,0.11821722239255905,0.3294505178928375,0.5523322820663452,0.04122233763337135,0.6902366280555725,0.26854103803634644,0.2493005096912384,0.43012210726737976,0.3205774128437042,0.244343101978302,0.32870176434516907,0.42695510387420654
76,the Wicked Witch,112,5037,her,25577,25578,1027,third_person_possessive_pronoun_to_canonical_possessive,True,"""No one has ever destroyed [[her]] before, so I naturally thought she would make slaves of you, as she has of the rest.","""No one has ever destroyed the Wicked Witch's before, so I naturally thought she would make slaves of you, as she has of the rest.","""No one has ever destroyed the Wicked Witch's before, so I naturally thought she would make slaves of you, as she has of the rest.","""No one has ever destroyed the Wicked Witch's before, so I naturally thought she would make slaves of you, as she has of the rest.",2,19.83968570001889,0.015510691329836845,0.38573580980300903,0.5987534523010254,0.0966934785246849,0.21578451991081238,0.6875219941139221,0.06251485645771027,0.2944793403148651,0.6430057883262634,0.003164106048643589,0.8437093496322632,0.15312661230564117,0.13051892817020416,0.49401843547821045,0.3754625618457794,0.3980165123939514,0.1680377721786499,0.4339456558227539
76,the Wicked Witch,113,5040,she,25584,25585,1027,third_person_subject_pronoun_to_canonical,True,"""No one has ever destroyed her before, so I naturally thought [[she]] would make slaves of you, as she has of the rest.","""No one has ever destroyed her before, so I naturally thought the Wicked Witch would make slaves of you, as she has of the rest.","""No one has ever destroyed her before, so I naturally thought the Wicked Witch would make slaves of you, as she has of the rest.","""No one has ever destroyed her before, so I naturally thought the Wicked Witch would make slaves of you, as she has of the rest.",2,19.83968570001889,0.016627425327897072,0.257820725440979,0.7255517840385437,0.08536344021558762,0.17396114766597748,0.7406753897666931,0.042857229709625244,0.31939199566841125,0.6377507448196411,0.0037488751113414764,0.8327855467796326,0.16346555948257446,0.12006943672895432,0.5742194652557373,0.3057110905647278,0.44862037897109985,0.20369550585746765,0.3476840853691101
76,the Wicked Witch,114,5044,she,25592,25593,1027,third_person_subject_pronoun_to_canonical,True,"""No one has ever destroyed her before, so I naturally thought she would make slaves of you, as [[she]] has of the rest.","""No one has ever destroyed her before, so I naturally thought she would make slaves of you, as the Wicked Witch has of the rest.","""No one has ever destroyed her before, so I naturally thought she would make slaves of you, as the Wicked Witch has of the rest.","""No one has ever destroyed her before, so I naturally thought she would make slaves of you, as the Wicked Witch has of the rest.",2,19.83968570001889,0.022559890523552895,0.21488001942634583,0.7625601291656494,0.1175808236002922,0.22708606719970703,0.6553330421447754,0.05474171042442322,0.23941822350025177,0.7058400511741638,0.006445214617997408,0.8173859715461731,0.17616893351078033,0.12586218118667603,0.4541332721710205,0.42000460624694824,0.5055341124534607,0.2024916261434555,0.29197418689727783
76,the Wicked Witch,115,5046,she,25603,25604,1028,third_person_subject_pronoun_to_canonical,True,"But take care; for [[she]] is wicked and fierce, and may not allow you to destroy her.","But take care; for the Wicked Witch is wicked and fierce, and may not allow you to destroy her.","But take care; for the Wicked Witch is wicked and fierce, and may not allow you to destroy her.","But take care; for the Wicked Witch is wicked and fierce, and may not allow you to destroy her.",2,19.83968570001889,0.009112031199038029,0.15854540467262268,0.8323425650596619,0.04392530769109726,0.04224255308508873,0.9138321280479431,0.03451116383075714,0.14473095536231995,0.8207578659057617,0.0017950887558981776,0.8718360662460327,0.12636885046958923,0.03441859409213066,0.10643167793750763,0.859149694442749,0.5627434253692627,0.02231557108461857,0.4149410128593445
76,the Wicked Witch,116,5049,her,25616,25617,1028,third_person_object_pronoun_to_canonical,True,"But take care; for she is wicked and fierce, and may not allow you to destroy [[her]].","But take care; for she is wicked and fierce, and may not allow you to destroy the Wicked Witch.","But take care; for she is wicked and fierce, and may not allow you to destroy the Wicked Witch.","But take care; for she is wicked and fierce, and may not allow you to destroy the Wicked Witch.",2,19.83968570001889,0.022657930850982666,0.28085651993751526,0.6964855790138245,0.10551940649747849,0.08274228870868683,0.8117383718490601,0.06210673600435257,0.24527737498283386,0.6926159262657166,0.003783630672842264,0.9052608013153076,0.09095560759305954,0.06765210628509521,0.27606281638145447,0.6562850475311279,0.5425130724906921,0.03394453227519989,0.42354241013526917
76,the Wicked Witch,117,5052,her,25635,25636,1029,third_person_object_pronoun_to_canonical,True,"Keep to the West, where the sun sets, and you cannot fail to find [[her]]."" They thanked him and bade him good-bye, and turned toward the West, walking over fields of soft grass dotted here and there with daisies and buttercups.","Keep to the West, where the sun sets, and you cannot fail to find the Wicked Witch."" They thanked him and bade him good-bye, and turned toward the West, walking over fields of soft grass dotted here and there with daisies and buttercups.","Keep to the West, where the sun sets, and you cannot fail to find the Wicked Witch."" They thanked him and bade him good-bye, and turned toward the West, walking over fields of soft grass dotted here and there with daisies and buttercups.","Keep to the West, where the sun sets, and you cannot fail to find the Wicked Witch."" They thanked him and bade him good-bye, and turned toward the West, walking over fields of soft grass dotted here and there with daisies and buttercups.",2,19.83968570001889,0.07848531752824783,0.25205808877944946,0.6694565415382385,0.2193089723587036,0.23050814867019653,0.5501829385757446,0.09857583791017532,0.2642538249492645,0.6371703743934631,0.11755206435918808,0.23094379901885986,0.6515040993690491,0.1600966900587082,0.5093144178390503,0.3305888772010803,0.19895561039447784,0.2578451335430145,0.5431993007659912
76,the Wicked Witch,118,5085,the Wicked Witch of the West,25821,25827,1035,proper_name_to_canonical,True,"Now [[the Wicked Witch of the West]] had but one eye, yet that was as powerful as a telescope, and could see everywhere.","Now the Wicked Witch had but one eye, yet that was as powerful as a telescope, and could see everywhere.","Now the Wicked Witch had but one eye, yet that was as powerful as a telescope, and could see everywhere.","Now the Wicked Witch had but one eye, yet that was as powerful as a telescope, and could see everywhere.",2,19.83968570001889,0.13957805931568146,0.3831358253955841,0.47728613018989563,0.15060555934906006,0.3975685238838196,0.45182594656944275,0.037967100739479065,0.5185195803642273,0.44351330399513245,0.07066518068313599,0.27569112181663513,0.6536436676979065,0.10747529566287994,0.6077009439468384,0.2848237156867981,0.32537516951560974,0.2053493708372116,0.46927541494369507
76,the Wicked Witch,119,5086,she,25849,25850,1036,third_person_subject_pronoun_to_canonical,True,"So, as [[she]] sat in the door of her castle, she happened to look around and saw Dorothy lying asleep, with her friends all about her.","So, as the Wicked Witch sat in the door of her castle, she happened to look around and saw Dorothy lying asleep, with her friends all about her.","So, as the Wicked Witch sat in the door of her castle, she happened to look around and saw Dorothy lying asleep, with her friends all about her.","So, as the Wicked Witch sat in the door of her castle, she happened to look around and saw Dorothy lying asleep, with her friends all about her.",2,19.83968570001889,0.13852690160274506,0.5958857536315918,0.2655872702598572,0.09215040504932404,0.40295496582984924,0.5048946142196655,0.0638991966843605,0.37786176800727844,0.5582390427589417,0.08037450164556503,0.5069913268089294,0.41263413429260254,0.17132394015789032,0.6228256225585938,0.20585043728351593,0.3317245543003082,0.6185337901115417,0.0497417189180851
76,the Wicked Witch,120,5087,her,25855,25856,1036,third_person_possessive_pronoun_to_canonical_possessive,True,"So, as she sat in the door of [[her]] castle, she happened to look around and saw Dorothy lying asleep, with her friends all about her.","So, as she sat in the door of the Wicked Witch's castle, she happened to look around and saw Dorothy lying asleep, with her friends all about her.","So, as she sat in the door of the Wicked Witch's castle, she happened to look around and saw Dorothy lying asleep, with her friends all about her.","So, as she sat in the door of the Wicked Witch's castle, she happened to look around and saw Dorothy lying asleep, with her friends all about her.",2,19.83968570001889,0.11606805771589279,0.4109950065612793,0.47293686866760254,0.13454672694206238,0.346271812915802,0.5191814303398132,0.09204074740409851,0.26867979764938354,0.6392794251441956,0.09061207622289658,0.45458292961120605,0.4548049569129944,0.22888408601284027,0.4610059857368469,0.3101098835468292,0.20762506127357483,0.6412500143051147,0.15112493932247162
