cluster_id,subject,mention_index_in_cluster,mention_id,mention_text,mention_start,mention_end,sentence_index,mention_render_rule,mention_render_was_changed,original_context_text,rendered_context_text,context_text,normalized_context_text,chunk_index,elapsed_seconds_at_completion,openness_positive_probability,openness_negative_probability,openness_neutral_probability,conscientiousness_positive_probability,conscientiousness_negative_probability,conscientiousness_neutral_probability,extraversion_positive_probability,extraversion_negative_probability,extraversion_neutral_probability,agreeableness_positive_probability,agreeableness_negative_probability,agreeableness_neutral_probability,neuroticism_positive_probability,neuroticism_negative_probability,neuroticism_neutral_probability,OCEAN_weight_high_probability,OCEAN_weight_medium_probability,OCEAN_weight_low_probability
76,the Wicked Witch,259,5670,the Witch,28719,28721,1150,proper_name_to_canonical,True,Once [[the Witch]] struck Toto a blow with her umbrella and the brave little dog flew at her and bit her leg in return.,Once the Wicked Witch struck Toto a blow with her umbrella and the brave little dog flew at her and bit her leg in return.,Once the Wicked Witch struck Toto a blow with her umbrella and the brave little dog flew at her and bit her leg in return.,Once the Wicked Witch struck Toto a blow with her umbrella and the brave little dog flew at her and bit her leg in return.,5,49.40084710001247,0.05477682501077652,0.47293248772621155,0.47229066491127014,0.07569558918476105,0.3764728307723999,0.5478315949440002,0.141459122300148,0.34544482827186584,0.5130959749221802,0.013265694491565228,0.8119503259658813,0.17478393018245697,0.218107208609581,0.43758711218833923,0.3443056344985962,0.5884079933166504,0.30333051085472107,0.10826148837804794
76,the Wicked Witch,260,5672,her,28726,28727,1150,third_person_possessive_pronoun_to_canonical_possessive,True,Once the Witch struck Toto a blow with [[her]] umbrella and the brave little dog flew at her and bit her leg in return.,Once the Witch struck Toto a blow with the Wicked Witch's umbrella and the brave little dog flew at her and bit her leg in return.,Once the Witch struck Toto a blow with the Wicked Witch's umbrella and the brave little dog flew at her and bit her leg in return.,Once the Witch struck Toto a blow with the Wicked Witch's umbrella and the brave little dog flew at her and bit her leg in return.,5,49.40084710001247,0.06267254799604416,0.5137695670127869,0.423557847738266,0.077077716588974,0.40159693360328674,0.5213252902030945,0.15414874255657196,0.3156755268573761,0.5301757454872131,0.010725842788815498,0.8570664525032043,0.13220778107643127,0.2860640585422516,0.37455812096595764,0.33937788009643555,0.5321263670921326,0.2653580904006958,0.20251551270484924
76,the Wicked Witch,261,5673,her,28735,28736,1150,third_person_object_pronoun_to_canonical,True,Once the Witch struck Toto a blow with her umbrella and the brave little dog flew at [[her]] and bit her leg in return.,Once the Witch struck Toto a blow with her umbrella and the brave little dog flew at the Wicked Witch and bit her leg in return.,Once the Witch struck Toto a blow with her umbrella and the brave little dog flew at the Wicked Witch and bit her leg in return.,Once the Witch struck Toto a blow with her umbrella and the brave little dog flew at the Wicked Witch and bit her leg in return.,5,49.40084710001247,0.04851951450109482,0.4876428544521332,0.46383756399154663,0.06423015892505646,0.3736109733581543,0.5621588230133057,0.08491353690624237,0.3520427644252777,0.5630436539649963,0.012666592374444008,0.8285126090049744,0.15882080793380737,0.24211756885051727,0.4574437439441681,0.30043870210647583,0.5676191449165344,0.3187943696975708,0.1135864183306694
76,the Wicked Witch,262,5674,her,28738,28739,1150,third_person_possessive_pronoun_to_canonical_possessive,True,Once the Witch struck Toto a blow with her umbrella and the brave little dog flew at her and bit [[her]] leg in return.,Once the Witch struck Toto a blow with her umbrella and the brave little dog flew at her and bit the Wicked Witch's leg in return.,Once the Witch struck Toto a blow with her umbrella and the brave little dog flew at her and bit the Wicked Witch's leg in return.,Once the Witch struck Toto a blow with her umbrella and the brave little dog flew at her and bit the Wicked Witch's leg in return.,5,49.40084710001247,0.052990060299634933,0.4838496744632721,0.4631602466106415,0.07300513237714767,0.40758776664733887,0.5194070935249329,0.10638843476772308,0.3496869206428528,0.5439246296882629,0.011343001388013363,0.869533121585846,0.11912381649017334,0.3033701181411743,0.33777347207069397,0.3588564097881317,0.5964548587799072,0.28395506739616394,0.11959008872509003
76,the Wicked Witch,263,5675,The Witch,28743,28745,1151,proper_name_to_canonical,True,"[[The Witch]] did not bleed where she was bitten, for she was so wicked that the blood in her had dried up many years before.","the Wicked Witch did not bleed where she was bitten, for she was so wicked that the blood in her had dried up many years before.","the Wicked Witch did not bleed where she was bitten, for she was so wicked that the blood in her had dried up many years before.","the Wicked Witch did not bleed where she was bitten, for she was so wicked that the blood in her had dried up many years before.",5,49.40084710001247,0.020820006728172302,0.26678726077079773,0.7123926877975464,0.042587731033563614,0.17226383090019226,0.7851485013961792,0.037951964884996414,0.3444288969039917,0.6176191568374634,0.006421517115086317,0.7986290454864502,0.1949494630098343,0.09597116708755493,0.5890440344810486,0.3149847984313965,0.328769713640213,0.07706690579652786,0.5941634178161621
76,the Wicked Witch,264,5676,she,28749,28750,1151,third_person_subject_pronoun_to_canonical,True,"The Witch did not bleed where [[she]] was bitten, for she was so wicked that the blood in her had dried up many years before.","The Witch did not bleed where the Wicked Witch was bitten, for she was so wicked that the blood in her had dried up many years before.","The Witch did not bleed where the Wicked Witch was bitten, for she was so wicked that the blood in her had dried up many years before.","The Witch did not bleed where the Wicked Witch was bitten, for she was so wicked that the blood in her had dried up many years before.",5,49.40084710001247,0.019792400300502777,0.23895250260829926,0.7412551641464233,0.03661542758345604,0.14173871278762817,0.8216458559036255,0.04727241024374962,0.3506655991077423,0.6020619869232178,0.006826979573816061,0.8269608616828918,0.16621218621730804,0.10982094705104828,0.5925280451774597,0.2976510226726532,0.32200267910957336,0.0690285935997963,0.6089687347412109
76,the Wicked Witch,265,5677,she,28754,28755,1151,third_person_subject_pronoun_to_canonical,True,"The Witch did not bleed where she was bitten, for [[she]] was so wicked that the blood in her had dried up many years before.","The Witch did not bleed where she was bitten, for the Wicked Witch was so wicked that the blood in her had dried up many years before.","The Witch did not bleed where she was bitten, for the Wicked Witch was so wicked that the blood in her had dried up many years before.","The Witch did not bleed where she was bitten, for the Wicked Witch was so wicked that the blood in her had dried up many years before.",5,49.40084710001247,0.016448751091957092,0.25020870566368103,0.7333424687385559,0.03538766875863075,0.1242409497499466,0.8403713703155518,0.041583798825740814,0.3739042580127716,0.5845118761062622,0.005079115740954876,0.8368370532989502,0.15808382630348206,0.09256128966808319,0.5994634628295898,0.30797526240348816,0.402655690908432,0.07422967255115509,0.5231146216392517
76,the Wicked Witch,266,5678,her,28762,28763,1151,third_person_possessive_pronoun_to_canonical_possessive,True,"The Witch did not bleed where she was bitten, for she was so wicked that the blood in [[her]] had dried up many years before.","The Witch did not bleed where she was bitten, for she was so wicked that the blood in the Wicked Witch's had dried up many years before.","The Witch did not bleed where she was bitten, for she was so wicked that the blood in the Wicked Witch's had dried up many years before.","The Witch did not bleed where she was bitten, for she was so wicked that the blood in the Wicked Witch's had dried up many years before.",5,49.40084710001247,0.015744328498840332,0.2557810842990875,0.7284746170043945,0.037924736738204956,0.11602059006690979,0.84605473279953,0.04032525047659874,0.33256691694259644,0.6271077990531921,0.004917085636407137,0.830974280834198,0.16410861909389496,0.09711997210979462,0.6051865816116333,0.2976934313774109,0.2878442108631134,0.0828319564461708,0.6293238401412964
76,the Wicked Witch,267,5699,the Wicked Witch,28873,28876,1155,proper_name_to_canonical,False,Now [[the Wicked Witch]] had a great longing to have for her own the Silver Shoes which the girl always wore.,Now the Wicked Witch had a great longing to have for her own the Silver Shoes which the girl always wore.,Now the Wicked Witch had a great longing to have for her own the Silver Shoes which the girl always wore.,Now the Wicked Witch had a great longing to have for her own the Silver Shoes which the girl always wore.,5,49.40084710001247,0.0416552796959877,0.3735424280166626,0.5848022699356079,0.05410817265510559,0.26854971051216125,0.6773420572280884,0.05530601739883423,0.41186442971229553,0.5328295230865479,0.01928620971739292,0.42920273542404175,0.5515110492706299,0.35845330357551575,0.36374273896217346,0.2778039574623108,0.5406290888786316,0.2927889823913574,0.16658194363117218
76,the Wicked Witch,268,5700,her,28883,28884,1155,third_person_possessive_pronoun_to_canonical_possessive,True,Now the Wicked Witch had a great longing to have for [[her]] own the Silver Shoes which the girl always wore.,Now the Wicked Witch had a great longing to have for the Wicked Witch's own the Silver Shoes which the girl always wore.,Now the Wicked Witch had a great longing to have for the Wicked Witch's own the Silver Shoes which the girl always wore.,Now the Wicked Witch had a great longing to have for the Wicked Witch's own the Silver Shoes which the girl always wore.,5,49.40084710001247,0.03759016841650009,0.3643018305301666,0.5981079936027527,0.04446974769234657,0.2161264717578888,0.7394038438796997,0.06753788143396378,0.4095991253852844,0.5228630304336548,0.035318806767463684,0.4325883984565735,0.532092809677124,0.36474278569221497,0.3340536952018738,0.30120351910591125,0.5182911157608032,0.24208928644657135,0.23961961269378662
76,the Wicked Witch,269,5702,Her,28894,28895,1156,proper_name_to_canonical,True,"[[Her]] bees and her crows and her wolves were lying in heaps and drying up, and she had used up all the power of the Golden Cap; but if she could only get hold of the Silver Shoes, they would give her more power than all the other things she had lost.","the Wicked Witch bees and her crows and her wolves were lying in heaps and drying up, and she had used up all the power of the Golden Cap; but if she could only get hold of the Silver Shoes, they would give her more power than all the other things she had lost.","the Wicked Witch bees and her crows and her wolves were lying in heaps and drying up, and she had used up all the power of the Golden Cap; but if she could only get hold of the Silver Shoes, they would give her more power than all the other things she had lost.","the Wicked Witch bees and her crows and her wolves were lying in heaps and drying up, and she had used up all the power of the Golden Cap; but if she could only get hold of the Silver Shoes, they would give her more power than all the other things she had lost.",5,49.40084710001247,0.039228226989507675,0.28781458735466003,0.672957181930542,0.07025066018104553,0.23328597843647003,0.6964632868766785,0.053516995161771774,0.2571921646595001,0.6892908811569214,0.014126239344477654,0.49080073833465576,0.49507299065589905,0.2923319637775421,0.4276311695575714,0.2800368666648865,0.2060963213443756,0.271968811750412,0.5219348669052124
76,the Wicked Witch,270,5703,her,28897,28898,1156,third_person_possessive_pronoun_to_canonical_possessive,True,"Her bees and [[her]] crows and her wolves were lying in heaps and drying up, and she had used up all the power of the Golden Cap; but if she could only get hold of the Silver Shoes, they would give her more power than all the other things she had lost.","Her bees and the Wicked Witch's crows and her wolves were lying in heaps and drying up, and she had used up all the power of the Golden Cap; but if she could only get hold of the Silver Shoes, they would give her more power than all the other things she had lost.","Her bees and the Wicked Witch's crows and her wolves were lying in heaps and drying up, and she had used up all the power of the Golden Cap; but if she could only get hold of the Silver Shoes, they would give her more power than all the other things she had lost.","Her bees and the Wicked Witch's crows and her wolves were lying in heaps and drying up, and she had used up all the power of the Golden Cap; but if she could only get hold of the Silver Shoes, they would give her more power than all the other things she had lost.",5,49.40084710001247,0.04756179451942444,0.3317197561264038,0.6207183599472046,0.0897391214966774,0.2560177147388458,0.6542431712150574,0.06693636626005173,0.3093595504760742,0.6237040758132935,0.024673370644450188,0.4922618269920349,0.48306483030319214,0.2657141089439392,0.5311518311500549,0.20313408970832825,0.25664758682250977,0.2591661810874939,0.48418617248535156
76,the Wicked Witch,271,5704,her,28900,28901,1156,third_person_possessive_pronoun_to_canonical_possessive,True,"Her bees and her crows and [[her]] wolves were lying in heaps and drying up, and she had used up all the power of the Golden Cap; but if she could only get hold of the Silver Shoes, they would give her more power than all the other things she had lost.","Her bees and her crows and the Wicked Witch's wolves were lying in heaps and drying up, and she had used up all the power of the Golden Cap; but if she could only get hold of the Silver Shoes, they would give her more power than all the other things she had lost.","Her bees and her crows and the Wicked Witch's wolves were lying in heaps and drying up, and she had used up all the power of the Golden Cap; but if she could only get hold of the Silver Shoes, they would give her more power than all the other things she had lost.","Her bees and her crows and the Wicked Witch's wolves were lying in heaps and drying up, and she had used up all the power of the Golden Cap; but if she could only get hold of the Silver Shoes, they would give her more power than all the other things she had lost.",5,49.40084710001247,0.04762512817978859,0.33656957745552063,0.6158052682876587,0.08640304952859879,0.25682076811790466,0.6567761898040771,0.06381869316101074,0.30209264159202576,0.6340886354446411,0.02251463197171688,0.5017531514167786,0.4757322072982788,0.27163803577423096,0.5159820318222046,0.21237988770008087,0.25775688886642456,0.26815566420555115,0.4740874767303467
76,the Wicked Witch,272,5705,she,28911,28912,1156,third_person_subject_pronoun_to_canonical,True,"Her bees and her crows and her wolves were lying in heaps and drying up, and [[she]] had used up all the power of the Golden Cap; but if she could only get hold of the Silver Shoes, they would give her more power than all the other things she had lost.","Her bees and her crows and her wolves were lying in heaps and drying up, and the Wicked Witch had used up all the power of the Golden Cap; but if she could only get hold of the Silver Shoes, they would give her more power than all the other things she had lost.","Her bees and her crows and her wolves were lying in heaps and drying up, and the Wicked Witch had used up all the power of the Golden Cap; but if she could only get hold of the Silver Shoes, they would give her more power than all the other things she had lost.","Her bees and her crows and her wolves were lying in heaps and drying up, and the Wicked Witch had used up all the power of the Golden Cap; but if she could only get hold of the Silver Shoes, they would give her more power than all the other things she had lost.",5,49.40084710001247,0.04570341855287552,0.32935911417007446,0.6249374747276306,0.08568578958511353,0.293574720621109,0.6207395195960999,0.05781557783484459,0.30493542551994324,0.6372490525245667,0.02089753933250904,0.5433889627456665,0.4357134997844696,0.25870782136917114,0.5173991322517395,0.2238929718732834,0.2602178156375885,0.27111271023750305,0.4686695337295532
76,the Wicked Witch,273,5706,she,28925,28926,1156,third_person_subject_pronoun_to_canonical,True,"Her bees and her crows and her wolves were lying in heaps and drying up, and she had used up all the power of the Golden Cap; but if [[she]] could only get hold of the Silver Shoes, they would give her more power than all the other things she had lost.","Her bees and her crows and her wolves were lying in heaps and drying up, and she had used up all the power of the Golden Cap; but if the Wicked Witch could only get hold of the Silver Shoes, they would give her more power than all the other things she had lost.","Her bees and her crows and her wolves were lying in heaps and drying up, and she had used up all the power of the Golden Cap; but if the Wicked Witch could only get hold of the Silver Shoes, they would give her more power than all the other things she had lost.","Her bees and her crows and her wolves were lying in heaps and drying up, and she had used up all the power of the Golden Cap; but if the Wicked Witch could only get hold of the Silver Shoes, they would give her more power than all the other things she had lost.",5,49.40084710001247,0.05122003331780434,0.3273766040802002,0.6214033365249634,0.08561981469392776,0.2871135175228119,0.6272667050361633,0.06081260368227959,0.31685104966163635,0.6223363280296326,0.03035488724708557,0.5027467012405396,0.46689847111701965,0.20838943123817444,0.5830175280570984,0.20859304070472717,0.2207849770784378,0.3118131458759308,0.46740180253982544
76,the Wicked Witch,274,5707,her,28938,28939,1156,third_person_possessive_pronoun_to_canonical_possessive,True,"Her bees and her crows and her wolves were lying in heaps and drying up, and she had used up all the power of the Golden Cap; but if she could only get hold of the Silver Shoes, they would give [[her]] more power than all the other things she had lost.","Her bees and her crows and her wolves were lying in heaps and drying up, and she had used up all the power of the Golden Cap; but if she could only get hold of the Silver Shoes, they would give the Wicked Witch's more power than all the other things she had lost.","Her bees and her crows and her wolves were lying in heaps and drying up, and she had used up all the power of the Golden Cap; but if she could only get hold of the Silver Shoes, they would give the Wicked Witch's more power than all the other things she had lost.","Her bees and her crows and her wolves were lying in heaps and drying up, and she had used up all the power of the Golden Cap; but if she could only get hold of the Silver Shoes, they would give the Wicked Witch's more power than all the other things she had lost.",5,49.40084710001247,0.06062225252389908,0.33631256222724915,0.6030651926994324,0.10181044042110443,0.255826473236084,0.6423630714416504,0.07546203583478928,0.38220006227493286,0.5423378944396973,0.03692462667822838,0.5142285823822021,0.4488467872142792,0.1743486523628235,0.627508819103241,0.19814254343509674,0.2430313676595688,0.29487451910972595,0.46209412813186646
76,the Wicked Witch,275,5708,she,28946,28947,1156,third_person_subject_pronoun_to_canonical,True,"Her bees and her crows and her wolves were lying in heaps and drying up, and she had used up all the power of the Golden Cap; but if she could only get hold of the Silver Shoes, they would give her more power than all the other things [[she]] had lost.","Her bees and her crows and her wolves were lying in heaps and drying up, and she had used up all the power of the Golden Cap; but if she could only get hold of the Silver Shoes, they would give her more power than all the other things the Wicked Witch had lost.","Her bees and her crows and her wolves were lying in heaps and drying up, and she had used up all the power of the Golden Cap; but if she could only get hold of the Silver Shoes, they would give her more power than all the other things the Wicked Witch had lost.","Her bees and her crows and her wolves were lying in heaps and drying up, and she had used up all the power of the Golden Cap; but if she could only get hold of the Silver Shoes, they would give her more power than all the other things the Wicked Witch had lost.",5,49.40084710001247,0.04121404141187668,0.3236199915409088,0.6351659893989563,0.07147487252950668,0.24038372933864594,0.688141405582428,0.051349494606256485,0.3022819459438324,0.6463686227798462,0.02177577279508114,0.5393486618995667,0.43887561559677124,0.23200659453868866,0.5590060949325562,0.20898734033107758,0.25913941860198975,0.28405365347862244,0.45680689811706543
76,the Wicked Witch,276,5709,She,28950,28951,1157,proper_name_to_canonical,True,"[[She]] watched Dorothy carefully, to see if she ever took off her shoes, thinking she might steal them.","the Wicked Witch watched Dorothy carefully, to see if she ever took off her shoes, thinking she might steal them.","the Wicked Witch watched Dorothy carefully, to see if she ever took off her shoes, thinking she might steal them.","the Wicked Witch watched Dorothy carefully, to see if she ever took off her shoes, thinking she might steal them.",5,49.40084710001247,0.04861350357532501,0.4238708019256592,0.527515709400177,0.5418935418128967,0.2881907820701599,0.16991569101810455,0.026808861643075943,0.4278411567211151,0.5453500151634216,0.011245687492191792,0.46664583683013916,0.5221084356307983,0.43271276354789734,0.2825356125831604,0.2847515642642975,0.5928899645805359,0.3077374994754791,0.09937255829572678
76,the Wicked Witch,277,5719,The Witch,28997,28999,1159,proper_name_to_canonical,True,"[[The Witch]] was too much afraid of the dark to dare go in Dorothy's room at night to take the shoes, and her dread of water was greater than her fear of the dark, so she never came near when Dorothy was bathing.","the Wicked Witch was too much afraid of the dark to dare go in Dorothy's room at night to take the shoes, and her dread of water was greater than her fear of the dark, so she never came near when Dorothy was bathing.","the Wicked Witch was too much afraid of the dark to dare go in Dorothy's room at night to take the shoes, and her dread of water was greater than her fear of the dark, so she never came near when Dorothy was bathing.","the Wicked Witch was too much afraid of the dark to dare go in Dorothy's room at night to take the shoes, and her dread of water was greater than her fear of the dark, so she never came near when Dorothy was bathing.",5,49.40084710001247,0.0050391582772135735,0.2944502532482147,0.7005105018615723,0.025536300614476204,0.07997407019138336,0.8944896459579468,0.009441745467483997,0.4230062663555145,0.5675519704818726,0.03564172238111496,0.6289944052696228,0.33536386489868164,0.7531576156616211,0.0850776731967926,0.1617646962404251,0.38721221685409546,0.5360182523727417,0.07676960527896881
76,the Wicked Witch,278,5722,her,29021,29022,1159,third_person_possessive_pronoun_to_canonical_possessive,True,"The Witch was too much afraid of the dark to dare go in Dorothy's room at night to take the shoes, and [[her]] dread of water was greater than her fear of the dark, so she never came near when Dorothy was bathing.","The Witch was too much afraid of the dark to dare go in Dorothy's room at night to take the shoes, and the Wicked Witch's dread of water was greater than her fear of the dark, so she never came near when Dorothy was bathing.","The Witch was too much afraid of the dark to dare go in Dorothy's room at night to take the shoes, and the Wicked Witch's dread of water was greater than her fear of the dark, so she never came near when Dorothy was bathing.","The Witch was too much afraid of the dark to dare go in Dorothy's room at night to take the shoes, and the Wicked Witch's dread of water was greater than her fear of the dark, so she never came near when Dorothy was bathing.",5,49.40084710001247,0.004736374132335186,0.287501722574234,0.7077619433403015,0.02588801458477974,0.11135957390069962,0.862752377986908,0.010290411300957203,0.43820080161094666,0.5515087842941284,0.029034597799181938,0.6626014113426208,0.30836403369903564,0.7794512510299683,0.06421991437673569,0.15632884204387665,0.3998450040817261,0.5079255104064941,0.09222950786352158
