cluster_id,subject,mention_index_in_cluster,mention_id,mention_text,mention_start,mention_end,sentence_index,mention_render_rule,mention_render_was_changed,original_context_text,rendered_context_text,context_text,normalized_context_text,chunk_index,elapsed_seconds_at_completion,openness_positive_probability,openness_negative_probability,openness_neutral_probability,conscientiousness_positive_probability,conscientiousness_negative_probability,conscientiousness_neutral_probability,extraversion_positive_probability,extraversion_negative_probability,extraversion_neutral_probability,agreeableness_positive_probability,agreeableness_negative_probability,agreeableness_neutral_probability,neuroticism_positive_probability,neuroticism_negative_probability,neuroticism_neutral_probability,OCEAN_weight_high_probability,OCEAN_weight_medium_probability,OCEAN_weight_low_probability
10,the West,0,206,Those who dwelt in the East and the West,2494,2503,112,proper_name_to_canonical,True,"[[Those who dwelt in the East and the West]] were, indeed, wicked witches; but now that you have killed one of them, there is but one Wicked Witch in all the Land of Oz—the one who lives in the West.""","the West were, indeed, wicked witches; but now that you have killed one of them, there is but one Wicked Witch in all the Land of Oz—the one who lives in the West.""","the West were, indeed, wicked witches; but now that you have killed one of them, there is but one Wicked Witch in all the Land of Oz—the one who lives in the West.""","the West were, indeed, wicked witches; but now that you have killed one of them, there is but one Wicked Witch in all the Land of Oz—the one who lives in the West.""",1,11.456428700010292,0.07458285987377167,0.5041124820709229,0.4213046133518219,0.09378605335950851,0.3553301692008972,0.5508838295936584,0.09575221687555313,0.3882564604282379,0.5159913301467896,0.018538128584623337,0.7124825716018677,0.2689792811870575,0.17190057039260864,0.5770066380500793,0.251092791557312,0.21178260445594788,0.36123964190483093,0.42697784304618835
10,the West,1,207,the East and the West,2498,2503,112,proper_name_to_canonical,True,"Those who dwelt in [[the East and the West]] were, indeed, wicked witches; but now that you have killed one of them, there is but one Wicked Witch in all the Land of Oz—the one who lives in the West.""","Those who dwelt in the West were, indeed, wicked witches; but now that you have killed one of them, there is but one Wicked Witch in all the Land of Oz—the one who lives in the West.""","Those who dwelt in the West were, indeed, wicked witches; but now that you have killed one of them, there is but one Wicked Witch in all the Land of Oz—the one who lives in the West.""","Those who dwelt in the West were, indeed, wicked witches; but now that you have killed one of them, there is but one Wicked Witch in all the Land of Oz—the one who lives in the West.""",1,11.456428700010292,0.056576624512672424,0.3437928557395935,0.5996305346488953,0.1004864051938057,0.33271563053131104,0.5667979717254639,0.08727212995290756,0.3533533811569214,0.5593745112419128,0.018833130598068237,0.6534385085105896,0.3277283310890198,0.1702452301979065,0.5736868381500244,0.25606799125671387,0.14991918206214905,0.28869470953941345,0.5613860487937927
10,the West,2,208,the West,2501,2503,112,proper_name_to_canonical,False,"Those who dwelt in the East and [[the West]] were, indeed, wicked witches; but now that you have killed one of them, there is but one Wicked Witch in all the Land of Oz—the one who lives in the West.""","Those who dwelt in the East and the West were, indeed, wicked witches; but now that you have killed one of them, there is but one Wicked Witch in all the Land of Oz—the one who lives in the West.""","Those who dwelt in the East and the West were, indeed, wicked witches; but now that you have killed one of them, there is but one Wicked Witch in all the Land of Oz—the one who lives in the West.""","Those who dwelt in the East and the West were, indeed, wicked witches; but now that you have killed one of them, there is but one Wicked Witch in all the Land of Oz—the one who lives in the West.""",1,11.456428700010292,0.10574506223201752,0.3693569600582123,0.5248979926109314,0.1584562361240387,0.34915557503700256,0.4923882484436035,0.16499538719654083,0.3662370443344116,0.46876752376556396,0.04924019053578377,0.5638337731361389,0.3869260847568512,0.15130957961082458,0.6618480086326599,0.1868423968553543,0.18183423578739166,0.3267767131328583,0.4913890063762665
10,the West,3,212,the one who lives in the West,2533,2540,112,proper_name_to_canonical,True,"Those who dwelt in the East and the West were, indeed, wicked witches; but now that you have killed one of them, there is but one Wicked Witch in all the Land of Oz—[[the one who lives in the West]].""","Those who dwelt in the East and the West were, indeed, wicked witches; but now that you have killed one of them, there is but one Wicked Witch in all the Land of Oz—the West.""","Those who dwelt in the East and the West were, indeed, wicked witches; but now that you have killed one of them, there is but one Wicked Witch in all the Land of Oz—the West.""","Those who dwelt in the East and the West were, indeed, wicked witches; but now that you have killed one of them, there is but one Wicked Witch in all the Land of Oz—the West.""",1,11.456428700010292,0.09627719223499298,0.4526336193084717,0.45108917355537415,0.12916052341461182,0.363479882478714,0.5073596239089966,0.11548855155706406,0.41548430919647217,0.46902716159820557,0.03174961358308792,0.6699458956718445,0.2983045279979706,0.16374337673187256,0.6278457641601562,0.20841084420681,0.15165480971336365,0.2959125339984894,0.552432656288147
10,the West,4,213,the West,2538,2540,112,proper_name_to_canonical,False,"Those who dwelt in the East and the West were, indeed, wicked witches; but now that you have killed one of them, there is but one Wicked Witch in all the Land of Oz—the one who lives in [[the West]].""","Those who dwelt in the East and the West were, indeed, wicked witches; but now that you have killed one of them, there is but one Wicked Witch in all the Land of Oz—the one who lives in the West.""","Those who dwelt in the East and the West were, indeed, wicked witches; but now that you have killed one of them, there is but one Wicked Witch in all the Land of Oz—the one who lives in the West.""","Those who dwelt in the East and the West were, indeed, wicked witches; but now that you have killed one of them, there is but one Wicked Witch in all the Land of Oz—the one who lives in the West.""",1,11.456428700010292,0.10574506223201752,0.3693569600582123,0.5248979926109314,0.1584562361240387,0.34915557503700256,0.4923882484436035,0.16499538719654083,0.3662370443344116,0.46876752376556396,0.04924019053578377,0.5638337731361389,0.3869260847568512,0.15130957961082458,0.6618480086326599,0.1868423968553543,0.18183423578739166,0.3267767131328583,0.4913890063762665
10,the West,5,271,the West,3156,3158,141,proper_name_to_canonical,False,""" ""I am told,"" said the third man, ""that it is the same at [[the West]].",""" ""I am told,"" said the third man, ""that it is the same at the West.",""" ""I am told,"" said the third man, ""that it is the same at the West.",""" ""I am told,"" said the third man, ""that it is the same at the West.",1,11.456428700010292,0.20321254432201385,0.30835282802581787,0.4884345829486847,0.32338666915893555,0.32592302560806274,0.3506902754306793,0.24222905933856964,0.3246840238571167,0.43308693170547485,0.28511351346969604,0.21839073300361633,0.49649572372436523,0.1817859709262848,0.521412193775177,0.29680174589157104,0.13172701001167297,0.43445444107055664,0.4338184893131256
10,the West,6,273,the Wicked Witch of the West,3171,3177,142,proper_name_to_canonical,True,"And that country, where the Winkies live, is ruled by [[the Wicked Witch of the West]], who would make you her slave if you passed her way.""","And that country, where the Winkies live, is ruled by the West, who would make you her slave if you passed her way.""","And that country, where the Winkies live, is ruled by the West, who would make you her slave if you passed her way.""","And that country, where the Winkies live, is ruled by the West, who would make you her slave if you passed her way.""",1,11.456428700010292,0.018016455695033073,0.302280068397522,0.6797034740447998,0.18267562985420227,0.17722828686237335,0.640096127986908,0.07858020067214966,0.34502333402633667,0.5763964056968689,0.004449058789759874,0.829414427280426,0.16613651812076569,0.15260502696037292,0.5546739101409912,0.29272109270095825,0.08928340673446655,0.16096247732639313,0.7497541904449463
10,the West,7,274,the West,3175,3177,142,proper_name_to_canonical,False,"And that country, where the Winkies live, is ruled by the Wicked Witch of [[the West]], who would make you her slave if you passed her way.""","And that country, where the Winkies live, is ruled by the Wicked Witch of the West, who would make you her slave if you passed her way.""","And that country, where the Winkies live, is ruled by the Wicked Witch of the West, who would make you her slave if you passed her way.""","And that country, where the Winkies live, is ruled by the Wicked Witch of the West, who would make you her slave if you passed her way.""",1,11.456428700010292,0.044037826359272,0.4017147719860077,0.5542474389076233,0.07822157442569733,0.2653965651988983,0.6563819050788879,0.08872721344232559,0.31272754073143005,0.5985453128814697,0.005840801168233156,0.8381328582763672,0.15602625906467438,0.1565294712781906,0.4914141595363617,0.3520563244819641,0.12637580931186676,0.1590534746646881,0.7145707011222839
10,the West,8,276,her,3182,3183,142,third_person_possessive_pronoun_to_canonical_possessive,True,"And that country, where the Winkies live, is ruled by the Wicked Witch of the West, who would make you [[her]] slave if you passed her way.""","And that country, where the Winkies live, is ruled by the Wicked Witch of the West, who would make you the West's slave if you passed her way.""","And that country, where the Winkies live, is ruled by the Wicked Witch of the West, who would make you the West's slave if you passed her way.""","And that country, where the Winkies live, is ruled by the Wicked Witch of the West, who would make you the West's slave if you passed her way.""",1,11.456428700010292,0.04178674891591072,0.4044785797595978,0.5537347197532654,0.18938897550106049,0.28126880526542664,0.5293421745300293,0.10637769103050232,0.37787899374961853,0.5157433152198792,0.00858763325959444,0.8409664034843445,0.15044604241847992,0.13482488691806793,0.539528489112854,0.32564660906791687,0.15042676031589508,0.19710567593574524,0.6524676084518433
10,the West,9,278,her,3187,3188,142,third_person_possessive_pronoun_to_canonical_possessive,True,"And that country, where the Winkies live, is ruled by the Wicked Witch of the West, who would make you her slave if you passed [[her]] way.""","And that country, where the Winkies live, is ruled by the Wicked Witch of the West, who would make you her slave if you passed the West's way.""","And that country, where the Winkies live, is ruled by the Wicked Witch of the West, who would make you her slave if you passed the West's way.""","And that country, where the Winkies live, is ruled by the Wicked Witch of the West, who would make you her slave if you passed the West's way.""",1,11.456428700010292,0.03522433713078499,0.3853188753128052,0.5794568657875061,0.13953006267547607,0.28213387727737427,0.5783360600471497,0.10086324065923691,0.39485225081443787,0.5042845010757446,0.006720242090523243,0.8037625551223755,0.18951718509197235,0.15252599120140076,0.5378549098968506,0.30961906909942627,0.12022072821855545,0.22349423170089722,0.6562849879264832
10,the West,10,2162,the country of the Wicked Witch of the West,14831,14840,611,proper_name_to_canonical,True,"""This is bad,"" said the Tin Woodman, ""for if we cannot get to the land we shall be carried into [[the country of the Wicked Witch of the West]], and she will enchant us and make us her slaves.","""This is bad,"" said the Tin Woodman, ""for if we cannot get to the land we shall be carried into the West, and she will enchant us and make us her slaves.","""This is bad,"" said the Tin Woodman, ""for if we cannot get to the land we shall be carried into the West, and she will enchant us and make us her slaves.","""This is bad,"" said the Tin Woodman, ""for if we cannot get to the land we shall be carried into the West, and she will enchant us and make us her slaves.",1,11.456428700010292,0.17522938549518585,0.29245269298553467,0.5323179364204407,0.09613359719514847,0.2643985450267792,0.6394678354263306,0.16375936567783356,0.34650930762290955,0.4897313416004181,0.03561021760106087,0.2985977828502655,0.6657920479774475,0.30852967500686646,0.37838780879974365,0.31308242678642273,0.1245197206735611,0.3308810889720917,0.544599175453186
10,the West,11,2163,the Wicked Witch of the West,14834,14840,611,proper_name_to_canonical,True,"""This is bad,"" said the Tin Woodman, ""for if we cannot get to the land we shall be carried into the country of [[the Wicked Witch of the West]], and she will enchant us and make us her slaves.","""This is bad,"" said the Tin Woodman, ""for if we cannot get to the land we shall be carried into the country of the West, and she will enchant us and make us her slaves.","""This is bad,"" said the Tin Woodman, ""for if we cannot get to the land we shall be carried into the country of the West, and she will enchant us and make us her slaves.","""This is bad,"" said the Tin Woodman, ""for if we cannot get to the land we shall be carried into the country of the West, and she will enchant us and make us her slaves.",1,11.456428700010292,0.14067181944847107,0.28821730613708496,0.5711107850074768,0.11971984058618546,0.2609819173812866,0.6192982196807861,0.1482831835746765,0.33156082034111023,0.5201559662818909,0.03584080934524536,0.3364969789981842,0.6276622414588928,0.2592100203037262,0.4290377199649811,0.3117522895336151,0.12242691218852997,0.31285715103149414,0.5647159218788147
10,the West,12,2164,she,14842,14843,611,third_person_subject_pronoun_to_canonical,True,"""This is bad,"" said the Tin Woodman, ""for if we cannot get to the land we shall be carried into the country of the Wicked Witch of the West, and [[she]] will enchant us and make us her slaves.","""This is bad,"" said the Tin Woodman, ""for if we cannot get to the land we shall be carried into the country of the Wicked Witch of the West, and the West will enchant us and make us her slaves.","""This is bad,"" said the Tin Woodman, ""for if we cannot get to the land we shall be carried into the country of the Wicked Witch of the West, and the West will enchant us and make us her slaves.","""This is bad,"" said the Tin Woodman, ""for if we cannot get to the land we shall be carried into the country of the Wicked Witch of the West, and the West will enchant us and make us her slaves.",1,11.456428700010292,0.0555829256772995,0.4405956566333771,0.5038213729858398,0.10771892964839935,0.286446750164032,0.6058343648910522,0.08492503315210342,0.3536410927772522,0.5614339709281921,0.012043481692671776,0.5715699195861816,0.4163866937160492,0.33539944887161255,0.3615923821926117,0.30300816893577576,0.16767455637454987,0.3426209092140198,0.48970457911491394
10,the West,13,2167,her,14849,14850,611,third_person_possessive_pronoun_to_canonical_possessive,True,"""This is bad,"" said the Tin Woodman, ""for if we cannot get to the land we shall be carried into the country of the Wicked Witch of the West, and she will enchant us and make us [[her]] slaves.","""This is bad,"" said the Tin Woodman, ""for if we cannot get to the land we shall be carried into the country of the Wicked Witch of the West, and she will enchant us and make us the West's slaves.","""This is bad,"" said the Tin Woodman, ""for if we cannot get to the land we shall be carried into the country of the Wicked Witch of the West, and she will enchant us and make us the West's slaves.","""This is bad,"" said the Tin Woodman, ""for if we cannot get to the land we shall be carried into the country of the Wicked Witch of the West, and she will enchant us and make us the West's slaves.",1,11.456428700010292,0.11022403836250305,0.3710668385028839,0.5187090635299683,0.19198907911777496,0.3029274046421051,0.505083441734314,0.12220983952283859,0.3315525949001312,0.546237587928772,0.029332226142287254,0.3969900906085968,0.5736777186393738,0.3683648705482483,0.3323028087615967,0.29933232069015503,0.20046722888946533,0.41032904386520386,0.3892037272453308
10,the West,14,3512,the Wicked Witch of the East,22748,22754,910,proper_name_to_canonical,True,"Then said the voice: ""Where did you get the silver shoes?"" ""I got them from [[the Wicked Witch of the East]], when my house fell on her and killed her,"" she replied.","Then said the voice: ""Where did you get the silver shoes?"" ""I got them from the West, when my house fell on her and killed her,"" she replied.","Then said the voice: ""Where did you get the silver shoes?"" ""I got them from the West, when my house fell on her and killed her,"" she replied.","Then said the voice: ""Where did you get the silver shoes?"" ""I got them from the West, when my house fell on her and killed her,"" she replied.",1,11.456428700010292,0.17482855916023254,0.311133474111557,0.5140379667282104,0.14980272948741913,0.2585832476615906,0.5916140079498291,0.1933208703994751,0.272626131772995,0.5340530276298523,0.2413005530834198,0.2548641860485077,0.5038352608680725,0.2424667477607727,0.48385366797447205,0.2736796438694,0.20319269597530365,0.42147862911224365,0.3753287196159363
10,the West,15,3514,her,22760,22761,910,third_person_object_pronoun_to_canonical,True,"Then said the voice: ""Where did you get the silver shoes?"" ""I got them from the Wicked Witch of the East, when my house fell on [[her]] and killed her,"" she replied.","Then said the voice: ""Where did you get the silver shoes?"" ""I got them from the Wicked Witch of the East, when my house fell on the West and killed her,"" she replied.","Then said the voice: ""Where did you get the silver shoes?"" ""I got them from the Wicked Witch of the East, when my house fell on the West and killed her,"" she replied.","Then said the voice: ""Where did you get the silver shoes?"" ""I got them from the Wicked Witch of the East, when my house fell on the West and killed her,"" she replied.",1,11.456428700010292,0.1886797696352005,0.3658270239830017,0.445493221282959,0.09852629899978638,0.2497597187757492,0.6517139673233032,0.15400704741477966,0.2481538951396942,0.5978390574455261,0.06896326690912247,0.3526266813278198,0.5784100294113159,0.2610774636268616,0.5094206929206848,0.22950179874897003,0.24148409068584442,0.4560241401195526,0.302491694688797
10,the West,16,3515,her,22763,22764,910,third_person_object_pronoun_to_canonical,True,"Then said the voice: ""Where did you get the silver shoes?"" ""I got them from the Wicked Witch of the East, when my house fell on her and killed [[her]],"" she replied.","Then said the voice: ""Where did you get the silver shoes?"" ""I got them from the Wicked Witch of the East, when my house fell on her and killed the West,"" she replied.","Then said the voice: ""Where did you get the silver shoes?"" ""I got them from the Wicked Witch of the East, when my house fell on her and killed the West,"" she replied.","Then said the voice: ""Where did you get the silver shoes?"" ""I got them from the Wicked Witch of the East, when my house fell on her and killed the West,"" she replied.",1,11.456428700010292,0.1572524458169937,0.3567174971103668,0.4860300123691559,0.0688743069767952,0.20957383513450623,0.7215518355369568,0.10992947220802307,0.22888904809951782,0.6611815094947815,0.06040085852146149,0.3769294321537018,0.5626696944236755,0.24712973833084106,0.5154399871826172,0.2374303638935089,0.25089696049690247,0.44206804037094116,0.30703502893447876
10,the West,17,3520,she,22800,22801,912,third_person_subject_pronoun_to_canonical,True,"""That is where the Good Witch of the North kissed me when [[she]] bade me good-bye and sent me to you,"" said the girl.","""That is where the Good Witch of the North kissed me when the West bade me good-bye and sent me to you,"" said the girl.","""That is where the Good Witch of the North kissed me when the West bade me good-bye and sent me to you,"" said the girl.","""That is where the Good Witch of the North kissed me when the West bade me good-bye and sent me to you,"" said the girl.",1,11.456428700010292,0.28128084540367126,0.36436012387275696,0.35435906052589417,0.20685803890228271,0.20206616818904877,0.5910757780075073,0.1933937817811966,0.23327742516994476,0.5733287930488586,0.6336867809295654,0.10395286977291107,0.2623603343963623,0.2082657665014267,0.6219185590744019,0.16981564462184906,0.18624912202358246,0.4961899518966675,0.31756094098091125
10,the West,18,3553,the Wicked Witch of the East,22997,23003,922,proper_name_to_canonical,True,"""But you were strong enough to kill [[the Wicked Witch of the East]],"" said Oz.","""But you were strong enough to kill the West,"" said Oz.","""But you were strong enough to kill the West,"" said Oz.","""But you were strong enough to kill the West,"" said Oz.",1,11.456428700010292,0.11661370098590851,0.3602493703365326,0.5231369733810425,0.20295952260494232,0.2051514983177185,0.591888964176178,0.10780026763677597,0.3262624144554138,0.5659372806549072,0.05937519669532776,0.32192105054855347,0.6187037825584412,0.06319884955883026,0.4401889145374298,0.49661222100257874,0.2998228073120117,0.06094244495034218,0.639234721660614
10,the West,19,3580,the Wicked Witch of the West,23123,23129,929,proper_name_to_canonical,True,"""Kill [[the Wicked Witch of the West]],"" answered Oz.","""Kill the West,"" answered Oz.","""Kill the West,"" answered Oz.","""Kill the West,"" answered Oz.",1,11.456428700010292,0.11204709112644196,0.39646628499031067,0.49148666858673096,0.2295706421136856,0.3870956003665924,0.3833337724208832,0.14372818171977997,0.4528807997703552,0.4033910036087036,0.051608648151159286,0.4384903013706207,0.5099009871482849,0.2864218056201935,0.5374631285667419,0.17611505091190338,0.10305600613355637,0.2693376839160919,0.6276063919067383
10,the West,20,3585,the Witch of the East,23152,23157,931,proper_name_to_canonical,True,"""You killed [[the Witch of the East]] and you wear the silver shoes, which bear a powerful charm.","""You killed the West and you wear the silver shoes, which bear a powerful charm.","""You killed the West and you wear the silver shoes, which bear a powerful charm.","""You killed the West and you wear the silver shoes, which bear a powerful charm.",1,11.456428700010292,0.2376628965139389,0.37316665053367615,0.38917040824890137,0.29154494404792786,0.2402871698141098,0.46816790103912354,0.23100130259990692,0.3929464817047119,0.37605226039886475,0.16111092269420624,0.23441502451896667,0.6044740676879883,0.23288604617118835,0.48065927624702454,0.2864547371864319,0.33323022723197937,0.11803625524044037,0.5487335324287415
10,the West,21,3590,she,23189,23190,932,third_person_subject_pronoun_to_canonical,True,"There is now but one Wicked Witch left in all this land, and when you can tell me [[she]] is dead I will send you back to Kansas—but not before.""","There is now but one Wicked Witch left in all this land, and when you can tell me the West is dead I will send you back to Kansas—but not before.""","There is now but one Wicked Witch left in all this land, and when you can tell me the West is dead I will send you back to Kansas—but not before.""","There is now but one Wicked Witch left in all this land, and when you can tell me the West is dead I will send you back to Kansas—but not before.""",1,11.456428700010292,0.15016929805278778,0.4756086766719818,0.3742220401763916,0.39146310091018677,0.25053587555885315,0.3580009937286377,0.19641561806201935,0.4081677496433258,0.39541661739349365,0.031023139134049416,0.8311574459075928,0.13781940937042236,0.20196856558322906,0.6446816325187683,0.15334978699684143,0.2775576710700989,0.20186686515808105,0.5205755233764648
10,the West,22,3605,the Wicked Witch,23269,23272,935,proper_name_to_canonical,True,"""Even if I wanted to, how could I kill [[the Wicked Witch]]?","""Even if I wanted to, how could I kill the West?","""Even if I wanted to, how could I kill the West?","""Even if I wanted to, how could I kill the West?",1,11.456428700010292,0.37640470266342163,0.29400435090065,0.32959097623825073,0.4843282699584961,0.23835913836956024,0.277312695980072,0.42313849925994873,0.3350571393966675,0.24180443584918976,0.3837589621543884,0.28574299812316895,0.33049798011779785,0.22013092041015625,0.5813854336738586,0.1984836906194687,0.13780845701694489,0.34350264072418213,0.5186888575553894
