cluster_id,subject,mention_index_in_cluster,mention_id,mention_text,mention_start,mention_end,sentence_index,mention_render_rule,mention_render_was_changed,original_context_text,rendered_context_text,context_text,normalized_context_text,chunk_index,elapsed_seconds_at_completion,openness_positive_probability,openness_negative_probability,openness_neutral_probability,conscientiousness_positive_probability,conscientiousness_negative_probability,conscientiousness_neutral_probability,extraversion_positive_probability,extraversion_negative_probability,extraversion_neutral_probability,agreeableness_positive_probability,agreeableness_negative_probability,agreeableness_neutral_probability,neuroticism_positive_probability,neuroticism_negative_probability,neuroticism_neutral_probability,OCEAN_weight_high_probability,OCEAN_weight_medium_probability,OCEAN_weight_low_probability
10,the West,23,3607,her,23285,23286,936,third_person_possessive_pronoun_to_canonical_possessive,True,"If you, who are Great and Terrible, cannot kill [[her]] yourself, how do you expect me to do it?"" ""I do not know,"" said the Head; ""but that is my answer, and until the Wicked Witch dies you will not see your uncle and aunt again.","If you, who are Great and Terrible, cannot kill the West's yourself, how do you expect me to do it?"" ""I do not know,"" said the Head; ""but that is my answer, and until the Wicked Witch dies you will not see your uncle and aunt again.","If you, who are Great and Terrible, cannot kill the West's yourself, how do you expect me to do it?"" ""I do not know,"" said the Head; ""but that is my answer, and until the Wicked Witch dies you will not see your uncle and aunt again.","If you, who are Great and Terrible, cannot kill the West's yourself, how do you expect me to do it?"" ""I do not know,"" said the Head; ""but that is my answer, and until the Wicked Witch dies you will not see your uncle and aunt again.",1,11.456428700010292,0.03991422429680824,0.2790282070636749,0.6810575723648071,0.2166171818971634,0.19181852042675018,0.5915642976760864,0.10215387493371964,0.36181342601776123,0.5360326766967773,0.027704311534762383,0.8088483810424805,0.1634472757577896,0.23081423342227936,0.5459094047546387,0.2232763171195984,0.23789699375629425,0.19847941398620605,0.5636235475540161
10,the West,24,3617,the Wicked Witch,23319,23322,936,proper_name_to_canonical,True,"If you, who are Great and Terrible, cannot kill her yourself, how do you expect me to do it?"" ""I do not know,"" said the Head; ""but that is my answer, and until [[the Wicked Witch]] dies you will not see your uncle and aunt again.","If you, who are Great and Terrible, cannot kill her yourself, how do you expect me to do it?"" ""I do not know,"" said the Head; ""but that is my answer, and until the West dies you will not see your uncle and aunt again.","If you, who are Great and Terrible, cannot kill her yourself, how do you expect me to do it?"" ""I do not know,"" said the Head; ""but that is my answer, and until the West dies you will not see your uncle and aunt again.","If you, who are Great and Terrible, cannot kill her yourself, how do you expect me to do it?"" ""I do not know,"" said the Head; ""but that is my answer, and until the West dies you will not see your uncle and aunt again.",1,11.456428700010292,0.03830355033278465,0.23754845559597015,0.7241479158401489,0.19252130389213562,0.19205184280872345,0.6154268980026245,0.07860861718654633,0.34777018427848816,0.5736211538314819,0.02168852649629116,0.8162438273429871,0.16206765174865723,0.2829555869102478,0.5314776301383972,0.18556681275367737,0.2507988512516022,0.17763419449329376,0.5715669989585876
10,the West,25,3621,the Witch,23335,23337,937,proper_name_to_canonical,True,Remember that [[the Witch]] is Wicked—tremendously Wicked—and ought to be killed.,Remember that the West is Wicked—tremendously Wicked—and ought to be killed.,Remember that the West is Wicked—tremendously Wicked—and ought to be killed.,Remember that the West is Wicked—tremendously Wicked—and ought to be killed.,1,11.456428700010292,0.09161029756069183,0.493791788816452,0.4145979583263397,0.03972978517413139,0.299355685710907,0.6609145998954773,0.2075774222612381,0.3064801096916199,0.4859425127506256,0.016929037868976593,0.6154121160507202,0.3676588237285614,0.10814622044563293,0.34638354182243347,0.5454702377319336,0.7197513580322266,0.07792612910270691,0.20232246816158295
10,the West,26,3639,the Wicked Witch of the West,23424,23430,940,proper_name_to_canonical,True,"""There is no hope for me,"" she said sadly, ""for Oz will not send me home until I have killed [[the Wicked Witch of the West]]; and that I can never do.","""There is no hope for me,"" she said sadly, ""for Oz will not send me home until I have killed the West; and that I can never do.","""There is no hope for me,"" she said sadly, ""for Oz will not send me home until I have killed the West; and that I can never do.","""There is no hope for me,"" she said sadly, ""for Oz will not send me home until I have killed the West; and that I can never do.",1,11.456428700010292,0.07456469535827637,0.27274632453918457,0.6526889801025391,0.19083818793296814,0.14906099438667297,0.6601008772850037,0.043929532170295715,0.22135645151138306,0.7347140312194824,0.08206881582736969,0.39421406388282776,0.5237171053886414,0.6123323440551758,0.30640026926994324,0.08126731961965561,0.18283280730247498,0.33464300632476807,0.48252421617507935
10,the West,27,3663,a most lovely Lady,23528,23532,943,proper_name_to_canonical,True,""" So the Scarecrow followed him and was admitted into the great Throne Room, where he saw, sitting in the emerald throne, [[a most lovely Lady]].",""" So the Scarecrow followed him and was admitted into the great Throne Room, where he saw, sitting in the emerald throne, the West.",""" So the Scarecrow followed him and was admitted into the great Throne Room, where he saw, sitting in the emerald throne, the West.",""" So the Scarecrow followed him and was admitted into the great Throne Room, where he saw, sitting in the emerald throne, the West.",1,11.456428700010292,0.20860867202281952,0.3639806807041168,0.42741066217422485,0.342721551656723,0.32591134309768677,0.3313671350479126,0.17865809798240662,0.3236660361289978,0.49767589569091797,0.27257293462753296,0.191404789686203,0.5360222458839417,0.2047950178384781,0.5953492522239685,0.19985567033290863,0.12384326756000519,0.24105675518512726,0.6350999474525452
10,the West,28,3665,She,23533,23534,944,proper_name_to_canonical,True,[[She]] was dressed in green silk gauze and wore upon her flowing green locks a crown of jewels.,the West was dressed in green silk gauze and wore upon her flowing green locks a crown of jewels.,the West was dressed in green silk gauze and wore upon her flowing green locks a crown of jewels.,the West was dressed in green silk gauze and wore upon her flowing green locks a crown of jewels.,1,11.456428700010292,0.39897269010543823,0.36898940801620483,0.23203790187835693,0.26768070459365845,0.319746732711792,0.4125725328922272,0.3215053677558899,0.30261680483818054,0.37587785720825195,0.4081343412399292,0.18093173205852509,0.41093388199806213,0.10160858184099197,0.7380696535110474,0.16032174229621887,0.07914084196090698,0.31840336322784424,0.6024557948112488
10,the West,29,3667,her,23543,23544,944,third_person_possessive_pronoun_to_canonical_possessive,True,She was dressed in green silk gauze and wore upon [[her]] flowing green locks a crown of jewels.,She was dressed in green silk gauze and wore upon the West's flowing green locks a crown of jewels.,She was dressed in green silk gauze and wore upon the West's flowing green locks a crown of jewels.,She was dressed in green silk gauze and wore upon the West's flowing green locks a crown of jewels.,1,11.456428700010292,0.3688492774963379,0.3713793456554413,0.2597714364528656,0.2166534662246704,0.33003464341163635,0.45331189036369324,0.29206937551498413,0.3398004472255707,0.3681302070617676,0.3735474944114685,0.16382953524589539,0.4626229703426361,0.13045306503772736,0.660879909992218,0.2086670845746994,0.11424840986728668,0.35371872782707214,0.53203284740448
10,the West,30,3669,her,23554,23555,945,third_person_possessive_pronoun_to_canonical_possessive,True,"Growing from [[her]] shoulders were wings, gorgeous in color and so light that they fluttered if the slightest breath of air reached them.","Growing from the West's shoulders were wings, gorgeous in color and so light that they fluttered if the slightest breath of air reached them.","Growing from the West's shoulders were wings, gorgeous in color and so light that they fluttered if the slightest breath of air reached them.","Growing from the West's shoulders were wings, gorgeous in color and so light that they fluttered if the slightest breath of air reached them.",1,11.456428700010292,0.694682776927948,0.14848537743091583,0.15683181583881378,0.12486561387777328,0.227875754237175,0.6472585797309875,0.4021899402141571,0.22146061062812805,0.3763495087623596,0.29378804564476013,0.07199585437774658,0.6342161297798157,0.044715143740177155,0.539448082447052,0.41583672165870667,0.020865587517619133,0.3048262596130371,0.674308180809021
10,the West,31,3674,this beautiful creature,23595,23598,946,ambiguous_or_unsupported_keep_original,False,"When the Scarecrow had bowed, as prettily as his straw stuffing would let him, before [[this beautiful creature]], she looked upon him sweetly, and said: ""I am Oz, the Great and Terrible.","When the Scarecrow had bowed, as prettily as his straw stuffing would let him, before this beautiful creature, she looked upon him sweetly, and said: ""I am Oz, the Great and Terrible.","When the Scarecrow had bowed, as prettily as his straw stuffing would let him, before this beautiful creature, she looked upon him sweetly, and said: ""I am Oz, the Great and Terrible.","When the Scarecrow had bowed, as prettily as his straw stuffing would let him, before this beautiful creature, she looked upon him sweetly, and said: ""I am Oz, the Great and Terrible.",1,11.456428700010292,0.40618765354156494,0.36839619278907776,0.22541610896587372,0.1686791181564331,0.2539602816104889,0.5773605704307556,0.38335031270980835,0.21588167548179626,0.4007680416107178,0.6239297986030579,0.19262492656707764,0.18344534933567047,0.17119455337524414,0.5876179933547974,0.24118737876415253,0.22130028903484344,0.41137930750846863,0.36732038855552673
10,the West,32,3676,she,23599,23600,946,third_person_subject_pronoun_to_canonical,True,"When the Scarecrow had bowed, as prettily as his straw stuffing would let him, before this beautiful creature, [[she]] looked upon him sweetly, and said: ""I am Oz, the Great and Terrible.","When the Scarecrow had bowed, as prettily as his straw stuffing would let him, before this beautiful creature, the West looked upon him sweetly, and said: ""I am Oz, the Great and Terrible.","When the Scarecrow had bowed, as prettily as his straw stuffing would let him, before this beautiful creature, the West looked upon him sweetly, and said: ""I am Oz, the Great and Terrible.","When the Scarecrow had bowed, as prettily as his straw stuffing would let him, before this beautiful creature, the West looked upon him sweetly, and said: ""I am Oz, the Great and Terrible.",1,11.456428700010292,0.4035787284374237,0.3357240557670593,0.26069727540016174,0.09257578104734421,0.25374460220336914,0.653679609298706,0.5654796361923218,0.1180112287402153,0.31650909781455994,0.6986177563667297,0.19137653708457947,0.11000567674636841,0.07165829837322235,0.7437855005264282,0.18455617129802704,0.24104638397693634,0.49215587973594666,0.2667977511882782
10,the West,33,3693,her,23657,23658,947,third_person_possessive_pronoun_to_canonical_possessive,True,"Who are you, and why do you seek me?"" Now the Scarecrow, who had expected to see the great Head Dorothy had told him of, was much astonished; but he answered [[her]] bravely.","Who are you, and why do you seek me?"" Now the Scarecrow, who had expected to see the great Head Dorothy had told him of, was much astonished; but he answered the West's bravely.","Who are you, and why do you seek me?"" Now the Scarecrow, who had expected to see the great Head Dorothy had told him of, was much astonished; but he answered the West's bravely.","Who are you, and why do you seek me?"" Now the Scarecrow, who had expected to see the great Head Dorothy had told him of, was much astonished; but he answered the West's bravely.",1,11.456428700010292,0.6266169548034668,0.10812146961688995,0.26526153087615967,0.3820148706436157,0.2195870280265808,0.39839810132980347,0.4571479260921478,0.21083614230155945,0.33201587200164795,0.3235413730144501,0.06569933146238327,0.6107593178749084,0.05709649622440338,0.49686431884765625,0.44603919982910156,0.3446751832962036,0.15954704582691193,0.49577781558036804
10,the West,34,3716,I,23717,23718,949,first_second_person_keep_original,False,"Therefore I have no brains, and I come to you praying that you will put brains in my head instead of straw, so that I may become as much a man as any other in your dominions."" ""Why should [[I]] do this for you?"" asked the Lady.","Therefore I have no brains, and I come to you praying that you will put brains in my head instead of straw, so that I may become as much a man as any other in your dominions."" ""Why should I do this for you?"" asked the Lady.","Therefore I have no brains, and I come to you praying that you will put brains in my head instead of straw, so that I may become as much a man as any other in your dominions."" ""Why should I do this for you?"" asked the Lady.","Therefore I have no brains, and I come to you praying that you will put brains in my head instead of straw, so that I may become as much a man as any other in your dominions."" ""Why should I do this for you?"" asked the Lady.",1,11.456428700010292,0.04916321113705635,0.13896305859088898,0.811873733997345,0.031237874180078506,0.06384606659412384,0.9049160480499268,0.03693274408578873,0.2551153302192688,0.7079519033432007,0.10017113387584686,0.3556581437587738,0.5441706776618958,0.18129442632198334,0.4101523160934448,0.4085533022880554,0.10949891805648804,0.441119909286499,0.44938117265701294
10,the West,35,3721,the Lady,23725,23727,949,proper_name_to_canonical,True,"Therefore I have no brains, and I come to you praying that you will put brains in my head instead of straw, so that I may become as much a man as any other in your dominions."" ""Why should I do this for you?"" asked [[the Lady]].","Therefore I have no brains, and I come to you praying that you will put brains in my head instead of straw, so that I may become as much a man as any other in your dominions."" ""Why should I do this for you?"" asked the West.","Therefore I have no brains, and I come to you praying that you will put brains in my head instead of straw, so that I may become as much a man as any other in your dominions."" ""Why should I do this for you?"" asked the West.","Therefore I have no brains, and I come to you praying that you will put brains in my head instead of straw, so that I may become as much a man as any other in your dominions."" ""Why should I do this for you?"" asked the West.",1,11.456428700010292,0.03760521486401558,0.13202643394470215,0.8303682804107666,0.026111021637916565,0.04984119534492493,0.9240477681159973,0.01561755035072565,0.2564616799354553,0.7279207110404968,0.053865689784288406,0.3590517044067383,0.5870826840400696,0.20772360265254974,0.46834099292755127,0.32393544912338257,0.08083663135766983,0.4871503412723541,0.43201297521591187
10,the West,36,3737,the Wicked Witch of the West,23778,23784,952,proper_name_to_canonical,True,"If you will kill for me [[the Wicked Witch of the West]], I will bestow upon you a great many brains, and such good brains that you will be the wisest man in all the Land of Oz."" ""I thought you asked Dorothy to kill the Witch,"" said the Scarecrow, in surprise.","If you will kill for me the West, I will bestow upon you a great many brains, and such good brains that you will be the wisest man in all the Land of Oz."" ""I thought you asked Dorothy to kill the Witch,"" said the Scarecrow, in surprise.","If you will kill for me the West, I will bestow upon you a great many brains, and such good brains that you will be the wisest man in all the Land of Oz."" ""I thought you asked Dorothy to kill the Witch,"" said the Scarecrow, in surprise.","If you will kill for me the West, I will bestow upon you a great many brains, and such good brains that you will be the wisest man in all the Land of Oz."" ""I thought you asked Dorothy to kill the Witch,"" said the Scarecrow, in surprise.",1,11.456428700010292,0.061905935406684875,0.2957696318626404,0.6423244476318359,0.10154164582490921,0.20977908372879028,0.6886792778968811,0.05596642941236496,0.2967722415924072,0.6472613215446472,0.022389179095625877,0.4439714848995209,0.5336393713951111,0.19234682619571686,0.4177716076374054,0.38988161087036133,0.08596121519804001,0.28503918647766113,0.6289995908737183
10,the West,37,3751,the Witch,23823,23825,952,proper_name_to_canonical,True,"If you will kill for me the Wicked Witch of the West, I will bestow upon you a great many brains, and such good brains that you will be the wisest man in all the Land of Oz."" ""I thought you asked Dorothy to kill [[the Witch]],"" said the Scarecrow, in surprise.","If you will kill for me the Wicked Witch of the West, I will bestow upon you a great many brains, and such good brains that you will be the wisest man in all the Land of Oz."" ""I thought you asked Dorothy to kill the West,"" said the Scarecrow, in surprise.","If you will kill for me the Wicked Witch of the West, I will bestow upon you a great many brains, and such good brains that you will be the wisest man in all the Land of Oz."" ""I thought you asked Dorothy to kill the West,"" said the Scarecrow, in surprise.","If you will kill for me the Wicked Witch of the West, I will bestow upon you a great many brains, and such good brains that you will be the wisest man in all the Land of Oz."" ""I thought you asked Dorothy to kill the West,"" said the Scarecrow, in surprise.",1,11.456428700010292,0.053715869784355164,0.26582270860671997,0.6804613471031189,0.0912245512008667,0.17887082695960999,0.7299046516418457,0.05898040905594826,0.2143762707710266,0.7266433835029602,0.030846351757645607,0.3267921209335327,0.6423615217208862,0.18599987030029297,0.3613360524177551,0.4526640474796295,0.11587344855070114,0.2737233340740204,0.6104032397270203
10,the West,38,3757,her,23846,23847,954,third_person_object_pronoun_to_canonical,True,I don't care who kills [[her]].,I don't care who kills the West.,I don't care who kills the West.,I don't care who kills the West.,1,11.456428700010292,0.18799084424972534,0.44964733719825745,0.3623618185520172,0.30628713965415955,0.3959781527519226,0.29773467779159546,0.2284313142299652,0.4596449136734009,0.3119238018989563,0.100748710334301,0.40237924456596375,0.49687203764915466,0.24595598876476288,0.49878934025764465,0.25525471568107605,0.08982356637716293,0.2173246294260025,0.6928517818450928
10,the West,39,3758,she,23850,23851,955,third_person_subject_pronoun_to_canonical,True,But until [[she]] is dead I will not grant your wish.,But until the West is dead I will not grant your wish.,But until the West is dead I will not grant your wish.,But until the West is dead I will not grant your wish.,1,11.456428700010292,0.1887349933385849,0.4744797348976135,0.3367852568626404,0.3348080813884735,0.3876263201236725,0.2775656282901764,0.2565036416053772,0.4359014928340912,0.30759483575820923,0.13355234265327454,0.40976640582084656,0.4566812515258789,0.23073428869247437,0.6011150479316711,0.16815069317817688,0.11046014726161957,0.2998589277267456,0.5896809101104736
10,the West,40,3779,a lovely Lady,23920,23923,957,proper_name_to_canonical,True,""" The Scarecrow went sorrowfully back to his friends and told them what Oz had said; and Dorothy was surprised to find that the Great Wizard was not a Head, as she had seen him, but [[a lovely Lady]].",""" The Scarecrow went sorrowfully back to his friends and told them what Oz had said; and Dorothy was surprised to find that the Great Wizard was not a Head, as she had seen him, but the West.",""" The Scarecrow went sorrowfully back to his friends and told them what Oz had said; and Dorothy was surprised to find that the Great Wizard was not a Head, as she had seen him, but the West.",""" The Scarecrow went sorrowfully back to his friends and told them what Oz had said; and Dorothy was surprised to find that the Great Wizard was not a Head, as she had seen him, but the West.",1,11.456428700010292,0.2796148657798767,0.42677831649780273,0.2936067581176758,0.2222270965576172,0.3911650478839874,0.3866078555583954,0.18618299067020416,0.3570418953895569,0.456775039434433,0.2968624532222748,0.22805732488632202,0.4750802516937256,0.22401772439479828,0.6221675872802734,0.15381468832492828,0.10816707462072372,0.35010653734207153,0.5417263507843018
10,the West,41,3781,she,23936,23937,958,third_person_subject_pronoun_to_canonical,True,"""All the same,"" said the Scarecrow, "" [[she]] needs a heart as much as the Tin Woodman.","""All the same,"" said the Scarecrow, "" the West needs a heart as much as the Tin Woodman.","""All the same,"" said the Scarecrow, "" the West needs a heart as much as the Tin Woodman.","""All the same,"" said the Scarecrow, "" the West needs a heart as much as the Tin Woodman.",1,11.456428700010292,0.10203063488006592,0.5173958539962769,0.3805735111236572,0.11246118694543839,0.41866087913513184,0.4688779413700104,0.0979551151394844,0.5102495551109314,0.39179539680480957,0.08471429347991943,0.3115408718585968,0.6037448048591614,0.31538569927215576,0.4200683534145355,0.2645459771156311,0.12955933809280396,0.45709043741226196,0.41335025429725647
10,the West,42,3799,the lovely Lady,24016,24019,962,proper_name_to_canonical,True,"He did not know whether he would find Oz a lovely Lady or a Head, but he hoped it would be [[the lovely Lady]].","He did not know whether he would find Oz a lovely Lady or a Head, but he hoped it would be the West.","He did not know whether he would find Oz a lovely Lady or a Head, but he hoped it would be the West.","He did not know whether he would find Oz a lovely Lady or a Head, but he hoped it would be the West.",1,11.456428700010292,0.4576359689235687,0.17643438279628754,0.3659296929836273,0.3214821219444275,0.32022878527641296,0.3582891523838043,0.44591665267944336,0.24565808475017548,0.30842530727386475,0.6210389137268066,0.0700196921825409,0.3089413642883301,0.14143308997154236,0.6354085803031921,0.2231583297252655,0.11502569913864136,0.4068071246147156,0.4781671166419983
10,the West,43,3806,the lovely Lady,24068,24071,964,proper_name_to_canonical,True,"But if it is [[the lovely Lady]] I shall beg hard for a heart, for all ladies are themselves said to be kindly hearted.","But if it is the West I shall beg hard for a heart, for all ladies are themselves said to be kindly hearted.","But if it is the West I shall beg hard for a heart, for all ladies are themselves said to be kindly hearted.","But if it is the West I shall beg hard for a heart, for all ladies are themselves said to be kindly hearted.",1,11.456428700010292,0.15709300339221954,0.46899306774139404,0.37391388416290283,0.12337613105773926,0.29828524589538574,0.578338623046875,0.19468609988689423,0.4562089741230011,0.34910503029823303,0.4476599097251892,0.2264203280210495,0.3259196877479553,0.19454924762248993,0.40587159991264343,0.39957913756370544,0.08842086791992188,0.5466918349266052,0.3648872673511505
10,the West,44,3812,the Lady,24107,24109,965,proper_name_to_canonical,True,""" But when the Woodman entered the great Throne Room he saw neither the Head nor [[the Lady]], for Oz had taken the shape of a most terrible Beast.",""" But when the Woodman entered the great Throne Room he saw neither the Head nor the West, for Oz had taken the shape of a most terrible Beast.",""" But when the Woodman entered the great Throne Room he saw neither the Head nor the West, for Oz had taken the shape of a most terrible Beast.",""" But when the Woodman entered the great Throne Room he saw neither the Head nor the West, for Oz had taken the shape of a most terrible Beast.",1,11.456428700010292,0.10062578320503235,0.2276512086391449,0.671722948551178,0.1512264907360077,0.26308825612068176,0.5856852531433105,0.07135967165231705,0.35376185178756714,0.574878454208374,0.09653989225625992,0.19886226952075958,0.7045978307723999,0.169950470328331,0.5338091254234314,0.29624035954475403,0.11211220920085907,0.3592616617679596,0.5286261439323425
10,the West,45,3856,the Wicked Witch of the West,24405,24411,979,proper_name_to_canonical,True,"""Help Dorothy to kill [[the Wicked Witch of the West]],"" replied the Beast.","""Help Dorothy to kill the West,"" replied the Beast.","""Help Dorothy to kill the West,"" replied the Beast.","""Help Dorothy to kill the West,"" replied the Beast.",1,11.456428700010292,0.13513191044330597,0.3481176197528839,0.5167503952980042,0.16898508369922638,0.3225618004798889,0.5084530711174011,0.12755316495895386,0.39059603214263916,0.48185092210769653,0.04699818417429924,0.40639907121658325,0.546602725982666,0.23424170911312103,0.5671539902687073,0.19860431551933289,0.14463652670383453,0.31560683250427246,0.5397566556930542
