cluster_id,subject,mention_index_in_cluster,mention_id,mention_text,mention_start,mention_end,sentence_index,mention_render_rule,mention_render_was_changed,original_context_text,rendered_context_text,context_text,normalized_context_text,chunk_index,elapsed_seconds_at_completion,openness_positive_probability,openness_negative_probability,openness_neutral_probability,conscientiousness_positive_probability,conscientiousness_negative_probability,conscientiousness_neutral_probability,extraversion_positive_probability,extraversion_negative_probability,extraversion_neutral_probability,agreeableness_positive_probability,agreeableness_negative_probability,agreeableness_neutral_probability,neuroticism_positive_probability,neuroticism_negative_probability,neuroticism_neutral_probability,OCEAN_weight_high_probability,OCEAN_weight_medium_probability,OCEAN_weight_low_probability
201,the Princess,25,8550,her,43305,43306,1757,third_person_possessive_pronoun_to_canonical_possessive,True,"As she left them the milkmaid cast many reproachful glances over her shoulder at the clumsy strangers, holding her nicked elbow close to [[her]] side.","As she left them the milkmaid cast many reproachful glances over her shoulder at the clumsy strangers, holding her nicked elbow close to the Princess' side.","As she left them the milkmaid cast many reproachful glances over her shoulder at the clumsy strangers, holding her nicked elbow close to the Princess' side.","As she left them the milkmaid cast many reproachful glances over her shoulder at the clumsy strangers, holding her nicked elbow close to the Princess' side.",1,8.40667910000775,0.07187487930059433,0.3827148675918579,0.5454102158546448,0.44379904866218567,0.35021787881851196,0.2059830278158188,0.07188275456428528,0.5036158561706543,0.4245014190673828,0.10781671106815338,0.557316243648529,0.3348669707775116,0.5404642820358276,0.37510058283805847,0.08443509787321091,0.3651498258113861,0.39967021346092224,0.23517996072769165
201,the Princess,26,8558,a most beautifully dressed young Princess,43359,43365,1760,proper_name_to_canonical,True,""" A little farther on Dorothy met [[a most beautifully dressed young Princess]], who stopped short as she saw the strangers and started to run away.",""" A little farther on Dorothy met the Princess, who stopped short as she saw the strangers and started to run away.",""" A little farther on Dorothy met the Princess, who stopped short as she saw the strangers and started to run away.",""" A little farther on Dorothy met the Princess, who stopped short as she saw the strangers and started to run away.",1,8.40667910000775,0.015162317082285881,0.4972274601459503,0.48761019110679626,0.031378209590911865,0.30780473351478577,0.66081702709198,0.020261988043785095,0.5097112059593201,0.47002676129341125,0.013807013630867004,0.18842539191246033,0.7977676391601562,0.9315923452377319,0.0272861085832119,0.04112162068486214,0.21062074601650238,0.4997324049472809,0.2896469235420227
201,the Princess,27,8559,she,43370,43371,1760,third_person_subject_pronoun_to_canonical,True,""" A little farther on Dorothy met a most beautifully dressed young Princess, who stopped short as [[she]] saw the strangers and started to run away.",""" A little farther on Dorothy met a most beautifully dressed young Princess, who stopped short as the Princess saw the strangers and started to run away.",""" A little farther on Dorothy met a most beautifully dressed young Princess, who stopped short as the Princess saw the strangers and started to run away.",""" A little farther on Dorothy met a most beautifully dressed young Princess, who stopped short as the Princess saw the strangers and started to run away.",1,8.40667910000775,0.014850638806819916,0.5204446315765381,0.4647047519683838,0.020176898688077927,0.24598504602909088,0.7338380217552185,0.02458271197974682,0.4799697697162628,0.4954475164413452,0.013766927644610405,0.08310632407665253,0.9031267762184143,0.9235022664070129,0.035081200301647186,0.04141657054424286,0.17020055651664734,0.4523773193359375,0.37742212414741516
201,the Princess,28,8562,the Princess,43387,43389,1761,proper_name_to_canonical,False,"Dorothy wanted to see more of [[the Princess]], so she ran after her.","Dorothy wanted to see more of the Princess, so she ran after her.","Dorothy wanted to see more of the Princess, so she ran after her.","Dorothy wanted to see more of the Princess, so she ran after her.",1,8.40667910000775,0.1344250738620758,0.42284390330314636,0.4427310824394226,0.1238190084695816,0.29057109355926514,0.5856099128723145,0.29886993765830994,0.2948116362094879,0.4063185155391693,0.2889793813228607,0.20926500856876373,0.5017555952072144,0.13304398953914642,0.5786226391792297,0.28833335638046265,0.1987597942352295,0.3385276794433594,0.46271246671676636
201,the Princess,29,8564,her,43394,43395,1761,third_person_object_pronoun_to_canonical,True,"Dorothy wanted to see more of the Princess, so she ran after [[her]].","Dorothy wanted to see more of the Princess, so she ran after the Princess.","Dorothy wanted to see more of the Princess, so she ran after the Princess.","Dorothy wanted to see more of the Princess, so she ran after the Princess.",1,8.40667910000775,0.11221577227115631,0.42175349593162537,0.4660307765007019,0.10991428792476654,0.2735055685043335,0.616580069065094,0.3156643509864807,0.2921557128429413,0.39217984676361084,0.2538659870624542,0.18967321515083313,0.5564607381820679,0.11910233646631241,0.6107872724533081,0.2701103985309601,0.1945093274116516,0.3632471263408661,0.4422435462474823
201,the Princess,30,8565,the china girl,43397,43400,1762,simple_nominal_to_canonical,True,"But [[the china girl]] cried out: ""Don't chase me!","But the Princess cried out: ""Don't chase me!","But the Princess cried out: ""Don't chase me!","But the Princess cried out: ""Don't chase me!",1,8.40667910000775,0.0898788794875145,0.5870863795280457,0.32303473353385925,0.15804407000541687,0.3654058873653412,0.47655001282691956,0.5717059969902039,0.34667256474494934,0.08162141591310501,0.026280149817466736,0.7520612478256226,0.22165854275226593,0.8971545100212097,0.05771838501095772,0.045127056539058685,0.3679148852825165,0.3686341643333435,0.2634509801864624
201,the Princess,31,8566,me,43408,43409,1762,first_second_person_keep_original,False,"But the china girl cried out: ""Don't chase [[me]]!","But the china girl cried out: ""Don't chase me!","But the china girl cried out: ""Don't chase me!","But the china girl cried out: ""Don't chase me!",1,8.40667910000775,0.1832352727651596,0.45306897163391113,0.36369580030441284,0.17056122422218323,0.38530516624450684,0.4441336393356323,0.385474294424057,0.4139575958251953,0.20056816935539246,0.15051962435245514,0.5094500184059143,0.34003034234046936,0.8056004047393799,0.13775469362735748,0.05664494261145592,0.2305171638727188,0.47394415736198425,0.29553860425949097
201,the Princess,32,8567,me,43413,43414,1763,first_second_person_keep_original,False,"Don't chase [[me]]!""","Don't chase me!""","Don't chase me!""","Don't chase me!""",1,8.40667910000775,0.2178972214460373,0.5197813510894775,0.2623213827610016,0.224772647023201,0.44898250699043274,0.3262448012828827,0.5702560544013977,0.2963147759437561,0.1334291696548462,0.0781063362956047,0.7785145044326782,0.14337922632694244,0.6137913465499878,0.29742667078971863,0.08878195285797119,0.31867003440856934,0.35811543464660645,0.3232145309448242
201,the Princess,33,8568,She,43417,43418,1764,proper_name_to_canonical,True,"[[She]] had such a frightened little voice that Dorothy stopped and said, ""Why not?"" ""Because,"" answered the Princess, also stopping, a safe distance away, ""if I run I may fall down and break myself.","the Princess had such a frightened little voice that Dorothy stopped and said, ""Why not?"" ""Because,"" answered the Princess, also stopping, a safe distance away, ""if I run I may fall down and break myself.","the Princess had such a frightened little voice that Dorothy stopped and said, ""Why not?"" ""Because,"" answered the Princess, also stopping, a safe distance away, ""if I run I may fall down and break myself.","the Princess had such a frightened little voice that Dorothy stopped and said, ""Why not?"" ""Because,"" answered the Princess, also stopping, a safe distance away, ""if I run I may fall down and break myself.",1,8.40667910000775,0.025851966813206673,0.5226847529411316,0.45146334171295166,0.08038434386253357,0.14190798997879028,0.7777076363563538,0.008974104188382626,0.30877479910850525,0.6822511553764343,0.051068015396595,0.07681205123662949,0.8721199631690979,0.9725815057754517,0.01631464622914791,0.011103914119303226,0.47970476746559143,0.4906013011932373,0.029693977907299995
201,the Princess,34,8570,the Princess,43441,43443,1764,proper_name_to_canonical,False,"She had such a frightened little voice that Dorothy stopped and said, ""Why not?"" ""Because,"" answered [[the Princess]], also stopping, a safe distance away, ""if I run I may fall down and break myself.","She had such a frightened little voice that Dorothy stopped and said, ""Why not?"" ""Because,"" answered the Princess, also stopping, a safe distance away, ""if I run I may fall down and break myself.","She had such a frightened little voice that Dorothy stopped and said, ""Why not?"" ""Because,"" answered the Princess, also stopping, a safe distance away, ""if I run I may fall down and break myself.","She had such a frightened little voice that Dorothy stopped and said, ""Why not?"" ""Because,"" answered the Princess, also stopping, a safe distance away, ""if I run I may fall down and break myself.",1,8.40667910000775,0.029498029500246048,0.5135036110877991,0.45699840784072876,0.09589513391256332,0.17053471505641937,0.7335701584815979,0.009787441231310368,0.3050643503665924,0.6851482391357422,0.061901625245809555,0.06693161278963089,0.8711668252944946,0.9547227025032043,0.0319744311273098,0.013302917592227459,0.48223817348480225,0.4784853756427765,0.03927646949887276
201,the Princess,35,8571,I,43454,43455,1764,first_second_person_keep_original,False,"She had such a frightened little voice that Dorothy stopped and said, ""Why not?"" ""Because,"" answered the Princess, also stopping, a safe distance away, ""if [[I]] run I may fall down and break myself.","She had such a frightened little voice that Dorothy stopped and said, ""Why not?"" ""Because,"" answered the Princess, also stopping, a safe distance away, ""if I run I may fall down and break myself.","She had such a frightened little voice that Dorothy stopped and said, ""Why not?"" ""Because,"" answered the Princess, also stopping, a safe distance away, ""if I run I may fall down and break myself.","She had such a frightened little voice that Dorothy stopped and said, ""Why not?"" ""Because,"" answered the Princess, also stopping, a safe distance away, ""if I run I may fall down and break myself.",1,8.40667910000775,0.029498029500246048,0.5135036110877991,0.45699840784072876,0.09589513391256332,0.17053471505641937,0.7335701584815979,0.009787441231310368,0.3050643503665924,0.6851482391357422,0.06190667673945427,0.0670679435133934,0.8710253238677979,0.9547957181930542,0.03186776861548424,0.013336455449461937,0.48203128576278687,0.4787473976612091,0.039221301674842834
201,the Princess,36,8572,I,43456,43457,1764,first_second_person_keep_original,False,"She had such a frightened little voice that Dorothy stopped and said, ""Why not?"" ""Because,"" answered the Princess, also stopping, a safe distance away, ""if I run [[I]] may fall down and break myself.","She had such a frightened little voice that Dorothy stopped and said, ""Why not?"" ""Because,"" answered the Princess, also stopping, a safe distance away, ""if I run I may fall down and break myself.","She had such a frightened little voice that Dorothy stopped and said, ""Why not?"" ""Because,"" answered the Princess, also stopping, a safe distance away, ""if I run I may fall down and break myself.","She had such a frightened little voice that Dorothy stopped and said, ""Why not?"" ""Because,"" answered the Princess, also stopping, a safe distance away, ""if I run I may fall down and break myself.",1,8.40667910000775,0.029384274035692215,0.5126485228538513,0.4579671621322632,0.09567327052354813,0.17030639946460724,0.7340202927589417,0.009785618633031845,0.3051937222480774,0.6850206255912781,0.062020208686590195,0.06705983728170395,0.8709200024604797,0.9547957181930542,0.03186776861548424,0.013336455449461937,0.48203128576278687,0.4787473976612091,0.039221301674842834
201,the Princess,37,8573,myself,43462,43463,1764,first_second_person_keep_original,False,"She had such a frightened little voice that Dorothy stopped and said, ""Why not?"" ""Because,"" answered the Princess, also stopping, a safe distance away, ""if I run I may fall down and break [[myself]].","She had such a frightened little voice that Dorothy stopped and said, ""Why not?"" ""Because,"" answered the Princess, also stopping, a safe distance away, ""if I run I may fall down and break myself.","She had such a frightened little voice that Dorothy stopped and said, ""Why not?"" ""Because,"" answered the Princess, also stopping, a safe distance away, ""if I run I may fall down and break myself.","She had such a frightened little voice that Dorothy stopped and said, ""Why not?"" ""Because,"" answered the Princess, also stopping, a safe distance away, ""if I run I may fall down and break myself.",1,8.40667910000775,0.029384274035692215,0.5126485228538513,0.4579671621322632,0.09567327052354813,0.17030639946460724,0.7340202927589417,0.009785618633031845,0.3051937222480774,0.6850206255912781,0.062020208686590195,0.06705983728170395,0.8709200024604797,0.9547957181930542,0.03186776861548424,0.013336455449461937,0.48203128576278687,0.4787473976612091,0.039221301674842834
201,the Princess,38,8574,you,43469,43470,1765,first_second_person_keep_original,False,""" ""But could [[you]] not be mended?"" asked the girl.",""" ""But could you not be mended?"" asked the girl.",""" ""But could you not be mended?"" asked the girl.",""" ""But could you not be mended?"" asked the girl.",1,8.40667910000775,0.4907817244529724,0.395125150680542,0.11409313231706619,0.28570523858070374,0.32964852452278137,0.3846461772918701,0.21821190416812897,0.3256610929965973,0.45612701773643494,0.6583824753761292,0.09043927490711212,0.2511782944202423,0.27398237586021423,0.5151259303092957,0.2108917534351349,0.1770009845495224,0.41581928730010986,0.40717971324920654
201,the Princess,39,8577,the Princess,43500,43502,1766,proper_name_to_canonical,False,"""Oh, yes; but one is never so pretty after being mended, you know,"" replied [[the Princess]].","""Oh, yes; but one is never so pretty after being mended, you know,"" replied the Princess.","""Oh, yes; but one is never so pretty after being mended, you know,"" replied the Princess.","""Oh, yes; but one is never so pretty after being mended, you know,"" replied the Princess.",1,8.40667910000775,0.1689588874578476,0.441447377204895,0.38959378004074097,0.14083237946033478,0.3274451196193695,0.5317224860191345,0.2719406485557556,0.3160734176635742,0.4119859039783478,0.557502031326294,0.14182156324386597,0.3006763756275177,0.14634492993354797,0.6491815447807312,0.204473614692688,0.19345353543758392,0.41754332184791565,0.389003187417984
201,the Princess,40,8583,"one of our clowns,"" continued the china lady",43521,43531,1768,ambiguous_or_unsupported_keep_original,False,"""Now there is Mr. Joker, [[one of our clowns,"" continued the china lady]], ""who is always trying to stand upon his head.","""Now there is Mr. Joker, one of our clowns,"" continued the china lady, ""who is always trying to stand upon his head.","""Now there is Mr. Joker, one of our clowns,"" continued the china lady, ""who is always trying to stand upon his head.","""Now there is Mr. Joker, one of our clowns,"" continued the china lady, ""who is always trying to stand upon his head.",1,8.40667910000775,0.15863117575645447,0.3541797697544098,0.48718905448913574,0.05252106115221977,0.2879752218723297,0.6595037579536438,0.24986034631729126,0.23312298953533173,0.517016589641571,0.07296381145715714,0.23923911154270172,0.6877970695495605,0.1828569769859314,0.4214348793029785,0.3957081735134125,0.1997767686843872,0.46631288528442383,0.3339103162288666
201,the Princess,41,8587,the china lady,43528,43531,1768,simple_nominal_to_canonical,True,"""Now there is Mr. Joker, one of our clowns,"" continued [[the china lady]], ""who is always trying to stand upon his head.","""Now there is Mr. Joker, one of our clowns,"" continued the Princess, ""who is always trying to stand upon his head.","""Now there is Mr. Joker, one of our clowns,"" continued the Princess, ""who is always trying to stand upon his head.","""Now there is Mr. Joker, one of our clowns,"" continued the Princess, ""who is always trying to stand upon his head.",1,8.40667910000775,0.1441834568977356,0.41644546389579773,0.4393710792064667,0.0610320046544075,0.24795664846897125,0.6910113096237183,0.3556075394153595,0.2032879739999771,0.4411045014858246,0.06184256449341774,0.2561895549297333,0.6819678544998169,0.14765140414237976,0.5219383239746094,0.3304102420806885,0.19339504837989807,0.33964166045188904,0.4669632315635681
201,the Princess,42,8634,the Princess,43700,43702,1773,proper_name_to_canonical,False,"You're quite as stiff And prim as if You'd eaten up a poker!"" ""Be quiet, sir!"" said [[the Princess]].","You're quite as stiff And prim as if You'd eaten up a poker!"" ""Be quiet, sir!"" said the Princess.","You're quite as stiff And prim as if You'd eaten up a poker!"" ""Be quiet, sir!"" said the Princess.","You're quite as stiff And prim as if You'd eaten up a poker!"" ""Be quiet, sir!"" said the Princess.",1,8.40667910000775,0.009187091141939163,0.5070154666900635,0.48379752039909363,0.19440998136997223,0.18397380411624908,0.6216161251068115,0.28944700956344604,0.4188358187675476,0.29171714186668396,0.012924869544804096,0.804332435131073,0.18274268507957458,0.21119047701358795,0.5310624241828918,0.25774717330932617,0.20989318192005157,0.2107146829366684,0.5793921947479248
201,the Princess,43,8647,"Mr. Joker,"" said the Princess",43748,43755,1775,proper_name_to_canonical,True,"""Don't mind [[Mr. Joker,"" said the Princess]] to Dorothy.","""Don't mind the Princess to Dorothy.","""Don't mind the Princess to Dorothy.","""Don't mind the Princess to Dorothy.",1,8.40667910000775,0.2761792242527008,0.49306443333625793,0.23075638711452484,0.1912624090909958,0.5113451480865479,0.29739242792129517,0.3382633328437805,0.45379605889320374,0.20794057846069336,0.41835838556289673,0.3072754740715027,0.2743661403656006,0.1537160873413086,0.6729491949081421,0.17333471775054932,0.0461902990937233,0.482726126909256,0.47108352184295654
201,the Princess,44,8648,the Princess,43753,43755,1775,proper_name_to_canonical,False,"""Don't mind Mr. Joker,"" said [[the Princess]] to Dorothy.","""Don't mind Mr. Joker,"" said the Princess to Dorothy.","""Don't mind Mr. Joker,"" said the Princess to Dorothy.","""Don't mind Mr. Joker,"" said the Princess to Dorothy.",1,8.40667910000775,0.20959648489952087,0.49669545888900757,0.29370811581611633,0.06832371652126312,0.37910139560699463,0.552574872970581,0.33330392837524414,0.3348536193370819,0.33184242248535156,0.4063408076763153,0.3194860816001892,0.2741730809211731,0.08453533053398132,0.6760528087615967,0.2394118458032608,0.203608900308609,0.46086058020591736,0.33553048968315125
201,the Princess,45,8661,you,43792,43793,1778,first_second_person_keep_original,False,"""But [[you]] are so beautiful,"" she continued, ""that I am sure I could love you dearly.","""But you are so beautiful,"" she continued, ""that I am sure I could love you dearly.","""But you are so beautiful,"" she continued, ""that I am sure I could love you dearly.","""But you are so beautiful,"" she continued, ""that I am sure I could love you dearly.",1,8.40667910000775,0.1449073702096939,0.34931617975234985,0.5057764053344727,0.09970706701278687,0.20062857866287231,0.6996644139289856,0.2347457855939865,0.2780877649784088,0.4871664047241211,0.6582754850387573,0.05365332216024399,0.2880711555480957,0.08695881813764572,0.4833919405937195,0.42964914441108704,0.1825024038553238,0.37916237115859985,0.43833526968955994
201,the Princess,46,8666,you,43809,43810,1778,first_second_person_keep_original,False,"""But you are so beautiful,"" she continued, ""that I am sure I could love [[you]] dearly.","""But you are so beautiful,"" she continued, ""that I am sure I could love you dearly.","""But you are so beautiful,"" she continued, ""that I am sure I could love you dearly.","""But you are so beautiful,"" she continued, ""that I am sure I could love you dearly.",1,8.40667910000775,0.1449073702096939,0.34931617975234985,0.5057764053344727,0.09985189884901047,0.2009200006723404,0.6992281675338745,0.23493129014968872,0.2781716585159302,0.4868971109390259,0.6581860780715942,0.05371155962347984,0.2881023585796356,0.08684059977531433,0.48364898562431335,0.4295104444026947,0.18244513869285583,0.3790896534919739,0.4384652376174927
201,the Princess,47,8668,you,43814,43815,1779,first_second_person_keep_original,False,"Won't [[you]] let me carry you back to Kansas, and stand you on Aunt Em's mantel?","Won't you let me carry you back to Kansas, and stand you on Aunt Em's mantel?","Won't you let me carry you back to Kansas, and stand you on Aunt Em's mantel?","Won't you let me carry you back to Kansas, and stand you on Aunt Em's mantel?",1,8.40667910000775,0.21831272542476654,0.519122302532196,0.2625650465488434,0.07507073879241943,0.3847940266132355,0.5401352047920227,0.33639058470726013,0.28410038352012634,0.3795090317726135,0.39023447036743164,0.3038407266139984,0.3059248626232147,0.263060599565506,0.5101669430732727,0.22677242755889893,0.22843687236309052,0.33123961091041565,0.4403235912322998
201,the Princess,48,8671,you,43818,43819,1779,first_second_person_keep_original,False,"Won't you let me carry [[you]] back to Kansas, and stand you on Aunt Em's mantel?","Won't you let me carry you back to Kansas, and stand you on Aunt Em's mantel?","Won't you let me carry you back to Kansas, and stand you on Aunt Em's mantel?","Won't you let me carry you back to Kansas, and stand you on Aunt Em's mantel?",1,8.40667910000775,0.21831272542476654,0.519122302532196,0.2625650465488434,0.07507073879241943,0.3847940266132355,0.5401352047920227,0.33639058470726013,0.28410038352012634,0.3795090317726135,0.39023447036743164,0.3038407266139984,0.3059248626232147,0.263060599565506,0.5101669430732727,0.22677242755889893,0.22843687236309052,0.33123961091041565,0.4403235912322998
201,the Princess,49,8674,you,43825,43826,1779,first_second_person_keep_original,False,"Won't you let me carry you back to Kansas, and stand [[you]] on Aunt Em's mantel?","Won't you let me carry you back to Kansas, and stand you on Aunt Em's mantel?","Won't you let me carry you back to Kansas, and stand you on Aunt Em's mantel?","Won't you let me carry you back to Kansas, and stand you on Aunt Em's mantel?",1,8.40667910000775,0.21831272542476654,0.519122302532196,0.2625650465488434,0.07507073879241943,0.3847940266132355,0.5401352047920227,0.33639058470726013,0.28410038352012634,0.3795090317726135,0.39023447036743164,0.3038407266139984,0.3059248626232147,0.2631188631057739,0.5102798938751221,0.2266012281179428,0.22800076007843018,0.3313344120979309,0.44066479802131653
201,the Princess,50,8678,you,43835,43836,1780,first_second_person_keep_original,False,"I could carry [[you]] in my basket."" ""That would make me very unhappy,"" answered the china Princess.","I could carry you in my basket."" ""That would make me very unhappy,"" answered the china Princess.","I could carry you in my basket."" ""That would make me very unhappy,"" answered the china Princess.","I could carry you in my basket."" ""That would make me very unhappy,"" answered the china Princess.",1,8.40667910000775,0.07634204626083374,0.4881840944290161,0.43547385931015015,0.11859020590782166,0.2124965786933899,0.6689132452011108,0.07356712967157364,0.3904843330383301,0.5359485745429993,0.08484530448913574,0.360541433095932,0.5546132326126099,0.5151378512382507,0.4076319634914398,0.07723020017147064,0.1945565789937973,0.3039952218532562,0.5014482140541077
201,the Princess,51,8680,me,43846,43847,1780,first_second_person_keep_original,False,"I could carry you in my basket."" ""That would make [[me]] very unhappy,"" answered the china Princess.","I could carry you in my basket."" ""That would make me very unhappy,"" answered the china Princess.","I could carry you in my basket."" ""That would make me very unhappy,"" answered the china Princess.","I could carry you in my basket."" ""That would make me very unhappy,"" answered the china Princess.",1,8.40667910000775,0.07634204626083374,0.4881840944290161,0.43547385931015015,0.11859020590782166,0.2124965786933899,0.6689132452011108,0.07356712967157364,0.3904843330383301,0.5359485745429993,0.08484530448913574,0.360541433095932,0.5546132326126099,0.5151378512382507,0.4076319634914398,0.07723020017147064,0.1945565789937973,0.3039952218532562,0.5014482140541077
