cluster_id,subject,mention_index_in_cluster,mention_id,mention_text,mention_start,mention_end,sentence_index,mention_render_rule,mention_render_was_changed,original_context_text,rendered_context_text,context_text,normalized_context_text,chunk_index,elapsed_seconds_at_completion,openness_positive_probability,openness_negative_probability,openness_neutral_probability,conscientiousness_positive_probability,conscientiousness_negative_probability,conscientiousness_neutral_probability,extraversion_positive_probability,extraversion_negative_probability,extraversion_neutral_probability,agreeableness_positive_probability,agreeableness_negative_probability,agreeableness_neutral_probability,neuroticism_positive_probability,neuroticism_negative_probability,neuroticism_neutral_probability,OCEAN_weight_high_probability,OCEAN_weight_medium_probability,OCEAN_weight_low_probability
201,the Princess,0,2690,a princess,14583,14585,603,ambiguous_or_unsupported_keep_original,False,"Our little party of travelers awakened the next morning refreshed and full of hope, and Dorothy breakfasted like [[a princess]] off peaches and plums from the trees beside the river.","Our little party of travelers awakened the next morning refreshed and full of hope, and Dorothy breakfasted like a princess off peaches and plums from the trees beside the river.","Our little party of travelers awakened the next morning refreshed and full of hope, and Dorothy breakfasted like a princess off peaches and plums from the trees beside the river.","Our little party of travelers awakened the next morning refreshed and full of hope, and Dorothy breakfasted like a princess off peaches and plums from the trees beside the river.",1,8.40667910000775,0.6457688212394714,0.12476083636283875,0.22947031259536743,0.37860924005508423,0.17831917107105255,0.44307154417037964,0.36428532004356384,0.19651716947555542,0.43919745087623596,0.7411792278289795,0.03022095188498497,0.22859981656074524,0.04452305659651756,0.42252612113952637,0.532950758934021,0.21048326790332794,0.36959004402160645,0.41992661356925964
201,the Princess,1,8037,She,40581,40582,1644,proper_name_to_canonical,True,"[[She]] is the most powerful of all the Witches, and rules over the Quadlings.","the Princess is the most powerful of all the Witches, and rules over the Quadlings.","the Princess is the most powerful of all the Witches, and rules over the Quadlings.","the Princess is the most powerful of all the Witches, and rules over the Quadlings.",1,8.40667910000775,0.09756995737552643,0.41078487038612366,0.49164509773254395,0.2875223457813263,0.3163989186286926,0.39607879519462585,0.11101901531219482,0.4473119378089905,0.4416690468788147,0.17246317863464355,0.4404001832008362,0.3871366083621979,0.06272132694721222,0.654529333114624,0.28274938464164734,0.20782330632209778,0.02771006152033806,0.7644666433334351
201,the Princess,2,8042,her,40599,40600,1645,third_person_possessive_pronoun_to_canonical_possessive,True,"Besides, [[her]] castle stands on the edge of the desert, so she may know a way to cross it.","Besides, the Princess' castle stands on the edge of the desert, so she may know a way to cross it.","Besides, the Princess' castle stands on the edge of the desert, so she may know a way to cross it.","Besides, the Princess' castle stands on the edge of the desert, so she may know a way to cross it.",1,8.40667910000775,0.3896436393260956,0.3765507638454437,0.23380570113658905,0.4914766550064087,0.28085657954216003,0.22766681015491486,0.1591145396232605,0.4192109704017639,0.421674519777298,0.23362398147583008,0.2742031216621399,0.4921729266643524,0.16298140585422516,0.5605888366699219,0.276429682970047,0.20000900328159332,0.4208747148513794,0.3791162967681885
201,the Princess,3,8046,she,40610,40611,1645,third_person_subject_pronoun_to_canonical,True,"Besides, her castle stands on the edge of the desert, so [[she]] may know a way to cross it.","Besides, her castle stands on the edge of the desert, so the Princess may know a way to cross it.","Besides, her castle stands on the edge of the desert, so the Princess may know a way to cross it.","Besides, her castle stands on the edge of the desert, so the Princess may know a way to cross it.",1,8.40667910000775,0.43076613545417786,0.2946188449859619,0.27461495995521545,0.4759007394313812,0.2903446555137634,0.23375459015369415,0.1486358940601349,0.4413678050041199,0.40999630093574524,0.24002034962177277,0.22902901470661163,0.5309506058692932,0.12811747193336487,0.5372917652130127,0.3345908522605896,0.17469243705272675,0.41094109416007996,0.4143664240837097
201,the Princess,4,8050,she,40630,40631,1646,third_person_subject_pronoun_to_canonical,True,""" ""Glinda is a Good Witch, isn't [[she]]?"" asked the child.",""" ""Glinda is a Good Witch, isn't the Princess?"" asked the child.",""" ""Glinda is a Good Witch, isn't the Princess?"" asked the child.",""" ""Glinda is a Good Witch, isn't the Princess?"" asked the child.",1,8.40667910000775,0.4169556498527527,0.3941878378391266,0.18885652720928192,0.2089487910270691,0.36315274238586426,0.4278985261917114,0.19583529233932495,0.38305261731147766,0.421112060546875,0.6823745965957642,0.10217151790857315,0.2154538482427597,0.138193741440773,0.5821015238761902,0.2797047793865204,0.06459753215312958,0.5128346681594849,0.42256781458854675
201,the Princess,5,8054,she,40642,40643,1647,third_person_subject_pronoun_to_canonical,True,"""The Quadlings think [[she]] is good,"" said the soldier, ""and she is kind to everyone.","""The Quadlings think the Princess is good,"" said the soldier, ""and she is kind to everyone.","""The Quadlings think the Princess is good,"" said the soldier, ""and she is kind to everyone.","""The Quadlings think the Princess is good,"" said the soldier, ""and she is kind to everyone.",1,8.40667910000775,0.16633589565753937,0.37101978063583374,0.4626442790031433,0.3204736113548279,0.18171092867851257,0.4978155493736267,0.2867256700992584,0.27912798523902893,0.4341464042663574,0.9722797274589539,0.005869563668966293,0.02185070887207985,0.05766700208187103,0.6577922701835632,0.2845407724380493,0.24292320013046265,0.5079978704452515,0.2490789145231247
201,the Princess,6,8057,she,40653,40654,1647,third_person_subject_pronoun_to_canonical,True,"""The Quadlings think she is good,"" said the soldier, ""and [[she]] is kind to everyone.","""The Quadlings think she is good,"" said the soldier, ""and the Princess is kind to everyone.","""The Quadlings think she is good,"" said the soldier, ""and the Princess is kind to everyone.","""The Quadlings think she is good,"" said the soldier, ""and the Princess is kind to everyone.",1,8.40667910000775,0.2658255994319916,0.2802199423313141,0.45395439863204956,0.3179207742214203,0.15509359538555145,0.5269856452941895,0.551612377166748,0.1368386596441269,0.31154897809028625,0.9811102151870728,0.005704320501536131,0.013185457326471806,0.03713585063815117,0.6422159671783447,0.320648193359375,0.27060467004776,0.5892899036407471,0.14010538160800934
201,the Princess,7,8062,she,40681,40682,1648,third_person_subject_pronoun_to_canonical,True,"I have heard that Glinda is a beautiful woman, who knows how to keep young in spite of the many years [[she]] has lived."" ""How can I get to her castle?"" asked Dorothy.","I have heard that Glinda is a beautiful woman, who knows how to keep young in spite of the many years the Princess has lived."" ""How can I get to her castle?"" asked Dorothy.","I have heard that Glinda is a beautiful woman, who knows how to keep young in spite of the many years the Princess has lived."" ""How can I get to her castle?"" asked Dorothy.","I have heard that Glinda is a beautiful woman, who knows how to keep young in spite of the many years the Princess has lived."" ""How can I get to her castle?"" asked Dorothy.",1,8.40667910000775,0.4234875738620758,0.3046359419822693,0.2718764841556549,0.17136861383914948,0.17474855482578278,0.6538828611373901,0.18324854969978333,0.23125234246253967,0.5854990482330322,0.40296268463134766,0.0973142609000206,0.49972298741340637,0.03779887408018112,0.4032137393951416,0.5589873790740967,0.08471506088972092,0.32002365589141846,0.59526127576828
201,the Princess,8,8065,her,40693,40694,1648,third_person_possessive_pronoun_to_canonical_possessive,True,"I have heard that Glinda is a beautiful woman, who knows how to keep young in spite of the many years she has lived."" ""How can I get to [[her]] castle?"" asked Dorothy.","I have heard that Glinda is a beautiful woman, who knows how to keep young in spite of the many years she has lived."" ""How can I get to the Princess' castle?"" asked Dorothy.","I have heard that Glinda is a beautiful woman, who knows how to keep young in spite of the many years she has lived."" ""How can I get to the Princess' castle?"" asked Dorothy.","I have heard that Glinda is a beautiful woman, who knows how to keep young in spite of the many years she has lived."" ""How can I get to the Princess' castle?"" asked Dorothy.",1,8.40667910000775,0.4334067404270172,0.27907794713974,0.2875153422355652,0.20588092505931854,0.2168174684047699,0.5773016214370728,0.2053898572921753,0.20072999596595764,0.5938801169395447,0.42984291911125183,0.07926098257303238,0.4908960163593292,0.06605875492095947,0.45597103238105774,0.4779702425003052,0.09188162535429001,0.3075103759765625,0.6006079912185669
201,the Princess,9,8522,a china milkmaid milking a china cow,43092,43099,1747,ambiguous_or_unsupported_keep_original,False,""" They began walking through the country of the china people, and the first thing they came to was [[a china milkmaid milking a china cow]].",""" They began walking through the country of the china people, and the first thing they came to was a china milkmaid milking a china cow.",""" They began walking through the country of the china people, and the first thing they came to was a china milkmaid milking a china cow.",""" They began walking through the country of the china people, and the first thing they came to was a china milkmaid milking a china cow.",1,8.40667910000775,0.3202224671840668,0.32463058829307556,0.35514694452285767,0.21316219866275787,0.3658021092414856,0.42103564739227295,0.24748240411281586,0.3543291389942169,0.3981884717941284,0.4032139778137207,0.15867376327514648,0.4381122887134552,0.19096742570400238,0.5262491703033447,0.2827833592891693,0.15071040391921997,0.3787933886051178,0.47049617767333984
201,the Princess,10,8525,the milkmaid,43122,43124,1748,simple_nominal_to_canonical,True,"As they drew near, the cow suddenly gave a kick and kicked over the stool, the pail, and even [[the milkmaid]] herself, and all fell on the china ground with a great clatter.","As they drew near, the cow suddenly gave a kick and kicked over the stool, the pail, and even the Princess herself, and all fell on the china ground with a great clatter.","As they drew near, the cow suddenly gave a kick and kicked over the stool, the pail, and even the Princess herself, and all fell on the china ground with a great clatter.","As they drew near, the cow suddenly gave a kick and kicked over the stool, the pail, and even the Princess herself, and all fell on the china ground with a great clatter.",1,8.40667910000775,0.10907207429409027,0.34426888823509216,0.5466590523719788,0.04582059383392334,0.2625231146812439,0.6916562914848328,0.11382152140140533,0.3162725269794464,0.5699059963226318,0.03569408506155014,0.15626409649848938,0.8080418705940247,0.5178300738334656,0.34293392300605774,0.13923603296279907,0.14829088747501373,0.4110969603061676,0.44061216711997986
201,the Princess,11,8526,herself,43124,43125,1748,third_person_reflexive_keep_original,False,"As they drew near, the cow suddenly gave a kick and kicked over the stool, the pail, and even the milkmaid [[herself]], and all fell on the china ground with a great clatter.","As they drew near, the cow suddenly gave a kick and kicked over the stool, the pail, and even the milkmaid herself, and all fell on the china ground with a great clatter.","As they drew near, the cow suddenly gave a kick and kicked over the stool, the pail, and even the milkmaid herself, and all fell on the china ground with a great clatter.","As they drew near, the cow suddenly gave a kick and kicked over the stool, the pail, and even the milkmaid herself, and all fell on the china ground with a great clatter.",1,8.40667910000775,0.15021422505378723,0.31003084778785706,0.5397549271583557,0.060492631047964096,0.29688408970832825,0.642623245716095,0.20218650996685028,0.2887715697288513,0.509041965007782,0.05218353122472763,0.396566241979599,0.5512502193450928,0.6177954077720642,0.22849823534488678,0.153706356883049,0.2688744366168976,0.46893203258514404,0.262193500995636
201,the Princess,12,8528,the poor milkmaid,43165,43168,1749,simple_nominal_to_canonical,True,"Dorothy was shocked to see that the cow had broken her leg off, and that the pail was lying in several small pieces, while [[the poor milkmaid]] had a nick in her left elbow.","Dorothy was shocked to see that the cow had broken her leg off, and that the pail was lying in several small pieces, while the Princess had a nick in her left elbow.","Dorothy was shocked to see that the cow had broken her leg off, and that the pail was lying in several small pieces, while the Princess had a nick in her left elbow.","Dorothy was shocked to see that the cow had broken her leg off, and that the pail was lying in several small pieces, while the Princess had a nick in her left elbow.",1,8.40667910000775,0.10859131067991257,0.35294148325920105,0.5384672284126282,0.09941313415765762,0.30338630080223083,0.5972005724906921,0.049074262380599976,0.17612020671367645,0.7748055458068848,0.06924121081829071,0.17003999650478363,0.7607187628746033,0.09831986576318741,0.5517415404319763,0.3499385118484497,0.13407160341739655,0.6139161586761475,0.2520122230052948
201,the Princess,13,8529,her,43172,43173,1749,third_person_possessive_pronoun_to_canonical_possessive,True,"Dorothy was shocked to see that the cow had broken her leg off, and that the pail was lying in several small pieces, while the poor milkmaid had a nick in [[her]] left elbow.","Dorothy was shocked to see that the cow had broken her leg off, and that the pail was lying in several small pieces, while the poor milkmaid had a nick in the Princess' left elbow.","Dorothy was shocked to see that the cow had broken her leg off, and that the pail was lying in several small pieces, while the poor milkmaid had a nick in the Princess' left elbow.","Dorothy was shocked to see that the cow had broken her leg off, and that the pail was lying in several small pieces, while the poor milkmaid had a nick in the Princess' left elbow.",1,8.40667910000775,0.07463201880455017,0.3716818690299988,0.5536860823631287,0.10931764543056488,0.3170942962169647,0.5735881328582764,0.06745582073926926,0.22117912769317627,0.7113651037216187,0.10062693059444427,0.21095697581768036,0.6884161233901978,0.16491682827472687,0.49187013506889343,0.3432130813598633,0.1488051563501358,0.5825318098068237,0.26866304874420166
201,the Princess,14,8530,the milkmaid,43182,43184,1750,simple_nominal_to_canonical,True,"""There!"" cried [[the milkmaid]] angrily.","""There!"" cried the Princess angrily.","""There!"" cried the Princess angrily.","""There!"" cried the Princess angrily.",1,8.40667910000775,0.06955408304929733,0.40045157074928284,0.5299943089485168,0.16363535821437836,0.3508419692516327,0.48552265763282776,0.2959851920604706,0.3528667986392975,0.35114800930023193,0.014654729515314102,0.7861793637275696,0.19916588068008423,0.21102918684482574,0.366410493850708,0.4225603938102722,0.3620583713054657,0.15899431705474854,0.47894731163978577
201,the Princess,15,8532,My,43193,43194,1752,first_second_person_keep_original,False,"[[My]] cow has broken her leg, and I must take her to the mender's shop and have it glued on again.","My cow has broken her leg, and I must take her to the mender's shop and have it glued on again.","My cow has broken her leg, and I must take her to the mender's shop and have it glued on again.","My cow has broken her leg, and I must take her to the mender's shop and have it glued on again.",1,8.40667910000775,0.0914335772395134,0.33494043350219727,0.5736259818077087,0.27549195289611816,0.34277158975601196,0.3817363977432251,0.1341668963432312,0.3803442120552063,0.4854888319969177,0.2343142330646515,0.2402224838733673,0.5254632830619812,0.2802862823009491,0.3328481912612915,0.3868655264377594,0.10593733936548233,0.4718892276287079,0.422173410654068
201,the Princess,16,8533,I,43201,43202,1752,first_second_person_keep_original,False,"My cow has broken her leg, and [[I]] must take her to the mender's shop and have it glued on again.","My cow has broken her leg, and I must take her to the mender's shop and have it glued on again.","My cow has broken her leg, and I must take her to the mender's shop and have it glued on again.","My cow has broken her leg, and I must take her to the mender's shop and have it glued on again.",1,8.40667910000775,0.0914335772395134,0.33494043350219727,0.5736259818077087,0.27549195289611816,0.34277158975601196,0.3817363977432251,0.1341668963432312,0.3803442120552063,0.4854888319969177,0.2343142330646515,0.2402224838733673,0.5254632830619812,0.2802862823009491,0.3328481912612915,0.3868655264377594,0.10593733936548233,0.4718892276287079,0.422173410654068
201,the Princess,17,8537,my,43226,43227,1753,first_second_person_keep_original,False,"What do you mean by coming here and frightening [[my]] cow?"" ""I'm very sorry,"" returned Dorothy.","What do you mean by coming here and frightening my cow?"" ""I'm very sorry,"" returned Dorothy.","What do you mean by coming here and frightening my cow?"" ""I'm very sorry,"" returned Dorothy.","What do you mean by coming here and frightening my cow?"" ""I'm very sorry,"" returned Dorothy.",1,8.40667910000775,0.20077450573444366,0.3274843394756317,0.4717411696910858,0.2301836460828781,0.30688560009002686,0.46293070912361145,0.1643044501543045,0.32811740040779114,0.5075781941413879,0.12563097476959229,0.2896154224872589,0.5847536325454712,0.42568355798721313,0.36624613404273987,0.2080702930688858,0.3657044768333435,0.3628585636615753,0.2714369297027588
201,the Princess,18,8541,the pretty milkmaid,43249,43252,1755,simple_nominal_to_canonical,True,""" But [[the pretty milkmaid]] was much too vexed to make any answer.",""" But the Princess was much too vexed to make any answer.",""" But the Princess was much too vexed to make any answer.",""" But the Princess was much too vexed to make any answer.",1,8.40667910000775,0.01664459891617298,0.325914204120636,0.6574411988258362,0.08398432284593582,0.2449227124452591,0.6710929870605469,0.010926817543804646,0.4675787389278412,0.521494448184967,0.00729937432333827,0.5657376646995544,0.4269630014896393,0.48622649908065796,0.12536203861236572,0.38841143250465393,0.35503560304641724,0.41064369678497314,0.234320729970932
201,the Princess,19,8542,She,43261,43262,1756,proper_name_to_canonical,True,"[[She]] picked up the leg sulkily and led her cow away, the poor animal limping on three legs.","the Princess picked up the leg sulkily and led her cow away, the poor animal limping on three legs.","the Princess picked up the leg sulkily and led her cow away, the poor animal limping on three legs.","the Princess picked up the leg sulkily and led her cow away, the poor animal limping on three legs.",1,8.40667910000775,0.018527096137404442,0.35000765323638916,0.6314652562141418,0.06599974632263184,0.2146683633327484,0.7193318605422974,0.005635497160255909,0.3995407819747925,0.5948237180709839,0.00919241551309824,0.4481362998485565,0.542671263217926,0.5226645469665527,0.21809187531471252,0.25924354791641235,0.36221373081207275,0.4623744487762451,0.1754118800163269
201,the Princess,20,8543,her,43269,43270,1756,third_person_possessive_pronoun_to_canonical_possessive,True,"She picked up the leg sulkily and led [[her]] cow away, the poor animal limping on three legs.","She picked up the leg sulkily and led the Princess' cow away, the poor animal limping on three legs.","She picked up the leg sulkily and led the Princess' cow away, the poor animal limping on three legs.","She picked up the leg sulkily and led the Princess' cow away, the poor animal limping on three legs.",1,8.40667910000775,0.05780079588294029,0.3433467447757721,0.5988524556159973,0.10190582275390625,0.263550341129303,0.6345438957214355,0.019816653802990913,0.4023268520832062,0.5778564214706421,0.031997524201869965,0.26712822914123535,0.7008742094039917,0.5068199038505554,0.24081164598464966,0.2523684501647949,0.26121869683265686,0.5818072557449341,0.15697406232357025
201,the Princess,21,8544,she,43282,43283,1757,third_person_subject_pronoun_to_canonical,True,"As [[she]] left them the milkmaid cast many reproachful glances over her shoulder at the clumsy strangers, holding her nicked elbow close to her side.","As the Princess left them the milkmaid cast many reproachful glances over her shoulder at the clumsy strangers, holding her nicked elbow close to her side.","As the Princess left them the milkmaid cast many reproachful glances over her shoulder at the clumsy strangers, holding her nicked elbow close to her side.","As the Princess left them the milkmaid cast many reproachful glances over her shoulder at the clumsy strangers, holding her nicked elbow close to her side.",1,8.40667910000775,0.04029536992311478,0.4595825672149658,0.5001221299171448,0.4410281777381897,0.3409666121006012,0.2180051952600479,0.03782876953482628,0.56990647315979,0.39226481318473816,0.05250011384487152,0.5871465802192688,0.3603532612323761,0.6833258271217346,0.19827741384506226,0.11839685589075089,0.29339098930358887,0.3943912982940674,0.3122177720069885
201,the Princess,22,8546,the milkmaid,43285,43287,1757,simple_nominal_to_canonical,True,"As she left them [[the milkmaid]] cast many reproachful glances over her shoulder at the clumsy strangers, holding her nicked elbow close to her side.","As she left them the Princess cast many reproachful glances over her shoulder at the clumsy strangers, holding her nicked elbow close to her side.","As she left them the Princess cast many reproachful glances over her shoulder at the clumsy strangers, holding her nicked elbow close to her side.","As she left them the Princess cast many reproachful glances over her shoulder at the clumsy strangers, holding her nicked elbow close to her side.",1,8.40667910000775,0.009167344309389591,0.39963436126708984,0.5911983251571655,0.5050573945045471,0.3155171573162079,0.17942547798156738,0.010570344515144825,0.6466608047485352,0.3427688181400299,0.005278194788843393,0.6513282656669617,0.343393474817276,0.8323338031768799,0.08358748257160187,0.08407868444919586,0.5860092639923096,0.30775150656700134,0.10623929649591446
201,the Princess,23,8547,her,43292,43293,1757,third_person_possessive_pronoun_to_canonical_possessive,True,"As she left them the milkmaid cast many reproachful glances over [[her]] shoulder at the clumsy strangers, holding her nicked elbow close to her side.","As she left them the milkmaid cast many reproachful glances over the Princess' shoulder at the clumsy strangers, holding her nicked elbow close to her side.","As she left them the milkmaid cast many reproachful glances over the Princess' shoulder at the clumsy strangers, holding her nicked elbow close to her side.","As she left them the milkmaid cast many reproachful glances over the Princess' shoulder at the clumsy strangers, holding her nicked elbow close to her side.",1,8.40667910000775,0.04920633137226105,0.3894072473049164,0.5613864064216614,0.2860272228717804,0.3998333811759949,0.3141394555568695,0.050348445773124695,0.4686821401119232,0.4809694290161133,0.09474579989910126,0.5346217155456543,0.3706325590610504,0.5916095972061157,0.33251169323921204,0.07587870210409164,0.34322604537010193,0.37111586332321167,0.285658061504364
201,the Princess,24,8549,her,43300,43301,1757,third_person_possessive_pronoun_to_canonical_possessive,True,"As she left them the milkmaid cast many reproachful glances over her shoulder at the clumsy strangers, holding [[her]] nicked elbow close to her side.","As she left them the milkmaid cast many reproachful glances over her shoulder at the clumsy strangers, holding the Princess' nicked elbow close to her side.","As she left them the milkmaid cast many reproachful glances over her shoulder at the clumsy strangers, holding the Princess' nicked elbow close to her side.","As she left them the milkmaid cast many reproachful glances over her shoulder at the clumsy strangers, holding the Princess' nicked elbow close to her side.",1,8.40667910000775,0.044567640870809555,0.3858054578304291,0.5696269273757935,0.29483887553215027,0.43087735772132874,0.2742837965488434,0.03111306205391884,0.4322375953197479,0.5366494059562683,0.06948483735322952,0.5449417233467102,0.3855734169483185,0.624728798866272,0.282413512468338,0.09285764396190643,0.35379672050476074,0.42905864119529724,0.21714456379413605
