cluster_id,subject,mention_index_in_cluster,mention_id,mention_text,mention_start,mention_end,sentence_index,mention_render_rule,mention_render_was_changed,original_context_text,rendered_context_text,context_text,normalized_context_text,chunk_index,elapsed_seconds_at_completion,openness_positive_probability,openness_negative_probability,openness_neutral_probability,conscientiousness_positive_probability,conscientiousness_negative_probability,conscientiousness_neutral_probability,extraversion_positive_probability,extraversion_negative_probability,extraversion_neutral_probability,agreeableness_positive_probability,agreeableness_negative_probability,agreeableness_neutral_probability,neuroticism_positive_probability,neuroticism_negative_probability,neuroticism_neutral_probability,OCEAN_weight_high_probability,OCEAN_weight_medium_probability,OCEAN_weight_low_probability
201,the Princess,52,8681,the china Princess,43852,43855,1780,proper_name_to_canonical,True,"I could carry you in my basket."" ""That would make me very unhappy,"" answered [[the china Princess]].","I could carry you in my basket."" ""That would make me very unhappy,"" answered the Princess.","I could carry you in my basket."" ""That would make me very unhappy,"" answered the Princess.","I could carry you in my basket."" ""That would make me very unhappy,"" answered the Princess.",1,8.40667910000775,0.06747762858867645,0.4851471781730652,0.44737520813941956,0.15593715012073517,0.21407952904701233,0.6299833059310913,0.0560455247759819,0.3847824037075043,0.5591720938682556,0.08488912880420685,0.36587199568748474,0.549238920211792,0.5803357362747192,0.3700677752494812,0.04959651082754135,0.24256263673305511,0.3396548330783844,0.41778257489204407
201,the Princess,53,8704,you,43944,43945,1783,first_second_person_keep_original,False,"Of course that is all that is expected of us when we are on mantels and cabinets and drawing-room tables, but our lives are much pleasanter here in our own country."" ""I would not make [[you]] unhappy for all the world!""","Of course that is all that is expected of us when we are on mantels and cabinets and drawing-room tables, but our lives are much pleasanter here in our own country."" ""I would not make you unhappy for all the world!""","Of course that is all that is expected of us when we are on mantels and cabinets and drawing-room tables, but our lives are much pleasanter here in our own country."" ""I would not make you unhappy for all the world!""","Of course that is all that is expected of us when we are on mantels and cabinets and drawing-room tables, but our lives are much pleasanter here in our own country."" ""I would not make you unhappy for all the world!""",1,8.40667910000775,0.12335453182458878,0.3967135548591614,0.47993186116218567,0.17912572622299194,0.28708192706108093,0.5337923169136047,0.4677146375179291,0.1996326595544815,0.3326527178287506,0.7210060358047485,0.12060992419719696,0.15838401019573212,0.12456492334604263,0.5788723230361938,0.29656273126602173,0.11526616662740707,0.4190605580806732,0.4656732380390167
201,the Princess,54,8708,the Princess,43974,43976,1786,proper_name_to_canonical,False,"""Good-bye,"" replied [[the Princess]].","""Good-bye,"" replied the Princess.","""Good-bye,"" replied the Princess.","""Good-bye,"" replied the Princess.",1,8.40667910000775,0.13918209075927734,0.4262584149837494,0.43455949425697327,0.33360281586647034,0.3117121160030365,0.35468512773513794,0.13045379519462585,0.4734667241573334,0.3960794508457184,0.2513717710971832,0.19500531256198883,0.5536229014396667,0.19128572940826416,0.6247565746307373,0.18395769596099854,0.18773388862609863,0.36443766951560974,0.4478284418582916
201,the Princess,55,8829,your,44673,44674,1816,first_second_person_keep_original,False,""" ""What is [[your]] trouble?"" asked the Lion quietly.",""" ""What is your trouble?"" asked the Lion quietly.",""" ""What is your trouble?"" asked the Lion quietly.",""" ""What is your trouble?"" asked the Lion quietly.",1,8.40667910000775,0.5509881377220154,0.2759741246700287,0.1730378121137619,0.2958005368709564,0.3421308100223541,0.36206862330436707,0.1679265797138214,0.41867753863334656,0.41339588165283203,0.6258390545845032,0.06825651973485947,0.30590447783470154,0.3334740102291107,0.4892461597919464,0.1772797554731369,0.24066008627414703,0.503111720085144,0.2562282383441925
201,the Princess,56,8874,your,44876,44877,1826,first_second_person_keep_original,False,"""If I put an end to [[your]] enemy, will you bow down to me and obey me as King of the Forest?"" inquired the Lion.","""If I put an end to your enemy, will you bow down to me and obey me as King of the Forest?"" inquired the Lion.","""If I put an end to your enemy, will you bow down to me and obey me as King of the Forest?"" inquired the Lion.","""If I put an end to your enemy, will you bow down to me and obey me as King of the Forest?"" inquired the Lion.",1,8.40667910000775,0.3125818073749542,0.3686712384223938,0.3187469244003296,0.30329403281211853,0.3015221059322357,0.39518389105796814,0.16748212277889252,0.4260132312774658,0.40650466084480286,0.2715696096420288,0.43016955256462097,0.2982608675956726,0.20098868012428284,0.5525141954421997,0.24649709463119507,0.2166791707277298,0.22170929610729218,0.561611533164978
201,the Princess,57,8877,you,44880,44881,1826,first_second_person_keep_original,False,"""If I put an end to your enemy, will [[you]] bow down to me and obey me as King of the Forest?"" inquired the Lion.","""If I put an end to your enemy, will you bow down to me and obey me as King of the Forest?"" inquired the Lion.","""If I put an end to your enemy, will you bow down to me and obey me as King of the Forest?"" inquired the Lion.","""If I put an end to your enemy, will you bow down to me and obey me as King of the Forest?"" inquired the Lion.",1,8.40667910000775,0.3117430508136749,0.3691210448741913,0.319135844707489,0.30358973145484924,0.3012272119522095,0.39518308639526367,0.1676531881093979,0.4258241355419159,0.406522661447525,0.2715345323085785,0.4305342137813568,0.2979312241077423,0.20062105357646942,0.552851676940918,0.24652725458145142,0.2160995900630951,0.22187332808971405,0.5620270371437073
201,the Princess,58,8929,You,45210,45211,1837,first_second_person_keep_original,False,"The Lion went back to the opening where the beasts of the forest were waiting for him and said proudly: "" [[You]] need fear your enemy no longer.","The Lion went back to the opening where the beasts of the forest were waiting for him and said proudly: "" You need fear your enemy no longer.","The Lion went back to the opening where the beasts of the forest were waiting for him and said proudly: "" You need fear your enemy no longer.","The Lion went back to the opening where the beasts of the forest were waiting for him and said proudly: "" You need fear your enemy no longer.",1,8.40667910000775,0.4327864348888397,0.34202808141708374,0.22518539428710938,0.20885345339775085,0.3250619173049927,0.46608462929725647,0.30859604477882385,0.42718982696533203,0.26421409845352173,0.3723953068256378,0.33186277747154236,0.2957419157028198,0.14151610434055328,0.5496859550476074,0.3087978661060333,0.3043549954891205,0.1533384919166565,0.5423065423965454
201,the Princess,59,8931,your,45213,45214,1837,first_second_person_keep_original,False,"The Lion went back to the opening where the beasts of the forest were waiting for him and said proudly: ""You need fear [[your]] enemy no longer.","The Lion went back to the opening where the beasts of the forest were waiting for him and said proudly: ""You need fear your enemy no longer.","The Lion went back to the opening where the beasts of the forest were waiting for him and said proudly: ""You need fear your enemy no longer.","The Lion went back to the opening where the beasts of the forest were waiting for him and said proudly: ""You need fear your enemy no longer.",1,8.40667910000775,0.43597903847694397,0.3452247679233551,0.2187962681055069,0.22336390614509583,0.32850250601768494,0.44813358783721924,0.29980456829071045,0.4223794937133789,0.27781596779823303,0.38350993394851685,0.3264355957508087,0.29005444049835205,0.14783655107021332,0.5543990135192871,0.2977644205093384,0.31223246455192566,0.15025031566619873,0.537517249584198
201,the Princess,60,8956,you,45356,45357,1842,first_second_person_keep_original,False,"They had nearly reached the first rock when they heard a rough voice cry out, ""Keep back!"" ""Who are [[you]]?"" asked the Scarecrow.","They had nearly reached the first rock when they heard a rough voice cry out, ""Keep back!"" ""Who are you?"" asked the Scarecrow.","They had nearly reached the first rock when they heard a rough voice cry out, ""Keep back!"" ""Who are you?"" asked the Scarecrow.","They had nearly reached the first rock when they heard a rough voice cry out, ""Keep back!"" ""Who are you?"" asked the Scarecrow.",1,8.40667910000775,0.23649106919765472,0.35087907314300537,0.4126299023628235,0.13899585604667664,0.2885628044605255,0.5724413990974426,0.11211132258176804,0.28895461559295654,0.5989340543746948,0.07051178067922592,0.586795449256897,0.34269285202026367,0.2333647608757019,0.35566502809524536,0.41097018122673035,0.14470785856246948,0.20198896527290344,0.6533030867576599
201,the Princess,61,8983,your,45529,45530,1849,first_second_person_keep_original,False,"So he said, ""I'm sorry not to do as you wish, but we must pass over [[your]] hill whether you like it or not,"" and he walked boldly forward.","So he said, ""I'm sorry not to do as you wish, but we must pass over your hill whether you like it or not,"" and he walked boldly forward.","So he said, ""I'm sorry not to do as you wish, but we must pass over your hill whether you like it or not,"" and he walked boldly forward.","So he said, ""I'm sorry not to do as you wish, but we must pass over your hill whether you like it or not,"" and he walked boldly forward.",1,8.40667910000775,0.13360625505447388,0.3638894557952881,0.5025042295455933,0.37820860743522644,0.2702935039997101,0.3514978885650635,0.7768764495849609,0.1297023594379425,0.0934211015701294,0.07765471190214157,0.49175241589546204,0.430592805147171,0.04528549686074257,0.599731981754303,0.3549826145172119,0.6444163918495178,0.08385074883699417,0.2717329263687134
