cluster_id,subject,mention_index_in_cluster,mention_id,mention_text,mention_start,mention_end,sentence_index,mention_render_rule,mention_render_was_changed,original_context_text,rendered_context_text,context_text,normalized_context_text,chunk_index,elapsed_seconds_at_completion,openness_positive_probability,openness_negative_probability,openness_neutral_probability,conscientiousness_positive_probability,conscientiousness_negative_probability,conscientiousness_neutral_probability,extraversion_positive_probability,extraversion_negative_probability,extraversion_neutral_probability,agreeableness_positive_probability,agreeableness_negative_probability,agreeableness_neutral_probability,neuroticism_positive_probability,neuroticism_negative_probability,neuroticism_neutral_probability,OCEAN_weight_high_probability,OCEAN_weight_medium_probability,OCEAN_weight_low_probability
10,the West,46,3859,the Witch,24419,24421,980,proper_name_to_canonical,True,"""When [[the Witch]] is dead, come to me, and I will then give you the biggest and kindest and most loving heart in all the Land of Oz.""","""When the West is dead, come to me, and I will then give you the biggest and kindest and most loving heart in all the Land of Oz.""","""When the West is dead, come to me, and I will then give you the biggest and kindest and most loving heart in all the Land of Oz.""","""When the West is dead, come to me, and I will then give you the biggest and kindest and most loving heart in all the Land of Oz.""",1,11.456428700010292,0.29851222038269043,0.3628985583782196,0.3385891318321228,0.25079742074012756,0.27117666602134705,0.47802597284317017,0.30234986543655396,0.39203476905822754,0.30561527609825134,0.649612545967102,0.1312417984008789,0.21914567053318024,0.15699338912963867,0.7014516592025757,0.14155496656894684,0.263621062040329,0.3249727189540863,0.4114062190055847
10,the West,47,3895,the lovely Lady,24531,24534,983,proper_name_to_canonical,True,"And if he is [[the lovely Lady]], I shall pretend to spring upon her, and so compel her to do my bidding.","And if he is the West, I shall pretend to spring upon her, and so compel her to do my bidding.","And if he is the West, I shall pretend to spring upon her, and so compel her to do my bidding.","And if he is the West, I shall pretend to spring upon her, and so compel her to do my bidding.",1,11.456428700010292,0.10736902803182602,0.3900640308856964,0.502566933631897,0.13652588427066803,0.3036363124847412,0.5598377585411072,0.1354638785123825,0.2958802878856659,0.568655788898468,0.026962503790855408,0.38345882296562195,0.5895786285400391,0.20933426916599274,0.5740528106689453,0.21661292016506195,0.20718321204185486,0.34321218729019165,0.4496045708656311
10,the West,48,3897,her,24541,24542,983,third_person_object_pronoun_to_canonical,True,"And if he is the lovely Lady, I shall pretend to spring upon [[her]], and so compel her to do my bidding.","And if he is the lovely Lady, I shall pretend to spring upon the West, and so compel her to do my bidding.","And if he is the lovely Lady, I shall pretend to spring upon the West, and so compel her to do my bidding.","And if he is the lovely Lady, I shall pretend to spring upon the West, and so compel her to do my bidding.",1,11.456428700010292,0.15960873663425446,0.31372183561325073,0.526669442653656,0.14101256430149078,0.349691778421402,0.509295642375946,0.17381462454795837,0.3138169050216675,0.5123685002326965,0.07843644917011261,0.2635393738746643,0.658024251461029,0.28665193915367126,0.4703071415424347,0.24304090440273285,0.14026644825935364,0.37868621945381165,0.4810473620891571
10,the West,49,3898,her,24546,24547,983,third_person_object_pronoun_to_canonical,True,"And if he is the lovely Lady, I shall pretend to spring upon her, and so compel [[her]] to do my bidding.","And if he is the lovely Lady, I shall pretend to spring upon her, and so compel the West to do my bidding.","And if he is the lovely Lady, I shall pretend to spring upon her, and so compel the West to do my bidding.","And if he is the lovely Lady, I shall pretend to spring upon her, and so compel the West to do my bidding.",1,11.456428700010292,0.10899169743061066,0.3190954923629761,0.5719128251075745,0.07956455647945404,0.32530781626701355,0.5951275825500488,0.13578949868679047,0.2891556918621063,0.5750547647476196,0.05457393452525139,0.23821870982646942,0.7072073817253113,0.30772364139556885,0.4293231964111328,0.26295310258865356,0.10265650600194931,0.32783856987953186,0.5695049166679382
10,the West,50,3963,the Wicked Witch,24872,24875,996,proper_name_to_canonical,True,"The Ball of Fire burned fiercely for a time, and the voice said, ""Bring me proof that [[the Wicked Witch]] is dead, and that moment I will give you courage.","The Ball of Fire burned fiercely for a time, and the voice said, ""Bring me proof that the West is dead, and that moment I will give you courage.","The Ball of Fire burned fiercely for a time, and the voice said, ""Bring me proof that the West is dead, and that moment I will give you courage.","The Ball of Fire burned fiercely for a time, and the voice said, ""Bring me proof that the West is dead, and that moment I will give you courage.",1,11.456428700010292,0.19995911419391632,0.4308202862739563,0.3692205548286438,0.3721911311149597,0.29385292530059814,0.33395594358444214,0.2834705412387848,0.3993673324584961,0.31716206669807434,0.07797260582447052,0.3860500454902649,0.5359773635864258,0.3962347209453583,0.4176906645298004,0.18607455492019653,0.337552934885025,0.11213141679763794,0.5503155589103699
10,the West,51,3968,the Witch,24891,24893,997,proper_name_to_canonical,True,"But as long as [[the Witch]] lives, you must remain a coward.","But as long as the West lives, you must remain a coward.","But as long as the West lives, you must remain a coward.","But as long as the West lives, you must remain a coward.",1,11.456428700010292,0.14044763147830963,0.4732758402824402,0.3862764835357666,0.30264535546302795,0.2796279788017273,0.41772666573524475,0.11480659991502762,0.4146474599838257,0.4705458879470825,0.09436150640249252,0.452377051115036,0.45326146483421326,0.35123488306999207,0.46349653601646423,0.1852686107158661,0.24502359330654144,0.6122035980224609,0.14277277886867523
10,the West,52,3990,the Wicked Witch,25010,25013,1002,proper_name_to_canonical,True,"""There is only one thing we can do,"" returned the Lion, ""and that is to go to the land of the Winkies, seek out [[the Wicked Witch]], and destroy her.""","""There is only one thing we can do,"" returned the Lion, ""and that is to go to the land of the Winkies, seek out the West, and destroy her.""","""There is only one thing we can do,"" returned the Lion, ""and that is to go to the land of the Winkies, seek out the West, and destroy her.""","""There is only one thing we can do,"" returned the Lion, ""and that is to go to the land of the Winkies, seek out the West, and destroy her.""",1,11.456428700010292,0.11783574521541595,0.32219308614730835,0.5599712133407593,0.2649390697479248,0.30080223083496094,0.43425872921943665,0.1578277051448822,0.35558342933654785,0.48658886551856995,0.09545846283435822,0.48171061277389526,0.4228309690952301,0.23450767993927002,0.5190093517303467,0.2464829832315445,0.17421650886535645,0.24985845386981964,0.5759250521659851
10,the West,53,3991,her,25016,25017,1002,third_person_object_pronoun_to_canonical,True,"""There is only one thing we can do,"" returned the Lion, ""and that is to go to the land of the Winkies, seek out the Wicked Witch, and destroy [[her]].""","""There is only one thing we can do,"" returned the Lion, ""and that is to go to the land of the Winkies, seek out the Wicked Witch, and destroy the West.""","""There is only one thing we can do,"" returned the Lion, ""and that is to go to the land of the Winkies, seek out the Wicked Witch, and destroy the West.""","""There is only one thing we can do,"" returned the Lion, ""and that is to go to the land of the Winkies, seek out the Wicked Witch, and destroy the West.""",1,11.456428700010292,0.15431420505046844,0.44892773032188416,0.3967580795288086,0.28221452236175537,0.3420819640159607,0.3757035434246063,0.16969746351242065,0.36929845809936523,0.4610040783882141,0.11559705436229706,0.4817168712615967,0.40268608927726746,0.26294198632240295,0.49316295981407166,0.24389506876468658,0.2213398963212967,0.31122615933418274,0.46743395924568176
10,the West,54,4018,the Witch,25178,25180,1012,proper_name_to_canonical,True,"""I will go with you; but I'm too much of a coward to kill [[the Witch]],"" said the Lion.","""I will go with you; but I'm too much of a coward to kill the West,"" said the Lion.","""I will go with you; but I'm too much of a coward to kill the West,"" said the Lion.","""I will go with you; but I'm too much of a coward to kill the West,"" said the Lion.",1,11.456428700010292,0.12426470965147018,0.32153216004371643,0.5542030930519104,0.21567778289318085,0.16464078426361084,0.6196814179420471,0.12316238880157471,0.3382406532764435,0.5385969877243042,0.14499928057193756,0.44903457164764404,0.4059661626815796,0.1329941749572754,0.6530240178108215,0.21398185193538666,0.16619515419006348,0.4022009074687958,0.43160396814346313
10,the West,55,4032,a Witch,25227,25229,1014,proper_name_to_canonical,True,""" ""I haven't the heart to harm even [[a Witch]],"" remarked the Tin Woodman; ""but if you go I certainly shall go with you.",""" ""I haven't the heart to harm even the West,"" remarked the Tin Woodman; ""but if you go I certainly shall go with you.",""" ""I haven't the heart to harm even the West,"" remarked the Tin Woodman; ""but if you go I certainly shall go with you.",""" ""I haven't the heart to harm even the West,"" remarked the Tin Woodman; ""but if you go I certainly shall go with you.",1,11.456428700010292,0.2013302743434906,0.32109710574150085,0.47757261991500854,0.24514760076999664,0.20522892475128174,0.5496234893798828,0.1842912882566452,0.3154863119125366,0.500222384929657,0.3280525207519531,0.2227858304977417,0.4491616189479828,0.12555694580078125,0.5286145210266113,0.3458285331726074,0.15521569550037384,0.32619374990463257,0.51859050989151
10,the West,56,4077,the Wicked Witch of the West,25444,25450,1021,proper_name_to_canonical,True,"""Which road leads to [[the Wicked Witch of the West]]?"" asked Dorothy.","""Which road leads to the West?"" asked Dorothy.","""Which road leads to the West?"" asked Dorothy.","""Which road leads to the West?"" asked Dorothy.",1,11.456428700010292,0.4225910007953644,0.2671763002872467,0.3102327287197113,0.28275150060653687,0.22965095937252045,0.4875974953174591,0.1586146503686905,0.3874334394931793,0.45395195484161377,0.2730666399002075,0.1790814846754074,0.5478518605232239,0.1588478535413742,0.5343663096427917,0.30678585171699524,0.08077893406152725,0.4074345529079437,0.5117865204811096
10,the West,57,4083,her,25491,25492,1023,third_person_object_pronoun_to_canonical,True,"""No one ever wishes to go that way."" ""How, then, are we to find [[her]]?"" inquired the girl.","""No one ever wishes to go that way."" ""How, then, are we to find the West?"" inquired the girl.","""No one ever wishes to go that way."" ""How, then, are we to find the West?"" inquired the girl.","""No one ever wishes to go that way."" ""How, then, are we to find the West?"" inquired the girl.",1,11.456428700010292,0.20163393020629883,0.306574285030365,0.4917917549610138,0.17676255106925964,0.1951812207698822,0.6280561685562134,0.06542656570672989,0.2514801025390625,0.6830933094024658,0.07916511595249176,0.06305432319641113,0.8577805161476135,0.15723252296447754,0.4656784236431122,0.37708911299705505,0.08134819567203522,0.35232672095298767,0.5663251280784607
10,the West,58,4086,she,25513,25514,1024,third_person_subject_pronoun_to_canonical,True,"""That will be easy,"" replied the man, ""for when [[she]] knows you are in the country of the Winkies she will find you, and make you all her slaves.","""That will be easy,"" replied the man, ""for when the West knows you are in the country of the Winkies she will find you, and make you all her slaves.","""That will be easy,"" replied the man, ""for when the West knows you are in the country of the Winkies she will find you, and make you all her slaves.","""That will be easy,"" replied the man, ""for when the West knows you are in the country of the Winkies she will find you, and make you all her slaves.",1,11.456428700010292,0.0712980255484581,0.3171263635158539,0.6115756034851074,0.2505548596382141,0.18968361616134644,0.5597615242004395,0.1217966303229332,0.27407118678092957,0.6041322350502014,0.04187387600541115,0.7108412981033325,0.2472848743200302,0.18424668908119202,0.5081008076667786,0.30765247344970703,0.1652267724275589,0.30134961009025574,0.533423662185669
10,the West,59,4091,she,25523,25524,1024,third_person_subject_pronoun_to_canonical,True,"""That will be easy,"" replied the man, ""for when she knows you are in the country of the Winkies [[she]] will find you, and make you all her slaves.","""That will be easy,"" replied the man, ""for when she knows you are in the country of the Winkies the West will find you, and make you all her slaves.","""That will be easy,"" replied the man, ""for when she knows you are in the country of the Winkies the West will find you, and make you all her slaves.","""That will be easy,"" replied the man, ""for when she knows you are in the country of the Winkies the West will find you, and make you all her slaves.",1,11.456428700010292,0.040952738374471664,0.2724453806877136,0.6866018772125244,0.23318198323249817,0.18302662670612335,0.5837914347648621,0.11574988812208176,0.25024184584617615,0.6340082287788391,0.03257092833518982,0.741672933101654,0.22575610876083374,0.09771313518285751,0.5393271446228027,0.36295974254608154,0.1549060344696045,0.2954349219799042,0.5496590733528137
10,the West,60,4096,her,25532,25533,1024,third_person_possessive_pronoun_to_canonical_possessive,True,"""That will be easy,"" replied the man, ""for when she knows you are in the country of the Winkies she will find you, and make you all [[her]] slaves.","""That will be easy,"" replied the man, ""for when she knows you are in the country of the Winkies she will find you, and make you all the West's slaves.","""That will be easy,"" replied the man, ""for when she knows you are in the country of the Winkies she will find you, and make you all the West's slaves.","""That will be easy,"" replied the man, ""for when she knows you are in the country of the Winkies she will find you, and make you all the West's slaves.",1,11.456428700010292,0.06088576465845108,0.25076764822006226,0.6883465051651001,0.17989356815814972,0.21279603242874146,0.6073104739189148,0.18471769988536835,0.24783767759799957,0.5674446225166321,0.0660247653722763,0.6024183630943298,0.33155688643455505,0.09905050694942474,0.49843570590019226,0.4025138318538666,0.18662914633750916,0.35728636384010315,0.45608454942703247
10,the West,61,4100,her,25552,25553,1025,third_person_object_pronoun_to_canonical,True,""" ""Perhaps not,"" said the Scarecrow, ""for we mean to destroy [[her]].",""" ""Perhaps not,"" said the Scarecrow, ""for we mean to destroy the West.",""" ""Perhaps not,"" said the Scarecrow, ""for we mean to destroy the West.",""" ""Perhaps not,"" said the Scarecrow, ""for we mean to destroy the West.",1,11.456428700010292,0.16486816108226776,0.4066602885723114,0.42847153544425964,0.21069340407848358,0.28854674100875854,0.5007598400115967,0.17384003102779388,0.2888616919517517,0.537298321723938,0.14959731698036194,0.3613268733024597,0.48907577991485596,0.20424726605415344,0.5040379762649536,0.2917148172855377,0.13164480030536652,0.351237028837204,0.5171182155609131
10,the West,62,4102,her,25577,25578,1027,third_person_possessive_pronoun_to_canonical_possessive,True,"""No one has ever destroyed [[her]] before, so I naturally thought she would make slaves of you, as she has of the rest.","""No one has ever destroyed the West's before, so I naturally thought she would make slaves of you, as she has of the rest.","""No one has ever destroyed the West's before, so I naturally thought she would make slaves of you, as she has of the rest.","""No one has ever destroyed the West's before, so I naturally thought she would make slaves of you, as she has of the rest.",1,11.456428700010292,0.043619271367788315,0.2485722303390503,0.7078084945678711,0.09249011427164078,0.2253662347793579,0.6821436285972595,0.12103306502103806,0.34546518325805664,0.5335016846656799,0.006404632702469826,0.5807647705078125,0.41283053159713745,0.2290467470884323,0.5325496196746826,0.23840361833572388,0.24434193968772888,0.2810985743999481,0.4745595157146454
10,the West,63,4104,she,25584,25585,1027,third_person_subject_pronoun_to_canonical,True,"""No one has ever destroyed her before, so I naturally thought [[she]] would make slaves of you, as she has of the rest.","""No one has ever destroyed her before, so I naturally thought the West would make slaves of you, as she has of the rest.","""No one has ever destroyed her before, so I naturally thought the West would make slaves of you, as she has of the rest.","""No one has ever destroyed her before, so I naturally thought the West would make slaves of you, as she has of the rest.",1,11.456428700010292,0.043457116931676865,0.23723238706588745,0.7193105220794678,0.1083819568157196,0.1620662659406662,0.7295517921447754,0.12014331668615341,0.27770960330963135,0.602147102355957,0.006382201798260212,0.5152367353439331,0.47838112711906433,0.1995544284582138,0.5957594513893127,0.20468610525131226,0.2517758011817932,0.24763043224811554,0.5005937218666077
10,the West,64,4107,she,25592,25593,1027,third_person_subject_pronoun_to_canonical,True,"""No one has ever destroyed her before, so I naturally thought she would make slaves of you, as [[she]] has of the rest.","""No one has ever destroyed her before, so I naturally thought she would make slaves of you, as the West has of the rest.","""No one has ever destroyed her before, so I naturally thought she would make slaves of you, as the West has of the rest.","""No one has ever destroyed her before, so I naturally thought she would make slaves of you, as the West has of the rest.",2,19.46748469999875,0.06197764351963997,0.2697449326515198,0.6682774424552917,0.1712404042482376,0.20695917308330536,0.621800422668457,0.19256050884723663,0.2799004018306732,0.527539074420929,0.027782052755355835,0.41967397928237915,0.5525439977645874,0.1901596188545227,0.5610977411270142,0.24874258041381836,0.2462540864944458,0.3959945738315582,0.3577512800693512
10,the West,65,4108,she,25603,25604,1028,third_person_subject_pronoun_to_canonical,True,"But take care; for [[she]] is wicked and fierce, and may not allow you to destroy her.","But take care; for the West is wicked and fierce, and may not allow you to destroy her.","But take care; for the West is wicked and fierce, and may not allow you to destroy her.","But take care; for the West is wicked and fierce, and may not allow you to destroy her.",2,19.46748469999875,0.011344751343131065,0.12364654988050461,0.8650087118148804,0.03339952975511551,0.042469073086977005,0.9241313934326172,0.0770639106631279,0.26688626408576965,0.6560497879981995,0.0016605618875473738,0.8669389486312866,0.1314004808664322,0.037956468760967255,0.12494157999753952,0.837101936340332,0.8326490521430969,0.024204203858971596,0.14314672350883484
10,the West,66,4111,her,25616,25617,1028,third_person_object_pronoun_to_canonical,True,"But take care; for she is wicked and fierce, and may not allow you to destroy [[her]].","But take care; for she is wicked and fierce, and may not allow you to destroy the West.","But take care; for she is wicked and fierce, and may not allow you to destroy the West.","But take care; for she is wicked and fierce, and may not allow you to destroy the West.",2,19.46748469999875,0.10496409237384796,0.31613123416900635,0.5789046883583069,0.19037511944770813,0.2625090181827545,0.5471158027648926,0.11290962249040604,0.43282684683799744,0.4542635679244995,0.009063058532774448,0.8479153513908386,0.1430215984582901,0.1823573261499405,0.4825635552406311,0.3350790739059448,0.40906035900115967,0.04948551952838898,0.5414540767669678
10,the West,67,4114,her,25635,25636,1029,third_person_object_pronoun_to_canonical,True,"Keep to the West, where the sun sets, and you cannot fail to find [[her]]."" They thanked him and bade him good-bye, and turned toward the West, walking over fields of soft grass dotted here and there with daisies and buttercups.","Keep to the West, where the sun sets, and you cannot fail to find the West."" They thanked him and bade him good-bye, and turned toward the West, walking over fields of soft grass dotted here and there with daisies and buttercups.","Keep to the West, where the sun sets, and you cannot fail to find the West."" They thanked him and bade him good-bye, and turned toward the West, walking over fields of soft grass dotted here and there with daisies and buttercups.","Keep to the West, where the sun sets, and you cannot fail to find the West."" They thanked him and bade him good-bye, and turned toward the West, walking over fields of soft grass dotted here and there with daisies and buttercups.",2,19.46748469999875,0.0984935462474823,0.1014217808842659,0.8000847101211548,0.17306570708751678,0.07278139889240265,0.7541528940200806,0.07137231528759003,0.08917193114757538,0.839455783367157,0.13205835223197937,0.010588901117444038,0.8573526740074158,0.017425844445824623,0.22920449078083038,0.7533696293830872,0.057273898273706436,0.2405441254377365,0.7021819949150085
10,the West,68,4128,this country of the West,25753,25758,1033,proper_name_to_canonical,True,"As they advanced the ground became rougher and hillier, for there were no farms nor houses in [[this country of the West]], and the ground was untilled.","As they advanced the ground became rougher and hillier, for there were no farms nor houses in the West, and the ground was untilled.","As they advanced the ground became rougher and hillier, for there were no farms nor houses in the West, and the ground was untilled.","As they advanced the ground became rougher and hillier, for there were no farms nor houses in the West, and the ground was untilled.",2,19.46748469999875,0.01923450268805027,0.10801732540130615,0.8727481961250305,0.06445854157209396,0.12018944323062897,0.8153520226478577,0.04316426068544388,0.20652934908866882,0.7503063678741455,0.010098925791680813,0.027613049373030663,0.9622880220413208,0.06801607459783554,0.5225948691368103,0.40938904881477356,0.02913421206176281,0.22021803259849548,0.750647783279419
10,the West,69,4129,the West,25756,25758,1033,proper_name_to_canonical,False,"As they advanced the ground became rougher and hillier, for there were no farms nor houses in this country of [[the West]], and the ground was untilled.","As they advanced the ground became rougher and hillier, for there were no farms nor houses in this country of the West, and the ground was untilled.","As they advanced the ground became rougher and hillier, for there were no farms nor houses in this country of the West, and the ground was untilled.","As they advanced the ground became rougher and hillier, for there were no farms nor houses in this country of the West, and the ground was untilled.",2,19.46748469999875,0.02698276750743389,0.13810452818870544,0.8349127769470215,0.08480395376682281,0.17047426104545593,0.7447217106819153,0.07154187560081482,0.25562727451324463,0.6728308200836182,0.014837580733001232,0.048745665699243546,0.9364168047904968,0.07998844981193542,0.5130025148391724,0.4070090651512146,0.03595611825585365,0.24043403565883636,0.7236098647117615
10,the West,70,4140,the Wicked Witch of the West,25821,25827,1035,proper_name_to_canonical,True,"Now [[the Wicked Witch of the West]] had but one eye, yet that was as powerful as a telescope, and could see everywhere.","Now the West had but one eye, yet that was as powerful as a telescope, and could see everywhere.","Now the West had but one eye, yet that was as powerful as a telescope, and could see everywhere.","Now the West had but one eye, yet that was as powerful as a telescope, and could see everywhere.",2,19.46748469999875,0.3561258912086487,0.3164357542991638,0.3274383842945099,0.2592959403991699,0.36709704995155334,0.37360697984695435,0.0725286528468132,0.4827454686164856,0.44472599029541016,0.17170260846614838,0.26750102639198303,0.560796320438385,0.1174272671341896,0.6063277721405029,0.2762449383735657,0.13205857574939728,0.22565609216690063,0.6422853469848633
10,the West,71,4142,she,25849,25850,1036,third_person_subject_pronoun_to_canonical,True,"So, as [[she]] sat in the door of her castle, she happened to look around and saw Dorothy lying asleep, with her friends all about her.","So, as the West sat in the door of her castle, she happened to look around and saw Dorothy lying asleep, with her friends all about her.","So, as the West sat in the door of her castle, she happened to look around and saw Dorothy lying asleep, with her friends all about her.","So, as the West sat in the door of her castle, she happened to look around and saw Dorothy lying asleep, with her friends all about her.",2,19.46748469999875,0.30014875531196594,0.40290945768356323,0.29694175720214844,0.18443578481674194,0.3464271128177643,0.46913713216781616,0.2012815773487091,0.24255496263504028,0.556163489818573,0.5123270750045776,0.15315395593643188,0.33451899886131287,0.11408977955579758,0.7425298690795898,0.14338041841983795,0.16263917088508606,0.7081992030143738,0.12916171550750732
