cluster_id,subject,mention_index_in_cluster,mention_id,mention_text,mention_start,mention_end,sentence_index,mention_render_rule,mention_render_was_changed,original_context_text,rendered_context_text,context_text,normalized_context_text,chunk_index,elapsed_seconds_at_completion,openness_positive_probability,openness_negative_probability,openness_neutral_probability,openness,conscientiousness_positive_probability,conscientiousness_negative_probability,conscientiousness_neutral_probability,conscientiousness,extraversion_positive_probability,extraversion_negative_probability,extraversion_neutral_probability,extraversion,agreeableness_positive_probability,agreeableness_negative_probability,agreeableness_neutral_probability,agreeableness,neuroticism_positive_probability,neuroticism_negative_probability,neuroticism_neutral_probability,neuroticism,OCEAN_weight_high_probability,OCEAN_weight_medium_probability,OCEAN_weight_low_probability,OCEAN_weight,OCEAN_weight_source
335,the Winged Monkeys,0,5349,the Winged Monkeys,27111,27114,1091,proper_name_to_canonical,False,"Whoever owned it could call three times upon [[the Winged Monkeys]], who would obey any order they were given.","Whoever owned it could call three times upon the Winged Monkeys, who would obey any order they were given.","Whoever owned it could call three times upon the Winged Monkeys, who would obey any order they were given.","Whoever owned it could call three times upon the Winged Monkeys, who would obey any order they were given.",1,20.13132939999923,0.06283359229564667,0.32538890838623047,0.6117775440216064,50.0,0.7588215470314026,0.024223145097494125,0.216955304145813,96.91,0.13009943068027496,0.38463062047958374,0.4852699339389801,50.0,0.7550055384635925,0.0220330897718668,0.22296138107776642,97.16,0.031125936657190323,0.5503751039505005,0.4184989035129547,50.0,0.062141671776771545,0.1351347118616104,0.8027236461639404,12.97,direct_nli_zero_shot
335,the Winged Monkeys,1,5350,they,27120,27121,1091,third_person_subject_pronoun_to_canonical,True,"Whoever owned it could call three times upon the Winged Monkeys, who would obey any order [[they]] were given.","Whoever owned it could call three times upon the Winged Monkeys, who would obey any order the Winged Monkeys were given.","Whoever owned it could call three times upon the Winged Monkeys, who would obey any order the Winged Monkeys were given.","Whoever owned it could call three times upon the Winged Monkeys, who would obey any order the Winged Monkeys were given.",1,20.13132939999923,0.12226494401693344,0.2938717305660248,0.5838633179664612,50.0,0.7591711282730103,0.03610129654407501,0.20472760498523712,95.46,0.1671847701072693,0.3983231484889984,0.4344920814037323,50.0,0.8429758548736572,0.02423073537647724,0.13279330730438232,97.21,0.05277719721198082,0.5914535522460938,0.3557692766189575,8.19,0.06120578572154045,0.17023688554763794,0.7685573101043701,14.63,direct_nli_zero_shot
335,the Winged Monkeys,2,5366,The Winged Monkeys,27170,27173,1095,proper_name_to_canonical,True,[[The Winged Monkeys]] had helped her do this.,the Winged Monkeys had helped her do this.,the Winged Monkeys had helped her do this.,the Winged Monkeys had helped her do this.,1,20.13132939999923,0.4568386375904083,0.3110808730125427,0.23208045959472656,50.0,0.2960232198238373,0.4083869755268097,0.2955898940563202,50.0,0.3694261312484741,0.42344576120376587,0.2071281224489212,50.0,0.9182642102241516,0.02339024655520916,0.05834546685218811,97.52,0.09895679354667664,0.7522010803222656,0.14884217083454132,11.63,0.17436198890209198,0.543138325214386,0.2824997007846832,44.59,direct_nli_zero_shot
335,the Winged Monkeys,3,5377,The Winged Monkeys,27204,27207,1097,proper_name_to_canonical,True,[[The Winged Monkeys]] had also helped her in doing this.,the Winged Monkeys had also helped her in doing this.,the Winged Monkeys had also helped her in doing this.,the Winged Monkeys had also helped her in doing this.,1,20.13132939999923,0.46114659309387207,0.2437201589345932,0.29513323307037354,50.0,0.34987688064575195,0.3157788813114166,0.3343442678451538,50.0,0.3245684802532196,0.42135801911354065,0.25407347083091736,50.0,0.9476328492164612,0.010178480297327042,0.042188625782728195,98.94,0.08126095682382584,0.7255098819732666,0.19322910904884338,10.07,0.18532808125019073,0.5193848609924316,0.29528704285621643,44.5,direct_nli_zero_shot
335,the Winged Monkeys,4,5433,the Winged Monkeys,27575,27578,1111,proper_name_to_canonical,False,"Then, with a great deal of chattering and noise, [[the Winged Monkeys]] flew away to the place where Dorothy and her friends were walking.","Then, with a great deal of chattering and noise, the Winged Monkeys flew away to the place where Dorothy and her friends were walking.","Then, with a great deal of chattering and noise, the Winged Monkeys flew away to the place where Dorothy and her friends were walking.","Then, with a great deal of chattering and noise, the Winged Monkeys flew away to the place where Dorothy and her friends were walking.",1,20.13132939999923,0.5193430185317993,0.1936383694410324,0.2870185971260071,72.84,0.0684008002281189,0.29269173741340637,0.6389074325561523,50.0,0.9178914427757263,0.02459271438419819,0.05751579627394676,97.39,0.39829903841018677,0.1474950909614563,0.4542059600353241,50.0,0.26426276564598083,0.22780874371528625,0.5079284310340881,50.0,0.04343281686306,0.323602557182312,0.6329646110534668,20.52,direct_nli_zero_shot
335,the Winged Monkeys,5,5438,Some of the Monkeys,27592,27596,1112,proper_name_to_canonical,True,[[Some of the Monkeys]] seized the Tin Woodman and carried him through the air until they were over a country thickly covered with sharp rocks.,the Winged Monkeys seized the Tin Woodman and carried him through the air until they were over a country thickly covered with sharp rocks.,the Winged Monkeys seized the Tin Woodman and carried him through the air until they were over a country thickly covered with sharp rocks.,the Winged Monkeys seized the Tin Woodman and carried him through the air until they were over a country thickly covered with sharp rocks.,1,20.13132939999923,0.5625049471855164,0.3118605613708496,0.12563444674015045,50.0,0.16957411170005798,0.3554237484931946,0.47500213980674744,50.0,0.7277929186820984,0.18649105727672577,0.08571600168943405,79.6,0.25205671787261963,0.41801342368125916,0.329929918050766,50.0,0.11586125940084457,0.5769410729408264,0.30719757080078125,16.72,0.1711222529411316,0.10657697170972824,0.7223008275032043,22.44,direct_nli_zero_shot
335,the Winged Monkeys,6,5442,they,27607,27608,1112,third_person_subject_pronoun_to_canonical,True,Some of the Monkeys seized the Tin Woodman and carried him through the air until [[they]] were over a country thickly covered with sharp rocks.,Some of the Monkeys seized the Tin Woodman and carried him through the air until the Winged Monkeys were over a country thickly covered with sharp rocks.,Some of the Monkeys seized the Tin Woodman and carried him through the air until the Winged Monkeys were over a country thickly covered with sharp rocks.,Some of the Monkeys seized the Tin Woodman and carried him through the air until the Winged Monkeys were over a country thickly covered with sharp rocks.,1,20.13132939999923,0.5952364802360535,0.2979913055896759,0.10677214711904526,50.0,0.1849818080663681,0.3654632568359375,0.4495548903942108,50.0,0.7696262001991272,0.14711901545524597,0.08325481414794922,83.95,0.35533690452575684,0.5106458067893982,0.13401727378368378,50.0,0.13363316655158997,0.5933717489242554,0.27299511432647705,18.38,0.22145509719848633,0.29936766624450684,0.47917717695236206,37.11,direct_nli_zero_shot
335,the Winged Monkeys,7,5445,they,27619,27620,1113,third_person_subject_pronoun_to_canonical,True,"Here [[they]] dropped the poor Woodman, who fell a great distance to the rocks, where he lay so battered and dented that he could neither move nor groan.","Here the Winged Monkeys dropped the poor Woodman, who fell a great distance to the rocks, where he lay so battered and dented that he could neither move nor groan.","Here the Winged Monkeys dropped the poor Woodman, who fell a great distance to the rocks, where he lay so battered and dented that he could neither move nor groan.","Here the Winged Monkeys dropped the poor Woodman, who fell a great distance to the rocks, where he lay so battered and dented that he could neither move nor groan.",1,20.13132939999923,0.10821198672056198,0.38552266359329224,0.5062653422355652,50.0,0.034302905201911926,0.2648288607597351,0.7008682489395142,50.0,0.07351084798574448,0.3626400828361511,0.5638490319252014,50.0,0.07404707372188568,0.44286954402923584,0.4830833971500397,50.0,0.09215076267719269,0.5768916606903076,0.33095765113830566,13.77,0.07863666862249374,0.23922079801559448,0.6821424961090088,19.82,direct_nli_zero_shot
335,the Winged Monkeys,8,5454,their,27660,27661,1114,third_person_possessive_pronoun_to_canonical_possessive,True,"Others of the Monkeys caught the Scarecrow, and with [[their]] long fingers pulled all of the straw out of his clothes and head.","Others of the Monkeys caught the Scarecrow, and with the Winged Monkeys' long fingers pulled all of the straw out of his clothes and head.","Others of the Monkeys caught the Scarecrow, and with the Winged Monkeys' long fingers pulled all of the straw out of his clothes and head.","Others of the Monkeys caught the Scarecrow, and with the Winged Monkeys' long fingers pulled all of the straw out of his clothes and head.",1,20.13132939999923,0.6703741550445557,0.14099916815757751,0.18862664699554443,82.62,0.31147363781929016,0.3746098279953003,0.31391656398773193,50.0,0.585844099521637,0.18411913514137268,0.23003679513931274,76.09,0.8816169500350952,0.0474974550306797,0.0708855614066124,94.89,0.0438225232064724,0.607763946056366,0.34841352701187134,6.73,0.08051998913288116,0.24923303723335266,0.6702468991279602,20.51,direct_nli_zero_shot
335,the Winged Monkeys,9,5457,They,27675,27676,1115,proper_name_to_canonical,True,[[They]] made his hat and boots and clothes into a small bundle and threw it into the top branches of a tall tree.,the Winged Monkeys made his hat and boots and clothes into a small bundle and threw it into the top branches of a tall tree.,the Winged Monkeys made his hat and boots and clothes into a small bundle and threw it into the top branches of a tall tree.,the Winged Monkeys made his hat and boots and clothes into a small bundle and threw it into the top branches of a tall tree.,1,20.13132939999923,0.2784814238548279,0.5186706185340881,0.20284795761108398,50.0,0.2883892357349396,0.48084333539009094,0.23076747357845306,50.0,0.10319475829601288,0.5486806035041809,0.34812459349632263,15.83,0.5029128193855286,0.38263094425201416,0.11445619910955429,50.0,0.3342960774898529,0.6057385802268982,0.059965264052152634,50.0,0.0769750326871872,0.3325326442718506,0.5904923677444458,24.32,direct_nli_zero_shot
335,the Winged Monkeys,10,5460,The remaining Monkeys,27700,27703,1116,proper_name_to_canonical,True,"[[The remaining Monkeys]] threw pieces of stout rope around the Lion and wound many coils about his body and head and legs, until he was unable to bite or scratch or struggle in any way.","the Winged Monkeys threw pieces of stout rope around the Lion and wound many coils about his body and head and legs, until he was unable to bite or scratch or struggle in any way.","the Winged Monkeys threw pieces of stout rope around the Lion and wound many coils about his body and head and legs, until he was unable to bite or scratch or struggle in any way.","the Winged Monkeys threw pieces of stout rope around the Lion and wound many coils about his body and head and legs, until he was unable to bite or scratch or struggle in any way.",1,20.13132939999923,0.21765047311782837,0.30158814787864685,0.48076131939888,50.0,0.314026802778244,0.3845658600330353,0.3014073669910431,50.0,0.20458829402923584,0.2302495241165161,0.5651622414588928,50.0,0.25991860032081604,0.41071027517318726,0.32937106490135193,50.0,0.05513300374150276,0.6246413588523865,0.3202255964279175,8.11,0.05879431590437889,0.13942259550094604,0.8017831444740295,12.85,direct_nli_zero_shot
335,the Winged Monkeys,11,5465,they,27738,27739,1117,third_person_subject_pronoun_to_canonical,True,"Then [[they]] lifted him up and flew away with him to the Witch's castle, where he was placed in a small yard with a high iron fence around it, so that he could not escape.","Then the Winged Monkeys lifted him up and flew away with him to the Witch's castle, where he was placed in a small yard with a high iron fence around it, so that he could not escape.","Then the Winged Monkeys lifted him up and flew away with him to the Witch's castle, where he was placed in a small yard with a high iron fence around it, so that he could not escape.","Then the Winged Monkeys lifted him up and flew away with him to the Witch's castle, where he was placed in a small yard with a high iron fence around it, so that he could not escape.",1,20.13132939999923,0.06466098874807358,0.27555543184280396,0.659783661365509,50.0,0.24884265661239624,0.3066800832748413,0.44447726011276245,50.0,0.1784963458776474,0.36357802152633667,0.4579256474971771,50.0,0.19622977077960968,0.35972046852111816,0.44404977560043335,50.0,0.06962795555591583,0.6360800266265869,0.29429197311401367,9.87,0.06768141686916351,0.20821911096572876,0.7240995168685913,17.18,direct_nli_zero_shot
335,the Winged Monkeys,12,5478,they,27779,27780,1118,third_person_subject_pronoun_to_canonical,True,But Dorothy [[they]] did not harm at all.,But Dorothy the Winged Monkeys did not harm at all.,But Dorothy the Winged Monkeys did not harm at all.,But Dorothy the Winged Monkeys did not harm at all.,1,20.13132939999923,0.23753008246421814,0.4205583930015564,0.34191155433654785,50.0,0.2523362636566162,0.33527204394340515,0.41239166259765625,50.0,0.20223991572856903,0.4186326265335083,0.37912753224372864,50.0,0.49253061413764954,0.21877267956733704,0.2886967957019806,50.0,0.06677258759737015,0.7077794075012207,0.22544799745082855,8.62,0.054441772401332855,0.2970525324344635,0.648505687713623,20.3,direct_nli_zero_shot
335,the Winged Monkeys,13,5485,the Winged Monkeys,27814,27817,1120,proper_name_to_canonical,False,"The leader of [[the Winged Monkeys]] flew up to her, his long, hairy arms stretched out and his ugly face grinning terribly; but he saw the mark of the Good Witch's kiss upon her forehead and stopped short, motioning the others not to touch her.","The leader of the Winged Monkeys flew up to her, his long, hairy arms stretched out and his ugly face grinning terribly; but he saw the mark of the Good Witch's kiss upon her forehead and stopped short, motioning the others not to touch her.","The leader of the Winged Monkeys flew up to her, his long, hairy arms stretched out and his ugly face grinning terribly; but he saw the mark of the Good Witch's kiss upon her forehead and stopped short, motioning the others not to touch her.","The leader of the Winged Monkeys flew up to her, his long, hairy arms stretched out and his ugly face grinning terribly; but he saw the mark of the Good Witch's kiss upon her forehead and stopped short, motioning the others not to touch her.",1,20.13132939999923,0.028566865250468254,0.49342384934425354,0.47800931334495544,50.0,0.05966804549098015,0.3013409674167633,0.6389909982681274,50.0,0.23183685541152954,0.3635304272174835,0.40463268756866455,50.0,0.032865993678569794,0.5805758833885193,0.3865581452846527,5.36,0.45787814259529114,0.23215468227863312,0.30996716022491455,50.0,0.2015046328306198,0.3895023763179779,0.40899303555488586,39.63,direct_nli_zero_shot
335,the Winged Monkeys,14,5502,them,27876,27877,1121,third_person_object_pronoun_to_canonical,True,"""We dare not harm this little girl,"" he said to [[them]], ""for she is protected by the Power of Good, and that is greater than the Power of Evil.","""We dare not harm this little girl,"" he said to the Winged Monkeys, ""for she is protected by the Power of Good, and that is greater than the Power of Evil.","""We dare not harm this little girl,"" he said to the Winged Monkeys, ""for she is protected by the Power of Good, and that is greater than the Power of Evil.","""We dare not harm this little girl,"" he said to the Winged Monkeys, ""for she is protected by the Power of Good, and that is greater than the Power of Evil.",1,20.13132939999923,0.16857624053955078,0.4546716809272766,0.3767520487308502,50.0,0.357438325881958,0.2805565595626831,0.3620050549507141,50.0,0.12502196431159973,0.46724268794059753,0.40773534774780273,50.0,0.4219655394554138,0.35794270038604736,0.2200917899608612,50.0,0.17232541739940643,0.4998590052127838,0.32781553268432617,25.64,0.14924220740795135,0.26422837376594543,0.5865294337272644,28.14,direct_nli_zero_shot
335,the Winged Monkeys,15,5511,they,27927,27928,1123,third_person_subject_pronoun_to_canonical,True,"So, carefully and gently, [[they]] lifted Dorothy in their arms and carried her swiftly through the air until they came to the castle, where they set her down upon the front doorstep.","So, carefully and gently, the Winged Monkeys lifted Dorothy in their arms and carried her swiftly through the air until they came to the castle, where they set her down upon the front doorstep.","So, carefully and gently, the Winged Monkeys lifted Dorothy in their arms and carried her swiftly through the air until they came to the castle, where they set her down upon the front doorstep.","So, carefully and gently, the Winged Monkeys lifted Dorothy in their arms and carried her swiftly through the air until they came to the castle, where they set her down upon the front doorstep.",1,20.13132939999923,0.6319455504417419,0.16158539056777954,0.20646913349628448,79.64,0.8933412432670593,0.06215314939618111,0.04450569301843643,93.5,0.5085618495941162,0.2334912270307541,0.2579469084739685,50.0,0.9877726435661316,0.005839196499437094,0.006388100329786539,99.41,0.041035331785678864,0.7508243322372437,0.20814037322998047,5.18,0.1096346452832222,0.20150132477283478,0.6888641119003296,21.04,direct_nli_zero_shot
335,the Winged Monkeys,16,5514,their,27931,27932,1123,third_person_possessive_pronoun_to_canonical_possessive,True,"So, carefully and gently, they lifted Dorothy in [[their]] arms and carried her swiftly through the air until they came to the castle, where they set her down upon the front doorstep.","So, carefully and gently, they lifted Dorothy in the Winged Monkeys' arms and carried her swiftly through the air until they came to the castle, where they set her down upon the front doorstep.","So, carefully and gently, they lifted Dorothy in the Winged Monkeys' arms and carried her swiftly through the air until they came to the castle, where they set her down upon the front doorstep.","So, carefully and gently, they lifted Dorothy in the Winged Monkeys' arms and carried her swiftly through the air until they came to the castle, where they set her down upon the front doorstep.",1,20.13132939999923,0.5837768912315369,0.19988486170768738,0.21633824706077576,74.49,0.8752912878990173,0.07887860387563705,0.04583010822534561,91.73,0.4299198389053345,0.29317983984947205,0.2769002616405487,50.0,0.9822564721107483,0.010331164114177227,0.007412247359752655,98.96,0.04549155756831169,0.7472164630889893,0.20729197561740875,5.74,0.09566161036491394,0.19385604560375214,0.7104822993278503,19.26,direct_nli_zero_shot
335,the Winged Monkeys,17,5517,they,27941,27942,1123,third_person_subject_pronoun_to_canonical,True,"So, carefully and gently, they lifted Dorothy in their arms and carried her swiftly through the air until [[they]] came to the castle, where they set her down upon the front doorstep.","So, carefully and gently, they lifted Dorothy in their arms and carried her swiftly through the air until the Winged Monkeys came to the castle, where they set her down upon the front doorstep.","So, carefully and gently, they lifted Dorothy in their arms and carried her swiftly through the air until the Winged Monkeys came to the castle, where they set her down upon the front doorstep.","So, carefully and gently, they lifted Dorothy in their arms and carried her swiftly through the air until the Winged Monkeys came to the castle, where they set her down upon the front doorstep.",1,20.13132939999923,0.45412519574165344,0.2826620042324066,0.26321280002593994,50.0,0.6989849805831909,0.16107270121574402,0.13994239270687103,81.27,0.36065050959587097,0.31951865553855896,0.31983083486557007,50.0,0.8665290474891663,0.06120862811803818,0.07226238399744034,93.4,0.10144687443971634,0.5753674507141113,0.3231855630874634,14.99,0.0854724571108818,0.2252827286720276,0.68924480676651,19.81,direct_nli_zero_shot
335,the Winged Monkeys,18,5520,they,27948,27949,1123,third_person_subject_pronoun_to_canonical,True,"So, carefully and gently, they lifted Dorothy in their arms and carried her swiftly through the air until they came to the castle, where [[they]] set her down upon the front doorstep.","So, carefully and gently, they lifted Dorothy in their arms and carried her swiftly through the air until they came to the castle, where the Winged Monkeys set her down upon the front doorstep.","So, carefully and gently, they lifted Dorothy in their arms and carried her swiftly through the air until they came to the castle, where the Winged Monkeys set her down upon the front doorstep.","So, carefully and gently, they lifted Dorothy in their arms and carried her swiftly through the air until they came to the castle, where the Winged Monkeys set her down upon the front doorstep.",1,20.13132939999923,0.5139682292938232,0.23234333097934723,0.25368842482566833,50.0,0.8379546403884888,0.08260493725538254,0.0794403925538063,91.03,0.4128369688987732,0.30064016580581665,0.28652289509773254,50.0,0.9667960405349731,0.015872888267040253,0.017331110313534737,98.38,0.049179889261722565,0.7272951602935791,0.22352489829063416,6.33,0.08190790563821793,0.21807599067687988,0.7000160813331604,19.09,direct_nli_zero_shot
335,the Winged Monkeys,19,5547,all the Winged Monkeys,28034,28038,1128,proper_name_to_canonical,True,"Then [[all the Winged Monkeys]], with much laughing and chattering and noise, flew into the air and were soon out of sight.","Then the Winged Monkeys, with much laughing and chattering and noise, flew into the air and were soon out of sight.","Then the Winged Monkeys, with much laughing and chattering and noise, flew into the air and were soon out of sight.","Then the Winged Monkeys, with much laughing and chattering and noise, flew into the air and were soon out of sight.",1,20.13132939999923,0.7128518223762512,0.07684070616960526,0.21030744910240173,90.27,0.027085065841674805,0.269933819770813,0.702981173992157,50.0,0.985770583152771,0.0043263002298772335,0.009902999736368656,99.56,0.633047342300415,0.09798580408096313,0.2689668834209442,86.6,0.05293829366564751,0.4647456407546997,0.4823160767555237,50.0,0.03875096142292023,0.36622554063796997,0.595023512840271,22.19,direct_nli_zero_shot
335,the Winged Monkeys,20,5552,the Winged Monkeys,28083,28086,1129,proper_name_to_canonical,False,"The Wicked Witch was both surprised and worried when she saw the mark on Dorothy's forehead, for she knew well that neither [[the Winged Monkeys]] nor she, herself, dare hurt the girl in any way.","The Wicked Witch was both surprised and worried when she saw the mark on Dorothy's forehead, for she knew well that neither the Winged Monkeys nor she, herself, dare hurt the girl in any way.","The Wicked Witch was both surprised and worried when she saw the mark on Dorothy's forehead, for she knew well that neither the Winged Monkeys nor she, herself, dare hurt the girl in any way.","The Wicked Witch was both surprised and worried when she saw the mark on Dorothy's forehead, for she knew well that neither the Winged Monkeys nor she, herself, dare hurt the girl in any way.",1,20.13132939999923,0.19694508612155914,0.520530641078949,0.28252437710762024,27.45,0.26301315426826477,0.30022379755973816,0.43676307797431946,50.0,0.15306182205677032,0.4370983839035034,0.4098397493362427,50.0,0.43448352813720703,0.37305954098701477,0.19245699048042297,50.0,0.30715110898017883,0.4829806089401245,0.20986835658550262,50.0,0.1378459930419922,0.3464179039001465,0.5157360434532166,31.11,direct_nli_zero_shot
335,the Winged Monkeys,21,6006,the Winged Monkeys,30498,30501,1209,proper_name_to_canonical,False,"So she called the Winkies to help her, and they walked all that day and part of the next until they came to the tall tree in the branches of which [[the Winged Monkeys]] had tossed the Scarecrow's clothes.","So she called the Winkies to help her, and they walked all that day and part of the next until they came to the tall tree in the branches of which the Winged Monkeys had tossed the Scarecrow's clothes.","So she called the Winkies to help her, and they walked all that day and part of the next until they came to the tall tree in the branches of which the Winged Monkeys had tossed the Scarecrow's clothes.","So she called the Winkies to help her, and they walked all that day and part of the next until they came to the tall tree in the branches of which the Winged Monkeys had tossed the Scarecrow's clothes.",1,20.13132939999923,0.5140869617462158,0.31811466813087463,0.16779844462871552,50.0,0.22825337946414948,0.4295157790184021,0.342230886220932,50.0,0.42975157499313354,0.31914016604423523,0.2511082887649536,50.0,0.6850730776786804,0.12702003121376038,0.18790684640407562,84.36,0.12141583859920502,0.4904579222202301,0.38812628388404846,50.0,0.10152047872543335,0.2811294496059418,0.6173501014709473,24.21,direct_nli_zero_shot
