cluster_id,subject,mention_index_in_cluster,mention_id,mention_text,mention_start,mention_end,sentence_index,mention_render_rule,mention_render_was_changed,original_context_text,rendered_context_text,context_text,normalized_context_text,chunk_index,elapsed_seconds_at_completion,openness_positive_probability,openness_negative_probability,openness_neutral_probability,openness,conscientiousness_positive_probability,conscientiousness_negative_probability,conscientiousness_neutral_probability,conscientiousness,extraversion_positive_probability,extraversion_negative_probability,extraversion_neutral_probability,extraversion,agreeableness_positive_probability,agreeableness_negative_probability,agreeableness_neutral_probability,agreeableness,neuroticism_positive_probability,neuroticism_negative_probability,neuroticism_neutral_probability,neuroticism,OCEAN_weight_high_probability,OCEAN_weight_medium_probability,OCEAN_weight_low_probability,OCEAN_weight,OCEAN_weight_source
2,Uncle Henry,0,2,Uncle Henry,12,14,0,proper_name_to_canonical,False,"Dorothy lived in the midst of the great Kansas prairies, with [[Uncle Henry]], who was a farmer, and Aunt Em, who was the farmer's wife.","Dorothy lived in the midst of the great Kansas prairies, with Uncle Henry, who was a farmer, and Aunt Em, who was the farmer's wife.","Dorothy lived in the midst of the great Kansas prairies, with Uncle Henry, who was a farmer, and Aunt Em, who was the farmer's wife.","Dorothy lived in the midst of the great Kansas prairies, with Uncle Henry, who was a farmer, and Aunt Em, who was the farmer's wife.",1,13.39257660000294,0.12111133337020874,0.5012577176094055,0.37763088941574097,50.0,0.3245057165622711,0.3478039801120758,0.3276902437210083,50.0,0.16968297958374023,0.4459649920463562,0.38435202836990356,50.0,0.32712942361831665,0.31429019570350647,0.3585803508758545,50.0,0.08638549596071243,0.7234514355659485,0.19016312062740326,10.67,0.13705167174339294,0.38738560676574707,0.4755626916885376,33.07,direct_nli_zero_shot
2,Uncle Henry,1,12,Uncle Henry,94,96,3,proper_name_to_canonical,False,"[[Uncle Henry]] and Aunt Em had a big bed in one corner, and Dorothy a little bed in another corner.","Uncle Henry and Aunt Em had a big bed in one corner, and Dorothy a little bed in another corner.","Uncle Henry and Aunt Em had a big bed in one corner, and Dorothy a little bed in another corner.","Uncle Henry and Aunt Em had a big bed in one corner, and Dorothy a little bed in another corner.",1,13.39257660000294,0.17436423897743225,0.4819054901599884,0.34373030066490173,50.0,0.2950226366519928,0.3896981477737427,0.31527912616729736,50.0,0.24196530878543854,0.42012494802474976,0.3379096984863281,50.0,0.38506364822387695,0.22836555540561676,0.3865707516670227,50.0,0.1844945102930069,0.6214001178741455,0.194105327129364,22.89,0.1455802023410797,0.4808480739593506,0.3735716938972473,38.6,direct_nli_zero_shot
2,Uncle Henry,2,53,Uncle Henry,456,458,16,proper_name_to_canonical,False,[[Uncle Henry]] never laughed.,Uncle Henry never laughed.,Uncle Henry never laughed.,Uncle Henry never laughed.,1,13.39257660000294,0.014173776842653751,0.6693947911262512,0.3164313733577728,2.07,0.5476096272468567,0.1762271225452423,0.2761632800102234,75.65,0.021101130172610283,0.5378651022911072,0.4410337805747986,50.0,0.1227511391043663,0.35867786407470703,0.5185710191726685,50.0,0.07013874500989914,0.8768660426139832,0.0529952310025692,7.41,0.48140084743499756,0.2741600275039673,0.2444390505552292,61.85,direct_nli_zero_shot
2,Uncle Henry,3,54,He,461,462,17,proper_name_to_canonical,True,[[He]] worked hard from morning till night and did not know what joy was.,Uncle Henry worked hard from morning till night and did not know what joy was.,Uncle Henry worked hard from morning till night and did not know what joy was.,Uncle Henry worked hard from morning till night and did not know what joy was.,1,13.39257660000294,0.010582479648292065,0.38714882731437683,0.6022686958312988,50.0,0.9380249381065369,0.01053305808454752,0.051442064344882965,98.89,0.010523097589612007,0.4594084620475769,0.5300684571266174,50.0,0.06795582920312881,0.13957253098487854,0.7924716472625732,50.0,0.1473831981420517,0.7205033302307129,0.13211344182491302,16.98,0.8963234424591064,0.04676693305373192,0.056909676641225815,91.97,direct_nli_zero_shot
2,Uncle Henry,4,55,He,476,477,18,proper_name_to_canonical,True,"[[He]] was gray also, from his long beard to his rough boots, and he looked stern and solemn, and rarely spoke.","Uncle Henry was gray also, from his long beard to his rough boots, and he looked stern and solemn, and rarely spoke.","Uncle Henry was gray also, from his long beard to his rough boots, and he looked stern and solemn, and rarely spoke.","Uncle Henry was gray also, from his long beard to his rough boots, and he looked stern and solemn, and rarely spoke.",1,13.39257660000294,0.001882090582512319,0.3221319913864136,0.6759859323501587,50.0,0.6797983646392822,0.1270461231470108,0.1931554675102234,84.25,0.001048861420713365,0.40455323457717896,0.5943979024887085,50.0,0.012124937027692795,0.13202080130577087,0.8558542728424072,50.0,0.14769037067890167,0.7596161961555481,0.09269344061613083,16.28,0.1823563277721405,0.03283867985010147,0.7848049998283386,19.88,direct_nli_zero_shot
2,Uncle Henry,5,56,his,482,483,18,third_person_possessive_pronoun_to_canonical_possessive,True,"He was gray also, from [[his]] long beard to his rough boots, and he looked stern and solemn, and rarely spoke.","He was gray also, from Uncle Henry's long beard to his rough boots, and he looked stern and solemn, and rarely spoke.","He was gray also, from Uncle Henry's long beard to his rough boots, and he looked stern and solemn, and rarely spoke.","He was gray also, from Uncle Henry's long beard to his rough boots, and he looked stern and solemn, and rarely spoke.",1,13.39257660000294,0.001562906545586884,0.2555011510848999,0.7429358959197998,50.0,0.7369264960289001,0.12038809061050415,0.1426854431629181,85.96,0.0009625227539800107,0.38154327869415283,0.6174941658973694,50.0,0.008955462835729122,0.09741522371768951,0.8936293125152588,50.0,0.1473800539970398,0.7580201625823975,0.09459979832172394,16.28,0.22938819229602814,0.03446374461054802,0.7361481189727783,24.66,direct_nli_zero_shot
2,Uncle Henry,6,57,his,486,487,18,third_person_possessive_pronoun_to_canonical_possessive,True,"He was gray also, from his long beard to [[his]] rough boots, and he looked stern and solemn, and rarely spoke.","He was gray also, from his long beard to Uncle Henry's rough boots, and he looked stern and solemn, and rarely spoke.","He was gray also, from his long beard to Uncle Henry's rough boots, and he looked stern and solemn, and rarely spoke.","He was gray also, from his long beard to Uncle Henry's rough boots, and he looked stern and solemn, and rarely spoke.",1,13.39257660000294,0.0013835957506671548,0.22818447649478912,0.7704319357872009,50.0,0.7146748304367065,0.12519647181034088,0.16012872755527496,85.09,0.0008978666155599058,0.37445417046546936,0.6246479153633118,50.0,0.009458746761083603,0.08638844639062881,0.9041528701782227,50.0,0.1567491739988327,0.7380144000053406,0.10523641854524612,17.52,0.23914773762226105,0.036353569477796555,0.7244986891746521,25.73,direct_nli_zero_shot
2,Uncle Henry,7,58,he,491,492,18,third_person_subject_pronoun_to_canonical,True,"He was gray also, from his long beard to his rough boots, and [[he]] looked stern and solemn, and rarely spoke.","He was gray also, from his long beard to his rough boots, and Uncle Henry looked stern and solemn, and rarely spoke.","He was gray also, from his long beard to his rough boots, and Uncle Henry looked stern and solemn, and rarely spoke.","He was gray also, from his long beard to his rough boots, and Uncle Henry looked stern and solemn, and rarely spoke.",1,13.39257660000294,0.00151357043068856,0.26767250895500183,0.7308139204978943,50.0,0.7612723708152771,0.10855286568403244,0.13017477095127106,87.52,0.0009442039299756289,0.4003709852695465,0.5986848473548889,50.0,0.010673249140381813,0.09596941620111465,0.8933572769165039,50.0,0.14508746564388275,0.7506139278411865,0.1042986735701561,16.2,0.23241867125034332,0.030397510156035423,0.7371838092803955,24.76,direct_nli_zero_shot
2,Uncle Henry,8,71,Uncle Henry,582,584,23,proper_name_to_canonical,False,"[[Uncle Henry]] sat upon the doorstep and looked anxiously at the sky, which was even grayer than usual.","Uncle Henry sat upon the doorstep and looked anxiously at the sky, which was even grayer than usual.","Uncle Henry sat upon the doorstep and looked anxiously at the sky, which was even grayer than usual.","Uncle Henry sat upon the doorstep and looked anxiously at the sky, which was even grayer than usual.",1,13.39257660000294,0.027494311332702637,0.2845628559589386,0.6879428029060364,50.0,0.16403155028820038,0.2650820314884186,0.5708863735198975,50.0,0.0050776563584804535,0.37745201587677,0.6174703240394592,50.0,0.03739844262599945,0.025930454954504967,0.9366710782051086,50.0,0.9861469864845276,0.005084655713289976,0.008768354542553425,99.49,0.19211632013320923,0.4025611877441406,0.40532249212265015,39.34,direct_nli_zero_shot
2,Uncle Henry,9,77,Uncle Henry,642,644,26,proper_name_to_canonical,False,"From the far north they heard a low wail of the wind, and [[Uncle Henry]] and Dorothy could see where the long grass bowed in waves before the coming storm.","From the far north they heard a low wail of the wind, and Uncle Henry and Dorothy could see where the long grass bowed in waves before the coming storm.","From the far north they heard a low wail of the wind, and Uncle Henry and Dorothy could see where the long grass bowed in waves before the coming storm.","From the far north they heard a low wail of the wind, and Uncle Henry and Dorothy could see where the long grass bowed in waves before the coming storm.",1,13.39257660000294,0.23827385902404785,0.44974222779273987,0.31198403239250183,50.0,0.2932961881160736,0.3898846209049225,0.3168192207813263,50.0,0.22764185070991516,0.4132641553878784,0.35909393429756165,50.0,0.37800756096839905,0.14948256313800812,0.47250989079475403,50.0,0.1437816321849823,0.7211480736732483,0.135070338845253,16.62,0.19179333746433258,0.35910531878471375,0.4491012990474701,37.13,direct_nli_zero_shot
2,Uncle Henry,10,82,Uncle Henry,695,697,28,proper_name_to_canonical,False,Suddenly [[Uncle Henry]] stood up.,Suddenly Uncle Henry stood up.,Suddenly Uncle Henry stood up.,Suddenly Uncle Henry stood up.,1,13.39257660000294,0.23317742347717285,0.4920724034309387,0.2747501730918884,50.0,0.20260624587535858,0.5353298187255859,0.2620639503002167,27.46,0.36733871698379517,0.5584860444068909,0.07417526841163635,50.0,0.29450705647468567,0.3138074576854706,0.39168551564216614,50.0,0.3352353870868683,0.6067365407943726,0.05802805721759796,50.0,0.2374192774295807,0.26654690504074097,0.49603378772735596,37.07,direct_nli_zero_shot
2,Uncle Henry,11,84,he,711,712,29,third_person_subject_pronoun_to_canonical,True,"""There's a cyclone coming, Em,"" [[he]] called to his wife.","""There's a cyclone coming, Em,"" Uncle Henry called to his wife.","""There's a cyclone coming, Em,"" Uncle Henry called to his wife.","""There's a cyclone coming, Em,"" Uncle Henry called to his wife.",1,13.39257660000294,0.19222228229045868,0.42428287863731384,0.38349485397338867,50.0,0.24684885144233704,0.4251650273799896,0.32798609137535095,50.0,0.37987250089645386,0.346131294965744,0.2739962637424469,50.0,0.19023054838180542,0.247502401471138,0.5622670650482178,50.0,0.26740890741348267,0.644699215888977,0.08789193630218506,29.32,0.23922760784626007,0.48942720890045166,0.27134525775909424,48.39,direct_nli_zero_shot
2,Uncle Henry,12,85,his,714,715,29,third_person_possessive_pronoun_to_canonical_possessive,True,"""There's a cyclone coming, Em,"" he called to [[his]] wife.","""There's a cyclone coming, Em,"" he called to Uncle Henry's wife.","""There's a cyclone coming, Em,"" he called to Uncle Henry's wife.","""There's a cyclone coming, Em,"" he called to Uncle Henry's wife.",1,13.39257660000294,0.18526625633239746,0.46746811270713806,0.3472656309604645,50.0,0.24138246476650238,0.3745456635951996,0.38407185673713684,50.0,0.3096368610858917,0.36344119906425476,0.3269219696521759,50.0,0.2951638400554657,0.3069218397140503,0.3979142904281616,50.0,0.31900754570961,0.577577531337738,0.10341499000787735,50.0,0.2535730004310608,0.5303009748458862,0.21612602472305298,51.87,direct_nli_zero_shot
2,Uncle Henry,13,87,I,718,719,30,first_second_person_keep_original,False,""" [[I]]'ll go look after the stock.""",""" I'll go look after the stock.""",""" I'll go look after the stock.""",""" I'll go look after the stock.""",1,13.39257660000294,0.19141091406345367,0.3449121415615082,0.46367695927619934,50.0,0.36162683367729187,0.3593386113643646,0.2790345251560211,50.0,0.17192420363426208,0.34358566999435425,0.4844900369644165,50.0,0.38662320375442505,0.2683296501636505,0.34504714608192444,50.0,0.2023182064294815,0.6006284356117249,0.19705335795879364,25.2,0.14304062724113464,0.43684735894203186,0.4201120138168335,36.15,direct_nli_zero_shot
2,Uncle Henry,14,88,he,728,729,31,third_person_subject_pronoun_to_canonical,True,Then [[he]] ran toward the sheds where the cows and horses were kept.,Then Uncle Henry ran toward the sheds where the cows and horses were kept.,Then Uncle Henry ran toward the sheds where the cows and horses were kept.,Then Uncle Henry ran toward the sheds where the cows and horses were kept.,1,13.39257660000294,0.5581799149513245,0.3464548885822296,0.09536518156528473,50.0,0.13970783352851868,0.4195416271686554,0.4407505691051483,50.0,0.7841361165046692,0.18157921731472015,0.034284722059965134,81.2,0.4002476632595062,0.3250020742416382,0.27475035190582275,50.0,0.6880527138710022,0.23013143241405487,0.08181584626436234,74.94,0.20736108720302582,0.3866456151008606,0.4059933125972748,40.07,direct_nli_zero_shot
2,Uncle Henry,15,209,Uncle Henry,1778,1780,74,proper_name_to_canonical,False,"The men, Dorothy thought, were about as old as [[Uncle Henry]], for two of them had beards.","The men, Dorothy thought, were about as old as Uncle Henry, for two of them had beards.","The men, Dorothy thought, were about as old as Uncle Henry, for two of them had beards.","The men, Dorothy thought, were about as old as Uncle Henry, for two of them had beards.",1,13.39257660000294,0.19180165231227875,0.48573389649391174,0.3224644660949707,28.31,0.3699650168418884,0.3899984657764435,0.24003656208515167,50.0,0.19230371713638306,0.5298022031784058,0.2778940796852112,26.63,0.40679463744163513,0.2958785593509674,0.29732680320739746,50.0,0.17489741742610931,0.678684651851654,0.14641794562339783,20.49,0.19787687063217163,0.4358319640159607,0.36629119515419006,41.58,direct_nli_zero_shot
2,Uncle Henry,16,390,uncle,3028,3029,136,ambiguous_or_unsupported_keep_original,False,"Then she came out again to the Munchkins and said: ""I am anxious to get back to my aunt and [[uncle]], for I am sure they will worry about me.","Then she came out again to the Munchkins and said: ""I am anxious to get back to my aunt and uncle, for I am sure they will worry about me.","Then she came out again to the Munchkins and said: ""I am anxious to get back to my aunt and uncle, for I am sure they will worry about me.","Then she came out again to the Munchkins and said: ""I am anxious to get back to my aunt and uncle, for I am sure they will worry about me.",1,13.39257660000294,0.09681299328804016,0.389693021774292,0.5134939551353455,50.0,0.30302152037620544,0.28299930691719055,0.41397911310195923,50.0,0.13256970047950745,0.3153893053531647,0.5520409345626831,50.0,0.2702552378177643,0.25264468789100647,0.47710007429122925,50.0,0.759413480758667,0.16911742091178894,0.07146909832954407,81.79,0.15613636374473572,0.4790588617324829,0.36480483412742615,39.57,direct_nli_zero_shot
2,Uncle Henry,17,4392,Uncle Henry,22862,22864,914,proper_name_to_canonical,False,"Then Oz asked, ""What do you wish me to do?"" ""Send me back to Kansas, where my Aunt Em and [[Uncle Henry]] are,"" she answered earnestly.","Then Oz asked, ""What do you wish me to do?"" ""Send me back to Kansas, where my Aunt Em and Uncle Henry are,"" she answered earnestly.","Then Oz asked, ""What do you wish me to do?"" ""Send me back to Kansas, where my Aunt Em and Uncle Henry are,"" she answered earnestly.","Then Oz asked, ""What do you wish me to do?"" ""Send me back to Kansas, where my Aunt Em and Uncle Henry are,"" she answered earnestly.",1,13.39257660000294,0.16901227831840515,0.5624847412109375,0.26850298047065735,23.1,0.3573954999446869,0.4101563096046448,0.23244816064834595,50.0,0.23621077835559845,0.5007912516593933,0.26299798488616943,50.0,0.4343976676464081,0.3397992253303528,0.22580312192440033,50.0,0.20325547456741333,0.6589460372924805,0.13779839873313904,23.57,0.23675984144210815,0.3402417004108429,0.42299848794937134,40.69,direct_nli_zero_shot
2,Uncle Henry,18,4913,Uncle Henry,25086,25088,1007,proper_name_to_canonical,False,"""And I shall never see Aunt Em and [[Uncle Henry]],"" said Dorothy, beginning to cry.","""And I shall never see Aunt Em and Uncle Henry,"" said Dorothy, beginning to cry.","""And I shall never see Aunt Em and Uncle Henry,"" said Dorothy, beginning to cry.","""And I shall never see Aunt Em and Uncle Henry,"" said Dorothy, beginning to cry.",1,13.39257660000294,0.05185353383421898,0.43906763195991516,0.5090787410736084,50.0,0.15404999256134033,0.30891865491867065,0.537031352519989,50.0,0.09342750906944275,0.42639845609664917,0.48017406463623047,50.0,0.13143496215343475,0.3145272731781006,0.5540378093719482,50.0,0.39682695269584656,0.44988346099853516,0.1532895267009735,50.0,0.14871478080749512,0.35259199142456055,0.4986932575702667,32.5,direct_nli_zero_shot
2,Uncle Henry,19,7929,Uncle Henry,40060,40062,1616,proper_name_to_canonical,False,"""I want to go to Kansas, and live with Aunt Em and [[Uncle Henry]].""","""I want to go to Kansas, and live with Aunt Em and Uncle Henry.""","""I want to go to Kansas, and live with Aunt Em and Uncle Henry.""","""I want to go to Kansas, and live with Aunt Em and Uncle Henry.""",1,13.39257660000294,0.3142259120941162,0.41223621368408203,0.27353793382644653,50.0,0.2927415668964386,0.3224570155143738,0.3848015069961548,50.0,0.28135359287261963,0.424221932888031,0.294424444437027,50.0,0.47213709354400635,0.2246612161397934,0.30320170521736145,50.0,0.2472507506608963,0.550159215927124,0.2025900036096573,50.0,0.14475058019161224,0.3656841218471527,0.48956534266471863,32.76,direct_nli_zero_shot
2,Uncle Henry,20,9017,the Tin Woodman,45786,45789,1856,proper_name_to_canonical,True,"""Call the Winged Monkeys,"" suggested [[the Tin Woodman]].","""Call the Winged Monkeys,"" suggested Uncle Henry.","""Call the Winged Monkeys,"" suggested Uncle Henry.","""Call the Winged Monkeys,"" suggested Uncle Henry.",1,13.39257660000294,0.5463146567344666,0.4063088595867157,0.047376520931720734,50.0,0.11862210929393768,0.40104860067367554,0.48032933473587036,50.0,0.6215474605560303,0.16365157067775726,0.21480107307434082,79.16,0.44227921962738037,0.13134534657001495,0.42637544870376587,50.0,0.12321531772613525,0.735862135887146,0.14092259109020233,14.34,0.12900006771087646,0.636124312877655,0.2348756343126297,44.71,direct_nli_zero_shot
2,Uncle Henry,21,9138,the Woodman,46461,46463,1881,proper_name_to_canonical,True,"Before they went to see Glinda, however, they were taken to a room of the Castle, where Dorothy washed her face and combed her hair, and the Lion shook the dust out of his mane, and the Scarecrow patted himself into his best shape, and [[the Woodman]] polished his tin and oiled his joints.","Before they went to see Glinda, however, they were taken to a room of the Castle, where Dorothy washed her face and combed her hair, and the Lion shook the dust out of his mane, and the Scarecrow patted himself into his best shape, and Uncle Henry polished his tin and oiled his joints.","Before they went to see Glinda, however, they were taken to a room of the Castle, where Dorothy washed her face and combed her hair, and the Lion shook the dust out of his mane, and the Scarecrow patted himself into his best shape, and Uncle Henry polished his tin and oiled his joints.","Before they went to see Glinda, however, they were taken to a room of the Castle, where Dorothy washed her face and combed her hair, and the Lion shook the dust out of his mane, and the Scarecrow patted himself into his best shape, and Uncle Henry polished his tin and oiled his joints.",1,13.39257660000294,0.23661714792251587,0.4310000240802765,0.33238276839256287,50.0,0.41399550437927246,0.3397752344608307,0.24622920155525208,50.0,0.2829040288925171,0.28063392639160156,0.43646207451820374,50.0,0.7589520812034607,0.053599946200847626,0.1874479353427887,93.4,0.0665464922785759,0.5621057152748108,0.3713478446006775,10.59,0.19905023276805878,0.33859583735466003,0.46235391497612,36.83,direct_nli_zero_shot
2,Uncle Henry,22,9140,his,46464,46465,1881,third_person_possessive_pronoun_to_canonical_possessive,True,"Before they went to see Glinda, however, they were taken to a room of the Castle, where Dorothy washed her face and combed her hair, and the Lion shook the dust out of his mane, and the Scarecrow patted himself into his best shape, and the Woodman polished [[his]] tin and oiled his joints.","Before they went to see Glinda, however, they were taken to a room of the Castle, where Dorothy washed her face and combed her hair, and the Lion shook the dust out of his mane, and the Scarecrow patted himself into his best shape, and the Woodman polished Uncle Henry's tin and oiled his joints.","Before they went to see Glinda, however, they were taken to a room of the Castle, where Dorothy washed her face and combed her hair, and the Lion shook the dust out of his mane, and the Scarecrow patted himself into his best shape, and the Woodman polished Uncle Henry's tin and oiled his joints.","Before they went to see Glinda, however, they were taken to a room of the Castle, where Dorothy washed her face and combed her hair, and the Lion shook the dust out of his mane, and the Scarecrow patted himself into his best shape, and the Woodman polished Uncle Henry's tin and oiled his joints.",1,13.39257660000294,0.2441118061542511,0.45941343903541565,0.296474814414978,50.0,0.4268339276313782,0.3464210033416748,0.226745143532753,50.0,0.2874976098537445,0.3035584092140198,0.4089439809322357,50.0,0.7128241658210754,0.10095198452472687,0.18622387945652008,87.59,0.10309343785047531,0.5863500833511353,0.31055641174316406,14.95,0.1707805097103119,0.3576793968677521,0.4715401232242584,34.96,direct_nli_zero_shot
2,Uncle Henry,23,9142,his,46468,46469,1881,third_person_possessive_pronoun_to_canonical_possessive,True,"Before they went to see Glinda, however, they were taken to a room of the Castle, where Dorothy washed her face and combed her hair, and the Lion shook the dust out of his mane, and the Scarecrow patted himself into his best shape, and the Woodman polished his tin and oiled [[his]] joints.","Before they went to see Glinda, however, they were taken to a room of the Castle, where Dorothy washed her face and combed her hair, and the Lion shook the dust out of his mane, and the Scarecrow patted himself into his best shape, and the Woodman polished his tin and oiled Uncle Henry's joints.","Before they went to see Glinda, however, they were taken to a room of the Castle, where Dorothy washed her face and combed her hair, and the Lion shook the dust out of his mane, and the Scarecrow patted himself into his best shape, and the Woodman polished his tin and oiled Uncle Henry's joints.","Before they went to see Glinda, however, they were taken to a room of the Castle, where Dorothy washed her face and combed her hair, and the Lion shook the dust out of his mane, and the Scarecrow patted himself into his best shape, and the Woodman polished his tin and oiled Uncle Henry's joints.",1,13.39257660000294,0.2235979437828064,0.4561128318309784,0.32028928399086,50.0,0.3725014328956604,0.36547502875328064,0.2620235085487366,50.0,0.23520122468471527,0.3463764786720276,0.41842228174209595,50.0,0.6275349259376526,0.16289494931697845,0.20957018435001373,79.39,0.12082559615373611,0.5986576676368713,0.28051671385765076,16.79,0.18851983547210693,0.37587878108024597,0.4356014132499695,37.65,direct_nli_zero_shot
