cluster_id,subject,mention_index_in_cluster,mention_id,mention_text,mention_start,mention_end,sentence_index,mention_render_rule,mention_render_was_changed,original_context_text,rendered_context_text,context_text,normalized_context_text,chunk_index,elapsed_seconds_at_completion,openness_positive_probability,openness_negative_probability,openness_neutral_probability,openness,conscientiousness_positive_probability,conscientiousness_negative_probability,conscientiousness_neutral_probability,conscientiousness,extraversion_positive_probability,extraversion_negative_probability,extraversion_neutral_probability,extraversion,agreeableness_positive_probability,agreeableness_negative_probability,agreeableness_neutral_probability,agreeableness,neuroticism_positive_probability,neuroticism_negative_probability,neuroticism_neutral_probability,neuroticism,OCEAN_weight_high_probability,OCEAN_weight_medium_probability,OCEAN_weight_low_probability,OCEAN_weight,OCEAN_weight_source
335,the Winged Monkeys,41,6537,the Winged Monkeys,33039,33042,1306,proper_name_to_canonical,False,"But my grandfather pleaded hard, for he knew the Monkeys would drown in the river with their wings tied, and Quelala said a kind word for them also; so that Gayelette finally spared them, on condition that [[the Winged Monkeys]] should ever after do three times the bidding of the owner of the Golden Cap.","But my grandfather pleaded hard, for he knew the Monkeys would drown in the river with their wings tied, and Quelala said a kind word for them also; so that Gayelette finally spared them, on condition that the Winged Monkeys should ever after do three times the bidding of the owner of the Golden Cap.","But my grandfather pleaded hard, for he knew the Monkeys would drown in the river with their wings tied, and Quelala said a kind word for them also; so that Gayelette finally spared them, on condition that the Winged Monkeys should ever after do three times the bidding of the owner of the Golden Cap.","But my grandfather pleaded hard, for he knew the Monkeys would drown in the river with their wings tied, and Quelala said a kind word for them also; so that Gayelette finally spared them, on condition that the Winged Monkeys should ever after do three times the bidding of the owner of the Golden Cap.",1,20.13132939999923,0.1501774936914444,0.42200660705566406,0.42781585454940796,50.0,0.6022740006446838,0.14620833098888397,0.2515176236629486,80.47,0.17729836702346802,0.3710583746433258,0.4516432583332062,50.0,0.9053691029548645,0.04648382589221001,0.048147089779376984,95.12,0.22934848070144653,0.5777092576026917,0.1929422914981842,28.42,0.15408708155155182,0.3150104284286499,0.5309025049209595,31.16,direct_nli_zero_shot
335,the Winged Monkeys,42,6557,them,33132,33133,1309,third_person_object_pronoun_to_canonical,True,"""And what became of [[them]]?"" asked Dorothy, who had been greatly interested in the story.","""And what became of the Winged Monkeys?"" asked Dorothy, who had been greatly interested in the story.","""And what became of the Winged Monkeys?"" asked Dorothy, who had been greatly interested in the story.","""And what became of the Winged Monkeys?"" asked Dorothy, who had been greatly interested in the story.",1,20.13132939999923,0.6208340525627136,0.16555218398571014,0.21361371874809265,78.95,0.21476121246814728,0.23198556900024414,0.5532532334327698,50.0,0.2176525592803955,0.2805652320384979,0.5017821788787842,50.0,0.37286576628685,0.08036273717880249,0.5467715263366699,50.0,0.19875742495059967,0.4427425265312195,0.35850006341934204,50.0,0.10403665900230408,0.33354654908180237,0.5624168515205383,27.08,direct_nli_zero_shot
335,the Winged Monkeys,43,6588,a Winged Monkey,33215,33218,1311,proper_name_to_canonical,True,"As his bride could not bear the sight of us, he called us all to him in the forest after he had married her and ordered us always to keep where she could never again set eyes on [[a Winged Monkey]], which we were glad to do, for we were all afraid of her.","As his bride could not bear the sight of us, he called us all to him in the forest after he had married her and ordered us always to keep where she could never again set eyes on the Winged Monkeys, which we were glad to do, for we were all afraid of her.","As his bride could not bear the sight of us, he called us all to him in the forest after he had married her and ordered us always to keep where she could never again set eyes on the Winged Monkeys, which we were glad to do, for we were all afraid of her.","As his bride could not bear the sight of us, he called us all to him in the forest after he had married her and ordered us always to keep where she could never again set eyes on the Winged Monkeys, which we were glad to do, for we were all afraid of her.",1,20.13132939999923,0.04943893477320671,0.2332259714603424,0.717335045337677,50.0,0.26518741250038147,0.16831664741039276,0.5664960145950317,50.0,0.03921736404299736,0.41834527254104614,0.5424374341964722,50.0,0.24136234819889069,0.48713403940200806,0.2715035378932953,50.0,0.38665589690208435,0.548125147819519,0.06521894037723541,50.0,0.24316149950027466,0.2916663587093353,0.4651721119880676,38.9,direct_nli_zero_shot
335,the Winged Monkeys,44,6618,the Monkeys,33334,33336,1315,proper_name_to_canonical,True,"She wondered at the rapid flight of [[the Monkeys]], but was glad the journey was over.","She wondered at the rapid flight of the Winged Monkeys, but was glad the journey was over.","She wondered at the rapid flight of the Winged Monkeys, but was glad the journey was over.","She wondered at the rapid flight of the Winged Monkeys, but was glad the journey was over.",1,20.13132939999923,0.2809346318244934,0.2067440152168274,0.5123213529586792,50.0,0.09807329624891281,0.21027378737926483,0.6916528940200806,50.0,0.16908350586891174,0.2045520395040512,0.626364529132843,50.0,0.09732586145401001,0.05054132267832756,0.8521328568458557,50.0,0.09697364270687103,0.49295398592948914,0.4100724458694458,50.0,0.09687615185976028,0.39204731583595276,0.5110765099525452,29.29,direct_nli_zero_shot
335,the Winged Monkeys,45,6620,The strange creatures,33345,33348,1316,proper_name_to_canonical,True,"[[The strange creatures]] set the travelers down carefully before the gate of the City, the King bowed low to Dorothy, and then flew swiftly away, followed by all his band.","the Winged Monkeys set the travelers down carefully before the gate of the City, the King bowed low to Dorothy, and then flew swiftly away, followed by all his band.","the Winged Monkeys set the travelers down carefully before the gate of the City, the King bowed low to Dorothy, and then flew swiftly away, followed by all his band.","the Winged Monkeys set the travelers down carefully before the gate of the City, the King bowed low to Dorothy, and then flew swiftly away, followed by all his band.",1,20.13132939999923,0.24467432498931885,0.44663184881210327,0.3086938261985779,50.0,0.6816160082817078,0.1872669905424118,0.13111700117588043,78.45,0.3595708906650543,0.3685756027698517,0.27185356616973877,50.0,0.8812293410301208,0.03787704557180405,0.08089356869459152,95.88,0.07074796408414841,0.6417519450187683,0.28750014305114746,9.93,0.08859103918075562,0.3005055785179138,0.6109034419059753,23.88,direct_nli_zero_shot
335,the Winged Monkeys,46,6751,the Winged Monkeys,33885,33888,1341,proper_name_to_canonical,False,"So the Scarecrow at last asked the green girl to take another message to Oz, saying if he did not let them in to see him at once they would call [[the Winged Monkeys]] to help them, and find out whether he kept his promises or not.","So the Scarecrow at last asked the green girl to take another message to Oz, saying if he did not let them in to see him at once they would call the Winged Monkeys to help them, and find out whether he kept his promises or not.","So the Scarecrow at last asked the green girl to take another message to Oz, saying if he did not let them in to see him at once they would call the Winged Monkeys to help them, and find out whether he kept his promises or not.","So the Scarecrow at last asked the green girl to take another message to Oz, saying if he did not let them in to see him at once they would call the Winged Monkeys to help them, and find out whether he kept his promises or not.",1,20.13132939999923,0.4430643916130066,0.3012597858905792,0.2556758522987366,50.0,0.4651566445827484,0.23815949261188507,0.2966838777065277,50.0,0.3845526874065399,0.3388698101043701,0.2765774726867676,50.0,0.46356213092803955,0.17187249660491943,0.3645654320716858,50.0,0.1656181365251541,0.5291679501533508,0.30521389842033386,23.84,0.10787855088710785,0.2593880891799927,0.6327333450317383,23.76,direct_nli_zero_shot
335,the Winged Monkeys,47,6763,the Winged Monkeys,33940,33943,1343,proper_name_to_canonical,False,"He had once met [[the Winged Monkeys]] in the Land of the West, and he did not wish to meet them again.","He had once met the Winged Monkeys in the Land of the West, and he did not wish to meet them again.","He had once met the Winged Monkeys in the Land of the West, and he did not wish to meet them again.","He had once met the Winged Monkeys in the Land of the West, and he did not wish to meet them again.",1,20.13132939999923,0.0173990149050951,0.2943539023399353,0.6882471442222595,50.0,0.09842929244041443,0.27605175971984863,0.6255189180374146,50.0,0.035170815885066986,0.4542684555053711,0.5105607509613037,50.0,0.01970166526734829,0.2164127677679062,0.7638855576515198,50.0,0.38066139817237854,0.4199160635471344,0.19942255318164825,50.0,0.21080532670021057,0.4619048535823822,0.32728978991508484,44.18,direct_nli_zero_shot
335,the Winged Monkeys,48,6767,them,33957,33958,1343,third_person_object_pronoun_to_canonical,True,"He had once met the Winged Monkeys in the Land of the West, and he did not wish to meet [[them]] again.","He had once met the Winged Monkeys in the Land of the West, and he did not wish to meet the Winged Monkeys again.","He had once met the Winged Monkeys in the Land of the West, and he did not wish to meet the Winged Monkeys again.","He had once met the Winged Monkeys in the Land of the West, and he did not wish to meet the Winged Monkeys again.",1,20.13132939999923,0.022623660042881966,0.2746051251888275,0.7027711868286133,50.0,0.11009085178375244,0.23443195223808289,0.6554772257804871,50.0,0.05057205259799957,0.40266549587249756,0.5467624068260193,50.0,0.02371889539062977,0.20034904778003693,0.7759320735931396,50.0,0.32431137561798096,0.4969363212585449,0.17875228822231293,50.0,0.19499656558036804,0.4501819610595703,0.35482147336006165,42.01,direct_nli_zero_shot
335,the Winged Monkeys,49,9020,them,45798,45799,1857,third_person_object_pronoun_to_canonical,True,"""You have still the right to command [[them]] once more.","""You have still the right to command the Winged Monkeys once more.","""You have still the right to command the Winged Monkeys once more.","""You have still the right to command the Winged Monkeys once more.",1,20.13132939999923,0.14939598739147186,0.36975860595703125,0.4808453619480133,50.0,0.31090253591537476,0.306680828332901,0.38241663575172424,50.0,0.15147371590137482,0.5420924425125122,0.30643385648727417,21.84,0.25382906198501587,0.24529987573623657,0.5008710026741028,50.0,0.15422898530960083,0.6158232092857361,0.22994783520698547,20.03,0.07004475593566895,0.2422817349433899,0.6876734495162964,19.12,direct_nli_zero_shot
335,the Winged Monkeys,50,9023,The Monkeys,45824,45826,1859,proper_name_to_canonical,True,"[[The Monkeys]] were as prompt as ever, and in a few moments the entire band stood before her.","the Winged Monkeys were as prompt as ever, and in a few moments the entire band stood before her.","the Winged Monkeys were as prompt as ever, and in a few moments the entire band stood before her.","the Winged Monkeys were as prompt as ever, and in a few moments the entire band stood before her.",1,20.13132939999923,0.3526770770549774,0.1445970982313156,0.5027258396148682,50.0,0.9445732831954956,0.0158835519105196,0.039543185383081436,98.35,0.6455574631690979,0.09621158242225647,0.258230984210968,87.03,0.92253178358078,0.010370473377406597,0.0670977309346199,98.89,0.019422326236963272,0.582484245300293,0.39809349179267883,3.23,0.3699239492416382,0.021364590153098106,0.6087114214897156,38.06,direct_nli_zero_shot
335,the Winged Monkeys,51,9024,the entire band,45837,45840,1859,simple_nominal_to_canonical,True,"The Monkeys were as prompt as ever, and in a few moments [[the entire band]] stood before her.","The Monkeys were as prompt as ever, and in a few moments the Winged Monkeys stood before her.","The Monkeys were as prompt as ever, and in a few moments the Winged Monkeys stood before her.","The Monkeys were as prompt as ever, and in a few moments the Winged Monkeys stood before her.",1,20.13132939999923,0.44106754660606384,0.13101749122142792,0.4279150068759918,50.0,0.8611741662025452,0.0352424681186676,0.10358337312936783,96.07,0.5641065835952759,0.1047576367855072,0.33113574981689453,84.34,0.8699332475662231,0.012678414583206177,0.11738824844360352,98.56,0.03150852024555206,0.4979560971260071,0.4705354571342468,50.0,0.1932872086763382,0.03737906739115715,0.7693337202072144,21.2,direct_nli_zero_shot
335,the Winged Monkeys,52,9027,the King of the Monkeys,45853,45858,1860,proper_name_to_canonical,True,"""What are your commands?"" inquired [[the King of the Monkeys]], bowing low.","""What are your commands?"" inquired the Winged Monkeys, bowing low.","""What are your commands?"" inquired the Winged Monkeys, bowing low.","""What are your commands?"" inquired the Winged Monkeys, bowing low.",1,20.13132939999923,0.6395096778869629,0.2380647361278534,0.12242560088634491,72.87,0.5614538788795471,0.22676481306552887,0.21178127825260162,71.23,0.11370878666639328,0.41704797744750977,0.46924319863319397,50.0,0.6858405470848083,0.036241885274648666,0.27791765332221985,94.98,0.12173663079738617,0.7029445171356201,0.17531880736351013,14.76,0.0751447081565857,0.256894052028656,0.6679612398147583,20.36,direct_nli_zero_shot
335,the Winged Monkeys,53,9032,the King,45890,45892,1862,proper_name_to_canonical,True,"""It shall be done,"" said [[the King]], and at once the Winged Monkeys caught the four travelers and Toto up in their arms and flew away with them.","""It shall be done,"" said the Winged Monkeys, and at once the Winged Monkeys caught the four travelers and Toto up in their arms and flew away with them.","""It shall be done,"" said the Winged Monkeys, and at once the Winged Monkeys caught the four travelers and Toto up in their arms and flew away with them.","""It shall be done,"" said the Winged Monkeys, and at once the Winged Monkeys caught the four travelers and Toto up in their arms and flew away with them.",1,20.13132939999923,0.34375202655792236,0.29792869091033936,0.3583192825317383,50.0,0.3443621098995209,0.30177292227745056,0.35386499762535095,50.0,0.48307356238365173,0.29029324650764465,0.2266332358121872,50.0,0.8554608225822449,0.05697747319936752,0.08756167441606522,93.76,0.028266405686736107,0.5909391641616821,0.38079455494880676,4.56,0.09566198289394379,0.15893755853176117,0.7454004287719727,17.51,direct_nli_zero_shot
335,the Winged Monkeys,54,9033,the Winged Monkeys,45896,45899,1862,proper_name_to_canonical,False,"""It shall be done,"" said the King, and at once [[the Winged Monkeys]] caught the four travelers and Toto up in their arms and flew away with them.","""It shall be done,"" said the King, and at once the Winged Monkeys caught the four travelers and Toto up in their arms and flew away with them.","""It shall be done,"" said the King, and at once the Winged Monkeys caught the four travelers and Toto up in their arms and flew away with them.","""It shall be done,"" said the King, and at once the Winged Monkeys caught the four travelers and Toto up in their arms and flew away with them.",1,20.13132939999923,0.4071352779865265,0.24851249158382416,0.34435221552848816,50.0,0.29434800148010254,0.307721883058548,0.3979301452636719,50.0,0.47039052844047546,0.29954639077186584,0.23006302118301392,50.0,0.8737392425537109,0.04554406926035881,0.08071675151586533,95.05,0.038132429122924805,0.6226807236671448,0.33918678760528564,5.77,0.08722131699323654,0.19974908232688904,0.7130296230316162,18.71,direct_nli_zero_shot
335,the Winged Monkeys,55,9034,the Winged Monkeys caught the four travelers,45896,45903,1862,proper_name_to_canonical,True,"""It shall be done,"" said the King, and at once [[the Winged Monkeys caught the four travelers]] and Toto up in their arms and flew away with them.","""It shall be done,"" said the King, and at once the Winged Monkeys and Toto up in their arms and flew away with them.","""It shall be done,"" said the King, and at once the Winged Monkeys and Toto up in their arms and flew away with them.","""It shall be done,"" said the King, and at once the Winged Monkeys and Toto up in their arms and flew away with them.",1,20.13132939999923,0.3558613955974579,0.28054898977279663,0.3635895848274231,50.0,0.19026249647140503,0.3234104514122009,0.48632702231407166,50.0,0.47238782048225403,0.3300416171550751,0.19757063686847687,50.0,0.7585006952285767,0.07538647204637527,0.1661127805709839,90.96,0.05890629068017006,0.6499053835868835,0.2911883592605591,8.31,0.0850195437669754,0.21415695548057556,0.7008235454559326,19.21,direct_nli_zero_shot
335,the Winged Monkeys,56,9037,their,45907,45908,1862,third_person_possessive_pronoun_to_canonical_possessive,True,"""It shall be done,"" said the King, and at once the Winged Monkeys caught the four travelers and Toto up in [[their]] arms and flew away with them.","""It shall be done,"" said the King, and at once the Winged Monkeys caught the four travelers and Toto up in the Winged Monkeys' arms and flew away with them.","""It shall be done,"" said the King, and at once the Winged Monkeys caught the four travelers and Toto up in the Winged Monkeys' arms and flew away with them.","""It shall be done,"" said the King, and at once the Winged Monkeys caught the four travelers and Toto up in the Winged Monkeys' arms and flew away with them.",1,20.13132939999923,0.3918170630931854,0.20941756665706635,0.39876535534858704,50.0,0.33086496591567993,0.27256107330322266,0.3965739905834198,50.0,0.4627073109149933,0.2927177846431732,0.24457485973834991,50.0,0.8625848889350891,0.049939509481191635,0.08747555315494537,94.53,0.03319196030497551,0.6046509742736816,0.3621571362018585,5.2,0.09241952002048492,0.1854206919670105,0.7221598029136658,18.51,direct_nli_zero_shot
335,the Winged Monkeys,57,9047,the Winged Monkeys,45943,45946,1863,proper_name_to_canonical,False,"As they passed over the hill the Hammer-Heads yelled with vexation, and shot their heads high in the air, but they could not reach [[the Winged Monkeys]], which carried Dorothy and her comrades safely over the hill and set them down in the beautiful country of the Quadlings.","As they passed over the hill the Hammer-Heads yelled with vexation, and shot their heads high in the air, but they could not reach the Winged Monkeys, which carried Dorothy and her comrades safely over the hill and set them down in the beautiful country of the Quadlings.","As they passed over the hill the Hammer-Heads yelled with vexation, and shot their heads high in the air, but they could not reach the Winged Monkeys, which carried Dorothy and her comrades safely over the hill and set them down in the beautiful country of the Quadlings.","As they passed over the hill the Hammer-Heads yelled with vexation, and shot their heads high in the air, but they could not reach the Winged Monkeys, which carried Dorothy and her comrades safely over the hill and set them down in the beautiful country of the Quadlings.",1,20.13132939999923,0.5634875297546387,0.25249987840652466,0.18401266634464264,50.0,0.6376465559005737,0.15934400260448456,0.20300951600074768,80.01,0.37990057468414307,0.3388819396495819,0.281217485666275,50.0,0.8315046429634094,0.037924233824014664,0.130571186542511,95.64,0.04924137145280838,0.775926947593689,0.17483173310756683,5.97,0.07302911579608917,0.3031409978866577,0.6238299012184143,22.46,direct_nli_zero_shot
335,the Winged Monkeys,58,9055,us,45979,45980,1864,first_second_person_keep_original,False,"""This is the last time you can summon [[us]],"" said the leader to Dorothy; ""so good-bye and good luck to you.","""This is the last time you can summon us,"" said the leader to Dorothy; ""so good-bye and good luck to you.","""This is the last time you can summon us,"" said the leader to Dorothy; ""so good-bye and good luck to you.","""This is the last time you can summon us,"" said the leader to Dorothy; ""so good-bye and good luck to you.",1,20.13132939999923,0.10525911301374435,0.517534613609314,0.3772062659263611,50.0,0.30378660559654236,0.30557185411453247,0.39064154028892517,50.0,0.12661030888557434,0.4522274136543274,0.42116227746009827,50.0,0.14638742804527283,0.36284351348876953,0.49076902866363525,50.0,0.2032761573791504,0.5574398040771484,0.23928405344486237,26.72,0.12754899263381958,0.23661170899868011,0.6358392834663391,24.59,direct_nli_zero_shot
335,the Winged Monkeys,59,9057,the leader,45983,45985,1864,simple_nominal_to_canonical,True,"""This is the last time you can summon us,"" said [[the leader]] to Dorothy; ""so good-bye and good luck to you.","""This is the last time you can summon us,"" said the Winged Monkeys to Dorothy; ""so good-bye and good luck to you.","""This is the last time you can summon us,"" said the Winged Monkeys to Dorothy; ""so good-bye and good luck to you.","""This is the last time you can summon us,"" said the Winged Monkeys to Dorothy; ""so good-bye and good luck to you.",1,20.13132939999923,0.054851800203323364,0.555473268032074,0.38967499136924744,8.99,0.31637245416641235,0.27804136276245117,0.4055861532688141,50.0,0.06800463050603867,0.5104030966758728,0.42159226536750793,50.0,0.08234687894582748,0.2950620651245117,0.6225910186767578,50.0,0.1606990247964859,0.630323052406311,0.20897792279720306,20.32,0.1355333775281906,0.2849346697330475,0.5795319676399231,27.8,direct_nli_zero_shot
335,the Winged Monkeys,60,9060,you,46008,46009,1865,first_second_person_keep_original,False,""" ""Good-bye, and thank [[you]] very much,"" returned the girl; and the Monkeys rose into the air and were out of sight in a twinkling.",""" ""Good-bye, and thank you very much,"" returned the girl; and the Monkeys rose into the air and were out of sight in a twinkling.",""" ""Good-bye, and thank you very much,"" returned the girl; and the Monkeys rose into the air and were out of sight in a twinkling.",""" ""Good-bye, and thank you very much,"" returned the girl; and the Monkeys rose into the air and were out of sight in a twinkling.",1,20.13132939999923,0.33547988533973694,0.31669679284095764,0.3478233814239502,50.0,0.30914008617401123,0.31678032875061035,0.37407952547073364,50.0,0.28336217999458313,0.36429980397224426,0.3523379862308502,50.0,0.7078400254249573,0.06987636536359787,0.22228358685970306,91.02,0.1134345605969429,0.5800197124481201,0.3065456748008728,16.36,0.13007286190986633,0.2850475311279297,0.5848795771598816,27.26,direct_nli_zero_shot
335,the Winged Monkeys,61,9063,the Monkeys,46018,46020,1865,proper_name_to_canonical,True,""" ""Good-bye, and thank you very much,"" returned the girl; and [[the Monkeys]] rose into the air and were out of sight in a twinkling.",""" ""Good-bye, and thank you very much,"" returned the girl; and the Winged Monkeys rose into the air and were out of sight in a twinkling.",""" ""Good-bye, and thank you very much,"" returned the girl; and the Winged Monkeys rose into the air and were out of sight in a twinkling.",""" ""Good-bye, and thank you very much,"" returned the girl; and the Winged Monkeys rose into the air and were out of sight in a twinkling.",1,20.13132939999923,0.284010648727417,0.31683677434921265,0.39915257692337036,50.0,0.29406455159187317,0.28321367502212524,0.422721803188324,50.0,0.25879746675491333,0.3986862301826477,0.34251630306243896,50.0,0.7220162153244019,0.05083291977643967,0.22715090215206146,93.42,0.11137369275093079,0.588420569896698,0.300205796957016,15.92,0.10275079309940338,0.27104297280311584,0.6262061595916748,23.83,direct_nli_zero_shot
335,the Winged Monkeys,62,9077,The Monkeys,46141,46143,1870,proper_name_to_canonical,True,"[[The Monkeys]] had set them down near a farmhouse, and the four travelers walked up to it and knocked at the door.","the Winged Monkeys had set them down near a farmhouse, and the four travelers walked up to it and knocked at the door.","the Winged Monkeys had set them down near a farmhouse, and the four travelers walked up to it and knocked at the door.","the Winged Monkeys had set them down near a farmhouse, and the four travelers walked up to it and knocked at the door.",1,20.13132939999923,0.26079118251800537,0.38844728469848633,0.3507615625858307,50.0,0.23680046200752258,0.37877577543258667,0.38442373275756836,50.0,0.3571293354034424,0.4332323968410492,0.20963820815086365,50.0,0.5630413889884949,0.1426374763250351,0.2943211495876312,79.79,0.09132606536149979,0.5874342322349548,0.321239709854126,13.45,0.099128857254982,0.30377694964408875,0.5970942378044128,25.1,direct_nli_zero_shot
