cluster_id,subject,mention_index_in_cluster,mention_id,mention_text,mention_start,mention_end,sentence_index,mention_render_rule,mention_render_was_changed,original_context_text,rendered_context_text,context_text,normalized_context_text,chunk_index,elapsed_seconds_at_completion,openness_positive_probability,openness_negative_probability,openness_neutral_probability,openness,conscientiousness_positive_probability,conscientiousness_negative_probability,conscientiousness_neutral_probability,conscientiousness,extraversion_positive_probability,extraversion_negative_probability,extraversion_neutral_probability,extraversion,agreeableness_positive_probability,agreeableness_negative_probability,agreeableness_neutral_probability,agreeableness,neuroticism_positive_probability,neuroticism_negative_probability,neuroticism_neutral_probability,neuroticism,OCEAN_weight_high_probability,OCEAN_weight_medium_probability,OCEAN_weight_low_probability,OCEAN_weight,OCEAN_weight_source
335,the Winged Monkeys,22,6122,the Winged Monkeys,31168,31171,1233,proper_name_to_canonical,False,"When the four travelers went in search of the Witch she had seen them coming, and so sent [[the Winged Monkeys]] to bring them to her.","When the four travelers went in search of the Witch she had seen them coming, and so sent the Winged Monkeys to bring them to her.","When the four travelers went in search of the Witch she had seen them coming, and so sent the Winged Monkeys to bring them to her.","When the four travelers went in search of the Witch she had seen them coming, and so sent the Winged Monkeys to bring them to her.",1,20.13132939999923,0.25208887457847595,0.354981929063797,0.39292916655540466,50.0,0.37330153584480286,0.28330034017562866,0.3433980941772461,50.0,0.3461918532848358,0.3387507498264313,0.3150573968887329,50.0,0.5921674966812134,0.18352332711219788,0.22430919110774994,76.34,0.12556186318397522,0.6730055809020996,0.20143258571624756,15.72,0.07646586745977402,0.401239812374115,0.522294282913208,27.71,direct_nli_zero_shot
335,the Winged Monkeys,23,6229,the Winged Monkeys,31779,31782,1256,proper_name_to_canonical,False,"Then she noticed Dorothy's Golden Cap, and said, ""Why don't you use the charm of the Cap, and call [[the Winged Monkeys]] to you?","Then she noticed Dorothy's Golden Cap, and said, ""Why don't you use the charm of the Cap, and call the Winged Monkeys to you?","Then she noticed Dorothy's Golden Cap, and said, ""Why don't you use the charm of the Cap, and call the Winged Monkeys to you?","Then she noticed Dorothy's Golden Cap, and said, ""Why don't you use the charm of the Cap, and call the Winged Monkeys to you?",1,20.13132939999923,0.6061204075813293,0.25242194533348083,0.1414576768875122,70.6,0.18067163228988647,0.25653553009033203,0.5627928972244263,50.0,0.45022183656692505,0.17046824097633362,0.3793099522590637,50.0,0.5834556818008423,0.12028536200523376,0.2962590456008911,82.91,0.10289116203784943,0.41720348596572876,0.47990527749061584,50.0,0.09099315106868744,0.2823045253753662,0.6267023682594299,23.21,direct_nli_zero_shot
335,the Winged Monkeys,24,6233,They,31785,31786,1257,proper_name_to_canonical,True,"[[They]] will carry you to the City of Oz in less than an hour.""","the Winged Monkeys will carry you to the City of Oz in less than an hour.""","the Winged Monkeys will carry you to the City of Oz in less than an hour.""","the Winged Monkeys will carry you to the City of Oz in less than an hour.""",1,20.13132939999923,0.491670697927475,0.21574102342128754,0.2925882041454315,50.0,0.2668684720993042,0.2735975384712219,0.4595339894294739,50.0,0.4622114300727844,0.22747448086738586,0.3103140890598297,50.0,0.4952516555786133,0.1371575891971588,0.3675907850265503,50.0,0.10667779296636581,0.5380309224128723,0.35529130697250366,16.55,0.034597717225551605,0.2198687642812729,0.7455335855484009,14.45,direct_nli_zero_shot
335,the Winged Monkeys,25,6239,the Winged Monkeys,31851,31854,1260,proper_name_to_canonical,False,"""But if you are going to call [[the Winged Monkeys]] we must run away, for they are full of mischief and think it great fun to plague us.","""But if you are going to call the Winged Monkeys we must run away, for they are full of mischief and think it great fun to plague us.","""But if you are going to call the Winged Monkeys we must run away, for they are full of mischief and think it great fun to plague us.","""But if you are going to call the Winged Monkeys we must run away, for they are full of mischief and think it great fun to plague us.",1,20.13132939999923,0.05721866711974144,0.27012428641319275,0.6726570725440979,50.0,0.0046479832381010056,0.1632680594921112,0.8320840001106262,50.0,0.7200618982315063,0.08499720692634583,0.19494090974330902,89.44,0.002717462833970785,0.5353398323059082,0.4619426727294922,50.0,0.3364863097667694,0.2267903983592987,0.4367232322692871,50.0,0.06766857951879501,0.4013746976852417,0.5309567451477051,26.84,direct_nli_zero_shot
335,the Winged Monkeys,26,6242,they,31860,31861,1260,third_person_subject_pronoun_to_canonical,True,"""But if you are going to call the Winged Monkeys we must run away, for [[they]] are full of mischief and think it great fun to plague us.","""But if you are going to call the Winged Monkeys we must run away, for the Winged Monkeys are full of mischief and think it great fun to plague us.","""But if you are going to call the Winged Monkeys we must run away, for the Winged Monkeys are full of mischief and think it great fun to plague us.","""But if you are going to call the Winged Monkeys we must run away, for the Winged Monkeys are full of mischief and think it great fun to plague us.",1,20.13132939999923,0.056712668389081955,0.2706931531429291,0.6725941896438599,50.0,0.004190483130514622,0.16055379807949066,0.8352557420730591,50.0,0.7462494969367981,0.05519166588783264,0.19855880737304688,93.11,0.0022955243475735188,0.49958300590515137,0.4981215298175812,50.0,0.2619435787200928,0.18756861984729767,0.5504878759384155,50.0,0.06518078595399857,0.3780314028263092,0.5567878484725952,25.42,direct_nli_zero_shot
335,the Winged Monkeys,27,6244,they,31879,31880,1261,third_person_subject_pronoun_to_canonical,True,""" ""Won't [[they]] hurt me?"" asked the girl anxiously.",""" ""Won't the Winged Monkeys hurt me?"" asked the girl anxiously.",""" ""Won't the Winged Monkeys hurt me?"" asked the girl anxiously.",""" ""Won't the Winged Monkeys hurt me?"" asked the girl anxiously.",1,20.13132939999923,0.09214034676551819,0.2601865530014038,0.6476731300354004,50.0,0.17716799676418304,0.22232697904109955,0.600504994392395,50.0,0.05485916510224342,0.25879567861557007,0.6863451600074768,50.0,0.2918572723865509,0.43557000160217285,0.27257275581359863,50.0,0.8145141005516052,0.12478785961866379,0.06069808080792427,86.71,0.11665191501379013,0.3847346305847168,0.4986134469509125,30.9,direct_nli_zero_shot
335,the Winged Monkeys,28,6247,They,31895,31896,1263,proper_name_to_canonical,True,[[They]] must obey the wearer of the Cap.,the Winged Monkeys must obey the wearer of the Cap.,the Winged Monkeys must obey the wearer of the Cap.,the Winged Monkeys must obey the wearer of the Cap.,1,20.13132939999923,0.036555610597133636,0.34649142622947693,0.6169530153274536,50.0,0.6121265292167664,0.0615030936896801,0.32637032866477966,90.87,0.05707324296236038,0.37655124068260193,0.5663754940032959,50.0,0.5486807227134705,0.11982500553131104,0.3314942419528961,82.08,0.08276169747114182,0.5818197131156921,0.33541861176490784,12.45,0.08223427087068558,0.3166245222091675,0.6011412143707275,24.05,direct_nli_zero_shot
335,the Winged Monkeys,29,6266,the band of Winged Monkeys,32091,32096,1275,proper_name_to_canonical,True,"This ended the saying of the charm, and they heard a great chattering and flapping of wings, as [[the band of Winged Monkeys]] flew up to them.","This ended the saying of the charm, and they heard a great chattering and flapping of wings, as the Winged Monkeys flew up to them.","This ended the saying of the charm, and they heard a great chattering and flapping of wings, as the Winged Monkeys flew up to them.","This ended the saying of the charm, and they heard a great chattering and flapping of wings, as the Winged Monkeys flew up to them.",1,20.13132939999923,0.4919683337211609,0.1728658676147461,0.335165798664093,74.0,0.12723597884178162,0.20332249999046326,0.6694415211677551,50.0,0.8885731101036072,0.024852460250258446,0.08657436072826385,97.28,0.5799311399459839,0.06103482469916344,0.3590340316295624,90.48,0.174094557762146,0.39753466844558716,0.42837080359458923,50.0,0.05823409557342529,0.30334222316741943,0.6384237408638,20.99,direct_nli_zero_shot
335,the Winged Monkeys,30,6285,the Monkeys,32165,32167,1277,proper_name_to_canonical,True,""" ""We will carry you,"" replied the King, and no sooner had he spoken than two of [[the Monkeys]] caught Dorothy in their arms and flew away with her.",""" ""We will carry you,"" replied the King, and no sooner had he spoken than two of the Winged Monkeys caught Dorothy in their arms and flew away with her.",""" ""We will carry you,"" replied the King, and no sooner had he spoken than two of the Winged Monkeys caught Dorothy in their arms and flew away with her.",""" ""We will carry you,"" replied the King, and no sooner had he spoken than two of the Winged Monkeys caught Dorothy in their arms and flew away with her.",1,20.13132939999923,0.49870565533638,0.165988489985466,0.33530595898628235,75.03,0.3369271457195282,0.2985009253025055,0.36457201838493347,50.0,0.6315832734107971,0.17163556814193726,0.19678112864494324,78.63,0.915529727935791,0.03556834161281586,0.04890185594558716,96.26,0.02499576285481453,0.5991213321685791,0.3758828938007355,4.0,0.10923486202955246,0.235523521900177,0.6552416682243347,22.7,direct_nli_zero_shot
335,the Winged Monkeys,31,6300,the Winged Monkeys,32227,32230,1279,proper_name_to_canonical,False,"The Scarecrow and the Tin Woodman were rather frightened at first, for they remembered how badly [[the Winged Monkeys]] had treated them before; but they saw that no harm was intended, so they rode through the air quite cheerfully, and had a fine time looking at the pretty gardens and woods far below them.","The Scarecrow and the Tin Woodman were rather frightened at first, for they remembered how badly the Winged Monkeys had treated them before; but they saw that no harm was intended, so they rode through the air quite cheerfully, and had a fine time looking at the pretty gardens and woods far below them.","The Scarecrow and the Tin Woodman were rather frightened at first, for they remembered how badly the Winged Monkeys had treated them before; but they saw that no harm was intended, so they rode through the air quite cheerfully, and had a fine time looking at the pretty gardens and woods far below them.","The Scarecrow and the Tin Woodman were rather frightened at first, for they remembered how badly the Winged Monkeys had treated them before; but they saw that no harm was intended, so they rode through the air quite cheerfully, and had a fine time looking at the pretty gardens and woods far below them.",1,20.13132939999923,0.07862655818462372,0.45545700192451477,0.4659164845943451,50.0,0.04453035071492195,0.27768662571907043,0.6777830123901367,50.0,0.16995151340961456,0.3483774960041046,0.48167094588279724,50.0,0.06205957755446434,0.486708402633667,0.451231986284256,50.0,0.11379694193601608,0.47502654790878296,0.41117650270462036,50.0,0.07946065813302994,0.3796412944793701,0.5408980250358582,26.93,direct_nli_zero_shot
335,the Winged Monkeys,32,6310,the biggest Monkeys,32278,32281,1280,proper_name_to_canonical,True,"Dorothy found herself riding easily between two of [[the biggest Monkeys]], one of them the King himself.","Dorothy found herself riding easily between two of the Winged Monkeys, one of them the King himself.","Dorothy found herself riding easily between two of the Winged Monkeys, one of them the King himself.","Dorothy found herself riding easily between two of the Winged Monkeys, one of them the King himself.",1,20.13132939999923,0.5946804881095886,0.19534027576446533,0.20997923612594604,75.27,0.30224624276161194,0.30431947112083435,0.3934342563152313,50.0,0.430921345949173,0.39235836267471313,0.1767202913761139,50.0,0.7808593511581421,0.04422548785805702,0.17491519451141357,94.64,0.03551897034049034,0.7440134286880493,0.22046753764152527,4.56,0.07448764890432358,0.3230859935283661,0.6024263501167297,23.6,direct_nli_zero_shot
335,the Winged Monkeys,33,6508,all the Winged Monkeys,32962,32966,1305,proper_name_to_canonical,True,"She had [[all the Winged Monkeys]] brought before her, and she said at first that their wings should be tied and they should be treated as they had treated Quelala, and dropped in the river.","She had the Winged Monkeys brought before her, and she said at first that their wings should be tied and they should be treated as they had treated Quelala, and dropped in the river.","She had the Winged Monkeys brought before her, and she said at first that their wings should be tied and they should be treated as they had treated Quelala, and dropped in the river.","She had the Winged Monkeys brought before her, and she said at first that their wings should be tied and they should be treated as they had treated Quelala, and dropped in the river.",1,20.13132939999923,0.04421672597527504,0.2940160632133484,0.6617671251296997,50.0,0.11290483921766281,0.3012651205062866,0.58583003282547,50.0,0.06023047864437103,0.38765546679496765,0.5521140694618225,50.0,0.06229317560791969,0.3883589506149292,0.5493478178977966,50.0,0.250095009803772,0.5007849931716919,0.24911998212337494,50.0,0.19941982626914978,0.33968034386634827,0.46089985966682434,36.93,direct_nli_zero_shot
335,the Winged Monkeys,34,6514,their,32976,32977,1305,third_person_possessive_pronoun_to_canonical_possessive,True,"She had all the Winged Monkeys brought before her, and she said at first that [[their]] wings should be tied and they should be treated as they had treated Quelala, and dropped in the river.","She had all the Winged Monkeys brought before her, and she said at first that the Winged Monkeys' wings should be tied and they should be treated as they had treated Quelala, and dropped in the river.","She had all the Winged Monkeys brought before her, and she said at first that the Winged Monkeys' wings should be tied and they should be treated as they had treated Quelala, and dropped in the river.","She had all the Winged Monkeys brought before her, and she said at first that the Winged Monkeys' wings should be tied and they should be treated as they had treated Quelala, and dropped in the river.",1,20.13132939999923,0.048074956983327866,0.31548434495925903,0.6364406943321228,50.0,0.09986704587936401,0.2779044210910797,0.6222285628318787,50.0,0.06406909972429276,0.4238961935043335,0.5120347142219543,50.0,0.057526662945747375,0.3437264859676361,0.5987468361854553,50.0,0.22458548843860626,0.5120770931243896,0.2633374035358429,50.0,0.17205184698104858,0.2776530981063843,0.5502949953079224,31.09,direct_nli_zero_shot
335,the Winged Monkeys,35,6516,they,32982,32983,1305,third_person_subject_pronoun_to_canonical,True,"She had all the Winged Monkeys brought before her, and she said at first that their wings should be tied and [[they]] should be treated as they had treated Quelala, and dropped in the river.","She had all the Winged Monkeys brought before her, and she said at first that their wings should be tied and the Winged Monkeys should be treated as they had treated Quelala, and dropped in the river.","She had all the Winged Monkeys brought before her, and she said at first that their wings should be tied and the Winged Monkeys should be treated as they had treated Quelala, and dropped in the river.","She had all the Winged Monkeys brought before her, and she said at first that their wings should be tied and the Winged Monkeys should be treated as they had treated Quelala, and dropped in the river.",1,20.13132939999923,0.04377102479338646,0.29276278614997864,0.663466215133667,50.0,0.10253720730543137,0.26414936780929565,0.6333134174346924,50.0,0.062348224222660065,0.38728126883506775,0.550370454788208,50.0,0.0694163516163826,0.3710704743862152,0.5595131516456604,50.0,0.20118404924869537,0.5683823823928833,0.23043352365493774,26.14,0.17904259264469147,0.3055298328399658,0.5154275298118591,33.18,direct_nli_zero_shot
335,the Winged Monkeys,36,6518,they,32987,32988,1305,third_person_subject_pronoun_to_canonical,True,"She had all the Winged Monkeys brought before her, and she said at first that their wings should be tied and they should be treated as [[they]] had treated Quelala, and dropped in the river.","She had all the Winged Monkeys brought before her, and she said at first that their wings should be tied and they should be treated as the Winged Monkeys had treated Quelala, and dropped in the river.","She had all the Winged Monkeys brought before her, and she said at first that their wings should be tied and they should be treated as the Winged Monkeys had treated Quelala, and dropped in the river.","She had all the Winged Monkeys brought before her, and she said at first that their wings should be tied and they should be treated as the Winged Monkeys had treated Quelala, and dropped in the river.",1,20.13132939999923,0.15943580865859985,0.3776417672634125,0.4629223644733429,50.0,0.21300414204597473,0.2405417412519455,0.5464540719985962,50.0,0.13928526639938354,0.39369896054267883,0.46701574325561523,50.0,0.295234739780426,0.3406437337398529,0.3641214966773987,50.0,0.12670034170150757,0.6602860689163208,0.21301360428333282,16.1,0.220887690782547,0.3705499768257141,0.4085623621940613,40.62,direct_nli_zero_shot
335,the Winged Monkeys,37,6525,the Monkeys,33007,33009,1306,proper_name_to_canonical,True,"But my grandfather pleaded hard, for he knew [[the Monkeys]] would drown in the river with their wings tied, and Quelala said a kind word for them also; so that Gayelette finally spared them, on condition that the Winged Monkeys should ever after do three times the bidding of the owner of the Golden Cap.","But my grandfather pleaded hard, for he knew the Winged Monkeys would drown in the river with their wings tied, and Quelala said a kind word for them also; so that Gayelette finally spared them, on condition that the Winged Monkeys should ever after do three times the bidding of the owner of the Golden Cap.","But my grandfather pleaded hard, for he knew the Winged Monkeys would drown in the river with their wings tied, and Quelala said a kind word for them also; so that Gayelette finally spared them, on condition that the Winged Monkeys should ever after do three times the bidding of the owner of the Golden Cap.","But my grandfather pleaded hard, for he knew the Winged Monkeys would drown in the river with their wings tied, and Quelala said a kind word for them also; so that Gayelette finally spared them, on condition that the Winged Monkeys should ever after do three times the bidding of the owner of the Golden Cap.",1,20.13132939999923,0.1267254501581192,0.38391509652137756,0.48935940861701965,50.0,0.5203549265861511,0.1553640216588974,0.32428109645843506,77.01,0.16445866227149963,0.3440187871456146,0.49152255058288574,50.0,0.8837321996688843,0.05586419254541397,0.06040359288454056,94.05,0.22338615357875824,0.5742091536521912,0.2024046778678894,28.01,0.1399814337491989,0.3244946300983429,0.5355239510536194,30.22,direct_nli_zero_shot
335,the Winged Monkeys,38,6528,their,33015,33016,1306,third_person_possessive_pronoun_to_canonical_possessive,True,"But my grandfather pleaded hard, for he knew the Monkeys would drown in the river with [[their]] wings tied, and Quelala said a kind word for them also; so that Gayelette finally spared them, on condition that the Winged Monkeys should ever after do three times the bidding of the owner of the Golden Cap.","But my grandfather pleaded hard, for he knew the Monkeys would drown in the river with the Winged Monkeys' wings tied, and Quelala said a kind word for them also; so that Gayelette finally spared them, on condition that the Winged Monkeys should ever after do three times the bidding of the owner of the Golden Cap.","But my grandfather pleaded hard, for he knew the Monkeys would drown in the river with the Winged Monkeys' wings tied, and Quelala said a kind word for them also; so that Gayelette finally spared them, on condition that the Winged Monkeys should ever after do three times the bidding of the owner of the Golden Cap.","But my grandfather pleaded hard, for he knew the Monkeys would drown in the river with the Winged Monkeys' wings tied, and Quelala said a kind word for them also; so that Gayelette finally spared them, on condition that the Winged Monkeys should ever after do three times the bidding of the owner of the Golden Cap.",1,20.13132939999923,0.11607158184051514,0.3694154620170593,0.5145129561424255,50.0,0.5025889873504639,0.1450880914926529,0.35232290625572205,77.6,0.16200007498264313,0.3533227741718292,0.48467716574668884,50.0,0.8828938007354736,0.05144079029560089,0.06566539406776428,94.49,0.20933440327644348,0.6064690351486206,0.18419651687145233,25.66,0.15489314496517181,0.32353511452674866,0.521571695804596,31.67,direct_nli_zero_shot
335,the Winged Monkeys,39,6532,them,33026,33027,1306,third_person_object_pronoun_to_canonical,True,"But my grandfather pleaded hard, for he knew the Monkeys would drown in the river with their wings tied, and Quelala said a kind word for [[them]] also; so that Gayelette finally spared them, on condition that the Winged Monkeys should ever after do three times the bidding of the owner of the Golden Cap.","But my grandfather pleaded hard, for he knew the Monkeys would drown in the river with their wings tied, and Quelala said a kind word for the Winged Monkeys also; so that Gayelette finally spared them, on condition that the Winged Monkeys should ever after do three times the bidding of the owner of the Golden Cap.","But my grandfather pleaded hard, for he knew the Monkeys would drown in the river with their wings tied, and Quelala said a kind word for the Winged Monkeys also; so that Gayelette finally spared them, on condition that the Winged Monkeys should ever after do three times the bidding of the owner of the Golden Cap.","But my grandfather pleaded hard, for he knew the Monkeys would drown in the river with their wings tied, and Quelala said a kind word for the Winged Monkeys also; so that Gayelette finally spared them, on condition that the Winged Monkeys should ever after do three times the bidding of the owner of the Golden Cap.",1,20.13132939999923,0.1731448769569397,0.4262421429157257,0.4006129801273346,50.0,0.546136200428009,0.15924541652202606,0.2946183681488037,77.42,0.19500650465488434,0.3770797550678253,0.42791369557380676,50.0,0.9056304097175598,0.046816181391477585,0.04755343124270439,95.08,0.1899174302816391,0.6449182629585266,0.16516433656215668,22.75,0.14869828522205353,0.355122834444046,0.49617883563041687,32.63,direct_nli_zero_shot
335,the Winged Monkeys,40,6536,them,33034,33035,1306,third_person_object_pronoun_to_canonical,True,"But my grandfather pleaded hard, for he knew the Monkeys would drown in the river with their wings tied, and Quelala said a kind word for them also; so that Gayelette finally spared [[them]], on condition that the Winged Monkeys should ever after do three times the bidding of the owner of the Golden Cap.","But my grandfather pleaded hard, for he knew the Monkeys would drown in the river with their wings tied, and Quelala said a kind word for them also; so that Gayelette finally spared the Winged Monkeys, on condition that the Winged Monkeys should ever after do three times the bidding of the owner of the Golden Cap.","But my grandfather pleaded hard, for he knew the Monkeys would drown in the river with their wings tied, and Quelala said a kind word for them also; so that Gayelette finally spared the Winged Monkeys, on condition that the Winged Monkeys should ever after do three times the bidding of the owner of the Golden Cap.","But my grandfather pleaded hard, for he knew the Monkeys would drown in the river with their wings tied, and Quelala said a kind word for them also; so that Gayelette finally spared the Winged Monkeys, on condition that the Winged Monkeys should ever after do three times the bidding of the owner of the Golden Cap.",1,20.13132939999923,0.1379839926958084,0.3723422586917877,0.4896737039089203,50.0,0.5146262049674988,0.1539163887500763,0.3314574360847473,76.98,0.15786482393741608,0.3461580276489258,0.49597713351249695,50.0,0.8584862351417542,0.06107509508728981,0.08043865859508514,93.36,0.22077402472496033,0.5740439891815186,0.2051820009946823,27.78,0.14060522615909576,0.3465202748775482,0.5128744840621948,31.39,direct_nli_zero_shot
